740,2026/1/15 19:31,ファッション,jun********,1時間11分,0,6,6.0,0,0,0.083,0.0,0.0,0.08,あと3日,https://detail.chiebukuro.yahoo.co.jp/qa/question_detail/q13324320148,大至急！！ このメルカリで出品されているセントマイケルのSAINT MICHAEL × Aries / CREW NECK SWEATは本物でしょうか？？ サイズはsでLAにあるBodegaで購入した...,0,0
741,2026/1/15 19:31,料理、食材,har********,1時間12分,7,17,2.4,0,0,0.236,41.18,0.01,5.03,あと3日,https://detail.chiebukuro.yahoo.co.jp/qa/question_detail/q11324320146,箸はいいの使ってますか？ 自分は安物です･･･,0,0
742,2026/1/15 19:31,冷蔵庫、キッチン家電,becc22c2b,1時間12分,1,6,6.0,0,0,0.083,16.67,0.0,0.77,あと3日,https://detail.chiebukuro.yahoo.co.jp/qa/question_detail/q12324320147,お菓子作りのオーブンレンジについて質問です。 8年間使ってきたオーブンレンジの焼きムラがひどく、お菓子作りには向いて居ないと感じため、オーブンレンジの買い替えを検討しています。 レンジ機能は必要最低限...,0,0
743,2026/1/15 19:31,大学受験,1252761779,1時間12分,1,42,42.0,0,0,0.582,2.38,0.24,1.26,あと3日,https://detail.chiebukuro.yahoo.co.jp/qa/question_detail/q10324320145,国公立現役合格を目指す理系受験生です。心身共にしんどいです。共テまで残り1日を乗り切るためのアドバイスください。 ※ここから先は自分語りなのでもしよかったら私の話を読んでいただけると嬉しいです。 私は...,0,0
744,2026/1/15 19:31,掃除機、洗濯機,ke1********,1時間12分,0,3,3.0,0,0,0.042,0.0,0.0,0.04,あと3日,https://detail.chiebukuro.yahoo.co.jp/qa/question_detail/q14324320144,洗濯機について ・ベランダなしで完全部屋干し ・ワンルームで全てつながっている 漫画をたくさん置いていて湿気はなるべく避けたいと思っていますが、予算4万円で縦型しか購入できません。 乾燥機能付きや部屋...,0,0
745,2026/1/15 19:31,高校受験,aa15515cb,1時間12分,1,3,3.0,0,0,0.042,33.33,0.0,0.72,あと3日,https://detail.chiebukuro.yahoo.co.jp/qa/question_detail/q13324320143,神奈川県の私立高校の面接を受けます。 必ず近つけた方がいいことはなんですか？,0,0
746,2026/1/15 19:31,K-POP、アジア,あ,1時間12分,0,7,7.0,1,0,0.097,0.0,0.0,1.46,あと3日,https://detail.chiebukuro.yahoo.co.jp/qa/question_detail/q12324320142,TOMORROW‪‪‪‬‪‪‪‪‪‪‪‪ X TOGETHERの東京ドームについて。 ①グッズをWeverseで当日頼む場合、うちわ、ペンライトは秒で売り切れるか。 ②親の名義で入れるのか。 教えて頂...,0,0
747,2026/1/15 19:31,楽器全般,とら,1時間12分,0,10,10.0,0,0,0.138,0.0,0.0,0.14,あと3日,https://detail.chiebukuro.yahoo.co.jp/qa/question_detail/q11324320141,｢ https://www.nonaka.com/bach/instruments/accessory/maintenance.html｣ このサイトにあるようなグリスやオイル、マッピクリーナー、 ク...,0,0
748,2026/1/15 19:31,音声、音楽,sud********,1時間12分,0,2,2.0,0,0,0.028,0.0,0.0,0.03,あと3日,https://detail.chiebukuro.yahoo.co.jp/qa/question_detail/q14324320139,音声入力って以下のような地名 ちゃんと変換してくれないのですか？ 誤変換 呼吸博物館 正しい 変換 故宮博物館 いちいち直すのめんどくさいんですけど…ちゃんと手動で 辞書登録しないとだめなんですか？？...,0,0
749,2026/1/15 19:31,アルバイト、フリーター,非公開,1時間12分,1,16,16.0,0,0,0.221,6.25,0.04,0.9,あと3日,https://detail.chiebukuro.yahoo.co.jp/qa/question_detail/q10324320140,至急！他の条件はいいけど会社の最寄駅から徒歩20分の会社のバイトの求人さんだったら応募しますか？アルバイトの場合です。,0,0
750,2026/1/15 19:31,学校の悩み,bc77e78aa,1時間12分,0,6,6.0,0,0,0.083,0.0,0.0,0.08,あと3日,https://detail.chiebukuro.yahoo.co.jp/qa/question_detail/q13324320138,こんにちは、どうしたらいいか分からなくて質問したした。 風引いた時みたいな痛筋肉痛と寒さがあってでも熱は37.2しかなくて最近は1時間から四時間程しか寝れないです。学校に行くのが苦痛で、でも留年ギリギ...,0,0
751,2026/1/15 19:31,転職,swe********,1時間12分,1,25,25.0,0,1,0.345,4.0,0.09,1.43,あと3日,https://detail.chiebukuro.yahoo.co.jp/qa/question_detail/q11324320136,事務職で転職希望です。今までも事務職でした。 20代で、短期離職が多く5社ほど経験があります。 どの会社でも、なぜか私だけ最初から期待されすぎます。 入社早々に会議に出されたり、「誰よりもできるように...,0,0
752,2026/1/15 19:31,学校の悩み,ac.yygi,1時間12分,1,22,22.0,0,0,0.303,4.55,0.07,0.98,あと3日,https://detail.chiebukuro.yahoo.co.jp/qa/question_detail/q10324320135,至急おねがいします。 高校生です。給付型奨学金を借りようとしています。学校に書類を提出して選考される形のものなのですが、世帯収入で父と私（アルバイト）の収入を書かなければなりません。学校は申請を出して...,0,0
753,2026/1/15 19:31,Android,b29c0ffb9,1時間12分,1,10,10.0,0,0,0.138,10.0,0.01,0.81,あと3日,https://detail.chiebukuro.yahoo.co.jp/qa/question_detail/q14324320134,スマホのロック解除が出来なくなりました。 Rakuten P780(Rakuten Hand)という機種についてです。ロック解除パスワードを変更する際、かな入力ができた為かな混じりのものにしました。 ...,0,0
754,2026/1/15 19:31,アクアリウム,1052517292,1時間12分,0,2,2.0,0,0,0.028,0.0,0.0,0.03,あと3日,https://detail.chiebukuro.yahoo.co.jp/qa/question_detail/q12324320132,エアドッグx5d使用しています！ 一番上のファンにゴミはいったんですけど、あそこって取り外したりできませんよね？どのようにゴミはとるんですかね？？,0,0
755,2026/1/15 19:30,住宅,golfgoliki49,1時間13分,1,2,2.0,0,0,0.027,50.0,0.0,0.7,あと3日,https://detail.chiebukuro.yahoo.co.jp/qa/question_detail/q14324320129,換気扇を強で使うと凄い寒くなるんですが、普通ですか？ 足元から風が吸い上げられてる感じでかなり寒くなります。,0,0
756,2026/1/15 19:30,Android,ガガガのガー太郎,1時間13分,1,2,2.0,0,1,0.027,50.0,0.0,1.1,あと3日,https://detail.chiebukuro.yahoo.co.jp/qa/question_detail/q13324320128,Basio active2の画面に、緊急通報の表示が出ており、再起動しても消えません。どうしたらいいのでしょうか。,0,0
757,2026/1/15 19:30,スマホアプリ,うーん。,1時間13分,0,6,6.0,0,0,0.081,0.0,0.0,0.08,あと3日,https://detail.chiebukuro.yahoo.co.jp/qa/question_detail/q12324320127,zetaというAIチャットのアプリについてです リロードしたら最初の文章が消えたり時間が経てば最初だけじゃなく1個前の候補も消えます これってバグなんでしょうか？それとも新機能ですか？,0,0
758,2026/1/15 19:30,メルカリ,KAZAN,1時間13分,1,1,1.0,0,0,0.014,100.0,0.0,0.68,あと3日,https://detail.chiebukuro.yahoo.co.jp/qa/question_detail/q10324320125,メルカリの配送方法について質問です。 パチンコの実機をたのメル便以外で送りたいのですが梱包などもやってくれる配送方法はありませんか。,0,0
759,2026/1/15 19:30,K-POP、アジア,匿名,1時間14分,0,2,2.0,0,0,0.027,0.0,0.0,0.03,あと3日,https://detail.chiebukuro.yahoo.co.jp/qa/question_detail/q11324320126,K-POPのドムソン代行で購入したことがある方いますか？ あれってステッカーになってるとおもいますが、画像編集して、自分でステッカーにしてるのではなく 業者に頼んで印刷してもらってるんでしょうか？ s...,0,0
760,2026/1/15 19:30,アニメ、コミック,a2433f721,1時間14分,0,2,2.0,0,0,0.027,0.0,0.0,0.03,あと3日,https://detail.chiebukuro.yahoo.co.jp/qa/question_detail/q14324320124,水子のキャラを教えてくれませんか？ 東方の戎瓔花と鬼太郎の名無しは知っています。 水子説があるだけというキャラはナシで。,0,0
761,2026/1/15 19:30,転職,質問ばかりするJK！,1時間14分,0,7,7.0,0,0,0.094,0.0,0.0,0.09,あと3日,https://detail.chiebukuro.yahoo.co.jp/qa/question_detail/q13324320123,21歳・コスモス薬品を続けるべきか、辞めるならいつが良いか悩んでいます 質問本文： 現在21歳です。 ドラッグストアのコスモス薬品に入社して2ヶ月目の一般社員です。 給与や勤務条件は以下の通りです。 ...,0,0
762,2026/1/15 19:30,ネコ,非公開,1時間14分,3,21,7.0,0,2,0.283,14.29,0.02,3.07,あと3日,https://detail.chiebukuro.yahoo.co.jp/qa/question_detail/q12324320122,大至急！少し目を離した隙に、うちで飼ってる猫がシンクの洗い物に溜まった水を飲んでしまいました！ 猫用のお皿には綺麗な水入れてました 病院に連れて言った方がいいでしょうか、 様子見た方がいいですか だべ...,0,0
763,2026/1/15 19:30,恋愛相談、人間関係の悩み,ひょーま,1時間14分,0,12,12.0,0,0,0.162,0.0,0.0,0.16,あと3日,https://detail.chiebukuro.yahoo.co.jp/qa/question_detail/q11324320121,この子は東京都内だとどこで生まれてそうですか？？,0,0
764,2026/1/15 19:30,パソコン,匿名,1時間14分,1,5,5.0,0,0,0.067,20.0,0.0,0.73,あと3日,https://detail.chiebukuro.yahoo.co.jp/qa/question_detail/q14324320119,動物専門学校に通ってる方または通っていた方に質問なのですが、通学カバンはリュックかトートバッグかどちらが良いのでしょうか？14インチのパソコンを持ち歩くのですが、教科書の有無が分かりません…,0,0
765,2026/1/15 19:30,恋愛相談、人間関係の悩み,2974bwpj,1時間14分,1,12,12.0,0,0,0.161,8.33,0.02,0.82,あと3日,https://detail.chiebukuro.yahoo.co.jp/qa/question_detail/q13324320118,好きという気持ちが続きません。 高校生です 私は高校になるまで好きになってもいつも片想いで、いい感じになったと期待しても思わせぶりだったり、裏で悪口言われてたりしてました。 付き合ってる人羨ましいな、...,0,0
766,2026/1/15 19:30,ヘアスタイル,lka********,1時間14分,0,6,6.0,0,0,0.081,0.0,0.0,0.08,あと3日,https://detail.chiebukuro.yahoo.co.jp/qa/question_detail/q10324320120,成人式の髪について 高校2年生です。私の髪は太くて硬くて伸びるのが遅く、ちょっとくせ毛です 成人式は3年後ですが、今から伸ばしておかないと綺麗にくくれない気がします。 今はショートからボブに伸ばし中で...,0,0
767,2026/1/15 19:30,ヘアスタイル,1150497754,1時間14分,0,3,3.0,0,0,0.04,0.0,0.0,0.04,あと3日,https://detail.chiebukuro.yahoo.co.jp/qa/question_detail/q12324320117,「夫に間違いありません」というドラマに出ている松下奈緒の髪型って、あれはなんていうのですか？？セミロングとは違うような、ショートでもないような。。。,0,0
768,2026/1/15 19:30,宝塚,*,1時間14分,7,127,18.1,2,5,1.703,5.51,0.31,10.95,あと3日,https://detail.chiebukuro.yahoo.co.jp/qa/question_detail/q11324320116,"私は週に5回ラブホテルの清掃をしています。宝塚はB席で見ています。 子育ても終わった専業主婦がSS席が14,000円、S席が11,000円で見てるのを やるせない気持ちです。こんな私に何か元気がでる励...",0,0
769,2026/1/15 19:30,ライブ、コンサート,b70cbb5e3,1時間14分,0,81,81.0,0,0,1.085,0.0,0.0,1.07,あと3日,https://detail.chiebukuro.yahoo.co.jp/qa/question_detail/q10324320115,Mrs. GREEN APPLEの国立競技場で行われるFC限定のライブに申し込みたいのですが、当たりやすい希望の出し方とかってありますか？ フロントエリアを第一にすると、当たる可能性は低くなってしまい...,0,0
770,2026/1/15 19:30,家族関係の悩み,非公開,1時間14分,3,35,11.7,0,0,0.468,8.57,0.05,2.44,あと3日,https://detail.chiebukuro.yahoo.co.jp/qa/question_detail/q13324320113,放置子は何故、人の家に入ることにあんなに執着するのでしょうか？ 遊ぶなら公園とか、誰でも行ける公共の場所に行けばいいのに。 ネットとかでもよく見かけますが、放置子は断られても諦めずに、何が何でも家に入...,0,0
771,2026/1/15 19:30,ヘアケア,tsu********,1時間14分,3,25,8.3,0,0,0.334,12.0,0.03,2.31,あと3日,https://detail.chiebukuro.yahoo.co.jp/qa/question_detail/q14324320114,シャンプーが1月も持たずにストレスが溜まります！！！！！！！！！！！！！！！！！！ 減りが早いの！！！！！！！！！ どんどんケチって半プッシュ以下しかしてないのにそれでも1月も持ちません どうしてです...,0,0
772,2026/1/15 19:30,ヘアスタイル,匿名,1時間14分,1,17,17.0,0,0,0.227,5.88,0.04,0.88,あと3日,https://detail.chiebukuro.yahoo.co.jp/qa/question_detail/q11324320111,至急！前髪の量を増やしたいなと思って、後ろの髪を前に持ってきて切ってしまいました。若干くせ毛だからか分からないのですが、持ってきた髪が前髪に上手く馴染みません。 髪乾かしたらいつも後ろに行ってしまいま...,0,0
773,2026/1/15 19:30,アニメ,1251571079,1時間14分,2,11,5.5,0,0,0.147,18.18,0.01,1.46,あと3日,https://detail.chiebukuro.yahoo.co.jp/qa/question_detail/q12324320112,キャラクターを探しています 曖昧な記憶かもしれませんが、 若い男です。 インクレディブルファミリーのようなCGアニメだまたと思います。 白と黒色のピッタリスーツを着たヒーローだったと思います。 髪は金...,0,0
774,2026/1/15 19:30,恋愛相談、人間関係の悩み,rpm********,1時間14分,1,4,4.0,0,0,0.053,25.0,0.0,0.71,あと3日,https://detail.chiebukuro.yahoo.co.jp/qa/question_detail/q10324320110,複数で居る場で彼氏がボーっと一点を見つめ、呼びかけると我に返るとかではなく、ゆっくり返事をする程度なのですが、何を考えているのでしょうか？,0,0
775,2026/1/15 19:30,車検、メンテナンス,omo********,1時間15分,1,16,16.0,0,0,0.213,6.25,0.03,0.87,あと3日,https://detail.chiebukuro.yahoo.co.jp/qa/question_detail/q14324320109,セロー250ファイナルエディションを所有しており、昨晩駐車する際立ちゴケをしてしまいました。 明るくなってから車体を確認すると、下にこのネジが落ちており、どこから外れたのか隈なく見たのですがどこにも外...,0,0
776,2026/1/15 19:30,トレーニング,b48f9b1b4,1時間15分,2,15,7.5,0,0,0.2,13.33,0.02,1.51,あと3日,https://detail.chiebukuro.yahoo.co.jp/qa/question_detail/q13324320108,高1です。中学校の時に柔道をやっていて重量級で出て居たんですが柔道をやめてしまいました。それから１年経ち残った脂肪を落として筋肉をつけたくてジムに行こうと思い至りました。 選択肢としては市営のジムに行...,0,0
777,2026/1/15 19:30,法律相談,30代独身,1時間15分,0,4,4.0,0,0,0.053,0.0,0.0,0.05,あと3日,https://detail.chiebukuro.yahoo.co.jp/qa/question_detail/q12324320107,1ヶ月だけでも100時間をこえる時間外労働をやらせたら問題になりますか？,0,0
778,2026/1/15 19:30,ライブ、コンサート,1152201552,1時間15分,0,107,107.0,1,0,1.422,0.0,0.0,2.71,あと3日,https://detail.chiebukuro.yahoo.co.jp/qa/question_detail/q11324320106,ミセスのライブについてです。 フロント、アリーナ、スタンドがそれぞれどこに当てはまるか教えて欲しいです。,0,0
779,2026/1/15 19:30,ギター、ベース,1151053842,1時間15分,0,9,9.0,0,0,0.119,0.0,0.0,0.12,あと3日,https://detail.chiebukuro.yahoo.co.jp/qa/question_detail/q10324320105,至急お願いします！ ギターを購入しようと思っているのですが、エレアコではなく、普通のアコギで考えてます！ 予算は30万くらいです。 MOROHA弾くのが多いので、それ用途で考えてます おすすめのアコギ...,0,0
780,2026/1/15 19:30,学校の悩み,b20bd20ab,1時間15分,1,11,11.0,0,0,0.146,9.09,0.02,0.8,あと3日,https://detail.chiebukuro.yahoo.co.jp/qa/question_detail/q14324320104,誰かアドバイスを下さい。今晩は、私は支援学校の高等部に通っている者です。私の学校には寄宿舎があり私も泊まり込みで毎日学校に通っています。寄宿舎の先生？ 指導員の方の対応についてです。同じ寮生の子に障害...,0,0
781,2026/1/15 19:30,男性アイドル,トート,1時間15分,0,4,4.0,0,0,0.053,0.0,0.0,0.05,あと3日,https://detail.chiebukuro.yahoo.co.jp/qa/question_detail/q10324320100,ジュニア担の年齢層についてです。 多ステ等前提で書くのでご理解ある方のみ回答お願いいたします。 ジュニアの夏現場を多ステしてるファンは何歳ぐらいの方々が多いですか？ ｢夏現場通ったのが青春｣という趣旨...,0,0
782,2026/1/15 19:30,アニメ,ホーリー,1時間15分,2,5,2.5,0,0,0.066,40.0,0.0,1.37,あと3日,https://detail.chiebukuro.yahoo.co.jp/qa/question_detail/q11324320101,皆さん名探偵プリキュア！は楽しみですか？,0,0
783,2026/1/15 19:30,おでかけグルメ,Kiki,1時間15分,2,28,14.0,0,1,0.37,7.14,0.05,2.06,あと3日,https://detail.chiebukuro.yahoo.co.jp/qa/question_detail/q14324320099,今度彼氏の誕生日に夜ご飯を食べに行くのですが、おすすめのお店を教えてほしいです！！ 条件？というか理想は ・コースであること ・できれば高級そう、格式高い雰囲気というよりは、おしゃれな隠れ家、ビストロ...,0,0
784,2026/1/15 19:30,国内,lD非公開,1時間15分,0,1,1.0,0,0,0.013,0.0,0.0,0.01,あと3日,https://detail.chiebukuro.yahoo.co.jp/qa/question_detail/q13324320098,近くに移転する松本市民病院は小児科をつくらないそうですが、 医師が確保できなかったからでしょうか？,0,0
785,2026/1/15 19:30,iPhone,1251871451,1時間15分,0,3,3.0,0,0,0.04,0.0,0.0,0.04,あと3日,https://detail.chiebukuro.yahoo.co.jp/qa/question_detail/q11324320096,chatGPTo1というものをiPhoneで使いたいのですがどうすれば使えるのでしょうか プランはplusです,0,0
787,2026/1/15 19:30,ライブ、コンサート,cbcba2beb,1時間15分,1,24,24.0,0,0,0.316,4.17,0.08,0.96,あと3日,https://detail.chiebukuro.yahoo.co.jp/qa/question_detail/q10324320095,SnowManのライブに参戦します！！ 開場時間になって直ぐに入ったら、トイレ空いてますかね？ どの時間帯からトイレ混み始めますか？ 京セラドームです！,0,0
788,2026/1/15 19:30,邦楽,1149915820,1時間15分,0,7,7.0,0,0,0.092,0.0,0.0,0.09,あと3日,https://detail.chiebukuro.yahoo.co.jp/qa/question_detail/q13324320093,米津玄師さん、宇多田ヒカルさんのJANE DOEに似た雰囲気や曲調の曲を教えてください！,0,0
789,2026/1/15 19:30,アニメ,秋霜烈日,1時間15分,0,1,1.0,0,0,0.013,0.0,0.0,0.01,あと3日,https://detail.chiebukuro.yahoo.co.jp/qa/question_detail/q12324320092,冬アニメでコケた作品はどれですか？ 安心してください！ てめぇのプライバシーは絶対守ります！,0,0
790,2026/1/15 19:29,商品の発送、受け取り,xmh********,1時間17分,0,5,5.0,0,0,0.065,0.0,0.0,0.06,あと3日,https://detail.chiebukuro.yahoo.co.jp/qa/question_detail/q10324320090,SHEINで商品を注文したのですが 不在で商品を持ち戻りとなってました 17〜20日に届く予定と書いてあり 不在通知が来たのが15日なのでまた待っていたら 再発送されるのでしょうか？ それともどこかに...,0,0
791,2026/1/15 19:29,恋愛相談,ID 非公開,1時間17分,2,17,8.5,0,0,0.22,11.76,0.02,1.5,あと3日,https://detail.chiebukuro.yahoo.co.jp/qa/question_detail/q14324320089,バレンタインって彼氏にみんなどのくらいの金額のどんなチョコ渡してますか？+プレゼントとかも渡してますか？ 私は元彼達には王道のブランドチョコだけ渡して終わりでした。3000円くらい。 年齢お互いアラサ...,0,0
792,2026/1/15 19:29,ニュース、事件,九々八十一,1時間17分,2,32,16.0,0,0,0.415,6.25,0.07,1.69,不明,https://detail.chiebukuro.yahoo.co.jp/qa/question_detail/q13324320088,メローニが来日しましたが なぜニュースで報じないのですか,0,0
793,2026/1/15 19:29,無印良品,tsc********,1時間17分,0,2,2.0,0,0,0.026,0.0,0.0,0.03,あと3日,https://detail.chiebukuro.yahoo.co.jp/qa/question_detail/q12324320087,無印以外でおすすめの導入美容液教えてほしいです,0,0
795,2026/1/15 19:29,ヘアスタイル,えい,1時間17分,0,2,2.0,0,0,0.026,0.0,0.0,0.03,あと3日,https://detail.chiebukuro.yahoo.co.jp/qa/question_detail/q10324320085,マッド系のワックスとハードスプレー使ってるんですけどナチュラル系のアップバングにしたいんですけど上手くできなくてコツがあったら教えて欲しいです！ 備考↓ 下の写真のような髪にしたいんですがワックスをつ...,0,0
796,2026/1/15 19:29,掃除,dab********,1時間17分,1,13,13.0,0,0,0.168,7.69,0.02,0.8,あと3日,https://detail.chiebukuro.yahoo.co.jp/qa/question_detail/q14324320084,お風呂の中で体や頭を洗う事について 5歳の子供と大人1人で、浴槽に入りながら、その中でシャンプー、ボディソープで洗い、そのみお湯に潜ったり掛けて洗い流します。 最後にシャワーでちゃんと洗い流したりして...,0,0
797,2026/1/15 19:29,バスケットボール,abbd2745a,1時間17分,0,3,3.0,0,0,0.039,0.0,0.0,0.04,あと3日,https://detail.chiebukuro.yahoo.co.jp/qa/question_detail/q13324320083,宮城県仙台市若林区にある、若林区中央市民センターの体育館について質問です。 体育館でバスケのシュート練習をしたいのですが、ゴールの高さは変えれますか？ コートはミニバスサイズとホームページに記載されて...,0,0
798,2026/1/15 19:29,恋愛相談、人間関係の悩み,！,1時間17分,2,8,4.0,0,0,0.103,25.0,0.0,1.38,あと3日,https://detail.chiebukuro.yahoo.co.jp/qa/question_detail/q12324320082,私の高校の友人がインスタで成人男性からDMで通話しようなど言われてるらしいのですが、成人男性がわざわざ女子高生にDMで通話をしたいなどを言うのはどういう心理なのでしょうか？ 私は友人として辞めとけと言...,0,0
799,2026/1/15 19:29,メイク、コスメ,ぽち,1時間17分,0,5,5.0,0,0,0.064,0.0,0.0,0.06,あと3日,https://detail.chiebukuro.yahoo.co.jp/qa/question_detail/q11324320081,ロムアンドの03のアイシャドウを使っているのですが、ピンクメイクをするとオレンジ感が強くなってしまって似合っている感じがしません。 他にピンクメイクが出来るおすすめのアイシャドウパレットなどありますか...,0,0
800,2026/1/15 19:29,就職活動,非公開,1時間17分,2,19,9.5,0,0,0.245,10.53,0.02,1.51,あと3日,https://detail.chiebukuro.yahoo.co.jp/qa/question_detail/q10324320080,中卒の求職者がハローワークに行ってもあまり意味はないですか?職員の方も困っちゃいますかね?,0,0
801,2026/1/15 19:29,自動車,1252717334,1時間17分,1,5,5.0,0,0,0.064,20.0,0.0,0.7,あと3日,https://detail.chiebukuro.yahoo.co.jp/qa/question_detail/q14324320079,155/65r14のタイヤのオートアールズの四本ノーマルタイヤの値段っていくらなんですかね スバルステラカスタムです,0,0
802,2026/1/15 19:29,生き方、人生相談,Sungerman,1時間17分,2,5,2.5,0,0,0.064,40.0,0.0,1.33,あと3日,https://detail.chiebukuro.yahoo.co.jp/qa/question_detail/q12324320077,人生で親以外に下の名前で呼ばれたことが無さすぎて、親と会ってないと自分の下の名前が自分の名前だと思えないっていうか、こんな名前だっけ？という感覚になっているんですが、これってよくあることですか？,0,0
803,2026/1/15 19:29,物理学,cd3813b0d,1時間17分,0,1,1.0,0,0,0.013,0.0,0.0,0.01,あと3日,https://detail.chiebukuro.yahoo.co.jp/qa/question_detail/q11324320076,2026Kパックの第二問なんですが、この小球Bは2mで小球Aはmの重さなんです。 なのに小球Bが床と衝突を繰り返して速度がゼロになった後に小球Aが下に下がっていき小球Bが上に上がっていく運動になるんで...,0,0
804,2026/1/15 19:29,LINE,aa1a9121,1時間17分,0,5,5.0,0,0,0.064,0.0,0.0,0.06,あと3日,https://detail.chiebukuro.yahoo.co.jp/qa/question_detail/q14324320074,個オプを繋げるのは違反になるのですか⁇ ／ 個オプ は 一対一のオープンチャットです‼︎,0,0
