2112,2026/1/15 18:57,恋愛相談、人間関係の悩み,avz********,3時間12分,2,14,7.0,0,2,0.073,14.29,0.01,0.9,あと3日,https://detail.chiebukuro.yahoo.co.jp/qa/question_detail/q11324318866,もし自分に好きな人がいて、けどその好きな人とは上手くいっていない時に他の異性にご飯だったり電話に誘われたらどうしますか？ たくさんの方のご意見待ってます。,0,0
2113,2026/1/15 18:57,特撮,jun********,3時間12分,3,11,3.7,0,0,0.057,27.27,0.0,0.83,あと3日,https://detail.chiebukuro.yahoo.co.jp/qa/question_detail/q10324318865,仮面ライダー龍騎の13人のライダーのバイザーで玩具化されていないものはどれでしょうか,0,0
2114,2026/1/15 18:57,リフォーム,5742688441,3時間12分,1,19,19.0,0,0,0.099,5.26,0.02,0.36,あと3日,https://detail.chiebukuro.yahoo.co.jp/qa/question_detail/q14324318864,家のスマートキー電池交換したら壊してしまいました。閉じないです。修理というか交換に3万円とかするんでしょうか泣。まだ新築して2年です。てかあの開けにくい構造なんとかして欲しいです！！YKKAPです。,0,0
2115,2026/1/15 18:57,資格,めぽりーぜ,3時間12分,0,3,3.0,0,0,0.016,0.0,0.0,0.02,あと3日,https://detail.chiebukuro.yahoo.co.jp/qa/question_detail/q13324318863,秘書検定準1級面接練習の過去問はどこにありますか？ 勉強活用したサイトがありましたら教えて頂きたいです。,0,0
2116,2026/1/15 18:57,恋愛相談、人間関係の悩み,たぬき,3時間12分,2,21,10.5,0,2,0.109,9.52,0.01,0.94,あと3日,https://detail.chiebukuro.yahoo.co.jp/qa/question_detail/q10324318860,高校生女子です。好きな人とLINEや電話はするのですが直接話せません…！！なんて話しかけるべきか、教えてください！ お互い男子グループ、女子グループでがっちりかたまってます。,0,0
2117,2026/1/15 18:57,芸能人,a apple,3時間12分,0,7,7.0,0,0,0.036,0.0,0.0,0.04,あと3日,https://detail.chiebukuro.yahoo.co.jp/qa/question_detail/q12324318862,この人の名前を教えてください,0,0
2118,2026/1/15 18:57,家族関係の悩み,c1481ef9f,3時間12分,2,11,5.5,0,4,0.057,18.18,0.0,1.19,あと3日,https://detail.chiebukuro.yahoo.co.jp/qa/question_detail/q11324318861,ウ一バ一アカウント永久停止になっちゃって祖母に登録して貰って自分が配達するのは出来ますかね？あとバレるのかな？,0,0
2119,2026/1/15 18:57,友人関係の悩み,あ,3時間12分,3,15,5.0,0,0,0.078,20.0,0.0,0.85,あと3日,https://detail.chiebukuro.yahoo.co.jp/qa/question_detail/q14324318859,友人のことで質問があります。 学生時代からよく遊ぶ友人がいるのですが、最近価値観の合わなさというより、その人の性格思考が特殊なのではと思えてきたので、客観的意見が欲しいです。 以下、友人とのエピソード...,0,0
2120,2026/1/15 18:57,病気、症状,めがとんぱんち,3時間12分,0,5,5.0,0,0,0.026,0.0,0.0,0.03,あと3日,https://detail.chiebukuro.yahoo.co.jp/qa/question_detail/q13324318858,勉強きついです。自分はもともと定期テスト恐怖症みたいな感じで、定期テスト直前期になるとものすごい不安と恐怖に襲われて勉強が手につかなくなります。(テスト本番はそこまで怖くない) そんな感じで定期テスト...,0,0
2121,2026/1/15 18:57,ヘアケア,わいわい,3時間12分,1,13,13.0,0,0,0.067,7.69,0.01,0.33,あと3日,https://detail.chiebukuro.yahoo.co.jp/qa/question_detail/q12324318857,市販カラーについて質問です 今日リーゼのティントカラージェルで染めたのですが個人的にはもう少し明るくというか色を入れたかったのですが次の日同じカラー剤で染めるとやばいですかね？ 髪が痛むのは大丈夫です...,0,0
2122,2026/1/15 18:57,ゲーム,c5fbfb434,3時間12分,0,7,7.0,0,0,0.036,0.0,0.0,0.04,あと3日,https://detail.chiebukuro.yahoo.co.jp/qa/question_detail/q14324318854,エイコーGOのdbd配信で面白くて記憶に残ってるシーンがあるのですが、何話か覚えていません。 狩野英孝さんはサバイバーで、 マップはレイリー記念病院で、 キラーはゴーストフェイスです。 キラー側が修理...,0,0
2123,2026/1/15 18:56,トレーニング,ID 非公開,3時間13分,1,13,13.0,0,0,0.067,7.69,0.01,0.32,あと3日,https://detail.chiebukuro.yahoo.co.jp/qa/question_detail/q13324318853,初見ベンチプレス45.5kgがMAXでしたがどう思いますか？ 成人男性痩せ型です。 また35.5kgは6回が限界でしたが、どんなメニューにしたらMAX増えますか？,0,0
2124,2026/1/15 18:56,生命保険,str********,3時間13分,2,22,11.0,0,0,0.113,9.09,0.01,0.63,あと3日,https://detail.chiebukuro.yahoo.co.jp/qa/question_detail/q12324318852,生命保険の解約について 現在うつ病で休職中で金銭的に余裕がなくなってきたので、解約したい理由はそのまま金銭的な余裕がないという理由を伝えて解約で大丈夫でしょうか？ また、解約を引き止められることってよ...,0,0
2125,2026/1/15 18:56,資格,KY240,3時間13分,1,19,19.0,0,2,0.098,5.26,0.02,0.66,あと3日,https://detail.chiebukuro.yahoo.co.jp/qa/question_detail/q10324318850,こんかいで2回目の漢検3級を受けるのですが、前回は惜しくも4点差で合格でした。いい覚え方などがあれば教えて欲しいです！よろしくお願いしますm(_ _)m,0,0
2126,2026/1/15 18:56,病院、検査,sun********,3時間13分,0,2,2.0,0,0,0.01,0.0,0.0,0.01,あと3日,https://detail.chiebukuro.yahoo.co.jp/qa/question_detail/q11324318851,ミラドライを受けようと思っています。 どうしても麻酔が怖くて 静脈麻酔をかけてもらって受けれたらと思ってますが やりすぎでしょうか、、、,0,0
2127,2026/1/15 18:56,職場の悩み,1252779377,3時間14分,1,11,11.0,0,0,0.057,9.09,0.01,0.31,あと3日,https://detail.chiebukuro.yahoo.co.jp/qa/question_detail/q14324318849,マックでバイトしてます。 今日給料日だったんですけど通帳通したら働いた日数に対して給料が明らか多くて明細見たら＋3万円でした。どこに連絡したらいいですか？それともほっといても自動で引き落とされますか？,0,0
2128,2026/1/15 18:56,アプリ開発,b87ca1d09,3時間14分,0,2,2.0,0,0,0.01,0.0,0.0,0.01,あと3日,https://detail.chiebukuro.yahoo.co.jp/qa/question_detail/q13324318848,Flutter flowでアプリ開発をしようとしているのですが、わからない事を質問するための無料で使えるAIツール（生成回数の制限なし）のおすすめ教えてください。 Geminiは時々、間違ったことを教...,0,0
2129,2026/1/15 18:56,恋愛相談、人間関係の悩み,a5a8112d9,3時間14分,5,57,11.4,0,0,0.294,8.77,0.03,1.57,あと3日,https://detail.chiebukuro.yahoo.co.jp/qa/question_detail/q11324318846,恋愛において、結局女の人って顔しか見てないですよね？,0,0
2130,2026/1/15 18:56,マインクラフト,b8f175cc1,3時間14分,2,28,14.0,0,2,0.144,7.14,0.02,0.96,あと3日,https://detail.chiebukuro.yahoo.co.jp/qa/question_detail/q10324318845,マイクラで質問です。 neoforgeとOptifineを一緒に入れたくてneoforge対応のOptifineを探してみたんですが見当たりませんでした。この二つを一緒に入れることは可能でしょうか？よ...,0,0
2131,2026/1/15 18:56,大学受験,ash,3時間14分,4,74,18.5,0,9,0.381,5.41,0.07,2.79,あと3日,https://detail.chiebukuro.yahoo.co.jp/qa/question_detail/q14324318844,慶應法学部と筑波大社会学類ってさすがに慶應が上ですよね？ 自分は慶應の法学部に在学中なのですが、この前筑波の社学にいった友達と久々に会った時に、どちらが上かという話題になりました。友達は数学や、理科基...,0,0
2132,2026/1/15 18:56,ネットバンキング,れい,3時間14分,0,10,10.0,0,0,0.051,0.0,0.0,0.05,あと3日,https://detail.chiebukuro.yahoo.co.jp/qa/question_detail/q13324318843,今話題のUFJ銀行口座開設についてです。 10歳、14歳、15歳の子供3人の口座開設を予定しています。私も夫もUFJ口座持ち。 私はUFJアプリも入れてあります。(招待コード確認済み。) 子供3人はモ...,0,0
2133,2026/1/15 18:56,転職,jog********,3時間14分,4,61,15.2,0,2,0.314,6.56,0.05,1.64,あと3日,https://detail.chiebukuro.yahoo.co.jp/qa/question_detail/q12324318842,失業しているのですが、自動車を３５年間運転していないペーパードライバーです。 ペーパードライバーなので、ブレーキが右だったか？左だったか？も忘れています。 ですが、求人に 普通自動車免許必須 という求...,0,0
2134,2026/1/15 18:56,スマホアプリ,gja42atjw,3時間14分,0,1,1.0,0,0,0.005,0.0,0.0,0.01,あと3日,https://detail.chiebukuro.yahoo.co.jp/qa/question_detail/q10324318840,Androidでポコチャの推しの配信を見に行こうとしてもこんなエラー出たからアプリをアンインストールしましが1週間後に再インストールして新しくアカウント作ってもまた同じエラーが出ますがポコチャのバグな...,0,0
2135,2026/1/15 18:56,交通事故,pap********,3時間14分,3,26,8.7,0,1,0.134,11.54,0.01,1.05,あと3日,https://detail.chiebukuro.yahoo.co.jp/qa/question_detail/q11324318841,去年12月にバイクに接触して事故に遭い、幸いムチウチ程度でした。整形外科にて電気治療を受け、年末最後にもう大丈夫と思い医師にだいぶ楽になったと伝えました。 しかしながら、また新年仕事が始まると肩や首が...,0,0
2136,2026/1/15 18:56,ミュージシャン,まさやん,3時間14分,0,7,7.0,1,0,0.036,0.0,0.0,0.55,あと3日,https://detail.chiebukuro.yahoo.co.jp/qa/question_detail/q14324318839,原由子さんの83年発売のシングル 「恋は、ご多忙申し上げます」ですが ザ・ベストテンの4週目、11月3日放送の 回には出演しましたか？ この日は8位でしたが欠席したような 気がするのですが良く覚えてい...,0,0
2137,2026/1/15 18:56,動画、映像,1151107896,3時間14分,3,24,8.0,1,0,0.123,12.5,0.01,1.4,あと3日,https://detail.chiebukuro.yahoo.co.jp/qa/question_detail/q13324318838,未経験OKの動画編集の仕事が月給30万円からとかで出てたりしますがどうですか？,0,0
2138,2026/1/15 18:56,中学校,あ,3時間14分,3,19,6.3,0,0,0.098,15.79,0.01,0.86,あと3日,https://detail.chiebukuro.yahoo.co.jp/qa/question_detail/q12324318837,至急です！ 中2女です。図書委員会委員長をやっています。明日委員会があるのですが、進行は完全に委員長にお任せだそうです。 前に立って仕切るのが得意なタイプではないので、進行がうまくできるか、皆が理解で...,0,0
2139,2026/1/15 18:56,同人誌、コミケ,a3af3d32f,3時間14分,1,10,10.0,0,0,0.051,10.0,0.01,0.31,あと3日,https://detail.chiebukuro.yahoo.co.jp/qa/question_detail/q11324318836,ZINEについて質問です 一次創作のBL本(小説)を個人で出そうと思っているのですが、ZINEのイベントに出展しても良いのでしょうか。 ZINEはおしゃれな旅行雑誌や映画紹介などがほとんどのイメージで...,0,0
2140,2026/1/15 18:56,ゲーム,匿名,3時間14分,0,14,14.0,0,0,0.072,0.0,0.0,0.07,あと3日,https://detail.chiebukuro.yahoo.co.jp/qa/question_detail/q10324318835,ソシャゲなどゲームの問い合わせを対応している方に質問です。 問い合わせをしてきたユーザーの問い合わせ内容は永久に保存されているのでしょうか？ また、問い合わせが来た際にそのユーザーが過去に行った問い合...,0,0
2141,2026/1/15 18:56,家族関係の悩み,*,3時間14分,0,6,6.0,0,0,0.031,0.0,0.0,0.03,あと3日,https://detail.chiebukuro.yahoo.co.jp/qa/question_detail/q14324318834,男子高校生、または男子高校生のお子さんがいるご両親に質問です。 美容室に行く頻度と1回あたりの予算を教えてください。,0,0
2142,2026/1/15 18:56,恋愛相談、人間関係の悩み,非公開,3時間14分,2,10,5.0,0,0,0.051,20.0,0.0,0.56,あと3日,https://detail.chiebukuro.yahoo.co.jp/qa/question_detail/q12324318832,彼氏がここ数ヶ月毎日遅い帰宅でした。 仕事が忙しいみたいですが毎日飲んで帰って きます。その前から先輩に誘われて飲んで帰って 来る日が多かったですが、仕事が遅いのに飲んで 帰ってきて私が起きているとき...,0,0
2143,2026/1/15 18:56,自転車、サイクリング,匿名,3時間15分,0,11,11.0,0,0,0.056,0.0,0.0,0.06,あと3日,https://detail.chiebukuro.yahoo.co.jp/qa/question_detail/q11324318831,コーダーブルームロードバイク ファーナ105リムブレーキとファーナティアグラどちらが良いですか ティアグラブレーキは、105ですが 11T–3210速と11速どれぐらい違いますか どちらも,0,0
2144,2026/1/15 18:56,職場の悩み,非公開,3時間15分,2,15,7.5,0,0,0.077,13.33,0.01,0.59,あと3日,https://detail.chiebukuro.yahoo.co.jp/qa/question_detail/q10324318830,部署異動しました。 新しい仕事場で覚えてます。 他部署の人が私のことを「あの子仕事ができない」とか言ってたり、案に私を馬鹿にしてくる人がたくさんいます。 言ってくる人はみんな自分は仕事ができると思って...,0,0
2145,2026/1/15 18:56,職業,わわわ,3時間15分,0,10,10.0,0,0,0.051,0.0,0.0,0.05,あと3日,https://detail.chiebukuro.yahoo.co.jp/qa/question_detail/q14324318829,看護師として働く時に、県立と市立は市立の方が給料が良いと聞きます。 行政保健師の場合、県と市どちらが良いのでしょうか？,0,0
2146,2026/1/15 18:56,株と経済,Jda834dtpa4,3時間15分,2,43,21.5,0,2,0.22,4.65,0.05,1.03,あと3日,https://detail.chiebukuro.yahoo.co.jp/qa/question_detail/q12324318827,高校生です。 株を始めようと思うのですが、 スマホよりもPCで管理運営した方がよいとかありますか？ メリットデメリット教えてください。,0,0
2148,2026/1/15 18:56,アニメ,mih********,3時間15分,0,3,3.0,0,0,0.015,0.0,0.0,0.02,あと3日,https://detail.chiebukuro.yahoo.co.jp/qa/question_detail/q10324318825,青ルパン赤ルパン黄ルパンなどの中で最も言動がネアカで男らしいルパンはどれ？,0,0
2149,2026/1/15 18:56,料理、食材,aik********,3時間15分,5,14,2.8,0,0,0.072,35.71,0.0,1.34,あと3日,https://detail.chiebukuro.yahoo.co.jp/qa/question_detail/q14324318824,まぜそばはよく食べますか？ 自分はごちゃごちゃ色々入ってるせいか味がよくわからないので食べません。,0,0
2150,2026/1/15 18:56,Yahoo!オークション,Www.google.co.jp,3時間15分,2,33,16.5,0,0,0.169,6.06,0.03,0.68,あと3日,https://detail.chiebukuro.yahoo.co.jp/qa/question_detail/q12324318822,Yahooフリマで自分のミスで送料が足りなくなってしまい、後日請求分が届きました。 まだ14歳なのでPayPay銀行も解説出来てないしクレカも持ってません。今月の31日に15歳になるのでPayPay銀...,0,0
2151,2026/1/15 18:56,男性アイドル,jijiji,3時間15分,0,6,6.0,0,0,0.031,0.0,0.0,0.03,あと3日,https://detail.chiebukuro.yahoo.co.jp/qa/question_detail/q13324318823,SixTONESのimitationrainは、なぜタイトルがimitation rain(にせものの雨)なのでしょうか？,0,0
2152,2026/1/15 18:56,携帯型ゲーム全般,1253100554,3時間15分,0,31,31.0,0,0,0.159,0.0,0.0,0.16,あと3日,https://detail.chiebukuro.yahoo.co.jp/qa/question_detail/q11324318821,原神についての質問です！！ コロンビーナが出て、いつかクロリンデをお迎えしたいなと思ってます。 コロンビーナとクロリンデを入れるなら、イネファも入れとけば強いと聞きました( ⋅ ̯⋅ ) ですが無課金...,0,0
2153,2026/1/15 18:55,政治、社会問題,nan********,3時間16分,3,29,9.7,0,1,0.147,10.34,0.01,1.06,あと3日,https://detail.chiebukuro.yahoo.co.jp/qa/question_detail/q10324318820,新進党が30年ぶりに復活しますが、国民民主も、立民と公明に合流しますか？ この合流の仕掛人は新進党党首であった小沢であり、いずれは小沢が代表になりますか？,0,0
2154,2026/1/15 18:55,数学,mnmnmn24242424,3時間16分,1,10,10.0,0,0,0.051,10.0,0.01,0.3,あと3日,https://detail.chiebukuro.yahoo.co.jp/qa/question_detail/q14324318819,青葉出版 リラックマ柄の 新 くりかえし けいさんドリル 1年生2学期 の37番の問題が欲しいのですが、どなたか持っていませんか？泣,0,0
2155,2026/1/15 18:55,ゲーム,b4394c6bb,3時間16分,0,10,10.0,0,0,0.051,0.0,0.0,0.05,あと3日,https://detail.chiebukuro.yahoo.co.jp/qa/question_detail/q13324318818,至急お願いします！ この方のxアカウントを探しています。 ツイコミなどで「ポテトくん」という名前で第五人格のイライ・クラークのイラストをアップしていたひとです。 よろしくお願いします！,0,0
2156,2026/1/15 18:55,パソコン,1051411762,3時間16分,4,74,18.5,0,0,0.376,5.41,0.07,1.38,あと3日,https://detail.chiebukuro.yahoo.co.jp/qa/question_detail/q12324318817,PCの故障について質問です。 去年の3月に修理店で修理してもらったPCが、 電源ランプは付くけれどHDDランプが光らず、ディスプレイの画面やキーボードマウスなども反応がない状態になりました。 そのため...,0,0
2157,2026/1/15 18:55,社会保険,1052186578,3時間16分,4,29,7.2,0,3,0.147,13.79,0.01,1.61,あと3日,https://detail.chiebukuro.yahoo.co.jp/qa/question_detail/q11324318816,私は現在厚生年金に加入していて、被扶養者の妻は第三号被保険者として国民年金に加入しています。 質問なのですが、私が65歳以降も仕事を続けて厚生年金に加入していても私が65歳になったら50代の妻は第三号...,0,0
2158,2026/1/15 18:55,バレエ,魔瑠瑚夢慧駒諏(笑),3時間17分,0,2,2.0,0,0,0.01,0.0,0.0,0.01,あと3日,https://detail.chiebukuro.yahoo.co.jp/qa/question_detail/q10324318815,プロ、しかも常時ソロで踊るようなバレエダンサーの体脂肪率は、平均すると何％ぐらいなんですか。 10%以下は余裕なんですか。,0,0
2159,2026/1/15 18:55,恋愛相談、人間関係の悩み,b20053ae7,3時間17分,2,45,22.5,0,0,0.228,4.44,0.05,0.73,あと3日,https://detail.chiebukuro.yahoo.co.jp/qa/question_detail/q13324318813,恋愛についての質問です。 復縁した方いますか？ 付き合ってた彼氏、彼女を気になる人ができたからと振ってからやっぱ元カレ元カノが良かったなと思い復縁した方いらっしゃいますか？ またその復縁後はより一層幸...,0,0
2160,2026/1/15 18:55,コスメ、美容,牛若丸,3時間17分,0,4,4.0,0,0,0.02,0.0,0.0,0.02,あと3日,https://detail.chiebukuro.yahoo.co.jp/qa/question_detail/q14324318814,キープミストについて質問です。 dプログラム、MAQuillAGE、アイムミミ、ELIXIRどれがいいと思いますか？,0,0
2161,2026/1/15 18:55,日本史,1150860049,3時間17分,1,8,8.0,0,0,0.041,12.5,0.0,0.29,あと3日,https://detail.chiebukuro.yahoo.co.jp/qa/question_detail/q12324318812,会津若松城の御三階櫓跡の石垣の発掘調査って、かなり前からずっとやっているようですが、調査自体はいつまでの予定なのですか？また、その後の石垣の復旧までにはどのくらいかかるのですか？,0,0
2162,2026/1/15 18:55,オンラインゲーム,米津玄師かっこいい,3時間17分,1,5,5.0,0,0,0.025,20.0,0.0,0.28,あと3日,https://detail.chiebukuro.yahoo.co.jp/qa/question_detail/q11324318811,[LOL]ノーマル回してて前動画で見たジャングルナサス面白そうだからピックしようとしたら味方からナサスやめろ。トロール。と、きました。 自分はノーマルだからやっても大丈夫だろうと思ったんですが、自分の...,0,0
2163,2026/1/15 18:55,家族関係の悩み,c6302cb3f,3時間17分,1,16,16.0,0,0,0.081,6.25,0.01,0.33,あと3日,https://detail.chiebukuro.yahoo.co.jp/qa/question_detail/q14324318809,誕生日プレゼントについて質問です 18歳の弟がいるのですが姉から貰って恥ずかしく感じる誕生日プレゼントって何かありますか？ 普段生意気なので懲らしめてやろうかなって言うのが目的です。 今のところマイメ...,0,0
2164,2026/1/15 18:55,ライブ、コンサート,nfy********,3時間17分,0,4,4.0,0,0,0.02,0.0,0.0,0.02,あと3日,https://detail.chiebukuro.yahoo.co.jp/qa/question_detail/q10324318810,zerobaseoneのアンコン神奈川公演両日落選してしまいました… 2次選考にかけるつもりですが、それでももし落ちてしまった場合、ライブビューイングはありますか？ あるとしても韓国の公演時のみでしょ...,0,0
2165,2026/1/15 18:55,Yahoo!知恵袋,lD非公開,3時間17分,1,29,29.0,1,0,0.147,3.45,0.04,0.9,あと3日,https://detail.chiebukuro.yahoo.co.jp/qa/question_detail/q13324318808,ベストアンサーのお礼メッセージに「回答はまず結論から書いて下さい」と書くと利用のルール違反で質問を削除されますか。,0,0
2166,2026/1/15 18:55,恋愛相談、人間関係の悩み,ssss,3時間17分,0,8,8.0,0,0,0.041,0.0,0.0,0.04,あと3日,https://detail.chiebukuro.yahoo.co.jp/qa/question_detail/q12324318807,学校を卒業後、とある共通点があり仲良くLINEしてたのですが、小さいことがきっかけで突然ブロックしてしまいました。 私はそれを少し後悔してたのですが、なんと先日の成人式で向こうから話しかけてくれて、割...,0,0
2167,2026/1/15 18:55,恋愛相談,1051849624,3時間17分,1,16,16.0,0,1,0.081,6.25,0.01,0.48,あと3日,https://detail.chiebukuro.yahoo.co.jp/qa/question_detail/q11324318806,俺様のそばで女がソワソワして髪をいじりだすのは、俺様がイケメンだからですか？ よく買い物に行くと、そういう店員がやってきて話しかけてきます。,0,0
2168,2026/1/15 18:55,ヘアスタイル,かかお,3時間17分,0,3,3.0,0,0,0.015,0.0,0.0,0.02,あと3日,https://detail.chiebukuro.yahoo.co.jp/qa/question_detail/q10324318805,今ブリーチ2回している状態で社会人になる前（3月あたり）に黒髪に戻したいかつまた軽いパーマもかけたいのと考えています。 次美容室に行くのが2月最初の週あたりです。 パーマかけるとしたらどの順序で行うべ...,0,0
2169,2026/1/15 18:55,役所、手続き,bc4eb6259,3時間17分,1,16,16.0,0,0,0.081,6.25,0.01,0.33,あと3日,https://detail.chiebukuro.yahoo.co.jp/qa/question_detail/q14324318804,教えてください。 岡山県在住です。3人兄弟の末っ子で学区外の中学校に越境ようと希望しましたが、抽選で落ちてしまいました。兄2人は抽選無しでいけたり、募集人数内だったので行けました。 住民票を越境先の住...,0,0
2170,2026/1/15 18:55,携帯型ゲーム全般,aa497468c,3時間17分,1,3,3.0,0,0,0.015,33.33,0.0,0.27,あと3日,https://detail.chiebukuro.yahoo.co.jp/qa/question_detail/q12324318802,質問です ロスワなのですが守矢秘境をクリアした後にキャラの絵札が変えることができなくなってしまいましたどうしたら変えることができますか？,0,0
2171,2026/1/15 18:55,特撮,オーレッド,3時間17分,7,47,6.7,1,0,0.238,14.89,0.02,2.5,あと3日,https://detail.chiebukuro.yahoo.co.jp/qa/question_detail/q13324318803,あなたの目の前に炎を操る敵が現れました！！一体何者でしたか？ 私の場合は、「快盗コレクションで炎を操る、異次元のギャング」でした。,0,0
2172,2026/1/15 18:55,インターネットサービス,非公開,3時間17分,2,11,5.5,0,0,0.056,18.18,0.0,0.56,あと3日,https://detail.chiebukuro.yahoo.co.jp/qa/question_detail/q10324318800,ウェブサイトサーバーがダウンしています とはなんですか？,0,0
2173,2026/1/15 18:55,落語、寄席,コンコルド打法,3時間17分,3,8,2.7,0,0,0.04,37.5,0.0,0.79,あと3日,https://detail.chiebukuro.yahoo.co.jp/qa/question_detail/q11324318801,【大喜利寄席】 ・３大主人公ありがちな設定 ①教室の席が後ろ ②何故かモテる ③?? ??は何ですか?,0,0
2174,2026/1/15 18:55,スマホアプリ,ai,3時間18分,0,1,1.0,0,0,0.005,0.0,0.0,0.01,あと3日,https://detail.chiebukuro.yahoo.co.jp/qa/question_detail/q14324318799,bubbleを1度解約して、その後すぐにまた登録した場合、ハートとトーク履歴は消えてしまいますか？,0,0
2175,2026/1/15 18:55,大学受験,1152379827,3時間18分,0,2,2.0,0,0,0.01,0.0,0.0,0.01,あと3日,https://detail.chiebukuro.yahoo.co.jp/qa/question_detail/q13324318798,専修大学の生田キャンパスに通ってる人で東京に住んでる方はいますか？,0,0
