ID,質問日時,カテゴリ,投稿者名,経過時間,回答数,閲覧数,回答難易度,共感数,回答リアクション総数,注目度,回答競争率,注目/競争比,ランキングポテンシャル,受付終了まで,URL,本文冒頭,マイフラグ,ベストアンサーフラグ
1,2026/1/15 19:52,アニメ、コミック,1252875995,4分,0,2,2.0,0,0,0.437,0.0,0.0,0.36,あと3日,https://detail.chiebukuro.yahoo.co.jp/qa/question_detail/q13324320943,呪術廻戦 死滅回遊について。ネタバレOKです。 死滅回遊っていう術式ですか？ もしくは領域展開死滅回遊って事？,0,0
2,2026/1/15 19:52,バラエティ、お笑い,b319ebc3e,4分,0,2,2.0,0,0,0.43,0.0,0.0,0.35,あと3日,https://detail.chiebukuro.yahoo.co.jp/qa/question_detail/q10324320940,『ホピ族の大予言、地球浄化の日』ナオキマンの知らない世界、ロマン編！ で、とろサーモン久保田さんがリスの話をしていた時に流れていたBGMってなんですか？ 変な質問ですみませんが、教えてください。,0,0
3,2026/1/15 19:52,学校の悩み,397©,4分,0,3,3.0,0,0,0.636,0.0,0.0,0.52,あと3日,https://detail.chiebukuro.yahoo.co.jp/qa/question_detail/q11324320941,【至急】私立中学校について 私は中学一年生です。結論から言うと私立中学校を辞めたいです。 辞めたい理由としては ･ 学校の勉強についていけない ･ 公立の子達が楽しそうに学校に通っていて行きたい気持ち...,0,0
4,2026/1/15 19:52,イヌ,しょう,4分,0,1,1.0,0,0,0.209,0.0,0.0,0.17,あと3日,https://detail.chiebukuro.yahoo.co.jp/qa/question_detail/q13324320938,胸部X線検査で心陰影が拡大して見える場合でも、必ずしも心疾患とは限らない理由は何ですか？,0,0
5,2026/1/15 19:52,目の病気,非公開,4分,0,3,3.0,0,0,0.618,0.0,0.0,0.51,あと3日,https://detail.chiebukuro.yahoo.co.jp/qa/question_detail/q11324320936,至急 これなんですか、 ・目を思いっきり左を向いたり右を向くと黄色っぽい丸い？光が見える ・正面を見ると消える ・首を振ると一緒に動く ・眼底検査異常なし ・3年前から です。また最近不安になってきた...,0,0
6,2026/1/15 19:52,恋愛相談、人間関係の悩み,1153203726,4分,0,4,4.0,0,0,0.813,0.0,0.0,0.68,あと3日,https://detail.chiebukuro.yahoo.co.jp/qa/question_detail/q10324320935,高1男です 中学の同級生で好きな人がいるのですが 少し喋ったことあるくらいで この前友達の助言で初めてDMをしてみました もともと間違えた動画を送っていて それを利用してネタ会話しました 後からキモい...,0,0
7,2026/1/15 19:52,携帯電話キャリア,非公開,4分,0,4,4.0,0,0,0.805,0.0,0.0,0.67,あと3日,https://detail.chiebukuro.yahoo.co.jp/qa/question_detail/q14324320934,留守電について。 母の携帯に知らない番号から着信があり、留守電が入っていたのですが、再生すると何故かコール音から入っていてそのあと「はい、〇〇〇〇(お店？の名前？)です」みたいな声が入っていました。(...,0,0
8,2026/1/15 19:52,花粉症、アレルギー,ねむすけ,5分,0,1,1.0,0,0,0.199,0.0,0.0,0.17,あと3日,https://detail.chiebukuro.yahoo.co.jp/qa/question_detail/q13324320933,すき焼きをたべて喉が痒かったり唇が腫れるのはアレルギーですか？ 生卵かな？と思っても単体で食べても問題ないです。 以前エバラすき焼きのたれで唇が腫れました。 なのでちがうすき焼きのタレを使ってみたので...,0,0
9,2026/1/15 19:52,就職活動,えふぴ,5分,0,0,0.0,0,0,0.0,0.0,0.0,0.0,あと3日,https://detail.chiebukuro.yahoo.co.jp/qa/question_detail/q12324320932,ハローワーク及びFP資格受験経験者に質問です ハローワークでは認定日に受給するためには月に最低2回ほど就職活動をやりますよね？ で その就職活動は資格試験を受けることもカウントされますよね？ 例えばF...,0,0
10,2026/1/15 19:52,大学受験,非公開,5分,0,8,8.0,0,0,1.554,0.0,0.0,1.3,あと3日,https://detail.chiebukuro.yahoo.co.jp/qa/question_detail/q11324320931,【至急】1科目受験の場合共通テスト試験会場の教室への入場は何時から可能ですか？2科目受験の人が1科目目を受けている時間に行ったら勉強する場所がないということはありますか？,0,0
11,2026/1/15 19:52,イヌ,べぶ,5分,0,1,1.0,0,0,0.192,0.0,0.0,0.16,あと3日,https://detail.chiebukuro.yahoo.co.jp/qa/question_detail/q10324320930,生後おそらく7ヶ月を迎える保護犬について質問です。 我が家にお迎えして約4ヶ月経ちました。 いたずらもたくさんしますが、できることもたくさん増えて家族の自覚も芽生えてきたのかかなり甘えてくれるようにな...,0,0
12,2026/1/15 19:52,プロ野球,アクアリウムしの助,5分,2,1,0.5,0,0,0.19,200.0,0.0,16.11,あと3日,https://detail.chiebukuro.yahoo.co.jp/qa/question_detail/q13324320928,2026年オフはメジャーがロックアウトで日本人選手はメジャー移籍できないらしいのですが、佐藤輝明が今季オフのポスティングを要求しているのはなぜですか。,0,0
14,2026/1/15 19:52,アルバイト、フリーター,1253109734,5分,0,4,4.0,0,0,0.744,0.0,0.0,0.63,あと3日,https://detail.chiebukuro.yahoo.co.jp/qa/question_detail/q12324320927,今ピザーラでバイトしてるんですけど辞めたいです。今月の給料はもうもらうのは諦めようとしています。先月の給料もらってバイト飛びたいです。どうすればいいですか？給料は現金手渡しなんで,0,0
15,2026/1/15 19:51,マッサージ、整体,wil********,6分,0,1,1.0,0,0,0.155,0.0,0.0,0.13,あと3日,https://detail.chiebukuro.yahoo.co.jp/qa/question_detail/q11324320926,某整骨院で施術時間が回ってくるまで30 分待ちましたがこれは正常でしょうか？ 18時入店 電気治療終了後に30分待ち ここから整体に入りますが時間が迫っていたのでもう帰りますと伝え退散しました ちなみ...,0,0
16,2026/1/15 19:51,病院、検査,匿名,6分,0,2,2.0,0,0,0.307,0.0,0.0,0.27,あと3日,https://detail.chiebukuro.yahoo.co.jp/qa/question_detail/q14324320924,飲み物をあまり飲まないで採血されていると血管を探られますか？,0,0
17,2026/1/15 19:51,外国映画,1624202676,6分,0,4,4.0,0,0,0.607,0.0,0.0,0.53,あと3日,https://detail.chiebukuro.yahoo.co.jp/qa/question_detail/q13324320923,洋画を探しています。 ストーリーもかなりうる覚えなので記憶違いもしてるかもしれません。情報も少ないです。2000年～2013年くらいまでの洋画でアメリカ映画。美人な奥さんとヒモ？体が悪い？の旦那の家族...,0,0
18,2026/1/15 19:51,インターネットショッピング,c59408fa1,6分,0,5,5.0,0,0,0.752,0.0,0.0,0.65,あと3日,https://detail.chiebukuro.yahoo.co.jp/qa/question_detail/q12324320922,Qoo10のsnowshopというところでald1のアルバムを購入したのですが、発送可能日が3/13と表記されていました。これって本当に3/13にならないと発送されないのでしょうか？ snowshop...,0,0
19,2026/1/15 19:51,大学受験,aa34dbef3,6分,1,3,3.0,0,0,0.447,33.33,0.01,6.87,あと3日,https://detail.chiebukuro.yahoo.co.jp/qa/question_detail/q11324320921,スポーツ用品を開発したり考えたりするものに携わりたいと思ってるんですが、大学の学部は経営学部で合ってるんですか？他におすすめの学部があれば教えてください,0,0
20,2026/1/15 19:51,電子マネー、電子決済,a5cf9cfbb,6分,1,5,5.0,0,3,0.738,20.0,0.04,18.66,あと3日,https://detail.chiebukuro.yahoo.co.jp/qa/question_detail/q10324320920,早生まれなので中学1年生なのにまだ12歳なんですけど、PayPayは今の年齢でも使えるんですか？,0,0
21,2026/1/15 19:51,大学受験,a8b38701f,6分,0,4,4.0,0,0,0.586,0.0,0.0,0.51,あと3日,https://detail.chiebukuro.yahoo.co.jp/qa/question_detail/q14324320919,東京農工大の獣医除く農学部の学科ごとのイメージ、就職の違いがうまく掴めません。それと応用生物科だけ少し偏差値が高いのはなぜですか,0,0
22,2026/1/15 19:51,外国映画,gu********,6分,0,3,3.0,0,0,0.436,0.0,0.0,0.38,あと3日,https://detail.chiebukuro.yahoo.co.jp/qa/question_detail/q13324320918,CIAの工作員が出てくる映画で面白いものはありますか？,0,0
23,2026/1/15 19:51,病気、症状,ID未公開,6分,0,2,2.0,0,0,0.287,0.0,0.0,0.25,あと3日,https://detail.chiebukuro.yahoo.co.jp/qa/question_detail/q12324320917,『逆流性食道炎』の旧称が『糜爛性胃食道逆流症』ですか？,0,0
24,2026/1/15 19:51,予備校、進学塾,c60e832ab,7分,0,2,2.0,0,0,0.285,0.0,0.0,0.25,あと3日,https://detail.chiebukuro.yahoo.co.jp/qa/question_detail/q11324320916,医学部 再受験 予備校について質問です 21歳 医学部再受験をしようと思い塾を探しているのですが、おすすめの予備校はありますか？ 個人的には個別のスタイルの方が自分に合ってるなと思うのですが、（メディ...,0,0
25,2026/1/15 19:51,料理、食材,lD非公開,7分,2,5,2.5,0,0,0.706,40.0,0.02,13.0,あと3日,https://detail.chiebukuro.yahoo.co.jp/qa/question_detail/q10324320915,たまごサンド好きですか？ https://www.google.com/search?num=10&newwindow=1&sca_esv=78ed8ff48bc9a0b0&udm=2&fbs=ADc...,0,0
26,2026/1/15 19:51,友人関係の悩み,今日子☆,7分,3,15,5.0,0,0,2.102,20.0,0.11,20.28,あと3日,https://detail.chiebukuro.yahoo.co.jp/qa/question_detail/q14324320914,本音を言わない人をどう感じますかー❓,0,0
27,2026/1/15 19:51,ゲーム,saito_225,7分,0,1,1.0,0,0,0.139,0.0,0.0,0.12,あと3日,https://detail.chiebukuro.yahoo.co.jp/qa/question_detail/q12324320912,war thunder mobileについて 空軍モードでやっているのですが敵機との距離が表示されません。 たまに表示されるのですが少しズレるとまた表示されなくなります,0,0
28,2026/1/15 19:51,外国映画,ebi********,7分,0,2,2.0,0,0,0.275,0.0,0.0,0.24,あと3日,https://detail.chiebukuro.yahoo.co.jp/qa/question_detail/q13324320913,既出でしたらスイマセン。 ジョディ・フォスター主演の映画「ブレイブ ワン」の地下鉄車内での射殺シーンをどこかで見たと思ったら「ジョーカー」でした。これはパクリではなく偶然ですよね？チャールズ・ブロンソ...,0,0
29,2026/1/15 19:51,メルカリ,bf072aef5,7分,0,1,1.0,0,0,0.136,0.0,0.0,0.12,あと3日,https://detail.chiebukuro.yahoo.co.jp/qa/question_detail/q11324320911,メルカリにあるクロムハーツのジャケットとかって偽物ですか？,0,0
30,2026/1/15 19:51,病院、検査,t,7分,1,4,4.0,0,0,0.54,25.0,0.02,6.43,あと3日,https://detail.chiebukuro.yahoo.co.jp/qa/question_detail/q10324320910,手術部から車椅子で行く患者さんもいますか？,0,0
31,2026/1/15 19:51,恋愛相談、人間関係の悩み,ccd05ba1e,7分,2,15,7.5,0,0,2.012,13.33,0.15,13.6,あと3日,https://detail.chiebukuro.yahoo.co.jp/qa/question_detail/q13324320908,質問ですめちゃくちゃ困ってます 修学旅行前に好きな人とデートに行って告白する予定だったのですが、その子がデートが行けなくなってしまって、修学旅行後に予定が伸びてしまいました。修学旅行前に付き合ってでデ...,0,0
32,2026/1/15 19:51,外国映画,非公開,7分,0,1,1.0,0,0,0.133,0.0,0.0,0.12,あと3日,https://detail.chiebukuro.yahoo.co.jp/qa/question_detail/q14324320909,フィフティシェイズオブグレイのアナスタシア（ダコタジョンソン）めちゃくちゃ可愛いくないですか？ 今日3部作全部見たのですが頭から離れません。,0,0
33,2026/1/15 19:51,恋愛相談、人間関係の悩み,Rio,7分,1,14,14.0,0,0,1.854,7.14,0.26,7.48,あと3日,https://detail.chiebukuro.yahoo.co.jp/qa/question_detail/q12324320907,なぜ男性は若い人が好きなのにいずれ年取る相手と結婚したがるのですか？ 女性も昔と違い、稼いだり自立したりしていたり 金持ちから定期的に金だけもらえれば、あとは子種だけあれば結婚する意味なくないですか？...,0,0
34,2026/1/15 19:51,イヌ,しょう,7分,0,2,2.0,0,0,0.263,0.0,0.0,0.23,あと3日,https://detail.chiebukuro.yahoo.co.jp/qa/question_detail/q10324320905,犬のリンパ腫で全身状態が急速に悪化することがある理由を、腫瘍細胞の性質から説明してください。,0,0
35,2026/1/15 19:51,政治、社会問題,dyw********,7分,0,1,1.0,0,0,0.13,0.0,0.0,0.12,あと3日,https://detail.chiebukuro.yahoo.co.jp/qa/question_detail/q11324320906,維新の364人の国保逃れは、なぜ報道されないのですか。 一番上の方もやっているのですか。,0,0
36,2026/1/15 19:51,ダイエット,1052123263,7分,1,1,1.0,0,0,0.129,100.0,0.0,5.84,あと3日,https://detail.chiebukuro.yahoo.co.jp/qa/question_detail/q14324320904,153/44kgってムチムチですか,0,0
37,2026/1/15 19:51,住宅,ot********,7分,1,9,9.0,0,0,1.154,11.11,0.1,6.71,あと3日,https://detail.chiebukuro.yahoo.co.jp/qa/question_detail/q13324320903,玄関のドアロックのフックが回らなくなりました 油?を吹いたら良くなるのでしょうか?,0,0
38,2026/1/15 19:51,友人関係の悩み,1052756977,7分,0,6,6.0,0,0,0.764,0.0,0.0,0.68,あと3日,https://detail.chiebukuro.yahoo.co.jp/qa/question_detail/q12324320902,高一です。相談というか、愚痴混じりなんですけど聞いてください。 同じクラスの友達に前々から少し違和感を感じていて、あまり良く思えない部分があるなとは思っていたんですけど、最近は限界で顔も見たくありませ...,0,0
39,2026/1/15 19:51,エステ、脱毛,1051409359,7分,0,2,2.0,0,0,0.253,0.0,0.0,0.22,あと3日,https://detail.chiebukuro.yahoo.co.jp/qa/question_detail/q11324320901,湘南美容外科の脱毛に通っているのですが、カウセリングの際に機械指定をしました。 そして、脱毛1回目はカウンセリングした院に行ったのですが、2回目は予約が取れないため、湘南美容外科の違う院に行こうと考え...,0,0
40,2026/1/15 19:51,観光,tri********,7分,0,2,2.0,0,0,0.252,0.0,0.0,0.22,あと3日,https://detail.chiebukuro.yahoo.co.jp/qa/question_detail/q14324320899,ウブド（バリ島）観光について教えてください。 カーチャーター利用を予定しています。 行きたい場所は、 ①ゴアガジャ ②ティルタエンプル寺院 ③ジャティルウィ（棚田）④ウブド王宮&市場 ⑤タマンアユン寺...,0,0
41,2026/1/7 20:50,ライブ、コンサート,匿名,191時間8分,3,17175,5725.0,0,7,1.498,0.02,74.9,1.53,回答受付が終了しました,https://detail.chiebukuro.yahoo.co.jp/qa/question_detail/q14324048779,京セラドームって何ゲートがアリーナの可能性高いですかね？ 実際に見てみないと確定しないのは重々承知です。,0,0
42,2026/1/8 22:22,日本映画,1152829203,165時間37分,11,146425,13311.4,22,328,14.735,0.01,1473.5,16.0,回答受付が終了しました,https://detail.chiebukuro.yahoo.co.jp/qa/question_detail/q14324085614,映画でっちあげについて質問です。 実話と聞いたのですが、実際に他の生徒に聞いたら分かるものではないのでしょうか？,0,0
43,2026/1/1 21:17,バンド,りほ,334時間42分,3,19231,6410.3,2,26,0.958,0.02,47.9,1.01,不明,https://detail.chiebukuro.yahoo.co.jp/qa/question_detail/q10323842520,至急です！ ミセス（Mrs.GREEN APPLE）のゼンジン続編が発表されましたよね。 そこでいくつか質問があるので答えてくれませんか？涙涙 1.大阪では何日間やるのか 2.受付はいつぐらいからか ...,0,0
44,2026/1/14 7:24,K-POP、アジア,みみ,36時間35分,7,28695,4099.3,4,50,13.071,0.02,653.55,14.09,あと2日,https://detail.chiebukuro.yahoo.co.jp/qa/question_detail/q10324269305,BTSの2026年のワールドツアーについての質問です （私はJAPANofficialfanclubに入っています） ①友達と一緒にLIVEに申し込みたいのですが、友達もファンクラブに入っています。s...,0,0
45,2026/1/14 17:41,ライブ、コンサート,mif********,26時間18分,10,29557,2955.7,2,45,18.726,0.03,624.2,20.01,あと2日,https://detail.chiebukuro.yahoo.co.jp/qa/question_detail/q12324283112,嵐のライブの注釈付き2次受付ですが、一次で当選している場合は、別公演で申し込むことはできませんか？ サイトには以下の記載があるので、一次で当選している公演と同一でなければ申し込みできるとも読めます。 ...,0,0
46,2026/1/3 18:21,飲食店,aea7de50d,289時間38分,15,52705,3513.7,9,162,3.033,0.03,101.1,3.41,回答受付が終了しました,https://detail.chiebukuro.yahoo.co.jp/qa/question_detail/q10323902570,マクドナルドからスパチキが消えるのですが、その理由はなんだと思いますか？店側の利益が少ないからですかね？,0,0
47,2026/1/12 0:26,政治、社会問題,1251744602,91時間33分,5,22268,4453.6,0,123,4.053,0.02,202.65,4.77,不明,https://detail.chiebukuro.yahoo.co.jp/qa/question_detail/q10324193750,衆議院はなぜ解散するんですか？？色々調べたところ政治状況に合わせてタイミングをみて解散とありますがただ任期を伸ばしたいからという理由ではないんですか？,0,0
48,2026/1/12 0:10,ファーストフード,きゃきゃん,91時間49分,4,8613,2153.2,0,9,1.563,0.05,31.26,1.65,回答受付が終了しました,https://detail.chiebukuro.yahoo.co.jp/qa/question_detail/q14324193224,吉野家の店員さんにお聞きしたいです。 今日の夜、角煮定食を食べようとしたら今日分は売り切れでした。今日分ということは、明日があるとのことでしょうけど、搬入？角煮などの発注されたものはいつ何時ごろ届きま...,0,0
49,2026/1/15 7:05,株式,1g7hy5ki,12時間54分,9,2363,262.6,13,62,3.05,0.38,8.03,7.7,あと3日,https://detail.chiebukuro.yahoo.co.jp/qa/question_detail/q13324302328,世界の株価 というサイトが開かなくなったのですが何故でしょうか？ https://sekai-kabuka.com/,0,0
50,2026/1/15 17:10,携帯型ゲーム全般,bd5c2137a,2時間49分,2,644,322.0,0,7,3.792,0.31,12.23,5.58,不明,https://detail.chiebukuro.yahoo.co.jp/qa/question_detail/q10324315375,ブロスタで質問です。ショップに10コインがありますが、これはまた騎士ダグ的なやつですか？,0,0
51,2026/1/15 19:51,絵画,1052904259,8分,0,2,2.0,0,0,0.225,0.0,0.0,0.2,あと3日,https://detail.chiebukuro.yahoo.co.jp/qa/question_detail/q13324320898,イラストを仕事にしたくて色んな講座を見ていたら絵を描ききれ無くなりました。 描いてる最中にこの構図じゃ1枚絵として足りないとかこの向きでこの手にはならないとか色んなところを修正してたら描き切る前に燃え...,0,0
52,2026/1/15 19:51,生き方、人生相談,非公開,8分,3,7,2.3,0,9,0.782,42.86,0.02,42.89,あと3日,https://detail.chiebukuro.yahoo.co.jp/qa/question_detail/q12324320897,ぼくをイジメた人はもともとイジメの被害者だった人でした。 自分がやられたから人には優しくする人と、自分がやられたから人に自分がやられたことをする人との違いってなんですか？,0,0
53,2026/1/15 19:51,超常現象、オカルト,James1950s,9分,1,8,8.0,0,3,0.888,12.5,0.07,14.78,あと3日,https://detail.chiebukuro.yahoo.co.jp/qa/question_detail/q11324320896,呪いの人形というとどういう見た目を思い浮かべますか?,0,0
54,2026/1/15 19:51,iPhone,天然水,9分,0,2,2.0,0,0,0.22,0.0,0.0,0.2,あと3日,https://detail.chiebukuro.yahoo.co.jp/qa/question_detail/q10324320895,Apple公式店舗でアイフォンを買ったのですが、下取りは買ってから14日以内、もしくははいそうのばあいきっとが届いてから14日以内だとどちらが正しいですか?,0,0
55,2026/1/15 19:51,料理、食材,ツインレイ,9分,3,7,2.3,0,1,0.766,42.86,0.02,18.45,不明,https://detail.chiebukuro.yahoo.co.jp/qa/question_detail/q14324320894,ハンバーグカレーは美味い❓,0,0
56,2026/1/15 19:51,大学受験,lD非公開,9分,0,5,5.0,0,0,0.544,0.0,0.0,0.49,あと3日,https://detail.chiebukuro.yahoo.co.jp/qa/question_detail/q13324320893,灘高校や開成高校やラサール高校を出ていながら Ｆラン大学へ行く人も中にはいますか？,0,0
57,2026/1/15 19:51,トレーニング,1050786660,9分,0,3,3.0,0,0,0.324,0.0,0.0,0.29,あと3日,https://detail.chiebukuro.yahoo.co.jp/qa/question_detail/q12324320892,筋トレ リアレイズをしっかりやっている場合はリバースフライって正直不要（優先度低い）ですか？ 背中と肩を同じ日にトレーニングしています。 背中はワンハンドロウ、ダンベルロウ、デッドリフト、リバースフラ...,0,0
58,2026/1/15 19:51,高校受験,b8c45b3e1,9分,0,3,3.0,0,0,0.322,0.0,0.0,0.29,あと3日,https://detail.chiebukuro.yahoo.co.jp/qa/question_detail/q11324320891,高校面接について 今度高校受験の面接試験があります 面接のときのセリフを考えるのに今凄い引っかかっているので優しい方一緒にくれませんか？ 中1の終わりで不登校になり中2の途中から別室登校で週数回登校し...,0,0
59,2026/1/15 19:51,メンタルヘルス,匿名,9分,0,0,0.0,0,0,0.0,0.0,0.0,0.0,あと3日,https://detail.chiebukuro.yahoo.co.jp/qa/question_detail/q10324320890,精神科医の男性Aは、私(女)が胆道閉鎖症という事を知っているのに、私に毎日飲む薬を10錠出したのですが、Aは、私が胆道閉鎖症という事を知っているのに、何故、毎日飲む薬を10錠も出したのでしょうか？ ※...,0,0
60,2026/1/15 19:50,職場の悩み,非公開,10分,1,2,2.0,0,0,0.191,50.0,0.0,4.54,あと3日,https://detail.chiebukuro.yahoo.co.jp/qa/question_detail/q13324320888,営業で成約比2割と4割の営業エリアの違いは？ どれぐらい成績に差が出ますか？,0,0
61,2026/1/15 19:50,Yahoo!オークション,1053196630,10分,1,6,6.0,0,0,0.57,16.67,0.03,4.86,あと3日,https://detail.chiebukuro.yahoo.co.jp/qa/question_detail/q12324320887,昨日、入札して落札した商品の件ですが、入金をセブンイレブンで行った後の4時間後に出品者のミスで商品を破損させてキャンセル扱いとなりました。 この場合は返金される予定ですが、返金口座はウオレット登録の口...,0,0
62,2026/1/15 19:50,ライブ、コンサート,ﾌﾞﾙｰﾘﾝｺﾞ,10分,2,35,17.5,0,0,3.302,5.71,0.58,11.64,あと3日,https://detail.chiebukuro.yahoo.co.jp/qa/question_detail/q11324320886,ミセスのゼンジンって1人で申し込むのと2人（1人の同行者）で申し込むのとではどちらのほうが当たりやすいですか？,0,0
63,2026/1/15 19:50,ゲーム,SORA,10分,0,2,2.0,0,0,0.188,0.0,0.0,0.17,あと3日,https://detail.chiebukuro.yahoo.co.jp/qa/question_detail/q10324320885,原神について アルハイゼン、雷電、行秋で超開花パーティを組む場合、後1人は誰がいいですか？ 最適なものと、代替の星4も教えてください,0,0
64,2026/1/15 19:50,麻雀,wro********,10分,1,2,2.0,0,0,0.187,50.0,0.0,4.44,あと3日,https://detail.chiebukuro.yahoo.co.jp/qa/question_detail/q12324320882,雀魂や牌譜屋の記録についてなんですが ダブロンされたときって放銃回数は2回分カウントするか分かりますか？,0,0
65,2026/1/15 19:50,タブレット端末,c30ccc5cc,10分,0,7,7.0,0,0,0.651,0.0,0.0,0.6,あと3日,https://detail.chiebukuro.yahoo.co.jp/qa/question_detail/q10324320880,今年入学する学校の推奨教材がiPadとChromebookなんですが、どちらの方が使いやすいですか？ iPad(A16)は第11世代でキーボード・タッチペンもセット、ChromebookはROA733...,0,0
66,2026/1/15 19:50,生物、動物、植物,相,10分,0,3,3.0,0,0,0.278,0.0,0.0,0.25,あと3日,https://detail.chiebukuro.yahoo.co.jp/qa/question_detail/q11324320881,生物の質問です。 T細胞やB細胞って血液の中にいるのですか？ 今までずっとリンパ液の中に存在していて免疫反応の時に活性化されて血管などに出てくるものだと考えていました。,0,0
67,2026/1/15 19:50,ライブ、コンサート,1151215809,10分,1,43,43.0,0,0,3.959,2.33,1.7,7.84,あと3日,https://detail.chiebukuro.yahoo.co.jp/qa/question_detail/q14324320879,ミセスのゼンジンでのライブ申し込みでの申込受付番号と申込状況照会用パスワードって何ですか？ どこかで確認できたりしますか？,0,0
68,2026/1/15 19:50,ライブ、コンサート,naochan,10分,0,3,3.0,1,0,0.274,0.0,0.0,8.63,あと3日,https://detail.chiebukuro.yahoo.co.jp/qa/question_detail/q13324320878,【至急】SnowManペンライトの不具合について 1月17日にSnowMan Dome Tour 2025 ONに参戦予定です。 先日14日のプレ販売日にこうにしたペンライトが、購入してすぐ点灯確認し...,0,0
