1455,2026/1/15 19:09,ライブ、コンサート,tvb********,2時間18分,2,27,13.5,0,0,0.195,7.41,0.03,0.91,あと3日,https://detail.chiebukuro.yahoo.co.jp/qa/question_detail/q14324319324,明後日、娘140cmが東京ドームに行くのですが、 Aスタンドで子供140cmが埋もれることはありますか？ 9月はtwiceのライブで1階三塁で7列目でしたが、見えなかった為、優しいお姉さん達が通路側を...,0,0
1456,2026/1/15 19:09,避妊,mpe********,2時間18分,3,34,11.3,0,0,0.245,8.82,0.03,1.32,あと3日,https://detail.chiebukuro.yahoo.co.jp/qa/question_detail/q13324319323,大至急。避妊に失敗したかもしれません。 昨日の夜、23時頃に彼と性、行為をしました。 彼のモノとゴムのサイズが合っていないのか、理由は分かりませんが毎回、射、精したあとに抜こうとするとスルッと抜けて私...,0,0
1457,2026/1/15 19:09,鉄道、列車、駅,1249935659,2時間18分,3,49,16.3,0,0,0.353,6.12,0.06,1.42,あと3日,https://detail.chiebukuro.yahoo.co.jp/qa/question_detail/q12324319322,小田急の駅で、JR川崎駅に、一番近い駅はどの駅でしょうか？ また、その駅は、JR川崎駅まで徒歩圏内ですか？,0,0
1458,2026/1/15 19:09,メンズシューズ,.,2時間18分,0,2,2.0,0,0,0.014,0.0,0.0,0.01,あと3日,https://detail.chiebukuro.yahoo.co.jp/qa/question_detail/q11324319321,NIKEの靴を１センチでかく買ってしまいました。おすすめのインソールがあればリンクお願いします。,0,0
1459,2026/1/15 19:09,恋愛相談、人間関係の悩み,1053189847,2時間18分,3,53,17.7,0,3,0.382,5.66,0.07,2.1,あと3日,https://detail.chiebukuro.yahoo.co.jp/qa/question_detail/q10324319320,恋愛相談です！ 昨日マチアプで3ヶ月程前から連絡を取っていたかたと初めて会いました。 元々2回会う予定があったのですが、私の体調のせいで2回ドタキャンしてしまい、そこから5日ほど連絡がなく私から追いで...,0,0
1460,2026/1/15 19:09,趣味,bor********,2時間18分,4,45,11.2,0,0,0.324,8.89,0.04,1.75,あと3日,https://detail.chiebukuro.yahoo.co.jp/qa/question_detail/q14324319319,初めてミシンの購入を検討しています。自分で調べたり販売店に問い合わせたりしたのですが、候補が増えてしまいなかなか決められず困っています。 用途や希望、候補を載せますので、この中でおすすめがあれば教えて...,0,0
1461,2026/1/15 19:09,ゲーム,たこめしやきそばん,2時間18分,0,2,2.0,0,0,0.014,0.0,0.0,0.01,あと3日,https://detail.chiebukuro.yahoo.co.jp/qa/question_detail/q12324319317,ゆく育について質問です。 魔王姉の武器を色んな人がデスサイズにしていますが、かみさまのナイフ10000回出撃のほうが攻撃力高くなるんじゃないんですか？,0,0
1462,2026/1/15 19:09,iPhone,Q,2時間19分,2,22,11.0,0,0,0.158,9.09,0.02,0.87,あと3日,https://detail.chiebukuro.yahoo.co.jp/qa/question_detail/q13324319318,iPhoneを新しいのに移行したのですが、添付画像の青いアイコンを取得するにはどうしたら良いでしょうか？,0,0
1463,2026/1/15 19:09,受験、進学,c2b2e99e1,2時間19分,2,16,8.0,0,0,0.115,12.5,0.01,0.83,あと3日,https://detail.chiebukuro.yahoo.co.jp/qa/question_detail/q11324319316,至急教えてください！ 北海道医療センター附属札幌看護学校に来年度入学する者です。 入学に向けて色々なものを親と準備しています。そのうち、教科書がパソコンで閲覧する電子テキストと紙のテキストと両方使うと...,0,0
1464,2026/1/15 19:09,カラオケ,kel********,2時間19分,5,17,3.4,0,0,0.122,29.41,0.0,1.91,あと3日,https://detail.chiebukuro.yahoo.co.jp/qa/question_detail/q10324319315,カラオケ1日40曲は歌いすぎですか。 40曲歌い、サワー3杯で810円でした。,0,0
1465,2026/1/15 19:09,ファイナルファンタジー,ID未公開,2時間19分,1,6,6.0,0,0,0.043,16.67,0.0,0.4,あと3日,https://detail.chiebukuro.yahoo.co.jp/qa/question_detail/q14324319314,FC FF3 敵のメテオを軽減する方法は ないのでしょうか？ アーリマンなどのメテオを食らうと 2〜3人死亡する可能性がある もしくはほとんど瀕死 最悪全滅,0,0
1466,2026/1/15 19:09,ギター、ベース,こーぎい,2時間19分,5,78,15.6,0,19,0.56,6.41,0.09,6.4,あと3日,https://detail.chiebukuro.yahoo.co.jp/qa/question_detail/q13324319313,ギターカテゴリーってギターに詳しい人が回答者やってると思ったらそうでもないんですかね？,0,0
1467,2026/1/15 19:09,ヘアスタイル,cbf33fb0e,2時間19分,0,7,7.0,0,0,0.05,0.0,0.0,0.05,あと3日,https://detail.chiebukuro.yahoo.co.jp/qa/question_detail/q12324319312,中学生男子です。自分は今センター分けで右の画像のようなロン毛にしたくて髪伸ばしてたら髪型が左のイラストみたいなかんじになってしまったのですが一回美容院で髪を整えるべきでしょうか？,0,0
1468,2026/1/15 19:09,Amazon,b64541d5e,2時間19分,0,3,3.0,0,0,0.022,0.0,0.0,0.02,あと3日,https://detail.chiebukuro.yahoo.co.jp/qa/question_detail/q14324319309,外部のリンクからAmazonの商品ページに飛ぶと「〇〇個のオプション」という画面が勝手に立ち上がるのですが、この機能を無効にする方法を教えてください これのせいで自動購入botに勝てません,0,0
1469,2026/1/15 19:09,税金,bacb87de,2時間19分,1,5,5.0,0,0,0.036,20.0,0.0,0.39,あと3日,https://detail.chiebukuro.yahoo.co.jp/qa/question_detail/q10324319310,確定申告について教えて下さい。 ２年ほど無職でした。 去年から一人暮らしを始め 2025年1月～11月 タイミー&シェアフル 2025年12月～ アルバイト勤務 12月の給料は1月振り込みとなります。...,0,0
1470,2026/1/15 19:09,インターネットショッピング,6867306,2時間19分,0,3,3.0,0,0,0.022,0.0,0.0,0.02,あと3日,https://detail.chiebukuro.yahoo.co.jp/qa/question_detail/q11324319311,vjuir .shopというところでbeck and callというところの服を買ったのですが、これは安全なサイトですか？ ところどころ文字がおかしいところ、メールアドレスの登録を求めなかったところ、...,0,0
1471,2026/1/15 19:09,恋愛相談、人間関係の悩み,みっちゃん,2時間19分,4,14,3.5,0,0,0.1,28.57,0.0,1.52,あと3日,https://detail.chiebukuro.yahoo.co.jp/qa/question_detail/q12324319307,人生で2回は骨折するらしいですが皆さんは何回骨折したことがありますか？？自分は0回です,0,0
1472,2026/1/15 19:09,Android,赤砂のサソリ,2時間19分,2,6,3.0,0,0,0.043,33.33,0.0,0.75,あと3日,https://detail.chiebukuro.yahoo.co.jp/qa/question_detail/q13324319308,アカウント削除について質問です 現在、とあるソーシャルゲームアプリ（スマホゲーム）を最初からスタートしようと思い、アカウント削除をしようとしたら警告文が表示されました。 私は少し不安に思いアカウント削...,0,0
1473,2026/1/15 19:09,妊娠、出産,eez********,2時間19分,2,22,11.0,0,0,0.157,9.09,0.02,0.87,あと3日,https://detail.chiebukuro.yahoo.co.jp/qa/question_detail/q11324319306,妊娠経験者さんに質問です！ 昨日妊娠検査薬で陽性反応出て、今日仕事終わることろに急に気持ち悪くなってずっと唾を飲み込んでました。これってつわりの始まりみたいな感じなんですかね？早すぎんかなっとも思って...,0,0
1474,2026/1/15 19:09,iPhone,あ,2時間19分,1,26,26.0,0,0,0.186,3.85,0.05,0.54,不明,https://detail.chiebukuro.yahoo.co.jp/qa/question_detail/q14324319304,至急お願いします。 ほぼ毎日、iPhoneの探すアプリに「不明なWireless Tagが検出されました」と通知が来るんですが、最近ストーカー？みたいなのされてることにきずきました。 そのTagみたい...,0,0
1475,2026/1/15 19:09,政治、社会問題,b70fe0c,2時間19分,3,30,10.0,0,2,0.215,10.0,0.02,1.7,あと3日,https://detail.chiebukuro.yahoo.co.jp/qa/question_detail/q10324319305,高市政権で株が上がっても庶民はたいして買えねーよなんの意味もない高市は一部の富裕層だけ優遇するんですね酷くないですか？,0,0
1476,2026/1/15 19:09,動画サービス,1052288377,2時間19分,0,3,3.0,0,0,0.021,0.0,0.0,0.02,あと3日,https://detail.chiebukuro.yahoo.co.jp/qa/question_detail/q13324319303,Tiktokのバイトな日常って人のある動画探してるんですけど..見つからなくて困ってます 内容はおみせが忙しい時にゆーだいが残業しようとするんですけど人件費がーっていって店長が帰らそうとするんですけど...,0,0
1477,2026/1/15 19:09,地震,koh********,2時間19分,2,15,7.5,0,0,0.107,13.33,0.01,0.82,あと3日,https://detail.chiebukuro.yahoo.co.jp/qa/question_detail/q12324319302,地震の際、ガラスの破片や、釘など、また、瓦礫倒壊の足への被害を減らすなど、足の裏や、上部を守る靴をAmazonで買いたいのですが、安全靴で検索したものの中で選べばいいのか、 防災スリッパで検索したもの...,0,0
1478,2026/1/15 19:09,スマホアプリ,b87139ed5,2時間20分,1,11,11.0,0,0,0.079,9.09,0.01,0.43,あと3日,https://detail.chiebukuro.yahoo.co.jp/qa/question_detail/q10324319300,duolingoについて質問です。 パスワードを忘れたので、新しくリセットしたいのですが、アプリと公式サイトどちらもパスワードが必要で入れません。 また、カスタマーサービスに連絡しようとも思いましたが...,0,0
1479,2026/1/15 19:09,ショッピング,yuk********,2時間20分,0,6,6.0,0,0,0.043,0.0,0.0,0.04,あと3日,https://detail.chiebukuro.yahoo.co.jp/qa/question_detail/q11324319301,サンキューマートってSHEINから仕入れてるんですか？それとも、SHEINがサンキューマートから仕入れてるんですか？ 似た商品ばかりで気になってしまい…,0,0
1480,2026/1/15 19:09,大学受験,Hscvuyrdv,2時間20分,2,90,45.0,0,0,0.642,2.22,0.29,1.35,あと3日,https://detail.chiebukuro.yahoo.co.jp/qa/question_detail/q14324319299,共テのバレないカンニングについて ①カンニングペーパーを靴下等、絶対に誤っても零れ落ちないところに隠す ②試験中に離席し、トイレに行って個室に入り①を確認 としたら絶対にバレなくないですか？ どう対策...,0,0
1481,2026/1/15 19:09,恋愛相談、人間関係の悩み,b6b2029ab,2時間20分,0,5,5.0,0,0,0.036,0.0,0.0,0.04,あと3日,https://detail.chiebukuro.yahoo.co.jp/qa/question_detail/q13324319298,男です。顔評価してほしいです。返信で送ります。,0,0
1482,2026/1/15 19:09,ファッション,。,2時間20分,0,2,2.0,0,0,0.014,0.0,0.0,0.01,あと3日,https://detail.chiebukuro.yahoo.co.jp/qa/question_detail/q12324319297,大至急お願いします。左の花村くんみたいなジャケット欲しいんですけどどこで売ってますか？,0,0
1483,2026/1/15 19:09,政治、社会問題,レンス,2時間20分,6,54,9.0,0,0,0.385,11.11,0.03,2.5,あと3日,https://detail.chiebukuro.yahoo.co.jp/qa/question_detail/q10324319295,日本経済に対して悲観的な人が結構多いですが、正直今までの30年よりはだいぶましで良い状況じゃないですかね？ 根拠としては大きく3つあって1つ目は地政学的な追い風で長年の効率を求めてやってきたグローバリ...,0,0
1484,2026/1/15 19:09,大学受験,ef5********,2時間20分,1,16,16.0,0,0,0.114,6.25,0.02,0.47,あと3日,https://detail.chiebukuro.yahoo.co.jp/qa/question_detail/q11324319296,Fランク大学は解答用紙に名前と受験番号だけ書けば入れますか？,0,0
1485,2026/1/15 19:09,自動車,sag********,2時間20分,5,22,4.4,0,3,0.157,22.73,0.01,2.56,あと3日,https://detail.chiebukuro.yahoo.co.jp/qa/question_detail/q14324319294,雪道でもPOTENZAほどのグリップ力があればスタッドレスがなくても余裕ですか❓,0,0
1486,2026/1/15 19:09,トレーニング,い,2時間20分,1,7,7.0,0,0,0.05,14.29,0.0,0.4,あと3日,https://detail.chiebukuro.yahoo.co.jp/qa/question_detail/q12324319292,筋トレ動画で、15分以内で終わる全身に効く筋トレのおすすめの動画は何かありますか？またそれは、効果とか本当に出ますか？,0,0
1487,2026/1/15 19:09,郵便、宅配,a85cad19c,2時間20分,0,9,9.0,0,0,0.064,0.0,0.0,0.06,あと3日,https://detail.chiebukuro.yahoo.co.jp/qa/question_detail/q11324319291,先程、インターホンが鳴りこのような服装の方が映っていました。 何かの業者？っぽい服装ですが心当たりが無いのと今家で1人なので少し怖く、居留守しました。 郵便受けに何も入っていなかったので気になります。...,0,0
1488,2026/1/15 19:09,アルバイト、フリーター,、,2時間20分,1,9,9.0,0,0,0.064,11.11,0.01,0.42,あと3日,https://detail.chiebukuro.yahoo.co.jp/qa/question_detail/q10324319290,コスモスのアルバイトは髪染め・ピアス・ネイルは禁止ですか？,0,0
1489,2026/1/15 19:08,物理学,ae80434ae,2時間21分,2,6,3.0,0,2,0.042,33.33,0.0,1.16,あと3日,https://detail.chiebukuro.yahoo.co.jp/qa/question_detail/q14324319289,【至急】高一の物理基礎について 密度が一様な物体を水（密度ρ0[km/m^3]に浮かべたところ、物体の体積V[m^3]の3分の2が水面より下に沈んだ。重力加速度の大きさをg[m/s^2]とする。 （1...,0,0
1490,2026/1/15 19:08,携帯電話キャリア,来世はサンタのエルフ,2時間21分,1,7,7.0,1,0,0.049,14.29,0.0,1.1,あと3日,https://detail.chiebukuro.yahoo.co.jp/qa/question_detail/q13324319288,携帯のプランについての質問です 現在ワイモバイルを家族割りで利用しているのですが､家族割を抜けて自分個人だけで新たに契約しようと考えています。正直ワイモバイルだと少し高いのでLINEMOにしたいです、...,0,0
1491,2026/1/15 19:08,大学受験,vdr********,2時間21分,2,7,3.5,0,0,0.049,28.57,0.0,0.75,あと3日,https://detail.chiebukuro.yahoo.co.jp/qa/question_detail/q12324319287,国公立医学部後期やっている大学がたったの１３校しかないことどう思いますか？実質前期一本,0,0
1492,2026/1/15 19:08,世界史,a2433f721,2時間22分,2,25,12.5,0,1,0.176,8.0,0.02,1.08,あと3日,https://detail.chiebukuro.yahoo.co.jp/qa/question_detail/q10324319285,ロシアの名君って中国と比べたら層が薄く無いですか？ ロシア最高の名君として名の挙がる事の多いピョートル1世やエカチェリーナ2世でさえ農奴制の強化という大ポカやらかして後のロシア革命の遠因を作ってますし...,0,0
1493,2026/1/15 19:08,ライブ、コンサート,c1bbbcb19,2時間22分,1,288,288.0,0,2,2.027,0.35,5.79,2.78,あと3日,https://detail.chiebukuro.yahoo.co.jp/qa/question_detail/q11324319286,ミセスのゼンジンのライブのチケットに応募したいんですが、ライブのチケットに応募するのが初めてなのでエリアの特徴とかエリアの場所とか教えてくれると嬉しいです！,0,0
1494,2026/1/15 19:08,メイク、コスメ,あ,2時間22分,1,10,10.0,0,0,0.07,10.0,0.01,0.42,あと3日,https://detail.chiebukuro.yahoo.co.jp/qa/question_detail/q13324319283,眉マスカラについてです。 眉マスカラを塗っても、正面から見ると眉頭あたりが自眉(黒)ガッツリ見えてて光が当たって上から(?)見ると眉マスカラの色がガッツリ付いてるのが分かる感じになるのは正解なんでしょ...,0,0
1495,2026/1/15 19:08,洋楽,gu********,2時間22分,5,14,2.8,0,3,0.098,35.71,0.0,2.47,あと3日,https://detail.chiebukuro.yahoo.co.jp/qa/question_detail/q12324319282,エルトン・ジョン 好きな曲はなんですか？ Your Song https://www.youtube.com/watch?v=FT3D1Cu6g10,0,0
1496,2026/1/15 19:08,外国映画,hou********,2時間22分,0,30,30.0,1,0,0.211,0.0,0.0,0.91,あと3日,https://detail.chiebukuro.yahoo.co.jp/qa/question_detail/q10324319280,当方48歳ですが22.3歳頃に見たDVDでタイトルを思い出してますが汗洋画です。 寝たら悪魔(その時はスキンヘッドのサングラスだった様な…)が夢に出て来てアル中のおじさん(現実世界では酒を辞めています...,0,0
1497,2026/1/15 19:08,特撮,biat,2時間22分,0,12,12.0,0,0,0.084,0.0,0.0,0.08,あと3日,https://detail.chiebukuro.yahoo.co.jp/qa/question_detail/q11324319281,仮面ライダーオーマジオウの能力‼️ 因果律操作、物語改変、現実改変、未来改変、運命改変、世界改変、概念改変、時間軸無視、50体分身、絶対無敵の防御力、破壊と創造、過去・未来行き来可能、平成が皆の記憶か...,0,0
1498,2026/1/15 19:08,K-POP、アジア,4xm0m,2時間22分,0,11,11.0,0,0,0.077,0.0,0.0,0.08,あと3日,https://detail.chiebukuro.yahoo.co.jp/qa/question_detail/q13324319278,CORTISのジュフンとZB1のユジンの顔がタイプなんですけど共通点ってどこだと思いますか？ あと2人を調味料顔で分類すると何顔になるんでしょうか？,0,0
1499,2026/1/15 19:08,恋愛相談、人間関係の悩み,。,2時間22分,1,18,18.0,0,0,0.126,5.56,0.02,0.47,あと3日,https://detail.chiebukuro.yahoo.co.jp/qa/question_detail/q12324319277,彼氏のことが大好きなのですが同棲してから体調を崩してばなりいます。 どの症状も病院に行くほど辛く診断は大体ストレスが原因と言われます。 同棲前はそのような事がなかったため、彼氏も自分のせいだと責めてい...,0,0
1500,2026/1/15 19:08,コミック,yous,2時間22分,2,22,11.0,0,0,0.154,9.09,0.02,0.85,あと3日,https://detail.chiebukuro.yahoo.co.jp/qa/question_detail/q11324319276,昔ちゃお(？)で連載されていた恋愛漫画が思い出せません。 ・大人しい女の子とイケイケな男の子の恋愛 ・多分学生だった ・大人になって男の子は芸能人、お母さんは人気漫画家になって最後は結婚し子供ができる...,0,0
1501,2026/1/15 19:08,バイク,欲しいのは喪失感,2時間22分,6,51,8.5,0,5,0.358,11.76,0.03,3.49,不明,https://detail.chiebukuro.yahoo.co.jp/qa/question_detail/q10324319275,バイクの車検を切れたままで1ヶ月ちょっと放置した後に車検通すのはバイク乗らなければ問題ないですよね？ 購入時期の関係で、積雪でバイク乗らない(乗れない）2月半ばに車検が切れます。 これからのことも考え...,0,0
1502,2026/1/15 19:08,賃貸物件,msa********,2時間22分,4,21,5.2,0,0,0.147,19.05,0.01,1.54,あと3日,https://detail.chiebukuro.yahoo.co.jp/qa/question_detail/q13324319273,一人暮らしをしている26歳です。 アパートに自転車を2台停めていました。(原則1台しか停めてはいけません) 1年くらいたって「この自転車の持ち主は管理会社までご連絡ください」と張り紙されていました。 ...,0,0
1503,2026/1/15 19:08,ローン,dbd********,2時間22分,6,73,12.2,1,0,0.512,8.22,0.06,3.29,あと3日,https://detail.chiebukuro.yahoo.co.jp/qa/question_detail/q11324319271,借金返済が出来ません。 ご回答お願いします。 今、現在3社合計650万程借金をしています。 事業を拡大する為に1社に350万、あとの2社は消費者金融から150万づつ借り入れしています。 毎月返済してい...,0,0
1504,2026/1/15 19:08,アルバイト、フリーター,1252205345,2時間22分,1,10,10.0,0,0,0.07,10.0,0.01,0.42,あと3日,https://detail.chiebukuro.yahoo.co.jp/qa/question_detail/q12324319272,至急。何やってもバイト落ちるんですけど鹿児島でおすすめの所ありますか？（近くのスーパーも本社のせいで落ちた）,0,0
1505,2026/1/15 19:08,ゲーム,c896a7ba9,2時間22分,2,17,8.5,0,2,0.119,11.76,0.01,1.23,あと3日,https://detail.chiebukuro.yahoo.co.jp/qa/question_detail/q14324319269,原神です！このパーティに雷元素を入れたいのですが、誰を外して誰をいれるべきでしょうか？？,0,0
1506,2026/1/15 19:08,レディースシューズ,ba7ec4356,2時間22分,0,2,2.0,0,0,0.014,0.0,0.0,0.01,あと3日,https://detail.chiebukuro.yahoo.co.jp/qa/question_detail/q10324319270,adidasスペツィアルのサイズは、ワンサイズ小さめにすべきですか？ 23か23.5で迷っています。 普段はエアフォース1の23.5cm、ジョーダン1は24cmを履いてます。,0,0
1507,2026/1/15 19:08,携帯型ゲーム全般,c72231c17,2時間22分,0,6,6.0,0,0,0.042,0.0,0.0,0.04,あと3日,https://detail.chiebukuro.yahoo.co.jp/qa/question_detail/q13324319268,プロスピaをiphoneでやっているのですがおすすめの指サックとタッチペン教えてください,0,0
1508,2026/1/15 19:08,ポケットモンスター,テーマパーカーまさる,2時間22分,0,11,11.0,0,0,0.077,0.0,0.0,0.08,あと3日,https://detail.chiebukuro.yahoo.co.jp/qa/question_detail/q12324319267,ポケモンカード 公式サイトで唯一在庫のあるステラミラクルって人気ないんですか？ トップレアの相場が低いのが理由でしょうか？,0,0
1509,2026/1/15 19:08,病気、症状,2b,2時間23分,3,27,9.0,0,8,0.189,11.11,0.02,2.9,あと3日,https://detail.chiebukuro.yahoo.co.jp/qa/question_detail/q11324319266,ロキソニンよりボルタレンの方が強い薬でしょうか？ 歯が痛くて…,0,0
1510,2026/1/15 19:08,恋愛相談,ccae17b11,2時間23分,9,107,11.9,0,1,0.748,8.41,0.09,4.07,あと3日,https://detail.chiebukuro.yahoo.co.jp/qa/question_detail/q13324319263,彼との関係について。 4ヶ月ほど付き合った彼がいます。 お互い嫌なところが見えてくる時期だというのもあると思うのですが最近喧嘩が増えてギクシャクすることが多く、生理前というのもあったのですがこないだも...,0,0
1511,2026/1/15 19:08,自動車,1059632170,2時間23分,3,11,3.7,0,0,0.077,27.27,0.0,1.12,あと3日,https://detail.chiebukuro.yahoo.co.jp/qa/question_detail/q12324319262,カーシェアの駐車場は、企業から話が来るというより自分から申し込むものなのですか？,0,0
1512,2026/1/15 19:08,メンズ全般,bsvehsasa,2時間23分,1,2,2.0,0,0,0.014,50.0,0.0,0.36,あと3日,https://detail.chiebukuro.yahoo.co.jp/qa/question_detail/q11324319261,IDA splyのTシャツを12月28日に買ったのですが、まだ届きません。元々届くのが遅いと分かっているのですが、大体いつ頃に届くかわかる方いませんか？関東在住です,0,0
1513,2026/1/15 19:08,恋愛相談、人間関係の悩み,sid********,2時間23分,0,7,7.0,0,0,0.049,0.0,0.0,0.05,あと3日,https://detail.chiebukuro.yahoo.co.jp/qa/question_detail/q10324319260,こんばんは、しがない40代の喪男です。 当方、人に好意を抱いた事は多々ありますが、相手方からは好かれた事はございません。 そもそも、確率的にこちらが勝手に好意を持っても、相手がこちらを好く確率は 限り...,0,0
1514,2026/1/15 19:08,病気、症状,tta********,2時間23分,0,16,16.0,0,0,0.112,0.0,0.0,0.11,あと3日,https://detail.chiebukuro.yahoo.co.jp/qa/question_detail/q13324319258,愚痴らせてください。 成人式が一昨日ありその二日前ほどに上司から呼び出され何かなと思うと私の病気と体が弱いことについてでした。 スーパーで働いているのですが年末5連勤だったのですがその時寝不足と疲れも...,0,0
1515,2026/1/15 19:08,アルバイト、フリーター,まだ決まっていません。,2時間23分,2,29,14.5,0,0,0.202,6.9,0.03,0.89,あと3日,https://detail.chiebukuro.yahoo.co.jp/qa/question_detail/q14324319259,至急です。 親の扶養内で隠れてバイトをしている高校生です。 親にバレずに一年半ほどバイトをしていて、月に2〜3万ほどで年間30万くらいの額を稼いでいます。 今の職場を変えるつもりはないのですが、そんな...,0,0
1516,2026/1/15 19:08,小説,a4caf1204,2時間23分,0,14,14.0,0,0,0.098,0.0,0.0,0.1,あと3日,https://detail.chiebukuro.yahoo.co.jp/qa/question_detail/q12324319257,次の小説のタイトルを教えて下さい。 シャーロックホームズのパスティーシュ作品で、原典の『青い紅玉』に登場したヘンリーベイカー氏が黒幕の作品。よろしくお願いします。,0,0
1517,2026/1/15 19:08,宗教,rao********,2時間23分,2,30,15.0,0,0,0.209,6.67,0.03,0.9,あと3日,https://detail.chiebukuro.yahoo.co.jp/qa/question_detail/q11324319256,法華経の中の諸法実相が今一つ理解出来ません。何か例えでどなたか教えて頂きたいです。よろしくお願い致します。,0,0
1518,2026/1/15 19:08,大学受験,c1ce425de,2時間23分,0,5,5.0,0,0,0.035,0.0,0.0,0.03,あと3日,https://detail.chiebukuro.yahoo.co.jp/qa/question_detail/q10324319255,現在高二です 高崎経済大学と専修大学の経済学部で第1志望迷っているのですがどちらのほうが難易度が高いのですか？ 教えていただけると幸いです！,0,0
