739,2026/1/16 19:29,恋愛相談、人間関係の悩み,James1950s,1時間13分,0,5,5.0,0,0,0.068,0.0,0.0,0.07,あと3日,https://detail.chiebukuro.yahoo.co.jp/qa/question_detail/q14324353814,鼻持ちならないと感じた体験談をお聞かせくださいませ,0,0
740,2026/1/16 19:29,プロ野球,1151607195,1時間13分,0,3,3.0,0,0,0.041,0.0,0.0,0.04,あと3日,https://detail.chiebukuro.yahoo.co.jp/qa/question_detail/q13324353813,阪神の近本光司選手がつけてるネックウォーマーわかる方教えてください！,0,0
741,2026/1/16 19:29,特撮,jun********,1時間13分,1,6,6.0,0,0,0.082,16.67,0.0,0.75,あと3日,https://detail.chiebukuro.yahoo.co.jp/qa/question_detail/q12324353812,仮面ライダー龍騎、ライダーの契約モンスターを倒したのは誰がいましたっけ ボルキャンサーは龍騎が倒したけど吸収することに反対で、ナイトに横取りされましたよね デストワイルダーを倒したのも龍騎でしたっけ、...,0,0
742,2026/1/16 19:29,コミック,えす,1時間13分,0,8,8.0,0,0,0.109,0.0,0.0,0.11,あと3日,https://detail.chiebukuro.yahoo.co.jp/qa/question_detail/q11324353811,こんな感じのウルフ？っぽい襟足長め+センター分けが本当に大好きで><♡ このような髪型をした男の子が出てくる漫画があったら ぜひ教えて欲しいです！ 少女漫画、恋愛漫画、BLを求めてます！！,0,0
743,2026/1/16 19:29,政治、社会問題,say********,1時間13分,2,24,12.0,0,0,0.327,8.33,0.04,1.67,あと3日,https://detail.chiebukuro.yahoo.co.jp/qa/question_detail/q10324353810,立憲と公明が選挙対策で新党作ったけど、創価学会の人的にはOKなんですか？,0,0
744,2026/1/16 19:29,コンビニ,aqp********,1時間13分,0,0,0.0,0,0,0.0,0.0,0.0,0.0,あと3日,https://detail.chiebukuro.yahoo.co.jp/qa/question_detail/q14324353809,カラーコピーを、コンビニより高画質で、できる場所都内にありますか？,0,0
745,2026/1/16 19:29,政治、社会問題,c6ad9d8f,1時間13分,1,13,13.0,0,0,0.177,7.69,0.02,0.84,あと3日,https://detail.chiebukuro.yahoo.co.jp/qa/question_detail/q13324353808,電気工事について質問です サスの寸切りを切る時は寸切りカッターで切らない方がいいですか？ バンドソーとかの方がいいですか？,0,0
746,2026/1/16 19:28,アルバイト、フリーター,c7089a7d4,1時間14分,4,12,3.0,0,0,0.161,33.33,0.0,2.8,あと3日,https://detail.chiebukuro.yahoo.co.jp/qa/question_detail/q12324353807,バイトの面接で落ちる理由はなんですか？ わたしはおちたことないのですが、友達が結構落ちるそうで。話してて、受け答えとかですか？,0,0
747,2026/1/16 19:28,鉄道、列車、駅,chi_,1時間14分,1,17,17.0,0,0,0.228,5.88,0.04,0.88,あと3日,https://detail.chiebukuro.yahoo.co.jp/qa/question_detail/q11324353806,新幹線で座席間違えただけでモザイクなしで晒されるのどう思いますか？ https://www.youtube.com/watch?v=olXF9HXAuG8,0,0
748,2026/1/16 19:28,ファーストフード,鯖鯖女と鰤鰤男,1時間14分,6,29,4.8,0,0,0.388,20.69,0.02,4.34,あと3日,https://detail.chiebukuro.yahoo.co.jp/qa/question_detail/q10324353805,マックって魅力的なバーガーないですよね？ 何食べてますか？,0,0
749,2026/1/16 19:28,恋愛相談、人間関係の悩み,匿名,1時間14分,0,19,19.0,0,0,0.254,0.0,0.0,0.25,あと3日,https://detail.chiebukuro.yahoo.co.jp/qa/question_detail/q14324353804,22歳男実家暮らしです 毎月お金は入れてます、家事もやります ただ実家暮らしという時点でやはりこの男は無いと判断されるのでしょうか,0,0
750,2026/1/16 19:28,職場の悩み,1151555688,1時間14分,0,20,20.0,0,0,0.267,0.0,0.0,0.26,あと3日,https://detail.chiebukuro.yahoo.co.jp/qa/question_detail/q13324353803,1人で2倍の業務量をこなすコツとかはありますか？ 当方入社3年目ですが、所属する部署が休職者や時短が多く、また代わりに入った人も新卒者のため、どうしても私が多く業務負担をせざる得ない状況になっておりま...,0,0
751,2026/1/16 19:28,ライブ、コンサート,gai********,1時間15分,0,6,6.0,0,0,0.08,0.0,0.0,0.08,あと3日,https://detail.chiebukuro.yahoo.co.jp/qa/question_detail/q11324353801,befirstのファンミずっと座ったまま見る感じでしょうか？,0,0
752,2026/1/16 19:28,恋愛相談、人間関係の悩み,aa9ef6155,1時間15分,2,27,13.5,1,0,0.36,7.41,0.05,2.98,あと3日,https://detail.chiebukuro.yahoo.co.jp/qa/question_detail/q12324353802,恋愛相談があります…。。 主に社会人男性、彼と近い方に伺えましたらと思います。 好きな方(40代フリー)が居ます。 その方とは仲良くさせて頂いています。 少し前に、彼にPC機材について相談するLINE...,0,0
753,2026/1/16 19:28,公務員試験,xl3********,1時間15分,0,6,6.0,0,0,0.08,0.0,0.0,0.08,あと3日,https://detail.chiebukuro.yahoo.co.jp/qa/question_detail/q10324353800,市役所の試験を申し込んでからキャンセルせざるを得なくなりました。 一応、メールを送ったのですが返信は返ってきてません。 次受ける時に不利になりますか？,0,0
754,2026/1/16 19:28,政治、社会問題,hir********,1時間15分,1,17,17.0,0,0,0.226,5.88,0.04,0.88,あと3日,https://detail.chiebukuro.yahoo.co.jp/qa/question_detail/q13324353798,公明党は、なんで中道だと嘘をつき 日本を壊したいんですか？,0,0
755,2026/1/16 19:28,タブレット端末,へのん、,1時間15分,0,4,4.0,0,0,0.053,0.0,0.0,0.05,あと3日,https://detail.chiebukuro.yahoo.co.jp/qa/question_detail/q14324353799,ipadminiについて質問です 第8世代？でも7世代でもいいのですが ウィザードリィダフネを分割画面でクロームなどと同時起動出来るか知りたいです。 もしプレイされている方、ipadminiお持ちの方...,0,0
756,2026/1/16 19:28,ショッピング,kbg********,1時間15分,1,4,4.0,0,0,0.053,25.0,0.0,0.71,あと3日,https://detail.chiebukuro.yahoo.co.jp/qa/question_detail/q11324353796,金を売るなら、おたからや、買取大吉の2店舗でしたらどちらがいいでしょうか？ 街の買取店なのでどっちもどっちかとは思いますが、行ったことある方がいましたらぜひ教えて下さい。,0,0
757,2026/1/16 19:28,携帯型ゲーム全般,匿名,1時間15分,1,10,10.0,0,0,0.133,10.0,0.01,0.79,あと3日,https://detail.chiebukuro.yahoo.co.jp/qa/question_detail/q12324353797,原神です コロンビーナをナヴィア、フリーナ、ベネットで使う時、それぞれの聖遺物を教えていただきたいです。 またスキル等の順番も教えていただければ幸いです。 このパーティーで戦えるかも知りたいです。,0,0
758,2026/1/16 19:28,ここ、探してます,1052707432,1時間15分,0,2,2.0,0,0,0.026,0.0,0.0,0.03,あと3日,https://detail.chiebukuro.yahoo.co.jp/qa/question_detail/q10324353795,ピクトリンクで位置情報ができなくてお店検索できないので教えていただきたいです。兵庫県にうちらの伝説プリが撮れるところはどこがありますか？？,0,0
759,2026/1/16 19:28,趣味,非公開,1時間15分,0,2,2.0,0,0,0.026,0.0,0.0,0.03,あと3日,https://detail.chiebukuro.yahoo.co.jp/qa/question_detail/q14324353794,神田伯山の講談をもっと知りたいです。 講談の『中村仲蔵』で、斧定九郎（おのさだくろう）と言う人物が登場するのですが役者の血がないけど、凄腕の役者、という話であってますか。 最後、掛け声で「さだいや！」...,0,0
761,2026/1/16 19:28,ローン,1151789466,1時間15分,0,10,10.0,0,0,0.132,0.0,0.0,0.13,あと3日,https://detail.chiebukuro.yahoo.co.jp/qa/question_detail/q11324353791,8月にバイクを購入しオリコでローンを組みました。 今オリコから電話があり支払いしてくださいと音声サービスから言われました。 しかしアプリで確認すると口座も登録できていて支払い回数も本来の支払い回数と一...,0,0
762,2026/1/16 19:28,国際情勢,harunatuakihuyu,1時間15分,0,14,14.0,0,0,0.185,0.0,0.0,0.18,あと3日,https://detail.chiebukuro.yahoo.co.jp/qa/question_detail/q12324353792,マチャドのノーベル平和賞は剥奪すべきと思いませんか？ ノーベル平和賞をトランプにプレゼントした、ふざけすぎてるマチャド、 ノーベル平和賞事務局と故ノーベルに、あまりにも失礼過ぎる行動、平和賞の資格無し...,0,0
763,2026/1/16 19:28,ライブ、コンサート,b8f6f4a97,1時間15分,0,6,6.0,0,0,0.079,0.0,0.0,0.08,あと3日,https://detail.chiebukuro.yahoo.co.jp/qa/question_detail/q10324353790,＝LOVEの横浜スタジアムのライブについてです。 初めてイコラブのライブに行くので色々教えていただきたいです。 ➀新しいグッズが出ると見たのですがそれはいつ頃に出そうですか? ➁このライブを機にグッズ...,0,0
764,2026/1/16 19:28,携帯型ゲーム全般,a4b1efd37,1時間15分,1,20,20.0,0,0,0.264,5.0,0.05,0.91,あと3日,https://detail.chiebukuro.yahoo.co.jp/qa/question_detail/q14324353789,グラブルについてです！ 本日公式から挙げられたこの編成ですが、ジャミルがいなくても機能するでしょうか？ 代わりとして採用出来そうなキャラも教えていただけると幸いです！,0,0
765,2026/1/16 19:28,アニメ,1150414348,1時間15分,2,6,3.0,0,0,0.079,33.33,0.0,1.38,あと3日,https://detail.chiebukuro.yahoo.co.jp/qa/question_detail/q13324353788,1クール(12話)で一気見しやすそうなアニメってありますか？ 4時間前後の列に並ぶのですがただsnsなどを弄るだけじゃ詰まらないのでおすすめを知りたいです,0,0
766,2026/1/16 19:28,話題の人物,bel********,1時間15分,0,3,3.0,0,0,0.04,0.0,0.0,0.04,あと3日,https://detail.chiebukuro.yahoo.co.jp/qa/question_detail/q11324353786,小川晶の不倫相手とその妻は、口封じをされたということですか？,0,0
767,2026/1/16 19:28,国内,awl********,1時間15分,2,8,4.0,0,0,0.105,25.0,0.0,1.4,あと3日,https://detail.chiebukuro.yahoo.co.jp/qa/question_detail/q10324353785,東京都板橋区の中心部（区内で最も発展してるエリア）と、大阪市城東区の中心部（蒲生四丁目エリア）ではどちらの方が都会だと思いますか？,0,0
768,2026/1/16 19:28,恋愛相談、人間関係の悩み,1151036628,1時間16分,1,10,10.0,0,0,0.132,10.0,0.01,0.78,あと3日,https://detail.chiebukuro.yahoo.co.jp/qa/question_detail/q14324353784,成人式の日にずっと好きな元カノと3年振りくらいに再会して飲みにも行って、次はドライブにも行こうって言ってくれました。 自分は人生でこれほど人を好きになったことがないので全力でぶつかりに行こうと思い、飲...,0,0
769,2026/1/16 19:28,恋愛相談,c41899789,1時間16分,2,15,7.5,0,0,0.197,13.33,0.01,1.49,あと3日,https://detail.chiebukuro.yahoo.co.jp/qa/question_detail/q11324353781,次のデートで彼女と手を繋ぎたいのですが、最初から恋人繋ぎってあまりよくないですか？ 最初は握手のようないわゆる普通の繋ぎ方のほうがいいでしょうか。,0,0
770,2026/1/16 19:28,卓球,ae80c5a98,1時間16分,1,18,18.0,0,1,0.236,5.56,0.04,1.27,あと3日,https://detail.chiebukuro.yahoo.co.jp/qa/question_detail/q12324353782,卓球部です。今度、ダブルスの試合がありカットマンと攻撃マンのダブルスと当たります。 試合をするときの戦略などを教えていただきたいです。 自分たちは2人とも右利きの攻撃マンです,0,0
771,2026/1/16 19:28,この仕事教えて,c6ad9d8f,1時間16分,0,7,7.0,0,0,0.092,0.0,0.0,0.09,あと3日,https://detail.chiebukuro.yahoo.co.jp/qa/question_detail/q10324353780,電気工事について質問です サスの寸切りを切る時は寸切りカッターで切らない方がいいですか？ バンドソーとかの方がいいですか？,0,0
772,2026/1/16 19:28,スキンケア,cc116f1cf,1時間16分,0,6,6.0,0,0,0.079,0.0,0.0,0.08,あと3日,https://detail.chiebukuro.yahoo.co.jp/qa/question_detail/q13324353778,至急です！ 私は、脂質肌よりの混合肌です。 クレンジングジェルで、市販のおすすめのやつありますか？ できれば、2000円程度以内のものがいいです。 また、脂質肌よりなので、クレンジングジェルでも、オイ...,0,0
774,2026/1/16 19:28,格闘技、武術全般,ID 非公開,1時間16分,1,1,1.0,0,3,0.013,100.0,0.0,1.82,あと3日,https://detail.chiebukuro.yahoo.co.jp/qa/question_detail/q12324353777,アマチュアの大会に、無所属の選手が出場し、 「わが拳は我流！！我流は無型！！無型ゆえにだれにも読めぬ！！」 と言ってきたら警戒度MAXですよね？,0,0
775,2026/1/16 19:28,話題の人物,ぺこりん,1時間16分,0,4,4.0,0,0,0.052,0.0,0.0,0.05,あと3日,https://detail.chiebukuro.yahoo.co.jp/qa/question_detail/q11324353776,高須克弥さんはガンが見つかってから10年以上が経ちますが、なぜご健在でいられるのでしょうか？（CMも出てるし） やはり、かなりお金をかけて延命させてるんでしょうか？ それともガンをかなり抑えているので...,0,0
776,2026/1/16 19:28,趣味,むむむ,1時間16分,0,6,6.0,0,0,0.078,0.0,0.0,0.08,あと3日,https://detail.chiebukuro.yahoo.co.jp/qa/question_detail/q14324353774,ペン回し初心者です ドクターKTを作るんですが、 ・慶弔サインペンの印字を消すメリット （滑りにくくなるとか？見た目だけ？） ・銀軸ではなく黒軸になってる慶弔サインペンでも代用可か この2点が分かりま...,0,0
777,2026/1/16 19:28,数学,a8c25bc29,1時間16分,2,20,10.0,0,0,0.261,10.0,0.03,1.55,不明,https://detail.chiebukuro.yahoo.co.jp/qa/question_detail/q13324353773,中学校数学の答え教えて欲しいです。,0,0
778,2026/1/16 19:27,幼児教育、幼稚園、保育園,ru-,1時間17分,4,21,5.2,0,0,0.27,19.05,0.01,2.81,あと3日,https://detail.chiebukuro.yahoo.co.jp/qa/question_detail/q11324353771,保育園に行き始まると集団生活になって風邪とか引きやすいと聞きますが､1歳になって保育園預けるようになった方どんな感じでしたか? そういうのがあるとしても最初の1ヶ月とかでその後は免疫ついて?慣れて大丈...,0,0
779,2026/1/16 19:27,タブレット端末,1253095478,1時間17分,0,3,3.0,0,0,0.039,0.0,0.0,0.04,あと3日,https://detail.chiebukuro.yahoo.co.jp/qa/question_detail/q10324353770,iPad Proは、端末の中では長持ちする方でしょうか？ もちろん使い方によるとは思いますが、他のメーカー？とかより。,0,0
780,2026/1/16 19:27,家族関係の悩み,1251848438,1時間17分,1,5,5.0,0,3,0.064,20.0,0.0,1.84,あと3日,https://detail.chiebukuro.yahoo.co.jp/qa/question_detail/q14324353769,皆さん、こんばんは。私の姉が今日また宝塚の私の実家に泊まりに来ました。夕方18時４０分くらいに帰宅しました。姉は朝から仕事へ行ってました。明日は休みです。 宝塚南口の武庫川河川敷で「宝」のライトアップ...,0,0
781,2026/1/16 19:27,Xbox,gs3********,1時間17分,1,4,4.0,0,0,0.051,25.0,0.0,0.69,あと3日,https://detail.chiebukuro.yahoo.co.jp/qa/question_detail/q12324353767,xbox360を中古で買いたいのですがモデルが複数ありおすすめモデルはどれかご教授いただけないでしょうか？ 当方xbox シリーズxは所有しております。,0,0
782,2026/1/16 19:27,海外,garapon,1時間17分,0,2,2.0,0,0,0.026,0.0,0.0,0.03,あと3日,https://detail.chiebukuro.yahoo.co.jp/qa/question_detail/q13324353768,タイ バンコク観光スポット教えて下さい。 朝から夕方までで行けるところ。 夜はナイトマーケット、アイコンサイアム、MBkセンター、マハナコーンスカイウォーク、ムエタイ、プーパッポンカリーなど食べに行っ...,0,0
783,2026/1/16 19:27,アニメ,1152818982,1時間17分,2,5,2.5,0,0,0.064,40.0,0.0,1.33,あと3日,https://detail.chiebukuro.yahoo.co.jp/qa/question_detail/q11324353766,スパイファミリーシーズン3が終わりましたがシーズン4はいつになるでしょうか。又、映画化の可能性はありますか？,0,0
784,2026/1/16 19:27,ライブ、コンサート,1151193934,1時間18分,3,2,0.7,0,0,0.026,150.0,0.0,1.92,不明,https://detail.chiebukuro.yahoo.co.jp/qa/question_detail/q10324353765,渋谷CLUB QUATTROのコインロッカーを利用したいのですが、すぐに埋まってしまいますか？ソールドアウト公演です。,0,0
785,2026/1/16 19:27,高校受験,c4dca7857,1時間18分,0,10,10.0,0,0,0.128,0.0,0.0,0.13,あと3日,https://detail.chiebukuro.yahoo.co.jp/qa/question_detail/q14324353764,受験生です。全然勉強できてなくて焦ってるのに謎の自信が湧いてて全く勉強に手がつきません。 どうか喝を入れて下さい。,0,0
786,2026/1/16 19:27,バスケットボール,1053214354,1時間18分,0,7,7.0,0,0,0.09,0.0,0.0,0.09,あと3日,https://detail.chiebukuro.yahoo.co.jp/qa/question_detail/q13324353763,バスケットボールの得点ルールって、バレーボールみたいに〇〇点先取した方がそのセットを獲得ってした方が面白くないですか？ 今の、4Qで逆転できないような試合はもう見るに堪えないし。 なにか欠点ありますか...,0,0
788,2026/1/16 19:27,携帯型ゲーム全般,1151766141,1時間18分,1,11,11.0,0,2,0.141,9.09,0.02,1.53,あと3日,https://detail.chiebukuro.yahoo.co.jp/qa/question_detail/q12324353762,原神 この中からコロンビーナ、イネファを含めた最強の月感電パーティを作っていただけませんか？ 初の月反応キャラなので、アタッカーは何のステータスが必要なのか分からず火力が伸び悩んでいます、可能であれば...,0,0
789,2026/1/16 19:27,政治、社会問題,1052639089,1時間18分,3,28,9.3,1,2,0.357,10.71,0.03,4.26,あと3日,https://detail.chiebukuro.yahoo.co.jp/qa/question_detail/q10324353760,氷河期世代とゆとり世代っていつ報われるのでしょうか？ 他の世代は何かしらでいい思いをしていますが、この２つの世代は20代、30代でもいい思いせず、老後も暗い未来しかありません。,0,0
790,2026/1/16 19:27,メンズ全般,1051442791,1時間18分,0,9,9.0,0,0,0.115,0.0,0.0,0.11,あと3日,https://detail.chiebukuro.yahoo.co.jp/qa/question_detail/q14324353759,お疲れ様です！ このような無地の黒のナップサックが急遽欲しいです！ ドンキ、ワークマン、調べましたが分からず.. 安いお店おしえてくれませんか！,0,0
791,2026/1/16 19:27,郵便、宅配,tvu********,1時間18分,2,18,9.0,1,1,0.229,11.11,0.02,3.12,あと3日,https://detail.chiebukuro.yahoo.co.jp/qa/question_detail/q13324353758,ウーバーイーツについてです。 私の家は結構な坂の上にあるんですが配達員の人大丈夫でしょうか？ 商品が崩れるとかはいいんですが自転車とかだとしんどいですよね？,0,0
792,2026/1/16 19:27,葬儀,1151207289,1時間18分,3,3,1.0,0,0,0.038,100.0,0.0,1.92,あと3日,https://detail.chiebukuro.yahoo.co.jp/qa/question_detail/q12324353757,友引は、火葬しないのですか。,0,0
793,2026/1/16 19:27,ライブ、コンサート,ara********,1時間18分,0,42,42.0,1,0,0.534,0.0,0.0,1.78,あと3日,https://detail.chiebukuro.yahoo.co.jp/qa/question_detail/q11324353756,国立競技場ライブでの見えかた、音響について。 ミセスのゼンジンライブ申し込みにあたり座席で悩んでいます。 アリーナは埋もれそうなのでスタンド一択にするか 、パノラマエリア(＝3層エリア？)も希望に入れ...,0,0
794,2026/1/16 19:27,数学,zang,1時間18分,0,5,5.0,0,0,0.064,0.0,0.0,0.06,あと3日,https://detail.chiebukuro.yahoo.co.jp/qa/question_detail/q14324353754,共通テストで1A2Bを申し込んだのですが2Bが要らなくなったので当日退出は可能ですか？,0,0
795,2026/1/16 19:27,恋愛相談、人間関係の悩み,be591c544,1時間18分,3,13,4.3,0,0,0.165,23.08,0.01,2.04,あと3日,https://detail.chiebukuro.yahoo.co.jp/qa/question_detail/q10324353755,階段降りる際、大体降りる方と登る方右左決まっていると思うのですが、その時急いでいたため、降りる方を急いで駆け降り、電車から降りてきた人たちが降りる方の道も使っていて、強行突破したのですが、 降りる際に...,0,0
796,2026/1/16 19:27,恋愛相談、人間関係の悩み,1152070518,1時間18分,1,13,13.0,0,0,0.165,7.69,0.02,0.79,あと3日,https://detail.chiebukuro.yahoo.co.jp/qa/question_detail/q13324353753,学校で虐められてる女の子を助けたら逆に自分が虐められるようになりました。 どうすればいいの？笑,0,0
797,2026/1/16 19:27,パソコン,ｍ,1時間18分,2,14,7.0,0,2,0.178,14.29,0.01,2.18,不明,https://detail.chiebukuro.yahoo.co.jp/qa/question_detail/q12324353752,PC起動時にエラーが発生している 下記の条件の時にPC起動時のBIOSにて下記エラーが表示され、起動できません。 ↓ フロントパネルのUSB Cに端子にハブを挿した時のみこれが起こります。以前はそのよ...,0,0
798,2026/1/16 19:27,ポケットモンスター,1052086963,1時間18分,2,4,2.0,0,0,0.051,50.0,0.0,1.3,あと3日,https://detail.chiebukuro.yahoo.co.jp/qa/question_detail/q11324353751,ポケモンzaのランクマでジャスト交代回避って自分と自分のポケモンの距離が離れている状態で交代するとかなり成功しやすいですか,0,0
799,2026/1/16 19:27,男性アイドル,a670cb77,1時間18分,0,7,7.0,0,0,0.089,0.0,0.0,0.09,あと3日,https://detail.chiebukuro.yahoo.co.jp/qa/question_detail/q10324353750,SnowManPOPUPについて質問です。 同行者登録した友人が仕事の都合でどうしても行けなくなりました…。 代表者だけ入れるか事務局に問い合わせたところ、当日スタッフにお問い合わせ下さい。と返信があ...,0,0
800,2026/1/16 19:27,メンズ腕時計、アクセサリー,c5f81d367,1時間19分,0,3,3.0,0,0,0.038,0.0,0.0,0.04,あと3日,https://detail.chiebukuro.yahoo.co.jp/qa/question_detail/q14324353749,"CASIO G-SHOCK MRG-BF1000RG-3AJR 美品 MR-G FROGMAN カシオ フロッグマン 落札数量：1落札価格：480,000円 終了日時：1月8日 17時49分 オークシ...",0,0
801,2026/1/16 19:27,家具、インテリア,非公開,1時間19分,0,3,3.0,0,0,0.038,0.0,0.0,0.04,あと3日,https://detail.chiebukuro.yahoo.co.jp/qa/question_detail/q13324353748,https://store.shopping.yahoo.co.jp/yaeden/fcl3032ecwh2kf.html ? sc_i=shopping-pc-web-top--rcmd_rel-r...,0,0
802,2026/1/16 19:27,病気、症状,1151187519,1時間19分,1,17,17.0,0,0,0.215,5.88,0.04,0.84,あと3日,https://detail.chiebukuro.yahoo.co.jp/qa/question_detail/q12324353747,職場で高所より落下して右手をついて複雑骨折になった男性がいます。翌日に手術をして労災申請をして3ヶ月休職しましたが復職するとまだ手が痛むから仕事を代わりにやって欲しいと頼みます。 医者は完治しない患者...,0,0
803,2026/1/16 19:27,大学数学,sxd********,1時間19分,0,9,9.0,0,0,0.114,0.0,0.0,0.11,あと3日,https://detail.chiebukuro.yahoo.co.jp/qa/question_detail/q11324353746,大学数学アルゴリズムとデータ構造についてです。この問題教えてください。 n個の要素からなる配列から、線形探索によって値を探索する際の最悪の比較回数をs回とする。このとき、8n 個の要素からなる配列から...,0,0
804,2026/1/16 19:27,家族関係の悩み,a3u********,1時間19分,2,13,6.5,0,1,0.164,15.38,0.01,1.78,あと3日,https://detail.chiebukuro.yahoo.co.jp/qa/question_detail/q10324353745,親って安定を望みますけど不安定な高給取りより薄給な正社員の方が安心するのですか？ YouTuberとか創作活動で月100万とか年収1000万とかより月10万の正社員でいてほしいですか？,0,0
805,2026/1/16 19:27,あの人は今,man********,1時間19分,0,2,2.0,0,0,0.025,0.0,0.0,0.02,あと3日,https://detail.chiebukuro.yahoo.co.jp/qa/question_detail/q14324353744,河合奈保子さんってスター誕生で書類選考で落ちたと聞きましたが、よっぽど変な写真送ったんでしょうか？ 最終選考とか決戦大会で落ちたとか言うならわかりますが、書類選考は可愛ければ通るでしょう普通。,0,0
806,2026/1/16 19:27,政治、社会問題,col********,1時間19分,0,1,1.0,0,0,0.013,0.0,0.0,0.01,あと3日,https://detail.chiebukuro.yahoo.co.jp/qa/question_detail/q12324353742,地方自治体の首長の不祥事やスキャンダルが多いですよね？ 何故なんですか？ すぐにオールドメディアガー言う奴がいますが、 別にオールドメディアのせいでは無いですよね？,0,0
