2136,2026/1/16 18:50,恋愛相談、人間関係の悩み,1,3時間19分,1,9,9.0,0,0,0.045,11.11,0.0,0.29,あと3日,https://detail.chiebukuro.yahoo.co.jp/qa/question_detail/q10324352515,二次元オタクが人間に興味を持てるようになる方法ってありますか？ 一生1人でもいいじゃんって言われそうですが、推しは私と一緒に生活してくれないし、双方向のコミュニケーションも今の技術レベルでは不完全なの...,0,0
2137,2026/1/16 18:50,恋愛相談、人間関係の悩み,匿名希望,3時間19分,1,17,17.0,0,0,0.085,5.88,0.01,0.33,あと3日,https://detail.chiebukuro.yahoo.co.jp/qa/question_detail/q13324352513,女性に聞きます 女性の吐く白い息のフェチなんですが男性に「(あなたの)白い息を顔にかけてほしい」と言われたらいっぱいかけてあげますか？,0,0
2138,2026/1/16 18:50,同人誌、コミケ,renren35,3時間19分,2,19,9.5,0,1,0.095,10.53,0.01,0.74,あと3日,https://detail.chiebukuro.yahoo.co.jp/qa/question_detail/q14324352514,自分で漫画を書いて同人誌に持って行ってて締切が間に合わないってどうゆう事ですか？ 会社のパートさんの事です。 自分で漫画？イラスト？かいて同人誌とやり取りがあるそうです。 これは売れてるって事ですか？...,0,0
2139,2026/1/16 18:50,文学、古典,Kurosuji,3時間20分,0,4,4.0,0,0,0.02,0.0,0.0,0.02,あと3日,https://detail.chiebukuro.yahoo.co.jp/qa/question_detail/q10324352510,こちらは金枝篇における一節との事ですが、どの箇所に登場するのでしょうか。 「有形の死すべき身体に姿を借りた聖なる命は、それがしばし収められている限りある媒体の弱さゆえに、やがては汚され崩壊してゆくこと...,0,0
2140,2026/1/16 18:50,YouTube,unknown,3時間20分,1,6,6.0,0,0,0.03,16.67,0.0,0.28,あと3日,https://detail.chiebukuro.yahoo.co.jp/qa/question_detail/q14324352509,東海オンエアのサブチャンネルの動画だと思うんですけど、 虫眼鏡さんが倒れた女性を名古屋まで送ったエピソードとりょうさんがガードレールに車体擦り付けながら走ってたおじいちゃんの車を止めて助けたみたいなエ...,0,0
2141,2026/1/16 18:50,サッカー,c8b8faa43,3時間20分,2,20,10.0,0,0,0.1,10.0,0.01,0.6,あと3日,https://detail.chiebukuro.yahoo.co.jp/qa/question_detail/q13324352508,中二男です。 僕は今は卓球部に入ってるんですが、高校生になったらサッカー部に入りたいと思ってます。 高校生からサッカーを始めても遅くないですか？ 一応小学生時代に3、4年サッカーをやっていました,0,0
2142,2026/1/16 18:50,家電、AV機器,1152016923,3時間20分,0,10,10.0,0,0,0.05,0.0,0.0,0.05,あと3日,https://detail.chiebukuro.yahoo.co.jp/qa/question_detail/q12324352507,この左上にある緑の線はアース線ですか？調べたところ似たような感じなので出来たらここに取り付けたいです。この場所で一緒に取り付けても大丈夫ですか？,0,0
2143,2026/1/16 18:50,ゲーム,b8c0d64a5,3時間20分,0,1,1.0,0,0,0.005,0.0,0.0,0.0,あと3日,https://detail.chiebukuro.yahoo.co.jp/qa/question_detail/q11324352506,ファンタジーライフで、地面でお絵かきしてみようと思ったのですが、道ってあんまりフィットしないんですね。何かお絵かき出来そうな家具ありますか?,0,0
2144,2026/1/16 18:50,政治、社会問題,はにまる ４号,3時間20分,9,86,9.6,0,10,0.429,10.47,0.04,4.15,あと3日,https://detail.chiebukuro.yahoo.co.jp/qa/question_detail/q10324352505,新党「中道改革」の支持者ではなくアンチですが、 高市自民・維新より「まし」であるのは明らかなので、 社民やれいわや共産はたとえ新党から要請がなくても 事実上の選挙協力をすべきではないでしょうか？,0,0
2145,2026/1/16 18:50,コミック,オックー,3時間20分,2,28,14.0,0,0,0.14,7.14,0.02,0.64,あと3日,https://detail.chiebukuro.yahoo.co.jp/qa/question_detail/q14324352504,呪術廻戦についてです。天元の護衛に回ったのが九十九ではなく乙骨ではどうなっていましたか？,0,0
2147,2026/1/16 18:50,アニメ,1152351792,3時間20分,2,14,7.0,0,0,0.07,14.29,0.0,0.57,あと3日,https://detail.chiebukuro.yahoo.co.jp/qa/question_detail/q12324352502,アニメ「呪術廻戦」５０話は段々エヴァンゲリオンみたいな話になっていませんか？補完が同化になっていたり、結構ダブったりしてませんか？,0,0
2148,2026/1/16 18:50,日用品、生活雑貨,^_^,3時間20分,0,2,2.0,0,0,0.01,0.0,0.0,0.01,あと3日,https://detail.chiebukuro.yahoo.co.jp/qa/question_detail/q11324352501,オススメの耳栓教えてください！！電車通勤中、勉強中、読書中に使いたいです。値段の制限はありません,0,0
2149,2026/1/16 18:50,メイク、コスメ,b21ef5657,3時間20分,1,13,13.0,0,0,0.065,7.69,0.01,0.31,あと3日,https://detail.chiebukuro.yahoo.co.jp/qa/question_detail/q10324352500,アイシャドウの中にこの色はチークとファンデでしょうか？,0,0
2150,2026/1/16 18:50,映画,1151332184,3時間20分,3,47,15.7,0,0,0.234,6.38,0.04,0.98,あと3日,https://detail.chiebukuro.yahoo.co.jp/qa/question_detail/q14324352499,高2女子です。小学校くらいから映画監督になりたいと思ってきたのですが、最近映画館という空間に魅力を感じています。 もちろん映画は大好きなのですがイオンシネマのような新しい映画館を作りたいですイメージを...,0,0
2151,2026/1/16 18:50,画像処理、制作,1152764385,3時間20分,1,43,43.0,0,0,0.214,2.33,0.09,0.46,あと3日,https://detail.chiebukuro.yahoo.co.jp/qa/question_detail/q13324352498,生成画像AIで1カ月も調整してめちゃくちゃ量産型ではない細部まで再現可能にしたハイクオリティなキャラ画像が生成できるようになったのですが、 投稿したらすぐに学習されて盗まれてしまうため投稿することをた...,0,0
2152,2026/1/16 18:50,資格,1252701467,3時間20分,2,4,2.0,0,0,0.02,50.0,0.0,0.52,あと3日,https://detail.chiebukuro.yahoo.co.jp/qa/question_detail/q12324352497,CBTでの問題集であるコアカリについての質問です。 CBTが終わったのですが、コアカリや重点ポイント集は卒業試験や国試にも使いましたか？ 国試などはまた別で教材があると思ったので必要なければ処分したい...,0,0
2153,2026/1/16 18:50,Instagram,piedeom,3時間20分,0,0,0.0,0,0,0.0,0.0,0.0,0.0,あと3日,https://detail.chiebukuro.yahoo.co.jp/qa/question_detail/q11324352496,インスタのアーカイブしてハイライトに入れたストーリーに画像のリアクションボタン？があるんですけど反応したら反映されますか？,0,0
2154,2026/1/16 18:50,ドラマ,aa34dbef3,3時間20分,0,6,6.0,0,0,0.03,0.0,0.0,0.03,あと3日,https://detail.chiebukuro.yahoo.co.jp/qa/question_detail/q10324352495,グランメゾンパリで一番最初のディナーの時りんこシェフが作ったソースを作り替えて出した和牛の料理はみんな残してたけど失敗だったの？りんこシェフが作ったやつのままの方良かった？,0,0
2155,2026/1/16 18:50,バイク,a76000ff9,3時間21分,3,27,9.0,0,0,0.134,11.11,0.01,0.88,あと3日,https://detail.chiebukuro.yahoo.co.jp/qa/question_detail/q14324352494,af27 原付 不明症状について教えてください。 3日前からアクセルをひねるとゴボゴボとかぶってる感じで進みません。 何故か後輪ブレーキ7割握るとゴボゴボならず普通に走ります。 何が原因でしょうか？ ...,0,0
2156,2026/1/16 18:50,YouTube,非公開,3時間21分,2,23,11.5,0,0,0.114,8.7,0.01,0.61,あと3日,https://detail.chiebukuro.yahoo.co.jp/qa/question_detail/q13324352493,至急！ホロライブの現地ライブのステージ上って どのようになってるんですか？ 配信ではメンバーが歌って踊ってますが…？,0,0
2157,2026/1/16 18:50,病気、症状,1253300870,3時間21分,1,10,10.0,0,1,0.05,10.0,0.01,0.45,あと3日,https://detail.chiebukuro.yahoo.co.jp/qa/question_detail/q12324352492,アースダニスプレーって吸い込んだらダメですか？一応換気してとかは書いてますが、そこまでダメですか？,0,0
2158,2026/1/16 18:50,邦楽,gu********,3時間21分,8,34,4.2,1,3,0.169,23.53,0.01,3.09,あと3日,https://detail.chiebukuro.yahoo.co.jp/qa/question_detail/q11324352491,槇原敬之さん オススメの曲はなんですか？ どんなときも https://www.youtube.com/watch?v=6xkVnf0wilw,0,0
2159,2026/1/16 18:50,アニメ,ブラックマジシャンガール,3時間21分,2,26,13.0,0,0,0.129,7.69,0.02,0.62,あと3日,https://detail.chiebukuro.yahoo.co.jp/qa/question_detail/q10324352490,友達から送られてきたのですが、何が面白いんですか？,0,0
2161,2026/1/16 18:50,社会保険,cd0b10350,3時間21分,2,20,10.0,0,0,0.099,10.0,0.01,0.59,あと3日,https://detail.chiebukuro.yahoo.co.jp/qa/question_detail/q13324352488,社会保険についてよくわかりません。私は今一つのアルバイト先でバイトをしています。 もっと稼がなきゃいけないので掛け持ちしようと思ってるのですが、その場合今のアルバイト先と掛け持ちするバイト先で社会保険...,0,0
2162,2026/1/16 18:50,高校受験,b354be447,3時間21分,0,6,6.0,0,0,0.03,0.0,0.0,0.03,あと3日,https://detail.chiebukuro.yahoo.co.jp/qa/question_detail/q12324352487,中学1年生女子です。 3年後に、とあるインターナショナルスクールに通いたいと思っているのですが、英語の勉強時間がなかなか取れなくて困っています。 今の中学の部活を辞めたら2時間程度も勉強時間が取れるの...,0,0
2163,2026/1/16 18:50,パチンコ,ゆまちゃん,3時間21分,2,4,2.0,0,0,0.02,50.0,0.0,0.51,あと3日,https://detail.chiebukuro.yahoo.co.jp/qa/question_detail/q11324352486,ICカードを持ってきたらダメですか?,0,0
2164,2026/1/16 18:50,恋愛相談、人間関係の悩み,yuu********,3時間21分,0,6,6.0,0,0,0.03,0.0,0.0,0.03,あと3日,https://detail.chiebukuro.yahoo.co.jp/qa/question_detail/q10324352485,憂鬱や不安な気持ちにならない人っているんですかね？もしいたら秘訣を教えて欲しいです！ または、そういう気持ちにならないように変われた方いますか？？どうやって変わりましたか？？ あと、憂鬱や不安な気持ち...,0,0
2165,2026/1/16 18:49,福祉、介護,1152900864,3時間22分,0,15,15.0,0,0,0.074,0.0,0.0,0.07,あと3日,https://detail.chiebukuro.yahoo.co.jp/qa/question_detail/q14324352484,オムツについて質問です 高齢のおじが、最近トイレが間に合わない為少し前からオムツをしています。思ったより消費ペースが早く困っています。まだ、使い始めてまも無いのでなにかいい方法や１ヶ月でどのくらい使う...,0,0
2166,2026/1/16 18:49,ライブ、コンサート,てなこ,3時間22分,1,8,8.0,0,0,0.039,12.5,0.0,0.28,あと3日,https://detail.chiebukuro.yahoo.co.jp/qa/question_detail/q12324352482,KANA-BOONのおすすめ曲を教えて下さい。 今度初めてライブに行くので、ライブで歌われがちな曲とか！普通に個人的おすすめでも大丈夫です。有名曲いくつかしか知らないのでお願いします！,0,0
2167,2026/1/16 18:49,職場の悩み,xuv********,3時間22分,5,37,7.4,0,2,0.182,13.51,0.01,1.7,あと3日,https://detail.chiebukuro.yahoo.co.jp/qa/question_detail/q10324352480,何をしたら良いかわからない 23歳現在ニートです。新卒で入社した食品企業で営業をやってましたが、全国転勤で職場の雰囲気、人間関係が辛かったことによりメンタルが壊れてしまったこと、親が身体を壊したことで...,0,0
2168,2026/1/16 18:49,ゲーム,名無し,3時間22分,1,26,26.0,0,0,0.128,3.85,0.03,0.37,あと3日,https://detail.chiebukuro.yahoo.co.jp/qa/question_detail/q14324352479,最近の鳴潮のストーリーワンパターンすぎませんか？ ピックアップキャラ(ヒロイン)がメインでそれ以外はほぼ出ず、ギャルゲーのようにヒロインがピンチはまたは主人公に助けを求めて2人で解決して最後は2人でい...,0,0
2169,2026/1/16 18:49,生き方、人生相談,mae********,3時間22分,2,21,10.5,2,0,0.103,9.52,0.01,1.57,あと3日,https://detail.chiebukuro.yahoo.co.jp/qa/question_detail/q13324352478,お友達を作りたいです。 私は50代のおばさんなのですが、酒ばかり飲んで、夜な夜な飲みにばかり出かける夫とのこれからの人生が想像できないのですが、おそらく経済的な理由から別れる事はないと思います。 自分...,0,0
2170,2026/1/16 18:49,観葉植物,Aちゃん,3時間22分,1,21,21.0,0,2,0.103,4.76,0.02,0.64,あと3日,https://detail.chiebukuro.yahoo.co.jp/qa/question_detail/q12324352477,ガジュマルについて、 詳しい方、教えて下さい。 お家でガジュマルを育てているのですが、 冬になって、枯れ木になり、 葉が全部、落ちてしまいました。。 幹？の部分を触ると、割としっかりしていて、 死んで...,0,0
2171,2026/1/16 18:49,モンスターハンター,bcbcb667e,3時間23分,1,19,19.0,0,1,0.094,5.26,0.02,0.49,不明,https://detail.chiebukuro.yahoo.co.jp/qa/question_detail/q11324352476,モンハンワイルズについての質問です。 強属性チャアクを使いたいと思い、アーティア武器の復元強化をしたところ基礎攻撃力強化が4切れ味強化が1つきました。 太刀とかなら強いと思いますが高出ぶっぱなすには渋...,0,0
2172,2026/1/16 18:49,恋愛相談、人間関係の悩み,チェリアン,3時間23分,3,11,3.7,0,0,0.054,27.27,0.0,0.79,あと3日,https://detail.chiebukuro.yahoo.co.jp/qa/question_detail/q14324352474,最期まで笑わせようとする人間って、迷惑でしょうか？,0,0
2173,2026/1/16 18:49,大学受験,c24687b70,3時間23分,1,15,15.0,0,0,0.074,6.67,0.01,0.32,あと3日,https://detail.chiebukuro.yahoo.co.jp/qa/question_detail/q10324352475,愛知大学と福知山公立大学だとどちらが就職有利ですか？,0,0
2174,2026/1/16 18:49,恋愛相談、人間関係の悩み,ccd05ba1e,3時間23分,2,28,14.0,0,5,0.138,7.14,0.02,1.36,あと3日,https://detail.chiebukuro.yahoo.co.jp/qa/question_detail/q13324352473,質問ですめちゃくちゃ困ってます 昨日も質問されていただきました。 修学旅行前に好きな人とデートに行って告白する予定だったのですが、その子がデートが行けなくなってしまって、修学旅行後に予定が伸びてしまい...,0,0
2175,2026/1/16 18:49,ギター、ベース,1252988291,3時間23分,0,24,24.0,0,0,0.118,0.0,0.0,0.12,あと3日,https://detail.chiebukuro.yahoo.co.jp/qa/question_detail/q12324352472,ベースのスケールについて質問です。 もしアドリブでベースを弾くことになったらキーがAだった場合最初にAのところからはじめればペンタトニックスケール弾いて途中でドリアンスケールに変えるとかってしていいん...,0,0
2176,2026/1/16 18:49,アニメ、コミック,まさかず@闇落ちしたいほど陽気,3時間23分,1,10,10.0,0,1,0.049,10.0,0.0,0.44,あと3日,https://detail.chiebukuro.yahoo.co.jp/qa/question_detail/q11324352471,菌が見える主人公の話を作るとしたらどんな作品を見たいですか？ ある程度操ることも可能です。 第１巻の盛り上がりどころは？,0,0
2177,2026/1/16 18:49,ゲーム,1151848143,3時間23分,2,6,3.0,0,0,0.029,33.33,0.0,0.52,あと3日,https://detail.chiebukuro.yahoo.co.jp/qa/question_detail/q14324352469,原神のフリンズについてなのですが フリンズを一凸すると爆発が3回撃てるかわりに翠緑バフが間に合わなくなってしまうので、スクロースの代わりに相性のいいサポーターを入れたいのですが、相性を考えると誰がおす...,0,0
2178,2026/1/16 18:49,恋愛相談、人間関係の悩み,ca3106cd7,3時間23分,0,5,5.0,0,0,0.025,0.0,0.0,0.02,あと3日,https://detail.chiebukuro.yahoo.co.jp/qa/question_detail/q10324352470,MBTIとラブタイプについてです。 ESFP(エンターテイナー)のFAPO(デビル天使)の男子とENFP(広報運動家)のLCPO(主役体質)の女子は相性がいいと思いますか？,0,0
2179,2026/1/16 18:49,就職活動,へー出る場所,3時間23分,0,4,4.0,0,0,0.02,0.0,0.0,0.02,あと3日,https://detail.chiebukuro.yahoo.co.jp/qa/question_detail/q13324352468,鮮魚の求人すくないわりには 身卸しできるひとが居ないから 特別枠で求人がでるのはなぜですか？,0,0
2180,2026/1/16 18:49,大学受験,1052505013,3時間23分,0,2,2.0,0,0,0.01,0.0,0.0,0.01,あと3日,https://detail.chiebukuro.yahoo.co.jp/qa/question_detail/q10324352465,大学入試の英検利用で使うデジタル証明書はどこで印刷できるか教えて欲しいです。 お願いします。,0,0
2181,2026/1/16 18:49,ピアノ、キーボード,********,3時間23分,3,25,8.3,0,3,0.123,12.0,0.01,1.29,あと3日,https://detail.chiebukuro.yahoo.co.jp/qa/question_detail/q14324352464,月光ソナタ第2楽章が弾けるようになったので、次はドビュッシーに挑戦したいと思っています。 「月の光」と「アラベスク第1番」で迷っているのですが、どちらの方が難易度は低いでしょうか。,0,0
2182,2026/1/16 18:49,スキンケア,1051444405,3時間23分,0,10,10.0,0,0,0.049,0.0,0.0,0.05,あと3日,https://detail.chiebukuro.yahoo.co.jp/qa/question_detail/q13324352463,至急！！！！！！ メラニン毛穴、黒ずみ毛穴、頬の毛穴についての質問です。 私は高校3年生なのですが、メラニン毛穴？黒ずみ毛穴？に悩まされています。 手で触った感じだとお風呂上がりはツルツルしていてそれ...,0,0
2183,2026/1/16 18:49,妊娠、出産,a808f5934,3時間23分,1,51,51.0,0,0,0.25,1.96,0.13,0.49,あと3日,https://detail.chiebukuro.yahoo.co.jp/qa/question_detail/q12324352462,妊娠検査薬について質問です。 まだ未婚ですが、結婚前提にお付き合いしている方がいます。いつも28〜３０日周期で生理がきますが、今回は生理予定日から５日経っても来ず妊娠検査薬を購入しました。結果、陽性反...,0,0
2184,2026/1/16 18:49,恋愛相談、人間関係の悩み,1153229718,3時間23分,4,64,16.0,0,1,0.314,6.25,0.05,1.44,あと3日,https://detail.chiebukuro.yahoo.co.jp/qa/question_detail/q11324352461,マッチングアプリがない時代が信じられない 近場の女で妥協するしかないじゃないですか？,0,0
2185,2026/1/16 18:49,コスプレ,1151076529,3時間23分,0,5,5.0,0,0,0.025,0.0,0.0,0.02,あと3日,https://detail.chiebukuro.yahoo.co.jp/qa/question_detail/q14324352459,コスプレ用に全眼カラコンが欲しいのですが、度合りは売っていますか？売っていたら教えてください！,0,0
2186,2026/1/16 18:49,健康、病気、病院,もっちゃわん,3時間23分,0,4,4.0,0,0,0.02,0.0,0.0,0.02,あと3日,https://detail.chiebukuro.yahoo.co.jp/qa/question_detail/q13324352458,ちょうど夕ご飯時なので質問します 子供が吐くのが｢ゲボ｣、大人が吐くのが｢ゲロ｣という考えはあっていますか？,0,0
2187,2026/1/16 18:49,バドミントン,非公開,3時間24分,0,15,15.0,0,0,0.074,0.0,0.0,0.07,あと3日,https://detail.chiebukuro.yahoo.co.jp/qa/question_detail/q11324352456,至急！バドミントンをしています。 この前大阪の末広体育館で試合をしました。その時に羽っぽい柄が描かれた服を着ている選手がいたのですがどこのチームでしょうか？？ 若めの人が多かったです。 情報が少なくす...,0,0
2188,2026/1/16 18:49,大学受験,1151322066,3時間24分,1,7,7.0,0,0,0.034,14.29,0.0,0.28,あと3日,https://detail.chiebukuro.yahoo.co.jp/qa/question_detail/q14324352454,医学部志望高一勉強についてです 高二になる前にやっておくこと教えて頂きたいです。 今青チャート数2B2週目1A3週目、3Cは勉強中です。 英語は文法一通り終えて、英検準一級勉強中です。 やっておくべき...,0,0
2189,2026/1/16 18:49,恋愛相談,afa********,3時間24分,2,11,5.5,0,0,0.054,18.18,0.0,0.54,あと3日,https://detail.chiebukuro.yahoo.co.jp/qa/question_detail/q12324352452,東京大神宮の御守りについて 東京大神宮の御守りの中で、復縁を願う場合はどの御守りを買うべきでしょうか。 以前復縁を経験した際に、復縁の1ヶ月程前に買った鈴蘭守りを持ち歩いていたため、年末にまた鈴蘭守り...,0,0
2190,2026/1/16 18:49,ホテル、旅館,カーマー,3時間24分,5,16,3.2,0,0,0.078,31.25,0.0,1.3,あと3日,https://detail.chiebukuro.yahoo.co.jp/qa/question_detail/q11324352451,自動車で1時間のところで宿泊気分転換でもいいと思いますか？,0,0
2191,2026/1/16 18:49,スキンケア,takku,3時間24分,0,1,1.0,0,0,0.005,0.0,0.0,0.0,あと3日,https://detail.chiebukuro.yahoo.co.jp/qa/question_detail/q10324352450,肝斑治療について 美容CLINICでのトーニングと皮膚科のトレチノイン、ハイドロキノン治療で迷っています どちらが効果があるとかありますか？ 以前12回ほどトーニングを受けたことがあります 一回900...,0,0
2192,2026/1/16 18:49,運転免許,1252687625,3時間24分,0,10,10.0,0,0,0.049,0.0,0.0,0.05,あと3日,https://detail.chiebukuro.yahoo.co.jp/qa/question_detail/q14324352449,免許更新でオンライン受講したくて本日免許証とマイナンバーを一体化しました。 マイナアプリにもログインし登録したのですが、オンラインをしようとすると、受講対象者ではありませんと出てきて、 下に時間を置い...,0,0
2193,2026/1/16 18:49,インターネットショッピング,1251480521,3時間24分,1,36,36.0,0,0,0.176,2.78,0.06,0.42,あと3日,https://detail.chiebukuro.yahoo.co.jp/qa/question_detail/q12324352447,ZOZOTOWNのツケ払いの督促に関して質問なのですが、給料日が毎月20日で今日16日にピンク？赤？の封筒が届いて、その封筒の手紙には今日の16日までが支払いの期日でした。 この場合20日以降に払うと...,0,0
2194,2026/1/16 18:49,コミック,1253330090,3時間24分,2,11,5.5,0,0,0.054,18.18,0.0,0.54,あと3日,https://detail.chiebukuro.yahoo.co.jp/qa/question_detail/q13324352448,ハンターハンターについて質問です。 12巻の表紙って勝手にサラサが描いたものと思ってるんですけど、そういう考察とかってありますか？ ウボォーギンがううﾞぉーぎんになってるのとか、わざとだと思うんです。...,0,0
2195,2026/1/16 18:48,喫煙マナー,lD非公開,3時間25分,0,33,33.0,0,0,0.161,0.0,0.0,0.16,あと3日,https://detail.chiebukuro.yahoo.co.jp/qa/question_detail/q11324352446,結局喫煙者と非喫煙者は分かり合えないのでしょうか？,0,0
2196,2026/1/16 18:48,声優,野奈芽,3時間25分,1,16,16.0,0,0,0.078,6.25,0.01,0.32,あと3日,https://detail.chiebukuro.yahoo.co.jp/qa/question_detail/q10324352445,声優さんはいわゆる「枕」の営業がマストなのですか？,0,0
2197,2026/1/16 18:48,Instagram,Rinka,3時間25分,0,2,2.0,0,0,0.01,0.0,0.0,0.01,あと3日,https://detail.chiebukuro.yahoo.co.jp/qa/question_detail/q14324352444,至急回答お願いします！ Instagramの2段階認証をオンにしていたのですが、2段階認証のDuo Mobileでそのアカウント用のパスワードがなくなってしまいました。アカウント復元もできず、、 知っ...,0,0
2198,2026/1/16 18:48,生き方、人生相談,チェリアン,3時間25分,3,9,3.0,0,0,0.044,33.33,0.0,0.77,あと3日,https://detail.chiebukuro.yahoo.co.jp/qa/question_detail/q13324352443,「もう変わらんでええ」と言われたら、本当に変わらなくていいんですか？,0,0
2199,2026/1/16 18:48,政治、社会問題,名無し,3時間25分,4,21,5.2,1,1,0.102,19.05,0.01,1.7,あと3日,https://detail.chiebukuro.yahoo.co.jp/qa/question_detail/q12324352442,出生率が高い国の特徴の一つに年金制度が無いというのがあります。 もし日本でも年金制度をなくせば出生率は上がりますか。 要は年金が貰えないので老後の面倒を子供にみてもらう必要性から子供を作るということの...,0,0
2200,2026/1/16 18:48,料理、食材,２７℃,3時間25分,3,14,4.7,0,6,0.068,21.43,0.0,1.66,あと3日,https://detail.chiebukuro.yahoo.co.jp/qa/question_detail/q11324352441,煮崩れしにくいと言う品種のジャガイモを購入し 肉じゃがを作ったのですが… 煮崩れました…(TДT) 煮方が悪かったのでしょうか…？ ▪️具材を全て入れ水から煮ました ▪️蓋は閉めてました(灰汁を取る時...,0,0
2201,2026/1/16 18:48,園芸、ガーデニング,ps*******,3時間25分,1,31,31.0,0,1,0.151,3.23,0.05,0.54,不明,https://detail.chiebukuro.yahoo.co.jp/qa/question_detail/q10324352440,これは何の水仙？,0,0
