1477,2026/1/16 19:04,料理、食材,鯖鯖女と鰤鰤男,2時間24分,0,8,8.0,0,0,0.055,0.0,0.0,0.05,あと3日,https://detail.chiebukuro.yahoo.co.jp/qa/question_detail/q11324352991,最近赤から鍋にハマっています スープがうますぎますだけど具材で良さがすごい変わる気がしていてベストな具材はなんだと思いますか? あまりパンチの強い食材じゃない方がいい気がすしてます スープをなるべく汚...,0,0
1478,2026/1/16 19:04,病気、症状,b75be4e0c,2時間24分,0,7,7.0,0,0,0.048,0.0,0.0,0.05,あと3日,https://detail.chiebukuro.yahoo.co.jp/qa/question_detail/q10324352990,最近文字が読めません。 読めないというか読んでいたり聞いてたりしても何にも頭に入ってこない、本を読んでも音楽やテレビを聞いてもそんな感じです。なんですかこれどうしたら治りますか(;_;),0,0
1479,2026/1/16 19:04,デンタルケア,1051588468,2時間24分,1,37,37.0,0,0,0.256,2.7,0.09,0.6,あと3日,https://detail.chiebukuro.yahoo.co.jp/qa/question_detail/q13324352988,今日抜歯の治療中舌の裏側辺りを切ってしまったらしく一縫されました。もし糸が取れても出血がなければ大丈夫でしょうか？,0,0
1480,2026/1/16 19:04,アルバイト、フリーター,you********,2時間24分,0,3,3.0,0,0,0.021,0.0,0.0,0.02,あと3日,https://detail.chiebukuro.yahoo.co.jp/qa/question_detail/q14324352989,らくしふについて質問です。副業先のシフト関連はらくしふにてしているのですがシフト確認画面が、店舗とつながろう。やQRコード読みとり、ラインと連携しよう。 のページのみになりシフト確認が出来ません！ログ...,0,0
1481,2026/1/16 19:04,移住、田舎暮らし,何秒,2時間24分,0,9,9.0,0,0,0.062,0.0,0.0,0.06,あと3日,https://detail.chiebukuro.yahoo.co.jp/qa/question_detail/q12324352987,もともと田舎ですが、都市部から別田舎は、アリでしょうか？,0,0
1482,2026/1/16 19:04,Windows 全般,bac7463de,2時間24分,2,14,7.0,0,0,0.097,14.29,0.01,0.78,あと3日,https://detail.chiebukuro.yahoo.co.jp/qa/question_detail/q11324352986,windows 11のパソコンにWi-Fiを接続したいのですが、ネットワークとインターネットを開いても、それらしきものがプロキシしか出てきません。この場合、どうすればいいのでしょうか？ 下記のパソコン...,0,0
1483,2026/1/16 19:04,女性アイドル,1k,2時間25分,0,1,1.0,0,0,0.007,0.0,0.0,0.01,あと3日,https://detail.chiebukuro.yahoo.co.jp/qa/question_detail/q10324352985,【ニアジョイのリリイベ.お見送り会】 お見送り会で見せたいものがあるんですが、 スケブとかプリントした紙とか持って見せれないんですか？,0,0
1484,2026/1/16 19:04,アニメ、コミック,1153040136,2時間25分,0,2,2.0,0,0,0.014,0.0,0.0,0.01,あと3日,https://detail.chiebukuro.yahoo.co.jp/qa/question_detail/q14324352984,天官賜福の三朗についてです。 アニメ版と漫画版では、なぜビジュアルが異なるのでしょうか？,0,0
1486,2026/1/16 19:04,バラエティ、お笑い,bbe********,2時間25分,0,3,3.0,0,0,0.021,0.0,0.0,0.02,あと3日,https://detail.chiebukuro.yahoo.co.jp/qa/question_detail/q13324352983,去年の12月18日に放送した、X年後の関係者たち（BS-TBS) （食べるラー油）を無料で見られるサイトを 知っている方は、教えてください。 ティーバーでは、終了しています。 見逃してしまって、どうし...,0,0
1487,2026/1/16 19:04,職場の悩み,1252035749,2時間25分,4,20,5.0,0,0,0.138,20.0,0.01,1.5,あと3日,https://detail.chiebukuro.yahoo.co.jp/qa/question_detail/q11324352981,私の勤務先の会社に、晩ごはんを食べると動きたくなくなるという理由で風呂に入ってから、晩ごはんを食べる人がいます。他にもそういう人いますか?。,0,0
1488,2026/1/16 19:04,恋愛相談、人間関係の悩み,綺沙良,2時間25分,1,15,15.0,0,0,0.103,6.67,0.02,0.44,あと3日,https://detail.chiebukuro.yahoo.co.jp/qa/question_detail/q10324352980,恋愛に関して質問です。 同じサークルに2年間片思いしていた男性がいます。 共通の趣味があり、展示会などに何度か誘い、12月には2人で水族館にも行きました。 その数日後、彼から「実は前から私のことを好き...,0,0
1489,2026/1/16 19:04,ファッション,さかな,2時間25分,1,9,9.0,0,0,0.062,11.11,0.01,0.4,あと3日,https://detail.chiebukuro.yahoo.co.jp/qa/question_detail/q14324352979,コーデについての質問です！ 自分(高一、男)は初詣誘われたので女子と行くことなったんですがアクセサリーをつけていくのってよくないですか？また初詣で避けた方がいい服装やこんな服装がいいって言うのがあった...,0,0
1490,2026/1/16 19:04,恋愛相談、人間関係の悩み,obn********,2時間25分,0,2,2.0,0,0,0.014,0.0,0.0,0.01,あと3日,https://detail.chiebukuro.yahoo.co.jp/qa/question_detail/q13324352978,顔面偏差値60は高いですか？,0,0
1491,2026/1/16 19:04,タブレット端末,t,2時間25分,0,1,1.0,0,0,0.007,0.0,0.0,0.01,あと3日,https://detail.chiebukuro.yahoo.co.jp/qa/question_detail/q10324352975,タブレットで動画を観ながらご飯を食べてますか？,0,0
1492,2026/1/16 19:04,プレイステーション4,a42304104,2時間25分,2,4,2.0,0,0,0.027,50.0,0.0,0.71,あと3日,https://detail.chiebukuro.yahoo.co.jp/qa/question_detail/q14324352974,プレステ5でNetflixを見ようと思っているんですが、ネットに繋がっていてもプレステ5のギガは減りますか？教えてください,0,0
1493,2026/1/16 19:04,恋愛相談、人間関係の悩み,非公開,2時間25分,0,4,4.0,0,0,0.027,0.0,0.0,0.03,あと3日,https://detail.chiebukuro.yahoo.co.jp/qa/question_detail/q13324352973,不安障害の者なんですが、悩み相談？です。 最近よくお店で迷惑行為〜で損害賠償数千万〜と聞きます。 それを聞いて加害恐怖っていうか自分も過去にお店などでそういう動画撮ったかも？TikTokとかTwitt...,0,0
1494,2026/1/16 19:04,俳優、女優,チェリアン,2時間25分,2,1,0.5,0,0,0.007,200.0,0.0,0.69,あと3日,https://detail.chiebukuro.yahoo.co.jp/qa/question_detail/q12324352972,沈黙が長いシーンで、何も考えないという選択はあり得ますか。,0,0
1495,2026/1/16 19:04,pixiv,よー,2時間25分,0,9,9.0,0,0,0.062,0.0,0.0,0.06,あと3日,https://detail.chiebukuro.yahoo.co.jp/qa/question_detail/q11324352971,pixivでこういう画風のaiイラストよく見かけるのですが元の絵師がわかる方いませんか？多分人の絵をaiに学習させて作ってると思うのですが,0,0
1496,2026/1/16 19:04,スマホアプリ,b1194f07e,2時間25分,0,8,8.0,0,0,0.055,0.0,0.0,0.05,あと3日,https://detail.chiebukuro.yahoo.co.jp/qa/question_detail/q10324352970,モンストでアブピッシャーの適性が ネオ×3 久遠×2 いますが、これで勝てますでしょうか？ と、最近韓非の獣神化改が発表されましたが、適正及び編成に入ることはありそうですかね？？ また、アブピッシャー...,0,0
1497,2026/1/16 19:03,学校の悩み,a2dd6f827,2時間26分,1,12,12.0,0,0,0.082,8.33,0.01,0.42,あと3日,https://detail.chiebukuro.yahoo.co.jp/qa/question_detail/q14324352969,高校しんどくないですか 早く大人になりたいです,0,0
1498,2026/1/16 19:03,飲食店,1153313307,2時間27分,1,13,13.0,0,0,0.088,7.69,0.01,0.43,あと3日,https://detail.chiebukuro.yahoo.co.jp/qa/question_detail/q13324352968,大至急お願いします 高校生です 明後日友達と西北でランチします。 お店が決まってなくて安くて美味しい店を紹介してください！！ よろしくお願いします,0,0
1499,2026/1/16 19:03,職場の悩み,c51e1826c,2時間27分,0,4,4.0,0,0,0.027,0.0,0.0,0.03,あと3日,https://detail.chiebukuro.yahoo.co.jp/qa/question_detail/q12324352967,上司や先輩の基本のやり方が違うってあるあるなんですかね。 別に後にみんなに教えて貰ったのを自分流で出来るなら良いですが、飲食店でアルバイトしてた時なんかみんな覚えてるマニュアルバラバラなのかってくらい...,0,0
1501,2026/1/16 19:03,ゲーム,1252127564,2時間27分,2,26,13.0,0,1,0.177,7.69,0.02,1.05,不明,https://detail.chiebukuro.yahoo.co.jp/qa/question_detail/q10324352965,Switch2のドラクエ1リメイクのトロフィーの確認方法を教えてください。 ホーム画面で確認できると記載されていたのですが、Switchを購入したばかりでホーム画面を開く方法がわかりません。 どのボタ...,0,0
1502,2026/1/16 19:03,K-POP、アジア,1253285456,2時間27分,0,15,15.0,0,0,0.102,0.0,0.0,0.1,あと3日,https://detail.chiebukuro.yahoo.co.jp/qa/question_detail/q14324352964,写真のG-DRAGONのグッズは今からメンバーシップ登録してもかえるんですかね？？ あと日本円でも買えますか？？,0,0
1503,2026/1/16 19:03,病気、症状,vvl********,2時間27分,1,16,16.0,0,0,0.109,6.25,0.02,0.45,あと3日,https://detail.chiebukuro.yahoo.co.jp/qa/question_detail/q12324352962,下痢便をするのは病気ですか？病院にいくべきですか？ コーヒーに牛乳をいれたのをコップ4杯以上のんでます,0,0
1504,2026/1/16 19:03,友人関係の悩み,ちいかわ,2時間27分,1,18,18.0,0,3,0.122,5.56,0.02,1.07,あと3日,https://detail.chiebukuro.yahoo.co.jp/qa/question_detail/q11324352961,愚痴だし悪口だし本当に申し訳ないのですが、陰キャの友達が、陽キャの前とか陽キャと遊ぶ時、自分のこととかずっと話してて正直ウザイです。 自分のことデブだとか頭悪いだとか言ってるくせに陽キャの前でクッキー...,0,0
1505,2026/1/16 19:03,生き方、人生相談,1150482833,2時間27分,0,3,3.0,0,0,0.02,0.0,0.0,0.02,あと3日,https://detail.chiebukuro.yahoo.co.jp/qa/question_detail/q10324352960,女性より男性の方が､元の顔が整ってる人が多いですか？,0,0
1506,2026/1/16 19:03,音楽,ccbb3632a,2時間27分,0,4,4.0,0,0,0.027,0.0,0.0,0.03,あと3日,https://detail.chiebukuro.yahoo.co.jp/qa/question_detail/q14324352959,曲名を知りたいです。お願いします。 曲の感じ的には たたんたん たん たららららら どん たたたた た たたたたたた どん わかる方がいたらぜひ教えてください！！！,0,0
1507,2026/1/16 19:03,法律相談,非公開,2時間27分,0,5,5.0,0,0,0.034,0.0,0.0,0.03,あと3日,https://detail.chiebukuro.yahoo.co.jp/qa/question_detail/q13324352958,裁判について、 犯罪の有罪判決とかって 犯行時の年齢で決まったり、減刑されるんですか？ 例えば19歳で事件を起こして、発覚時が25歳とかだったら犯行時が未成年だし〜みたいな感じで,0,0
1508,2026/1/16 19:03,芸能人,1053292597,2時間27分,0,2,2.0,0,0,0.014,0.0,0.0,0.01,あと3日,https://detail.chiebukuro.yahoo.co.jp/qa/question_detail/q12324352957,ミッケライブというアプリの広告に出てたこの女性は誰なのか分かる方いますか？,0,0
1509,2026/1/16 19:03,福祉、介護,1150849514,2時間27分,5,140,28.0,2,14,0.948,3.57,0.27,6.79,あと3日,https://detail.chiebukuro.yahoo.co.jp/qa/question_detail/q11324352956,障害の方はどうやって生きてるんですか？ 年金はそんなに高くないですよね？ B型ならせいぜい月2万、A型でも8万程度ですよね そこから交通費や家賃、光熱費、食費、医療費ってやってもカツカツに感じるのです...,0,0
1510,2026/1/16 19:03,自動車保険,miy********,2時間27分,5,61,12.2,0,0,0.413,8.2,0.05,2.09,あと3日,https://detail.chiebukuro.yahoo.co.jp/qa/question_detail/q10324352955,自動車保険の車両保険の免責について。 0－10、5－5、5－10（車対車免0）、5－10のどれがいいでしょうか？ 0－10から他にすると12000円程度変わります。 新型ステップワゴンプレミアムライン...,0,0
1511,2026/1/16 19:03,転職,sas********,2時間27分,3,20,6.7,0,0,0.135,15.0,0.01,1.14,あと3日,https://detail.chiebukuro.yahoo.co.jp/qa/question_detail/q13324352953,入社したその日に会社を辞めるとしたら、どんな理由が考えられますか？,0,0
1512,2026/1/16 19:03,メイク、コスメ,1153003026,2時間27分,0,7,7.0,0,0,0.047,0.0,0.0,0.05,あと3日,https://detail.chiebukuro.yahoo.co.jp/qa/question_detail/q12324352952,画像のカラコンどこのかわかる方いらっしゃいますか‬т т TikTokで見かけて私の好みドンピシャで画像検索とか色々やってみたんですけど全く同じっていうのが出てこなくて… コメントでたくさんカラコンに...,0,0
1513,2026/1/16 19:03,恋愛相談、人間関係の悩み,非公開,2時間27分,0,8,8.0,0,0,0.054,0.0,0.0,0.05,あと3日,https://detail.chiebukuro.yahoo.co.jp/qa/question_detail/q11324352951,女性はなぜ嫉妬するのですか？とても、教えてほしい、、です。,0,0
1514,2026/1/16 19:03,恋愛相談、人間関係の悩み,ぴぽぽ,2時間27分,2,31,15.5,1,4,0.209,6.45,0.03,2.36,あと3日,https://detail.chiebukuro.yahoo.co.jp/qa/question_detail/q13324352948,助けてください 彼氏に来年の3月に死ぬから1年後別れて欲しいと言われたらどうしますか。 先日、彼氏の中退のことで質問させて頂きました者です。 彼氏には 今日今も君のことは愛してるし幸せにしたかった、ず...,0,0
1515,2026/1/16 19:03,Yahoo!知恵袋,ara***,2時間28分,0,9,9.0,0,0,0.061,0.0,0.0,0.06,あと3日,https://detail.chiebukuro.yahoo.co.jp/qa/question_detail/q14324352949,Yahoo 知恵袋の個人情報、例えば アカウントが、 ABC 123 この人は自分の健康のこと、 自分の家族のこと、家の不動産のこと、車のこと、そういうことを質問している人なんだな ということ、わかる...,0,0
1516,2026/1/16 19:03,メルカリ,you********,2時間28分,4,74,18.5,0,0,0.5,5.41,0.09,1.84,あと3日,https://detail.chiebukuro.yahoo.co.jp/qa/question_detail/q10324352950,もう1つメルカリについて質問させて下さい 先日電化製品を購入していただいて、評価も終わっていたのですが、後日その方から 購入いただいた商品が不良品だったので 返品、返金して欲しいと連絡 がきました。 ...,0,0
1517,2026/1/16 19:03,俳優、女優,チェリアン,2時間28分,2,2,1.0,0,0,0.013,100.0,0.0,0.68,あと3日,https://detail.chiebukuro.yahoo.co.jp/qa/question_detail/q12324352947,役を演じ終えたあと、すぐ次に切り替えられないのは問題ですか？,0,0
1518,2026/1/16 19:03,シミュレーションゲーム,glo********,2時間28分,0,2,2.0,0,0,0.013,0.0,0.0,0.01,あと3日,https://detail.chiebukuro.yahoo.co.jp/qa/question_detail/q11324352946,ウマ娘の長距離のステゴ育成用の親は誰がおすすめですか？ 写ってないですがスペちゃん（通常と有馬）とオグリ（全部）とフランスゴルシとタイシン（通常とエンジニア）とアマゾン（通常と嫁）と通常イナリと通常ア...,0,0
1519,2026/1/16 19:03,大学受験,非公開,2時間28分,1,12,12.0,0,0,0.081,8.33,0.01,0.42,あと3日,https://detail.chiebukuro.yahoo.co.jp/qa/question_detail/q14324352944,MARCH、早慶上の経済学部で数学がマストではないのはどこですか？,0,0
1520,2026/1/16 19:03,恋愛相談、人間関係の悩み,＊＊＊＊,2時間28分,0,7,7.0,0,0,0.047,0.0,0.0,0.05,あと3日,https://detail.chiebukuro.yahoo.co.jp/qa/question_detail/q10324352945,人から逆恨みで呪われた体験談が聞きたいです。 自分や周囲の人の体験談があったら教えて下さい。 できればグッドエンドで解決した話だと嬉しいです！,0,0
1521,2026/1/16 19:03,DTM,1252576622,2時間28分,0,17,17.0,0,0,0.115,0.0,0.0,0.11,あと3日,https://detail.chiebukuro.yahoo.co.jp/qa/question_detail/q13324352943,fl studioでevol workstationをインストールしたのですがこれが表示されて音がなりません。 どうしたらいいでしょうか？,0,0
1522,2026/1/16 19:03,ライブ、コンサート,モーサラー,2時間28分,0,2,2.0,0,0,0.013,0.0,0.0,0.01,あと3日,https://detail.chiebukuro.yahoo.co.jp/qa/question_detail/q12324352942,xgのライブってぺんら必須ですか？,0,0
1523,2026/1/16 19:03,政治、社会問題,nan********,2時間28分,3,28,9.3,0,4,0.188,10.71,0.02,1.99,あと3日,https://detail.chiebukuro.yahoo.co.jp/qa/question_detail/q11324352941,次期衆院選で、国民か自民党に過半数を与えるようなことをするようなものならば、世も末？,0,0
1524,2026/1/16 19:03,菓子、スイーツ,bel********,2時間28分,3,8,2.7,0,0,0.054,37.5,0.0,1.06,あと3日,https://detail.chiebukuro.yahoo.co.jp/qa/question_detail/q10324352940,シュークリームとエクレアの生地は同じですか？,0,0
1525,2026/1/16 19:02,一人暮らし、シングルライフ,taro,2時間29分,2,25,12.5,0,0,0.167,8.0,0.02,0.83,あと3日,https://detail.chiebukuro.yahoo.co.jp/qa/question_detail/q14324352939,至急質問です！ 一人暮らしワンルームについて！ ワンルーム1K 六畳なんですが、全身ミラーを置きたくて大きいのがいいんですけど 横60cm、縦180cm か 横80 縦180 か迷ってますが、後者だと...,0,0
1526,2026/1/16 19:02,法律相談,カイセンモン,2時間29分,0,3,3.0,0,0,0.02,0.0,0.0,0.02,あと3日,https://detail.chiebukuro.yahoo.co.jp/qa/question_detail/q13324352938,今更ですが…。少年法は名前は出ないと思いますが、他の刑罰やシステムは成人の人と変わらないんでしたっけ? 傷害とか暴行とか強盗系の事件の話です。殺人とか比較的重い犯罪をしなかった場合って、事です。比較的...,0,0
1527,2026/1/16 19:02,政治、社会問題,1152608310,2時間29分,0,5,5.0,0,0,0.033,0.0,0.0,0.03,あと3日,https://detail.chiebukuro.yahoo.co.jp/qa/question_detail/q12324352937,今度の選挙の比例代表で「ナカミチ」「なかみち」と書いた場合は有効票ですか？,0,0
1528,2026/1/16 19:02,イヌ,キクチ沼真一／8009,2時間29分,0,9,9.0,0,0,0.06,0.0,0.0,0.06,あと3日,https://detail.chiebukuro.yahoo.co.jp/qa/question_detail/q11324352936,北海道産イシモナミについてハニーフラッシュ8009✋ このごろ流行りの過疎マスは 一般カテゴリーにまで進出していますが、過疎マスのプライドは無くなったのでしょうか❓ 過疎マスのプライドを取り戻すいい考...,0,0
1529,2026/1/16 19:02,大学受験,ID 非公開,2時間29分,1,29,29.0,0,0,0.193,3.45,0.06,0.52,あと3日,https://detail.chiebukuro.yahoo.co.jp/qa/question_detail/q10324352935,共テの受験会場が、自分の高校なのは、正直でかいですか？,0,0
1530,2026/1/16 19:02,Yahoo!知恵袋,nmh********,2時間29分,3,55,18.3,0,0,0.367,5.45,0.07,1.36,あと3日,https://detail.chiebukuro.yahoo.co.jp/qa/question_detail/q14324352934,○○について質問です。 ○○と△△を悩んでいます。,0,0
1531,2026/1/16 19:02,恋愛相談、人間関係の悩み,まみむめも,2時間29分,0,24,24.0,0,0,0.16,0.0,0.0,0.16,あと3日,https://detail.chiebukuro.yahoo.co.jp/qa/question_detail/q14324252489,好きな人と好きになってくれた人、どちらを選びますか？ 好きな人は1年くらい好きです。同級生で、少し冷め期に入っています。前は優しい方だったんですが、最近は承認欲求がすごい芽生えてきたというか、性格が少...,0,0
1532,2026/1/16 19:02,サバイバルゲーム,anh********,2時間30分,0,8,8.0,0,0,0.053,0.0,0.0,0.05,あと3日,https://detail.chiebukuro.yahoo.co.jp/qa/question_detail/q13324352933,M45 DOC NiteShift というガスガン。 緑の夜光サイトがついていますが、｢NiteShift」はそれを 意味してるのでしょうか？ スペルが「night」でないですが。 ｢DOC」は何を意...,0,0
1533,2026/1/16 19:02,世界史,krlf,2時間30分,1,23,23.0,0,0,0.153,4.35,0.04,0.48,あと3日,https://detail.chiebukuro.yahoo.co.jp/qa/question_detail/q14324252299,ナポレオンの時代の国同士の戦(いくさ)の主な形態を、御教示下さい。 地上戦と海戦があったと思いますが、地上戦は、騎馬戦、歩兵戦、大砲の砲撃戦が中心なのでしょうか？ 兵士は鎧は着けなかった？ 兵士が携帯...,0,0
1534,2026/1/16 19:02,釣り,1052810386,2時間30分,1,14,14.0,0,0,0.093,7.14,0.01,0.42,あと3日,https://detail.chiebukuro.yahoo.co.jp/qa/question_detail/q12324352932,みなさまならこのタックルだとどういうように使いますか？ 21ポイズングロリアス166mに24メタニウムDC 21ポイズングロリアス174mh＋に21アンタレスDCです,0,0
1535,2026/1/16 19:02,恋愛相談、人間関係の悩み,非公開,2時間30分,1,8,8.0,0,0,0.053,12.5,0.0,0.38,あと3日,https://detail.chiebukuro.yahoo.co.jp/qa/question_detail/q11324352931,私の友達がナンパの人と浮気をして ナンパの人がヤリモクなのに そういうことが初めてで付き合って いると思ってしまって彼氏にそのことを いったら彼氏から聞かれて素直に 話をしたみていでちがうことに気づい...,0,0
1536,2026/1/16 19:02,病気、症状,a,2時間30分,0,46,46.0,0,0,0.306,0.0,0.0,0.3,あと3日,https://detail.chiebukuro.yahoo.co.jp/qa/question_detail/q14324252364,尻？股？なんという場所か分からないですが青丸をつけたところがものすごく痒いです。 写真を撮ろうにも取れない場所、鏡で自分に見ようにも見れない場所なのでどうなっているのかは不明。 現在生理でナプキンをつ...,0,0
1537,2026/1/16 19:02,温泉,温泉旅館番頭,2時間30分,0,13,13.0,0,0,0.086,0.0,0.0,0.09,あと3日,https://detail.chiebukuro.yahoo.co.jp/qa/question_detail/q14324252014,草津温泉では、「色浴衣」を置いてある宿泊施設はほぼ無いと聴きましたが、何か理由がありますか？？ ＼(^o^)／,0,0
1538,2026/1/16 19:02,英語,非公開,2時間30分,0,26,26.0,0,0,0.173,0.0,0.0,0.17,あと3日,https://detail.chiebukuro.yahoo.co.jp/qa/question_detail/q14324252034,英検準二級まで残り１週間弱です単語一切覚えてません。過去問は一回やってみましたがリーディングは半分しか取れていませんでした。ライティングは全然できませんでした。諦めた方がいいですか？ 何かギリギリまで...,0,0
1539,2026/1/16 19:02,K-POP、アジア,rrd********,2時間30分,1,78,78.0,1,0,0.518,1.28,0.4,1.5,あと3日,https://detail.chiebukuro.yahoo.co.jp/qa/question_detail/q14324252054,推しのミーグリに積まないように私を叱って…！ 推しは韓国でも割と有名なKPOPアイドルで，日本人気は強いです。(ドームは余裕でできます) 今までずっと1対1で会うイベントは，自分の容姿の問題や，たった...,0,0
1540,2026/1/16 19:02,邦楽,なみ,2時間30分,0,7,7.0,0,0,0.046,0.0,0.0,0.05,あと3日,https://detail.chiebukuro.yahoo.co.jp/qa/question_detail/q14324252129,Creepy Nutsさんの「中学22年生」にでてくる「公開処刑」というワードは、キングギドラさんの曲「公開処刑」と絡めてますか？,0,0
1541,2026/1/16 19:02,エアコン、空調家電,RoL,2時間30分,1,27,27.0,0,1,0.179,3.7,0.05,0.71,あと3日,https://detail.chiebukuro.yahoo.co.jp/qa/question_detail/q14324251954,足元用の暖房器具について 現在、自室が木造一戸建ての2階にあるのですが、真下の部屋を使っていないためか、エアコンの暖房で室温自体は22度程度あっても、足元が冷えてまともに椅子に座っていられません。 当...,0,0
1542,2026/1/16 19:02,YouTube,yel********,2時間30分,0,23,23.0,0,0,0.153,0.0,0.0,0.15,あと3日,https://detail.chiebukuro.yahoo.co.jp/qa/question_detail/q14324252039,YouTubeで横型の動画で10本投稿し、登録者数が13人です。 長さは3分ほどの短い動画ですが、最初こそ500回再生くらいまでいくのもあったものの、8本目、9本目は100回にも行きませんでした。クリ...,0,0
1543,2026/1/16 19:02,高校受験,c30511b99,2時間30分,0,61,61.0,0,0,0.405,0.0,0.0,0.4,あと3日,https://detail.chiebukuro.yahoo.co.jp/qa/question_detail/q14324251869,高校の推薦入試で面接の時に質問されそうなことをたくさん教えていただきたいです。対策をしておきたくて。本当にどんなものでも構いません。難しい質問などの場合は良い回答も教えていただけると助かります。 例 ...,0,0
1544,2026/1/16 19:02,ネットワークセキュリティ,nak********,2時間30分,0,5,5.0,0,0,0.033,0.0,0.0,0.03,あと3日,https://detail.chiebukuro.yahoo.co.jp/qa/question_detail/q10324352930,ネットワークの勉強も兼ねて、譲りうけたXeonサーバーにTrueNAS SCALEをインストールし、NAS＋マイクラサーバー（コンテナ使用）を構築しているところです。 有識者の皆様のご意見を賜りたく投...,0,0
