1511,2026/1/27 5:17,法律相談,1152573456,10時間25分,1,41,41.0,0,0,0.065,2.44,0.03,0.15,不明,https://detail.chiebukuro.yahoo.co.jp/qa/question_detail/q13324719818,法学部1年です。今日初めて民法の定期試験を受けます。 試験には六法以外持ち込み不可なのですが、判例を根拠に記述する際、判決日時も書かないと根拠にならず×にされますか？,0,0
1512,2026/1/27 5:17,料理、食材,own********,10時間26分,8,26,3.2,0,0,0.042,30.77,0.0,0.68,あと3日,https://detail.chiebukuro.yahoo.co.jp/qa/question_detail/q12324719817,たこ焼き好きですか？,0,0
1513,2026/1/27 5:17,化学,1151204855,10時間26分,3,19,6.3,0,0,0.03,15.79,0.0,0.27,あと3日,https://detail.chiebukuro.yahoo.co.jp/qa/question_detail/q11324719816,部屋全体の空気の質量×湿度 をしたら空気に含まれている水蒸気量を求められますか？,0,0
1514,2026/1/27 5:17,学校の悩み,ホットケーキミックス,10時間26分,1,12,12.0,0,3,0.019,8.33,0.0,0.24,あと3日,https://detail.chiebukuro.yahoo.co.jp/qa/question_detail/q10324719815,4月から高校生になる中学3年生です。 メイク禁止の学校でメイクしてる人ってどのくらいいますか？また、メイクしてる子は一軍の陽キャって感じの子ばっかですか？ 内申下げられたくなかったらメイクはしない方が...,0,0
1515,2026/1/27 5:17,恋愛相談、人間関係の悩み,瀬名,10時間26分,1,39,39.0,0,0,0.062,2.56,0.02,0.14,あと3日,https://detail.chiebukuro.yahoo.co.jp/qa/question_detail/q14324719814,遠距離（4〜600㎞の距離）で恋愛している高校生の彼女と交際5ヶ月目で3回目のデートをする事になったのですが、皆さんに相談したい事があります。 まず僕は彼女の事が大好きで、笑顔、しぐさが可愛く、華奢で...,0,0
1516,2026/1/27 5:17,ピアス,acae51fb1,10時間26分,0,12,12.0,0,0,0.019,0.0,0.0,0.02,あと3日,https://detail.chiebukuro.yahoo.co.jp/qa/question_detail/q13324719813,スプタンってどんくらいで癒着しますか？？？ 舌ピなしで貝印のピンクのカミソリで1cm切りました 深夜テンションで切っちゃったけど滑舌悪くなってだいぶピンチです,0,0
1517,2026/1/27 5:17,恋愛相談、人間関係の悩み,ゆ,10時間26分,3,53,17.7,0,0,0.085,5.66,0.02,0.32,あと3日,https://detail.chiebukuro.yahoo.co.jp/qa/question_detail/q12324719812,大学生女です。 これはネット恋愛をする上で避けられるものなのか、教えてください。 いま同い年の彼氏がいます。SNSで出会い、数ヶ月かけて仲良くなり、交際に発展しました。 同じ都道府県ではないですが、お...,0,0
1518,2026/1/27 5:16,職場の悩み,非公開,10時間27分,2,7,3.5,0,0,0.011,28.57,0.0,0.17,あと3日,https://detail.chiebukuro.yahoo.co.jp/qa/question_detail/q11324719811,皆さんの結果がでないのは、努力不足（適性ない）か環境要因（可能性がないエリア）の判断する基準は？,0,0
1519,2026/1/27 5:16,スキンケア,1149746966,10時間27分,2,26,13.0,0,0,0.041,7.69,0.01,0.2,あと3日,https://detail.chiebukuro.yahoo.co.jp/qa/question_detail/q10324719810,大至急お願いします。 30代（女性） 30代になり鼻下のところに肝斑がでてきて髭のように見えて恥ずかしいです。 若い時に日焼け止めを塗らなかったのは承知の上ですが… 化粧しても鼻下のところが黒く目立っ...,0,0
1520,2026/1/27 5:16,トレーニング,ミント,10時間27分,2,6,3.0,0,0,0.01,33.33,0.0,0.17,あと3日,https://detail.chiebukuro.yahoo.co.jp/qa/question_detail/q11324719806,椅子に座ったままでもできる一つが4㎏のダンベルのトレーニング方法を教えてください。テレビを見ながらでもできる方法があったら知りたいなって思いながらしつもんしました。,0,0
1521,2026/1/27 5:16,ゲーム,1151265926,10時間27分,0,5,5.0,0,0,0.008,0.0,0.0,0.01,あと3日,https://detail.chiebukuro.yahoo.co.jp/qa/question_detail/q13324719803,zetaをやっているのですがヤンデレ妖夢のチャットの文末が8行ぐらいハートで邪魔くさいんですけどこれってどうにもできやいんですかね一時期消えた時期があったんですけど,0,0
1522,2026/1/27 5:15,イヌ,小悪魔,10時間28分,1,8,8.0,0,0,0.013,12.5,0.0,0.09,あと3日,https://detail.chiebukuro.yahoo.co.jp/qa/question_detail/q12324719802,シェットランドシープドッグとサモエドはどっちが番犬に向いてますか？,0,0
1523,2026/1/27 5:15,スポーツ,都合の悪い回答者はバンする人？,10時間28分,5,21,4.2,0,1,0.033,23.81,0.0,0.48,あと3日,https://detail.chiebukuro.yahoo.co.jp/qa/question_detail/q10324719800,剣道の防具がムレて困っているのですが、友人はムレないらしく、その理由を聞くと『一匹狼だから』と言われた場合、なんと返せば良いですか？,0,0
1524,2026/1/27 5:15,幼児教育、幼稚園、保育園,pan********,10時間28分,4,39,9.8,0,0,0.062,10.26,0.01,0.38,不明,https://detail.chiebukuro.yahoo.co.jp/qa/question_detail/q14324719799,保育士やっている人は、子供好きですか？,0,0
1525,2026/1/27 5:15,高校数学,25368741,10時間28分,0,70,70.0,1,0,0.111,0.0,0.0,0.27,あと3日,https://detail.chiebukuro.yahoo.co.jp/qa/question_detail/q13324719798,某旧帝大の大学入試の改変問題です。 じゃんけんの確率の問題です。 問題 4人がじゃんけんをして順位を決める。ちょうどn回目で4人の順位が確定する確率を求めよ。 （某旧帝大は3人でした） この問題はじゃ...,0,0
1526,2026/1/27 5:14,哲学、倫理,翠,10時間29分,4,70,17.5,0,2,0.111,5.71,0.02,0.52,あと3日,https://detail.chiebukuro.yahoo.co.jp/qa/question_detail/q12324719797,恐れ入るという感覚は、現代人よりも昔の人々のほうがあったと思いますか？ そういえば、中学校のときの国語の教科書に確か「畏れについて」というタイトルの山本健吉という人が書いた文章が載っていました。 この...,0,0
1527,2026/1/27 5:14,スノーボード,無名,10時間30分,5,126,25.2,0,0,0.2,3.97,0.05,0.6,あと3日,https://detail.chiebukuro.yahoo.co.jp/qa/question_detail/q11324719796,最近スキー場に行きました。 その時スノボの板が無くなり、盗まれたのかも…と思い、最近被害届を提出しました。 どのくらいの確率で返ってきますか？ スキー場リフト付近で無くなったのですが、リフト周りに防犯...,0,0
1528,2026/1/27 5:14,就職活動,bll********,10時間30分,4,28,7.0,0,0,0.044,14.29,0.0,0.36,あと3日,https://detail.chiebukuro.yahoo.co.jp/qa/question_detail/q10324719795,30歳 医療の面接に行くのに持っているのがユニクロのネイビーのスーツ(セットアップ)になります。 これで面接に行っても大丈夫でしょうか？ インナーはワイシャツではなく、キレイめなブラウスを考えています...,0,0
1529,2026/1/27 5:14,労働条件、給与、残業,bun********,10時間30分,4,50,12.5,0,0,0.079,8.0,0.01,0.4,あと3日,https://detail.chiebukuro.yahoo.co.jp/qa/question_detail/q14324719794,有給休暇についてですが、 2月末で退職するのですが、28日が土曜日で事務所は休みですが私は仕事です。 で、事務員が遠回しに ｢事務手続きが面倒なので、最終日は有給を取ってもらえませんか？｣ 的な言い方...,0,0
1530,2026/1/27 5:14,ポケットモンスター,natsukiarn3drc,10時間30分,2,14,7.0,0,0,0.022,14.29,0.0,0.18,あと3日,https://detail.chiebukuro.yahoo.co.jp/qa/question_detail/q13324719793,ポケモン オブジェクトについて質問があります この写真のカラカラみたいな子て、名前ありますか？ 画像はポケパークカントーのものです。 原作だとジムの中とか、Z-Aだとワイルドゾーンの入口にいる子です ...,0,0
1531,2026/1/27 5:14,大学受験,あ,10時間30分,6,53,8.8,0,0,0.084,11.32,0.01,0.56,あと3日,https://detail.chiebukuro.yahoo.co.jp/qa/question_detail/q12324719792,高1女です。将来心理学関係の仕事をしないのに大学で心理学部を選ぶのはやめておいた方がいいですか？ 就職に苦労しますか？ 入りたい理由は授業が面白そうだからと、優しい人が多そうだからです。,0,0
1532,2026/1/27 5:13,職場の悩み,非公開,10時間31分,4,21,5.2,0,0,0.033,19.05,0.0,0.35,あと3日,https://detail.chiebukuro.yahoo.co.jp/qa/question_detail/q11324719791,営業をしているとなぜわずかな時間と情報で説得力がある話ができるようになる？,0,0
1533,2026/1/27 5:13,政治、社会問題,Fuhdu384***,10時間31分,2,71,35.5,0,2,0.112,2.82,0.04,0.37,あと3日,https://detail.chiebukuro.yahoo.co.jp/qa/question_detail/q10324719790,2026衆議院議員選挙の、投票用紙が届いていません。 本日公示、翌日から期日前投票がはじまるようですが、未だに届いておりません。山間部や離島に住んでいる訳ではなく、都市に住んでいます。 これって、まず...,0,0
1534,2026/1/27 5:13,就職活動,1151707215,10時間31分,1,27,27.0,0,0,0.043,3.7,0.01,0.12,あと3日,https://detail.chiebukuro.yahoo.co.jp/qa/question_detail/q14324719789,27卒就活生です。内定をもらった会社から労働条件通知書を受け取ったのですが、マイナビには完全週休二日・固定残業代なしとあったのに通知書には週休二日・固定残業代1時間と記載されていました。 この会社大丈...,0,0
1535,2026/1/27 5:13,男性アイドル,gic********,10時間31分,2,92,46.0,0,1,0.146,2.17,0.07,0.35,あと3日,https://detail.chiebukuro.yahoo.co.jp/qa/question_detail/q13324719788,Aぇ! group2026のツアーに当選しました ですが都合が悪くなってしまい行けなくなってしまったのですが、入金をしないで流すか、入金して公式リセールに出すかどちらの方がいいのでしょうか？ 公式のリ...,0,0
1536,2026/1/27 5:12,恋愛相談、人間関係の悩み,imptrnphnx,10時間32分,4,21,5.2,0,2,0.033,19.05,0.0,0.44,あと3日,https://detail.chiebukuro.yahoo.co.jp/qa/question_detail/q12324719787,彼女との電話がめんどくさすぎるんですけど、こういう時ってどうしてますか？ 結構な頻度で電話したいとか言ってくるんですけど、普通に面倒くさいし、何度も話してると話題とかも尽きると思います。 対処法をおし...,0,0
1537,2026/1/27 5:12,病院、検査,jav********,10時間32分,2,39,19.5,0,0,0.062,5.13,0.01,0.22,あと3日,https://detail.chiebukuro.yahoo.co.jp/qa/question_detail/q11324719786,大腸内視鏡検査をする予定ですが、35年ほど前に盲腸腹膜炎の手術を2回しております。色々検索をしておりましたら癒着により痛みが強い場合が多いようですが、鎮静剤を使っても大変なものでしょうか？,0,0
1538,2026/1/27 5:12,家族関係の悩み,1251891554,10時間32分,3,50,16.7,1,6,0.079,6.0,0.01,0.76,あと3日,https://detail.chiebukuro.yahoo.co.jp/qa/question_detail/q10324719785,心身の調子を崩し家のことが何も出来ない(しない)で寝込んでいる時に、パートナーがキレながら「出てけ！準備しろ！なんで準備手伝わなきゃいけないんだよ！自分でやれよ！お前の親に電話するから！ 」などを家具...,0,0
1539,2026/1/27 5:11,恋愛相談,okw********,10時間33分,6,119,19.8,0,7,0.188,5.04,0.04,0.99,あと3日,https://detail.chiebukuro.yahoo.co.jp/qa/question_detail/q14324719784,最近彼氏が男2.女3の旅行に行きました。そもそも異性との旅行は嫌でしたが、彼の気持ちも考えて行ってきて良いと伝えました。 まず大きな問題点が2つあるんです。 一つが、その旅行がゲームで知り合って一年ほ...,0,0
1541,2026/1/27 5:11,料理、食材,jpm,10時間33分,2,11,5.5,0,2,0.017,18.18,0.0,0.27,あと3日,https://detail.chiebukuro.yahoo.co.jp/qa/question_detail/q12324719782,なぜサトウのごはんは体に悪くないんですか？,0,0
1542,2026/1/27 5:11,ドラマ,Cuugalのんビューティフル,10時間33分,0,23,23.0,0,0,0.036,0.0,0.0,0.04,あと3日,https://detail.chiebukuro.yahoo.co.jp/qa/question_detail/q11324719781,このドラマのタイトル名はなんですか？ https://x.com/kinakomochibox/status/2012072455817617465?s=46 また逮捕された女子高生役を演じた女優かア...,0,0
1543,2026/1/27 5:10,大学受験,1150854732,10時間35分,3,50,16.7,0,0,0.079,6.0,0.01,0.31,あと3日,https://detail.chiebukuro.yahoo.co.jp/qa/question_detail/q10324719780,弟の進路について気になることがあります 弟は高校2年生で自称進レベルの高校で全ての教科で4以上(4の方が若干多いくらい)の成績をとっています。 文系より理系の方が得意で数学の成績は学年でもトップレベル...,0,0
1544,2026/1/27 5:10,シニアライフ、シルバーライフ,翠,10時間35分,9,106,11.8,0,12,0.167,8.49,0.02,1.44,あと3日,https://detail.chiebukuro.yahoo.co.jp/qa/question_detail/q14324719779,自分として最低できることは、自分に正直に生きること、と言う人に対してあなたは何と言いますか。,0,0
1545,2026/1/27 5:10,起業,eis********,10時間35分,1,65,65.0,0,1,0.102,1.54,0.07,0.23,あと3日,https://detail.chiebukuro.yahoo.co.jp/qa/question_detail/q13324719778,前々から少しずつではあるのですが、会社員をしもって、個人の副業で空き時間を利用し依頼があったお客さんの仕事やお手伝いをする形の形式で仕事をさせてもらってきました。 特に今は別職種なのですが１７年間建築...,0,0
1547,2026/1/27 5:10,派遣、アルバイト、パート,1053229063,10時間35分,0,7,7.0,0,0,0.011,0.0,0.0,0.01,あと3日,https://detail.chiebukuro.yahoo.co.jp/qa/question_detail/q11324719776,白衣に着替えて食品工場の中に入ってみたことある方？,0,0
1548,2026/1/27 5:10,iPhone,1052468956,10時間35分,1,13,13.0,0,0,0.02,7.69,0.0,0.1,あと3日,https://detail.chiebukuro.yahoo.co.jp/qa/question_detail/q10324719775,iPhoneの写真のストレージを快適化にすると画質は落ちますか?またストレージ快適化にした後元の画質に戻す方法はありますか？,0,0
1549,2026/1/27 5:09,運転免許,a4d5e0c90,10時間36分,1,10,10.0,0,0,0.016,10.0,0.0,0.09,あと3日,https://detail.chiebukuro.yahoo.co.jp/qa/question_detail/q13324719773,岡山で普通免許(at限定)を取って半年ほどでも働けるドライバー求人教えてください,0,0
1550,2026/1/27 5:09,職場の悩み,kaz********,10時間36分,3,39,13.0,0,6,0.061,7.69,0.01,0.58,あと3日,https://detail.chiebukuro.yahoo.co.jp/qa/question_detail/q12324719772,許せない元パート先があります。 もう退職しましたが、Google Mapsでいじめがあったと口コミに書いてやりたいくらい酷いパート先でした。 口コミに書くと訴えられますか？,0,0
1551,2026/1/27 5:09,無印良品,非公開,10時間36分,2,5,2.5,0,0,0.008,40.0,0.0,0.16,あと3日,https://detail.chiebukuro.yahoo.co.jp/qa/question_detail/q11324719771,無印良品のインナーは温かいですか？ ユニクロのヒートテックを愛用してますが、汗をかくと急激に冷えるような気がして。,0,0
1552,2026/1/27 5:08,政治、社会問題,霞ヶ関監視機構,10時間37分,0,6,6.0,0,0,0.009,0.0,0.0,0.01,あと3日,https://detail.chiebukuro.yahoo.co.jp/qa/question_detail/q10324719770,不祥事のデパート神奈川県警は なぜ日刊ゲンダイを 刑事告発したのに 公職選挙法違反で捜査しないのですか？ 初鹿野ひろき参議院議員は 横領で警察を辞めたのですか？ 衆院選公示前に…警察庁が臨時本部長会議...,0,0
1553,2026/1/27 5:08,恋愛相談、人間関係の悩み,1051926220,10時間37分,1,13,13.0,0,0,0.02,7.69,0.0,0.1,あと3日,https://detail.chiebukuro.yahoo.co.jp/qa/question_detail/q12324719767,私はAくんに5年間片思いしてきました。私が県外の大学に行って2年間全然関わりがなかったのに今もずっと好きです。ただ、おかしいことに最近大学で気になる人（B）ができてしまいました。 次帰省した時にAくん...,0,0
1554,2026/1/27 5:08,バス、タクシー,14123**********,10時間37分,0,6,6.0,0,0,0.009,0.0,0.0,0.01,あと3日,https://detail.chiebukuro.yahoo.co.jp/qa/question_detail/q11324719766,スカイチケットでリモンバスの夜行便を予約しました。 大阪→東京 です。 29日の夜発ですが、路面凍結や雪の影響で運休になる可能性はどのくらいありますか？ 冬の季節に夜行バスに乗るのが初めてなのでたどり...,0,0
1555,2026/1/27 5:08,大学受験,********,10時間37分,2,22,11.0,0,0,0.034,9.09,0.0,0.19,あと3日,https://detail.chiebukuro.yahoo.co.jp/qa/question_detail/q10324719765,質問です。 千葉商科大学の一般入試、個別試験型と共テ利用型ってどっちの方が難易度が高いのでしょうか? 共テ利用する方は滑り止めで受けることがほとんどでしょうが、わざわざ個別試験を受ける方はいないと思う...,0,0
1556,2026/1/27 5:07,シニアライフ、シルバーライフ,翠,10時間38分,3,31,10.3,0,3,0.049,9.68,0.01,0.42,あと3日,https://detail.chiebukuro.yahoo.co.jp/qa/question_detail/q14324719764,物事に善し悪しは付きものという考え方をしたとき、認知症になることの中にもまた善きこともあると考えられますよね。認知症になることの善きことは何でしょうか。,0,0
1558,2026/1/27 5:07,カスタマイズ,1149920553,10時間39分,0,5,5.0,0,0,0.008,0.0,0.0,0.01,あと3日,https://detail.chiebukuro.yahoo.co.jp/qa/question_detail/q12324719762,日産NV200バネットにアシストグリップを取り付けたいですが、お薦めのアシストグリップ及び取付ベースの金具 （【ロブテックス LOBTEX】 ロブテックス HNC06R エビ ハンドナッター ちょっと...,0,0
1559,2026/1/27 5:07,派遣、アルバイト、パート,1053229063,10時間39分,1,13,13.0,0,0,0.02,7.69,0.0,0.1,あと3日,https://detail.chiebukuro.yahoo.co.jp/qa/question_detail/q11324719761,食品工場って休憩中以外ほぼずっとマスクは着けてますか？,0,0
1560,2026/1/27 5:07,福祉、介護,cii********,10時間39分,5,94,18.8,1,2,0.147,5.32,0.03,0.79,あと3日,https://detail.chiebukuro.yahoo.co.jp/qa/question_detail/q10324719760,精神疾患、福祉関係に詳しい方利用されてる方教えて下さい。 長文です。 まとめる事が、難しく長々となります。 現在、40代半ばの女です。 就労支援b型、在宅で作業してます。10000円いかないくらいの工...,0,0
1561,2026/1/27 5:07,インフルエンザ,1252098863,10時間39分,2,147,73.5,0,4,0.23,1.36,0.17,0.57,不明,https://detail.chiebukuro.yahoo.co.jp/qa/question_detail/q14324719759,インフルエンザについてです。インフルエンザB型にかかりました。 日曜日の夜から関節痛が少しあり、念の為EVEを飲んで寝ました。月曜日の朝5時くらいに痛過ぎておきました 昼過ぎに熱を測ると38度、15時...,0,0
1562,2026/1/27 5:07,引越し,ac9bc3fed,10時間39分,1,12,12.0,0,1,0.019,8.33,0.0,0.14,あと3日,https://detail.chiebukuro.yahoo.co.jp/qa/question_detail/q13324719758,雪かきが嫌で雪が積もらない地域に引っ越した人もいますか？,0,0
1563,2026/1/27 5:06,吹奏楽,べんきょうわかんない,10時間40分,5,96,19.2,0,1,0.15,5.21,0.03,0.59,あと3日,https://detail.chiebukuro.yahoo.co.jp/qa/question_detail/q12324719757,吹奏楽のバンドで、足りないパート(ベースや小物パーカス)を、パソコンに入力して、そのデータを大きなスピーカーから鳴らせればな、と思っているのですが、なんていうソフトを買えばいいのでしょうか。,0,0
1564,2026/1/27 5:06,この仕事教えて,1053229063,10時間40分,0,2,2.0,0,0,0.003,0.0,0.0,0.0,あと3日,https://detail.chiebukuro.yahoo.co.jp/qa/question_detail/q11324719756,食品工場の作業着は着たら出てる場所は目だけになりますか？,0,0
1565,2026/1/27 5:06,プレイステーション4,qay********,10時間40分,4,4,1.0,0,0,0.006,100.0,0.0,0.32,あと3日,https://detail.chiebukuro.yahoo.co.jp/qa/question_detail/q10324719755,APEXをプレステ4かプレステ5でやるならどちらがいいですか？ちなみに、ゲーム用のモニターではなくTCLのテレビで出力する予定です。,0,0
1566,2026/1/27 5:06,恋愛相談、人間関係の悩み,1151192492,10時間40分,2,13,6.5,0,0,0.02,15.38,0.0,0.18,あと3日,https://detail.chiebukuro.yahoo.co.jp/qa/question_detail/q14324719754,気になる人とのドライブデートで、高速代やガソリン代を渡そうとしても断られます。 ダッシュボードに入れる以外でいい方法ありませんか？,0,0
1567,2026/1/27 5:06,国際情勢,gm0********,10時間40分,3,22,7.3,0,1,0.034,13.64,0.0,0.31,あと3日,https://detail.chiebukuro.yahoo.co.jp/qa/question_detail/q13324719753,中国の張又俠はなぜやめさせられたでしょう？,0,0
1568,2026/1/27 5:06,この仕事教えて,1053229063,10時間40分,0,2,2.0,0,0,0.003,0.0,0.0,0.0,あと3日,https://detail.chiebukuro.yahoo.co.jp/qa/question_detail/q12324719752,半導体工場やクリーンルームの工場到着から現場内に入るまでの流れを教えてほしいです。,0,0
1569,2026/1/27 5:06,YouTube,1252260524,10時間40分,0,4,4.0,0,0,0.006,0.0,0.0,0.01,あと3日,https://detail.chiebukuro.yahoo.co.jp/qa/question_detail/q11324719751,先端恐怖症/ぎゃるみって人の【人狼殺】占い当てちゃってごめん！応援したくなる狼…！ って動画に出てる3番の頬骨前歯ちゃんって人声と喋り方がVtuberの星川サラさんに似てません？ だからどうってわけで...,0,0
1570,2026/1/27 5:06,恋愛相談、人間関係の悩み,むむむ,10時間40分,0,5,5.0,0,0,0.008,0.0,0.0,0.01,あと3日,https://detail.chiebukuro.yahoo.co.jp/qa/question_detail/q10324719750,もし店員の仕事をしていて、その店に来る客に好意を寄せてしまったらどうしますか？ 仕事を辞めますか？ 何かしらアクションを起こしますか？ 見るだけでなにもしませんか？,0,0
1571,2026/1/27 5:06,Instagram,b851f0cal,10時間40分,0,8,8.0,0,0,0.012,0.0,0.0,0.01,あと3日,https://detail.chiebukuro.yahoo.co.jp/qa/question_detail/q14324719749,インスタのメインアカウントにサブアカメンションしてる奴自己顕示欲特に高い説は立証するでしょうか？,0,0
1572,2026/1/27 5:05,iPhone,1052468956,10時間41分,1,17,17.0,0,0,0.026,5.88,0.0,0.1,不明,https://detail.chiebukuro.yahoo.co.jp/qa/question_detail/q13324719748,iPhoneの写真の非表示のところに写真を入れると画質が落ちる気がするのですが気のせいでしょうか?,0,0
1573,2026/1/27 5:05,料理、食材,soy********,10時間41分,1,5,5.0,0,0,0.008,20.0,0.0,0.09,あと3日,https://detail.chiebukuro.yahoo.co.jp/qa/question_detail/q12324719747,市販の小豆が異様にテカテカに テカってるんですが… あれは何かコーティング剤とか使ってるのですか？ . 農産物直売所とかで購入する小豆は 殆どがテカってません。 ご存知の方よろしくお願い申し上げます。,0,0
1574,2026/1/27 5:05,国際情勢,お米8合,10時間41分,17,107,6.3,0,6,0.167,15.89,0.01,1.77,あと3日,https://detail.chiebukuro.yahoo.co.jp/qa/question_detail/q11324719746,世界のEV熱は消えたようですが、結局EVは「あだ花」だったのでしょうか？,0,0
1575,2026/1/27 5:05,派遣、アルバイト、パート,1053229063,10時間42分,0,2,2.0,0,0,0.003,0.0,0.0,0.0,あと3日,https://detail.chiebukuro.yahoo.co.jp/qa/question_detail/q10324719745,食品工場の作業開始までの準備好きな方いませんか？,0,0
1576,2026/1/27 5:04,一般教養,ac9bc3fed,10時間43分,2,5,2.5,0,2,0.008,40.0,0.0,0.26,あと3日,https://detail.chiebukuro.yahoo.co.jp/qa/question_detail/q13324719743,消費者金融の建物に入る時は周りに誰もいない時にはいりますか？,0,0
1577,2026/1/27 5:04,公務員試験,cc5c31a8,10時間43分,3,30,10.0,0,0,0.047,10.0,0.0,0.28,あと3日,https://detail.chiebukuro.yahoo.co.jp/qa/question_detail/q12324719742,先日自衛官候補生の試験を受けたのですが、面接時作文の内容を聞かれてすぐ答えられず、面接官からお題を言われてから思いだし、すぐに内容を答えました。 合格は厳しいでしょうか？,0,0
1578,2026/1/27 5:04,事件、事故,東組(西成区山王1-11-8),10時間43分,0,2,2.0,0,0,0.003,0.0,0.0,0.0,あと3日,https://detail.chiebukuro.yahoo.co.jp/qa/question_detail/q11324719741,稲川会(東京)と会津小鉄会(京都)が抗争し何方が強い?,0,0
1579,2026/1/27 5:04,派遣、アルバイト、パート,1053229063,10時間43分,0,3,3.0,0,0,0.005,0.0,0.0,0.0,あと3日,https://detail.chiebukuro.yahoo.co.jp/qa/question_detail/q10324719740,白衣帽子マスク姿で働いたことある方？,0,0
