2163,2026/1/27 3:18,アルバイト、フリーター,abfd594f3,13時間7分,0,5,5.0,1,0,0.006,0.0,0.0,0.13,あと3日,https://detail.chiebukuro.yahoo.co.jp/qa/question_detail/q14324719114,横浜でUVERして月15万稼げると思いますか？,0,0
2164,2026/1/27 3:17,外国為替、FX,1050548585,13時間8分,1,40,40.0,0,2,0.051,2.5,0.02,0.19,あと3日,https://detail.chiebukuro.yahoo.co.jp/qa/question_detail/q13324719113,為替介入の際のレートチェックに関する質問です。 レートチェックとは具体的に何をするのですか？ 私はネコが取っ組み合いの喧嘩をする前に猫パンチを繰り出して相手を威嚇、牽制するようなものだと理解しています...,0,0
2165,2026/1/27 3:17,音楽,匿名,13時間8分,3,24,8.0,0,2,0.03,12.5,0.0,0.3,あと3日,https://detail.chiebukuro.yahoo.co.jp/qa/question_detail/q12324719112,和な、おすすめボカロ曲を教えてください。 例:トキヲ・ファンカ、いかないで、ギガンティックO.T.N、吉原ラメント、天樂、結ンデ開イテ羅刹ト骸、番凩,0,0
2166,2026/1/27 3:17,メンタルヘルス,1153107504,13時間8分,0,11,11.0,0,0,0.014,0.0,0.0,0.01,あと3日,https://detail.chiebukuro.yahoo.co.jp/qa/question_detail/q11324719111,精神科の開放病棟で患者が無断外泊したらどうなりますか？ 閉鎖病棟や拘束されますか？ それとも強制退院とかになりますか？,0,0
2167,2026/1/27 3:17,芸能人,tvt********,13時間8分,0,16,16.0,0,0,0.02,0.0,0.0,0.02,あと3日,https://detail.chiebukuro.yahoo.co.jp/qa/question_detail/q10324719110,過去にチャウヌさんに似てると話題になった人を探してます。 確か中小事務所のアイドル (既に解散してる可能性あり)で、俳優業もやっていた気がします。岩瀬洋二さんにも似ている感じです。ウノさんではないです...,0,0
2168,2026/1/27 3:17,恋愛相談、人間関係の悩み,c554f8f57,13時間8分,3,34,11.3,0,2,0.043,8.82,0.0,0.31,あと3日,https://detail.chiebukuro.yahoo.co.jp/qa/question_detail/q14324719109,女性は好きじゃない男性でもなんとなく告白OKしますか,0,0
2169,2026/1/27 3:17,大学受験,1152599943,13時間8分,2,47,23.5,0,0,0.06,4.26,0.01,0.19,あと3日,https://detail.chiebukuro.yahoo.co.jp/qa/question_detail/q13324719108,名古屋大学の情報学部と筑波大学の情報化学類は難易度同じくらいですか？偏差値が同じくらいで出てましたが,0,0
2170,2026/1/27 3:17,日本映画,1052278414,13時間8分,0,25,25.0,0,0,0.032,0.0,0.0,0.03,あと3日,https://detail.chiebukuro.yahoo.co.jp/qa/question_detail/q12324719107,『超かぐや姫』について 以下「ネタバレ」なため注意！ 拙い文章ですけど悪しからず ↓ ↓ ↓ ↓ ↓ ↓ ↓ ↓ ↓ ↓ ↓ ↓ ↓ ↓ ↓ ↓ ↓ ↓ ↓ ↓ ↓ 質問1「彩葉が作ったかぐやの体に入...,0,0
2171,2026/1/27 3:17,数学,b27b8a6c,13時間8分,3,36,12.0,0,0,0.046,8.33,0.01,0.24,あと3日,https://detail.chiebukuro.yahoo.co.jp/qa/question_detail/q11324719106,ある関数の値域は、その逆関数の定義域になるのですか？,0,0
2172,2026/1/27 3:17,恋愛相談、人間関係の悩み,匿名,13時間8分,7,62,8.9,0,0,0.079,11.29,0.01,0.52,あと3日,https://detail.chiebukuro.yahoo.co.jp/qa/question_detail/q10324719105,人間が嫌いでしんどいです。みんな好き勝手な事ばかり言うので嫌いです。精神疾患がありますが病院のデイケアのカウンセラーやスタッフですら嫌です。 私は間違っているのでしょうか？わかんなくてつらいです。出会...,0,0
2173,2026/1/27 3:17,アルバイト、フリーター,柚羽,13時間8分,1,19,19.0,0,0,0.024,5.26,0.0,0.09,あと3日,https://detail.chiebukuro.yahoo.co.jp/qa/question_detail/q14324719104,至急です。20歳学生です。 今月からバイト先のチーフが代わり、初めてシフトを作るため希望休に契約休と契約時間を書いて欲しいと言われました。 私自身、契約休が曖昧だったので店長に確認して欲しいと伝えまし...,0,0
2174,2026/1/27 3:16,Android,1250686116,13時間10分,1,31,31.0,0,0,0.039,3.23,0.01,0.1,あと3日,https://detail.chiebukuro.yahoo.co.jp/qa/question_detail/q12324719102,ギガを消費しているアプリを突き止めたいです。 Xperia 10 Ⅲ で3か月ほど前から突然1日当たり800MB～1600MB消費するようになりました。 IIJmioの1月のデータ利用料を見てみると2...,0,0
2175,2026/1/27 3:16,模型、プラモデル、ラジコン,非公開,13時間10分,0,8,8.0,0,0,0.01,0.0,0.0,0.01,あと3日,https://detail.chiebukuro.yahoo.co.jp/qa/question_detail/q10324719100,pguニューガンダムって中国ではもう販売されてますか？ 毎日のようにレビューが投稿されてますが,0,0
2176,2026/1/27 3:16,病気、症状,1152448863,13時間10分,0,8,8.0,0,0,0.01,0.0,0.0,0.01,あと3日,https://detail.chiebukuro.yahoo.co.jp/qa/question_detail/q14324719099,2週間ほど肺からの咳が続いています。20代喫煙者です（3年間、週に2箱吸わないくらいです）。 肺からかどうかは定かではありませんが、結構強めの咳が出るのに、喉が全く痛くないので、風邪ではないと思ってい...,0,0
2177,2026/1/27 3:16,ダイエット、フィットネス,64843488,13時間10分,1,15,15.0,0,0,0.019,6.67,0.0,0.08,あと3日,https://detail.chiebukuro.yahoo.co.jp/qa/question_detail/q13324719098,ダンベルプレス24kg 17回ってバーベルプレスだと何キロくらいになりますか？,0,0
2178,2026/1/27 3:16,pixiv,1152384234,13時間10分,1,34,34.0,0,0,0.043,2.94,0.01,0.11,あと3日,https://detail.chiebukuro.yahoo.co.jp/qa/question_detail/q12324719097,pixivでの小説投稿について。 現在、一日に数件小説が投稿される、新しめのジャンルにいます。 そのような環境の中で自作小説を投稿する場合、どれくらいの頻度で載せていいと思いますか？ 現在執筆している...,0,0
2179,2026/1/27 3:16,生き方、人生相談,1252083014,13時間10分,5,59,11.8,0,0,0.075,8.47,0.01,0.39,あと3日,https://detail.chiebukuro.yahoo.co.jp/qa/question_detail/q14324719094,嫌なことから逃げたくて仕方ないです。 去年のはじめにひとり暮らしを始め、夜間の医療系の専門学校に通っています。週3で6時間のバイトと車校にもかよっているのですが、どれ一つとして完璧にできていません。 ...,0,0
2180,2026/1/27 3:16,恋愛相談、人間関係の悩み,c554f8f57,13時間10分,1,6,6.0,0,0,0.008,16.67,0.0,0.07,あと3日,https://detail.chiebukuro.yahoo.co.jp/qa/question_detail/q13324719093,付き合う前デートで2ショットを提案したり、男性の無防備な姿をこっそり撮影する女性心理教えてください,0,0
2181,2026/1/27 3:15,病院、検査,つつきき,13時間11分,1,5,5.0,0,0,0.006,20.0,0.0,0.07,あと3日,https://detail.chiebukuro.yahoo.co.jp/qa/question_detail/q12324719092,お食事時に見てしまった方すみません、尿検査について質問です。 今まで陰性（ー）だったのですが、 今回なんと陽性、それも（４＋）という結果が届きました。 （陽性の中で１番高い・まずい数値らしい） 他の項...,0,0
2182,2026/1/27 3:15,発達障害,1152448863,13時間11分,8,67,8.4,1,5,0.085,11.94,0.01,0.9,あと3日,https://detail.chiebukuro.yahoo.co.jp/qa/question_detail/q10324719090,自分がADHDかどうか確かめたい場合、どうするのが正解なのでしょうか？ 心理検査を受けたいと考えていたのですが、発達障害はそういうものの数値では測れないという情報も見かけました。 また検査の種類につい...,0,0
2183,2026/1/27 3:15,メルカリ,a65d3b43f,13時間11分,13,228,17.5,0,36,0.288,5.7,0.05,2.47,あと3日,https://detail.chiebukuro.yahoo.co.jp/qa/question_detail/q14324719089,メルカリで評価コメントをしない方について メルカリの出品者側です。 最近、商品が届いた後の評価で、良かった、だけでコメントをいただけない割合が増えてきました。直近は10回のうち4回もあり凹んでいます。...,0,0
2184,2026/1/27 3:14,Yahoo!知恵袋,zab********,13時間12分,2,50,25.0,0,0,0.063,4.0,0.02,0.19,あと3日,https://detail.chiebukuro.yahoo.co.jp/qa/question_detail/q13324719088,ベストアンサーに選定した回答者が、翌日も同カテゴリーの質問へ回答してきたので返信しようとしましたがブロックされて返信できなくなっていました。 どういう心境なんですかね? 別に攻撃的な回答とかでもなく、...,0,0
2185,2026/1/27 3:14,ドラマ,非公開,13時間12分,0,1,1.0,0,0,0.001,0.0,0.0,0.0,あと3日,https://detail.chiebukuro.yahoo.co.jp/qa/question_detail/q12324719087,家なき子 1 2どちらが面白かったですか？ ２はすずが主役というより光一や中山えみりの殺人などすず以外がかなり目立った印象がありました。,0,0
2186,2026/1/27 3:14,英語,oko********,13時間12分,3,52,17.3,0,0,0.066,5.77,0.01,0.25,あと3日,https://detail.chiebukuro.yahoo.co.jp/qa/question_detail/q11324719086,英語のiの発音について。 sleepyという単語はアルクの英辞郎では発音記号が slíːpi となっていて最後のiはsitやliveという単語のiの発音（日本語のゆるいイのような）と同じ感じで発音し...,0,0
2187,2026/1/27 3:14,恋愛相談,c554f8f57,13時間12分,2,71,35.5,0,2,0.09,2.82,0.03,0.29,不明,https://detail.chiebukuro.yahoo.co.jp/qa/question_detail/q10324719085,女性に質問します どんなに初対面から好印象な男性でも、恋愛感情を抱くまでには最低どれくらいの期間や会う回数必要ですか,0,0
2188,2026/1/27 3:14,トレーニング,1052508475,13時間12分,2,13,6.5,0,0,0.016,15.38,0.0,0.14,あと3日,https://detail.chiebukuro.yahoo.co.jp/qa/question_detail/q14324719084,筋トレの自重の話で中でも懸垂の質問です。 部位別の背中の日に最後にやってるのですが、最後なので5回くらいやって終わってしまいます。 最初にやれば8回はできます。 という観点で背中の日も含めて 懸垂を最...,0,0
2189,2026/1/27 3:14,スノーボード,kom********,13時間13分,2,66,33.0,0,2,0.083,3.03,0.03,0.28,あと3日,https://detail.chiebukuro.yahoo.co.jp/qa/question_detail/q12324719082,カービング(深くて大きい感じ)を目指して練習しているのですが、カービング初心者におすすめであまり高くない板ありますでしょうか。 15年ほど前のグラトリ系の板？をリサイクルショップで買って練習してますが...,0,0
2190,2026/1/27 3:13,飛行機、空港,v********,13時間14分,1,36,36.0,0,3,0.045,2.78,0.02,0.22,あと3日,https://detail.chiebukuro.yahoo.co.jp/qa/question_detail/q11324719081,成田空港でのチェックインと預け荷物の流れについて教えてください。 明日、成田空港からジンエアーで韓国へ行きます。 飛行機に乗るのが初めてで、空港での流れが分からず不安です。 24時間前にオンラインチェ...,0,0
2191,2026/1/27 3:13,生命保険,1151699979,13時間14分,0,17,17.0,0,0,0.021,0.0,0.0,0.02,あと3日,https://detail.chiebukuro.yahoo.co.jp/qa/question_detail/q10324719080,医療保険、がん保険に月々いくら払っていますか。,0,0
2192,2026/1/27 3:13,メンズ全般,a9a195861,13時間14分,1,25,25.0,0,0,0.031,4.0,0.01,0.09,あと3日,https://detail.chiebukuro.yahoo.co.jp/qa/question_detail/q13324719078,質問です軍物のアウターが買いたいと思い、東京に買い物に行こうと思っています。現物でもアルファとかアヴィレックスでも良いと思っています。どこかいいお店はありますか？ 狙っているのはN3Bです！ファーつい...,0,0
2193,2026/1/27 3:13,恋愛相談、人間関係の悩み,c554f8f57,13時間14分,2,32,16.0,0,0,0.04,6.25,0.01,0.17,不明,https://detail.chiebukuro.yahoo.co.jp/qa/question_detail/q12324719077,告白されたとき、これから好きになれる期待ができるかできないか、この違いは大きいですか,0,0
2194,2026/1/27 3:13,イベント、フェス,exa********,13時間14分,1,46,46.0,0,0,0.058,2.17,0.03,0.12,不明,https://detail.chiebukuro.yahoo.co.jp/qa/question_detail/q11324719076,サロンデュショコラで分からないことがあります。 パート1が1/24〜1/29までとした場合、1/27や1/29のかなり早い時間に行っても有名どころは買えないのでしょうか(パトリックロジェやフィリップベ...,0,0
2195,2026/1/27 3:13,健康、病気、病院,1151699979,13時間14分,0,13,13.0,0,0,0.016,0.0,0.0,0.02,あと3日,https://detail.chiebukuro.yahoo.co.jp/qa/question_detail/q10324719075,がん保険と医療保険、両方入ったほうがよいものですか？,0,0
2196,2026/1/27 3:13,自転車、サイクリング,1249993210,13時間14分,10,136,13.6,0,8,0.171,7.35,0.02,1.1,あと3日,https://detail.chiebukuro.yahoo.co.jp/qa/question_detail/q14324719074,8月にしまなみ海道を一日中でロードバイク横断は暑さ的に無謀ですか？,0,0
2197,2026/1/27 3:12,ダイエット,こた,13時間15分,3,35,11.7,0,0,0.044,8.57,0.01,0.23,あと3日,https://detail.chiebukuro.yahoo.co.jp/qa/question_detail/q13324719073,過食嘔吐についての質問です。 私の彼女が最近、ダイエットをし始めたのですが体重や見た目を気にしすぎて過食嘔吐になりかけています。 どのような声掛けをしてあげたり、支えてあげたら良いのでしょうか。 早い...,0,0
2198,2026/1/27 3:12,携帯型ゲーム全般,1252260524,13時間15分,3,36,12.0,0,1,0.045,8.33,0.01,0.27,あと3日,https://detail.chiebukuro.yahoo.co.jp/qa/question_detail/q12324719072,シャドバビヨンドについてです。 何か一時期ガリュウの超進化時効果が進化時効果になるみたいなアッパーの話ありませんでした？ あれどこいきました？,0,0
2199,2026/1/27 3:12,恋愛相談、人間関係の悩み,非公開,13時間15分,3,10,3.3,0,6,0.013,30.0,0.0,0.43,あと3日,https://detail.chiebukuro.yahoo.co.jp/qa/question_detail/q10324719070,内容までは言えませんが重要な相談話をしてる時に同じ職場の人間が他人事のように割り込んで自分の話を始めすごく腹が立ちました。それも一度だけではありません。 今まで我慢してましたが今日という今日は我慢の限...,0,0
2200,2026/1/27 3:12,恋愛相談、人間関係の悩み,c554f8f57,13時間15分,1,11,11.0,0,0,0.014,9.09,0.0,0.08,不明,https://detail.chiebukuro.yahoo.co.jp/qa/question_detail/q14324719069,相手の男性に恋愛感情とはいえないがこれから好きになれる期待を感じる、これだけでも十分相性が良いということですか？,0,0
2201,2026/1/27 3:11,株式,1052805106.,13時間16分,1,10,10.0,0,0,0.013,10.0,0.0,0.08,あと3日,https://detail.chiebukuro.yahoo.co.jp/qa/question_detail/q13324719068,令和の虎やリアルバリューに出ている人たちで上場している社長は沢山いるんでしょうか？ 調べても令和の虎の安藤社長しか出てこないのですが。,0,0
2202,2026/1/27 3:11,家族関係の悩み,彼岸花,13時間16分,6,45,7.5,0,1,0.056,13.33,0.0,0.47,あと3日,https://detail.chiebukuro.yahoo.co.jp/qa/question_detail/q12324719067,残業や会社での泊まりが多いのはブラック企業ですか？ 今年24歳になる実家暮らしの女です。今の会社に入って4年、現場仕事に務めています。 深夜作業や早朝作業で会社に泊まることがありますが繁忙期は特に泊ま...,0,0
2203,2026/1/27 3:11,DIY,tor********,13時間16分,0,5,5.0,0,0,0.006,0.0,0.0,0.01,あと3日,https://detail.chiebukuro.yahoo.co.jp/qa/question_detail/q11324719066,11.13ミリが一緒に付属しているエクステンションレンチならどのようなものがありますか？,0,0
2204,2026/1/27 3:11,恋愛相談,非公開,13時間17分,9,125,13.9,0,17,0.157,7.2,0.02,1.36,あと3日,https://detail.chiebukuro.yahoo.co.jp/qa/question_detail/q14324719064,超低身長の男はほとんどの場合恋愛できませんよね？？？ 特に、若い人同士の場合 僕もネットや友人から色々情報を集めて、低身長向けのファッションとか、変な感じにならない程度の筋トレとかスキンケアとか、あと...,0,0
2205,2026/1/27 3:11,ピアス,匿名,13時間17分,0,8,8.0,0,0,0.01,0.0,0.0,0.01,あと3日,https://detail.chiebukuro.yahoo.co.jp/qa/question_detail/q13324719063,約1週間前セルフでカミソリとハサミでスプタンにしてみました。右側が多分全力で開いた時の長さなんですが短いですか？感覚1cmくらいです。左右別々に動かせるようになりますか？ またなるには何ヶ月くらいでな...,0,0
2206,2026/1/27 3:10,就職活動,kyo********,13時間18分,2,37,18.5,0,0,0.046,5.41,0.01,0.17,あと3日,https://detail.chiebukuro.yahoo.co.jp/qa/question_detail/q12324719062,昨年3月に大学を卒業したのですが、今の若い世代（20代）で自分以外で、卒業後にアルバイトすら受からず働いていない人を聞いたことがありません。 恐らくもうこれから私は非正規で生きていくと思うのですが、2...,0,0
2207,2026/1/27 3:10,恋愛相談,聖なる猫愛の永遠国語教師,13時間18分,3,55,18.3,0,1,0.069,5.45,0.01,0.29,あと3日,https://detail.chiebukuro.yahoo.co.jp/qa/question_detail/q11324719061,女子大生の落とし方でいい方法ありますか。,0,0
2208,2026/1/27 3:10,プレイステーション4,1252259153,13時間18分,0,4,4.0,0,0,0.005,0.0,0.0,0.01,あと3日,https://detail.chiebukuro.yahoo.co.jp/qa/question_detail/q10324719060,フォートナイトのブレインロットについて質問です ※「STEAL THE BRAINROT」の方 盗みたいのですが盗み方が分かりません… 普通のショップから色々なアイテム？を買うと思うのですが…もう何が...,0,0
2209,2026/1/27 3:10,受験、進学,bde59f24e,13時間18分,0,16,16.0,0,0,0.02,0.0,0.0,0.02,あと3日,https://detail.chiebukuro.yahoo.co.jp/qa/question_detail/q14324719059,第35回歯科衛生士国家試験を受けるものです。 本当にやる気が起きなくて、模試の点数も悪くて100〜110点くらいで調子がいいと120点代 校内Eでは140点でした 34回が難しかったと聞いているのです...,0,0
2210,2026/1/27 3:10,ギター、ベース,082719385,13時間18分,1,13,13.0,0,1,0.016,7.69,0.0,0.12,あと3日,https://detail.chiebukuro.yahoo.co.jp/qa/question_detail/q13324719058,origin effectsのベースコンプレッサーについて質問です。 bass compressorとcompact bassはどこが違うのですか？ おすすめも知りたいです,0,0
2211,2026/1/27 3:10,プロ野球,ゆう,13時間18分,1,4,4.0,0,0,0.005,25.0,0.0,0.07,あと3日,https://detail.chiebukuro.yahoo.co.jp/qa/question_detail/q12324719057,南海ホークスをプロスピ2025で作っていて ホームランファンファーレをつくりたいのですが自分では難しいので作ってくれませんか！ https://youtu.be/ItHjrUExxzA?si=mdZo...,0,0
2212,2026/1/27 3:10,トレーニング,1052508475,13時間18分,1,25,25.0,0,0,0.031,4.0,0.01,0.09,あと3日,https://detail.chiebukuro.yahoo.co.jp/qa/question_detail/q11324719056,家で筋トレ週4～5してる中年男です。 脚トレが嫌いです。でも脚トレはやらないと駄目なことはわかっております。 なので脚トレします。 って人です。 その中で脚トレの日を儲けるとダメージがでかく筋トレ自体...,0,0
2213,2026/1/27 3:10,福祉、介護,jpdtpmwt,13時間18分,3,21,7.0,0,0,0.026,14.29,0.0,0.21,あと3日,https://detail.chiebukuro.yahoo.co.jp/qa/question_detail/q10324719055,高校生以下の身寄りがない子どもは児童養護施設に行くらしいですが、自力で生きていくのに十分な収入がある場合は強制入所になりませんか？ また、弟などがいた場合、兄が養えるなら児童養護施設に行かなくていいで...,0,0
2214,2026/1/27 3:10,ヘアスタイル,1151267410,13時間18分,1,16,16.0,0,0,0.02,6.25,0.0,0.08,あと3日,https://detail.chiebukuro.yahoo.co.jp/qa/question_detail/q14324719054,美容師さんがいたら教えて欲しいです。暖色寒色カラーどっちもした事あるのですが、暖色だけ明らか色落ちが早いです。暖色は落ちやすいとかあるのでしょうか？,0,0
2215,2026/1/27 3:09,税金,およよ,13時間19分,6,47,7.8,0,2,0.059,12.77,0.0,0.51,あと3日,https://detail.chiebukuro.yahoo.co.jp/qa/question_detail/q13324719053,年末調整の還付金についての質問です。 昨年2年働いた会社を8月末に退職致しました。 それ以降12月から働き始めました。 月末締めの翌月15日払いだったので、8月以降給与は発生しておりませんでした。 そ...,0,0
2216,2026/1/27 3:09,ゲーム,非公開,13時間19分,3,14,4.7,0,0,0.018,21.43,0.0,0.2,あと3日,https://detail.chiebukuro.yahoo.co.jp/qa/question_detail/q12324719052,Switch2について Switch2はWi-Fi6に対応してるんですよね？ 家のWi-Fiは6なんですけど、何故かSwitch2に表示されません。 パソコンだと6G（802.11sx）に接続できるん...,0,0
2217,2026/1/27 3:09,スマホアプリ,his********,13時間19分,1,7,7.0,0,0,0.009,14.29,0.0,0.07,あと3日,https://detail.chiebukuro.yahoo.co.jp/qa/question_detail/q11324719051,Tiktokの不明なエラーって何ですか？,0,0
2218,2026/1/27 3:09,大学受験,非公開,13時間20分,2,88,44.0,0,0,0.11,2.27,0.05,0.23,あと3日,https://detail.chiebukuro.yahoo.co.jp/qa/question_detail/q10324719050,兵庫県立大の中期の難易度とはどれくらいでしょうか。 担任の先生に兵庫県立大の中期を勧められて、共テリサーチなども見てみましたがE判定の上2次の配点も低いというこれ受かる確率ほぼないですよね？ また共テ...,0,0
2219,2026/1/27 3:09,海外ドラマ,1150520645,13時間20分,0,14,14.0,0,0,0.017,0.0,0.0,0.02,あと3日,https://detail.chiebukuro.yahoo.co.jp/qa/question_detail/q13324719048,過去にディズニーチャンネルやDlifeで放送されていた「シェキラ!」というドラマのオープニングにこんなシーンがあるのですが、しばらく視聴していてこんなシーンは見かけませんでした。 昔視聴していた際はこ...,0,0
2220,2026/1/27 3:08,バス、タクシー,1251903878,13時間21分,3,82,27.3,1,6,0.102,3.66,0.03,0.64,あと3日,https://detail.chiebukuro.yahoo.co.jp/qa/question_detail/q12324719047,夜行バスについて教えてください。JR高速バス 岩手から名古屋まで夜行バスで行きたいのですがJR高速バスだと岩手から愛知までの直通が恐らくなくて、岩手→東京 東京→愛知みたいな感じで行こうと思ってます。...,0,0
2221,2026/1/27 3:08,Macintosh（Mac),gop********,13時間21分,1,12,12.0,0,0,0.015,8.33,0.0,0.08,あと3日,https://detail.chiebukuro.yahoo.co.jp/qa/question_detail/q11324719046,MacBookの購入を考えているのですが、Back Market と イオシス ではどちらがオススメですか？,0,0
2222,2026/1/27 3:08,恋愛相談、人間関係の悩み,c554f8f57,13時間21分,2,35,17.5,0,1,0.044,5.71,0.01,0.21,あと3日,https://detail.chiebukuro.yahoo.co.jp/qa/question_detail/q10324719045,恋愛感情が完全に無い状態で 付き合う女性はほぼいないですか,0,0
2223,2026/1/27 3:08,日本映画,ac77c335e,13時間21分,2,57,28.5,1,0,0.071,3.51,0.02,0.32,あと3日,https://detail.chiebukuro.yahoo.co.jp/qa/question_detail/q14324719044,邦画ホラー映画のタイトルがわかりません。 18〜22年ほど前にTSUTAYAのホラー映画コーナーでレンタルしたビデオかDVDのタイトルが思い出せません。 唯一思い出せるシーンとしては夢の中のような背景...,0,0
2224,2026/1/27 3:08,ギター、ベース,gjpp,13時間21分,5,51,10.2,0,1,0.064,9.8,0.01,0.41,あと3日,https://detail.chiebukuro.yahoo.co.jp/qa/question_detail/q13324719043,ギターリフとは何ですか？ これが激しめだとどんな印象の曲になりますか？？,0,0
2225,2026/1/27 3:08,大学受験,1,13時間21分,1,24,24.0,0,0,0.03,4.17,0.01,0.09,あと3日,https://detail.chiebukuro.yahoo.co.jp/qa/question_detail/q12324719042,高校2年の今の時期や高３の春、夏ってみなさんどれくらい勉強してましたか？ 志望校も書いてくれると嬉しいです！,0,0
2226,2026/1/27 3:08,げっ歯類、ウサギ,α,13時間21分,2,13,6.5,0,0,0.016,15.38,0.0,0.14,あと3日,https://detail.chiebukuro.yahoo.co.jp/qa/question_detail/q11324719041,ジャンガリアンハムスターを飼ってます。写真のように、砂遊び場で寝てしまうことがあるのですが、そっとしておいても大丈夫ですか？また、この瓶を少し斜めに立ててるのですが真っ直ぐ立てた方が良いですか？,0,0
