2189,2026/1/24 2:53,美容整形,たまごちゃん,13時間24分,0,9,9.0,0,0,0.011,0.0,0.0,0.01,あと3日,https://detail.chiebukuro.yahoo.co.jp/qa/question_detail/q14324612169,大学1年生です。 水の森名古屋院で埋没を考えています。 まぶたの皮膚が伸びてきたことや、浮腫んでる時にアイプチしにくいのが気になるからです。 幅的には末広二重希望です。幅欲張るよりかは取れにくさ重視で...,0,0
2190,2026/1/24 2:53,土地,ume********,13時間24分,4,41,10.2,0,0,0.051,9.76,0.01,0.3,あと3日,https://detail.chiebukuro.yahoo.co.jp/qa/question_detail/q13324612168,建設会社に土地を貸していたのですが、その会社が倒産してしまい。賃料を得られなくなりました。 土地の上物は倒産した会社が建てたものです。 他の借り手を探させばいいのですが、土地を更地にしないと中々買い手...,0,0
2191,2026/1/24 2:53,メンズシューズ,tpmgmtmpm,13時間24分,0,4,4.0,0,0,0.005,0.0,0.0,0.0,あと3日,https://detail.chiebukuro.yahoo.co.jp/qa/question_detail/q12324612167,adidasのAsterWに似たスニーカーありますか？ ブランドは特にこだわりは無いのですが、ほぼ同じようなもの欲しいです。,0,0
2193,2026/1/24 2:52,超常現象、オカルト,1152706266,13時間26分,7,52,7.4,2,3,0.065,13.46,0.0,0.86,あと3日,https://detail.chiebukuro.yahoo.co.jp/qa/question_detail/q10324612165,時々死後の世界について考えて 言葉に表せないほどの恐怖心に襲われめちゃくちゃ苦しくなっています。 なんか…… 産まれる前も無で 死んだ後も無なのに この約80年の間だけ存在してる世界 今ある感覚がめち...,0,0
2194,2026/1/24 2:52,おもちゃ,1151075945,13時間26分,1,3,3.0,0,0,0.004,33.33,0.0,0.07,あと3日,https://detail.chiebukuro.yahoo.co.jp/qa/question_detail/q14324612164,去年販売されたたまごっちサプライズは店頭で購入できますか？,0,0
2195,2026/1/24 2:52,バイク,chi********,13時間26分,2,9,4.5,0,0,0.011,22.22,0.0,0.14,あと3日,https://detail.chiebukuro.yahoo.co.jp/qa/question_detail/q13324612163,2018 FLFBファットボーイメーター交換について 純正メーターの曇り跡が気になるので 状態の良い純正中古メーターに交換したいのですが この場合ODOの距離はどうなるのかお分かりの方おられますでしょ...,0,0
2196,2026/1/24 2:52,恋愛相談、人間関係の悩み,b2adc17e4,13時間26分,2,8,4.0,0,0,0.01,25.0,0.0,0.13,あと3日,https://detail.chiebukuro.yahoo.co.jp/qa/question_detail/q12324612162,中学一緒の仲良かった女子に久しぶりにDMしてるんですけど、気になってて彼氏がおるかどうか確認したいんですけどなんて聞くべきですか？「SNSで」,0,0
2197,2026/1/24 2:52,ネコ,非公開,13時間26分,3,35,11.7,0,2,0.043,8.57,0.01,0.3,あと3日,https://detail.chiebukuro.yahoo.co.jp/qa/question_detail/q11324612161,猫が死んじゃってすごく悲しくて眠れません。もうすぐ受験なのにどうしたらいいんだろう,0,0
2198,2026/1/24 2:52,病気、症状,tom********,13時間26分,0,6,6.0,0,0,0.007,0.0,0.0,0.01,あと3日,https://detail.chiebukuro.yahoo.co.jp/qa/question_detail/q10324612160,最近、うとうとして睡眠に入ってから途中で目が覚めることがあるのですが その時に天井に手足の細いユウレイグモのような蜘蛛が走って逃げたりふわふわと降りてきたりという姿が見え、 怖くて飛び起きるという事が...,0,0
2199,2026/1/24 2:52,水虫,gum********,13時間26分,2,6,3.0,0,0,0.007,33.33,0.0,0.13,あと3日,https://detail.chiebukuro.yahoo.co.jp/qa/question_detail/q14324612159,水虫の内服薬ネイリンは、爪、かかと、どちらにも効果がありますか？,0,0
2200,2026/1/24 2:52,コミック,1052843005,13時間26分,1,29,29.0,0,0,0.036,3.45,0.01,0.1,あと3日,https://detail.chiebukuro.yahoo.co.jp/qa/question_detail/q12324612157,進撃の巨人についてです。 エレンは未来が見えるから、地鳴らしをすることも自分がミカサに殺されることも知っていたと思いますが、 最後のミカサがキスするところは見れていないのでしょうか？報われなくて辛いで...,0,0
2201,2026/1/24 2:52,バイク,dsfomkgds,13時間26分,2,19,9.5,0,0,0.024,10.53,0.0,0.15,あと3日,https://detail.chiebukuro.yahoo.co.jp/qa/question_detail/q11324612156,新型R7とR9だったらどっちがいいですかね。 用途はバイトへの通勤大学への通学、週末ミニサーキットで大型連休にサーキットに行きたいなぐらいです。 用途的にはR7なんですが、フル規格のサーキットいったと...,0,0
2202,2026/1/24 2:51,政治、社会問題,Sunrise,13時間27分,4,72,18.0,0,5,0.089,5.56,0.02,0.52,不明,https://detail.chiebukuro.yahoo.co.jp/qa/question_detail/q12324612152,高市自民と中革、どっちを選んでも国民とっては不幸でしかないですか？,0,0
2203,2026/1/24 2:51,恋愛相談、人間関係の悩み,c69d20928,13時間27分,2,11,5.5,0,0,0.014,18.18,0.0,0.14,あと3日,https://detail.chiebukuro.yahoo.co.jp/qa/question_detail/q11324612151,リスカって浅かったらリスカじゃないの？,0,0
2204,2026/1/24 2:51,職場の悩み,aa57262d1,13時間27分,4,24,6.0,0,2,0.03,16.67,0.0,0.35,あと3日,https://detail.chiebukuro.yahoo.co.jp/qa/question_detail/q10324612150,現在ミスタードーナツでバイトしてるものです。ドリンクを作る仕事が全然覚えられなくて常に周りに迷惑をかけて辛いです。どうすればすぐに仕事を覚えれますか？,0,0
2205,2026/1/24 2:51,家族関係の悩み,1153257402,13時間27分,2,25,12.5,0,2,0.031,8.0,0.0,0.23,あと3日,https://detail.chiebukuro.yahoo.co.jp/qa/question_detail/q14324612149,もし旦那が、家事育児を全部妻に任せておいて、夜はトップヒーローズで独身のフリして知らない女と毎日DMして、ご飯の写真送り合って、 寝落ちするまで「ちょっと話そ」ってやってたら…それ普通にアウトじゃない...,0,0
2206,2026/1/24 2:51,ゲーム,cbac6b356,13時間27分,1,14,14.0,0,0,0.017,7.14,0.0,0.08,あと3日,https://detail.chiebukuro.yahoo.co.jp/qa/question_detail/q13324612148,最近PCを買ったのですが、GPU5060ti 16GB CPU 14700F メモリは32です。 APEXをプレイしておりFPSは平均160ほどです。 マップによっては120FPSほどに落ちるのですが...,0,0
2207,2026/1/24 2:51,大学受験,1150514595,13時間27分,1,53,53.0,0,1,0.066,1.89,0.03,0.16,あと3日,https://detail.chiebukuro.yahoo.co.jp/qa/question_detail/q12324612147,国公立中期の薬学部についての質問です。 名古屋市立大と静岡県立大ではどちらの方が 1、就職などに強いか 2、立地やアクセスは便利か を知りたいです。 教えていただけると幸いです、よろしくお願いします。,0,0
2208,2026/1/24 2:50,インフルエンザ,1152821511,13時間28分,1,17,17.0,0,0,0.021,5.88,0.0,0.08,あと3日,https://detail.chiebukuro.yahoo.co.jp/qa/question_detail/q11324612146,インフルエンザおさまって 10日後くらいにまたインフルエンザにかかることってありますか？,0,0
2209,2026/1/24 2:50,恋愛相談、人間関係の悩み,b2adc17e4,13時間29分,4,17,4.2,0,0,0.021,23.53,0.0,0.27,あと3日,https://detail.chiebukuro.yahoo.co.jp/qa/question_detail/q10324612145,最近仲良い女子に二人でお泊まりしよって言われたんですけど、どーゆー意図ですかねー、家にも行ったことないんですけど結構仲良くて。,0,0
2210,2026/1/24 2:50,男性アイドル,1053207364,13時間29分,0,4,4.0,0,0,0.005,0.0,0.0,0.0,あと3日,https://detail.chiebukuro.yahoo.co.jp/qa/question_detail/q14324612144,交換同行(他名義)でエラー等でどちらかの公演が入れなくなってしまった場合、入れなくなった側のチケットを所持していた人は返金すべきですか？それも承知の上で取引しているため返金はしなくて大丈夫ですか？,0,0
2211,2026/1/24 2:50,政治、社会問題,ちか,13時間29分,2,37,18.5,0,0,0.046,5.41,0.01,0.17,不明,https://detail.chiebukuro.yahoo.co.jp/qa/question_detail/q13324612143,衆議院解散ではバンザイする人がいますが、 これは仮に自民が勝ったとしても、何割かは戻ってこれないから、ヤケクソでやってるんですか？,0,0
2212,2026/1/24 2:50,鉄道、列車、駅,cc4833328,13時間29分,0,10,10.0,0,0,0.012,0.0,0.0,0.01,あと3日,https://detail.chiebukuro.yahoo.co.jp/qa/question_detail/q12324612142,質問です。 E233系0番台にされていてラッピングなのですが，このラッピングの詳細を教えて欲しいです！お願いします！,0,0
2213,2026/1/24 2:50,貯金,122500,13時間29分,1,16,16.0,0,0,0.02,6.25,0.0,0.08,あと3日,https://detail.chiebukuro.yahoo.co.jp/qa/question_detail/q11324612141,約7年ほど前にみずほ銀行の口座を作り2.3年使っていたのですが、それ以降手をつけておらず口座が全く動いていない状態です。 みずほダイレクトを使用したいのですがキャッシュカードをどこにしまったか忘れてし...,0,0
2214,2026/1/24 2:50,男性アイドル,ab7e2e8ac,13時間29分,2,30,15.0,0,1,0.037,6.67,0.01,0.2,あと3日,https://detail.chiebukuro.yahoo.co.jp/qa/question_detail/q10324612140,すとぷりグッズのレートとそれぞれの名称を を教えてください。 6年ほど前に担降りして以降物置にしまっていたものになります。メルカリで売ろうと思っているのですが、レートとグッズ名が分からず困っています。...,0,0
2215,2026/1/24 2:50,健康、病気、病院,c59daa34f,13時間29分,5,34,6.8,0,1,0.042,14.71,0.0,0.39,あと3日,https://detail.chiebukuro.yahoo.co.jp/qa/question_detail/q14324612139,病院で処方箋を出してもらいましたが、処方薬の中に1つだけ高額な薬があります。 今回はその薬を支払うお金が足りず、他の薬の分の支払いはできます。 この場合、 ・先に他の薬だけ調剤してもらい ・高額な薬は...,0,0
2216,2026/1/24 2:50,コンタクトレンズ、視力矯正,あ,13時間29分,0,7,7.0,0,0,0.009,0.0,0.0,0.01,あと3日,https://detail.chiebukuro.yahoo.co.jp/qa/question_detail/q13324612138,顎が長めなのがコンプレックスなんですけど、この場合どんなカラコンが似合うと思いますか？,0,0
2217,2026/1/24 2:50,ペット,受験生,13時間29分,3,17,5.7,0,0,0.021,17.65,0.0,0.21,あと3日,https://detail.chiebukuro.yahoo.co.jp/qa/question_detail/q11324612136,犬猫以外で人懐っこくて虫が寄ってこない室内で飼えるペットを教えてください。例えばうさぎとか,0,0
2218,2026/1/24 2:50,アニメ、コミック,1150741494,13時間29分,2,22,11.0,0,6,0.027,9.09,0.0,0.37,あと3日,https://detail.chiebukuro.yahoo.co.jp/qa/question_detail/q14324612134,薬屋のひとりごと アニメを見ていて疑問だったので質問させていただきます。 子の一族は何故謀反を起こしたのでしょうか。 神美が皇帝、高級に対しての不満、復讐心からというのは分かりますが、子昌は先帝とも良...,0,0
2219,2026/1/24 2:50,アニメ,1051908376,13時間29分,3,22,7.3,0,0,0.027,13.64,0.0,0.21,あと3日,https://detail.chiebukuro.yahoo.co.jp/qa/question_detail/q13324612133,呪術廻戦の五条vs宿儺はアニメと映画どちらでやると思いますか？自分は映画で大迫力でやって欲しいです。,0,0
2220,2026/1/24 2:50,コミック,gjpp,13時間29分,1,26,26.0,0,1,0.032,3.85,0.01,0.13,あと3日,https://detail.chiebukuro.yahoo.co.jp/qa/question_detail/q12324612132,漫画「ブラック・ジャック」に関する質問です！ 1番初めに出たチャンピオンコミックス版の4巻の「植物人間」って増刷されてからは「からだが石に...」に差し替えられているそうですが。 「植物人間」を読むに...,0,0
2221,2026/1/24 2:50,職場の悩み,ogtp,13時間29分,1,24,24.0,0,0,0.03,4.17,0.01,0.09,あと3日,https://detail.chiebukuro.yahoo.co.jp/qa/question_detail/q11324612131,男で総務経理をしており今仕事を女性の上司から教わっていますが、女性が教える時の距離が近く、人半分くらいの距離です。 教えているのだからこれくらい近くなるのでしょうか？ それとも教えているとはいえ近過ぎ...,0,0
2222,2026/1/24 2:50,ゲーム,c251eca4b,13時間29分,0,6,6.0,0,0,0.007,0.0,0.0,0.01,あと3日,https://detail.chiebukuro.yahoo.co.jp/qa/question_detail/q10324612130,スマメイト最近のルールチェックで新しい項目ができて出来なくなってしまったので教えて欲しいです,0,0
2223,2026/1/24 2:49,政治、社会問題,cf0c82b43*^_^*,13時間30分,2,28,14.0,0,1,0.035,7.14,0.0,0.19,あと3日,https://detail.chiebukuro.yahoo.co.jp/qa/question_detail/q14324612129,高市総理の選挙結果とその先を予測してください。あなたはどうなると思われますか？,0,0
2224,2026/1/24 2:49,ファミリーレストラン,1151328838,13時間31分,1,7,7.0,0,0,0.009,14.29,0.0,0.07,あと3日,https://detail.chiebukuro.yahoo.co.jp/qa/question_detail/q13324612128,サイゼリヤで働いてる方、ベリフィ(V)のコツ教えて欲しいです。自分がいつも困る時としては ・料理のサーブが追いつかなく料理が溜まり置けなくなる時 ・料理の仕分けが忙しく伝票整理する暇がない ・ライスが...,0,0
2225,2026/1/24 2:49,郵便、宅配,you********,13時間31分,0,4,4.0,0,0,0.005,0.0,0.0,0.0,あと3日,https://detail.chiebukuro.yahoo.co.jp/qa/question_detail/q12324612127,Amazonフレックスユーザーの方に質問なのですが、不在が出た場合は不在票に荷物の番号をかいてキチンと不在票をお客さんのポストにいれていますか？ 必ず入れるべきなのでしょうか？,0,0
2226,2026/1/24 2:49,美容整形,a99dabcfb,13時間31分,0,2,2.0,0,0,0.002,0.0,0.0,0.0,あと3日,https://detail.chiebukuro.yahoo.co.jp/qa/question_detail/q10324612125,整形 湘南スクエア二重について。 閲覧ありがとうございます。 数年ほど前に湘南さんでスクエア二重術をさせて頂きました。こちらの施術についてなのですが、点どめと箱となっていることは理解しているのですが、...,0,0
2227,2026/1/24 2:49,Android,Mega,13時間31分,2,3,1.5,0,0,0.004,66.67,0.0,0.13,あと3日,https://detail.chiebukuro.yahoo.co.jp/qa/question_detail/q13324612123,通話についてです。 イヤホンでLINE通話しながらロブロックスでゲームをしていたのですが、やっていたゲームをやめてホームに戻った時に、イヤホンから鳴っていた通話の音声が本体スピーカーに変更されてしまい...,0,0
2228,2026/1/24 2:49,スマホアプリ,1249856061,13時間31分,4,43,10.8,0,0,0.053,9.3,0.01,0.3,あと3日,https://detail.chiebukuro.yahoo.co.jp/qa/question_detail/q12324612122,にゃんこ大戦争について ユーザーランク1585でこの編成は強いと思いますか！！,0,0
2229,2026/1/24 2:49,資産運用、投資信託、NISA,1068753654,13時間31分,1,37,37.0,0,0,0.046,2.7,0.02,0.11,あと3日,https://detail.chiebukuro.yahoo.co.jp/qa/question_detail/q10324612120,NISAとiDeCoをはじめたいです。 iDeCoを満額とNISAは月5千円か一万です。 ゴールドとオルカンで考えていますが、iDeCo、NISA同じ銘柄でいいですか？,0,0
2230,2026/1/24 2:49,恋愛相談、人間関係の悩み,あーあ,13時間31分,2,11,5.5,0,0,0.014,18.18,0.0,0.14,あと3日,https://detail.chiebukuro.yahoo.co.jp/qa/question_detail/q14324612119,大学生男です。今まで女性経験もなく話すだけでも緊張するのですが女性経験を増やすために何か行動できることありますか？,0,0
2231,2026/1/24 2:49,恋愛相談、人間関係の悩み,1ijjq,13時間31分,3,12,4.0,0,0,0.015,25.0,0.0,0.2,あと3日,https://detail.chiebukuro.yahoo.co.jp/qa/question_detail/q13324612118,3年間ずっと好きだった人でもあり半年間恋人だった人と別れて半年経ちました。振ったのは私で相手はまだ私のことが好きらしくて告白もまだしてくるくらいです。 私は新しい恋に進みたいけど3年間その人が好きだっ...,0,0
2232,2026/1/24 2:48,恋愛相談、人間関係の悩み,1052975539,13時間32分,4,63,15.8,0,0,0.078,6.35,0.01,0.32,あと3日,https://detail.chiebukuro.yahoo.co.jp/qa/question_detail/q11324612116,リスナーさんをブロックしようか迷ってます ライブ配信を私はしていて ルールを何回も説明してもわかってくれない 知的障害のあるリスナーさんが 私の配信にはいるのですが その子をブロックしようか迷ってます...,0,0
2233,2026/1/24 2:48,政治、社会問題,ちか,13時間32分,2,37,18.5,0,1,0.046,5.41,0.01,0.21,不明,https://detail.chiebukuro.yahoo.co.jp/qa/question_detail/q14324612114,いわゆる独身税は、生殖機能に問題があって子供ができない人、LGBTなどそもそも子供ができない人、高齢者で子作り機能が低下・退化しているものも払うんですか？,0,0
2234,2026/1/24 2:48,病気、症状,匿名,13時間32分,0,6,6.0,0,0,0.007,0.0,0.0,0.01,あと3日,https://detail.chiebukuro.yahoo.co.jp/qa/question_detail/q13324612113,緊急です。木曜日の朝に発熱があり病院に行き唯の風邪ではあったんですが今日の夜ご飯前までは落ち着いてはいましたが夜ご飯を通常時よりも量は少ないけど食べてめっちゃ気持ち悪くなって辛めの麺だったんですが、 ...,0,0
2235,2026/1/24 2:48,トレーディングカード,1152827073,13時間32分,5,40,8.0,0,0,0.049,12.5,0.0,0.36,あと3日,https://detail.chiebukuro.yahoo.co.jp/qa/question_detail/q12324612112,ポケモンカードについての質問です。自分はプレイヤーなのですがパックを剥くのが好きで剥いている時に高額なカードが出た時にどうすればいいのか悩んでいます。 デッキをハイレアにしたい！ということは特にはなく...,0,0
2236,2026/1/24 2:48,恋愛相談、人間関係の悩み,b2adc17e4,13時間32分,2,4,2.0,0,0,0.005,50.0,0.0,0.13,あと3日,https://detail.chiebukuro.yahoo.co.jp/qa/question_detail/q11324612111,1年くらい会ってないけど、SNSで話してる中学一緒の女子が気になってて、どうアプローチすればいいですか？,0,0
2237,2026/1/24 2:48,動画サービス,ba01707bf,13時間32分,0,2,2.0,0,0,0.002,0.0,0.0,0.0,あと3日,https://detail.chiebukuro.yahoo.co.jp/qa/question_detail/q14324612109,TikTokのある動画探しています。恐らく韓国人のjkの1人のダンス動画なんですが、いいねがとても多かった気がします(海外ウケがすごい)。グレーの服を着ていて、へそを出していた気がします！,0,0
2238,2026/1/24 2:47,妊娠、出産,b928025d3,13時間33分,1,10,10.0,0,0,0.012,10.0,0.0,0.07,あと3日,https://detail.chiebukuro.yahoo.co.jp/qa/question_detail/q13324612108,妊娠中、妊娠初期の眠剤と安定剤について質問です。 元々精神安定剤と眠剤を飲んで過ごしていて、妊活をしたいと思ったタイミングで医師と相談し、クエチアピン50mg、デエビゴ20mg、ラメルテオン8mgを服...,0,0
2239,2026/1/24 2:47,恋愛相談、人間関係の悩み,1052641333,13時間33分,3,47,15.7,0,2,0.058,6.38,0.01,0.32,あと3日,https://detail.chiebukuro.yahoo.co.jp/qa/question_detail/q12324612107,復縁について質問です。 今年の初め彼女に好きだけど別れようと言われました 今現在彼女には別の男がいます ですが最近今度から自分はちゃんと想いを伝えるようにすると本人に伝えたのですが 伝えたい想いが伝わ...,0,0
2240,2026/1/24 2:47,職場の悩み,。。。。。,13時間33分,7,46,6.6,0,0,0.057,15.22,0.0,0.49,あと3日,https://detail.chiebukuro.yahoo.co.jp/qa/question_detail/q11324612106,宗教の勧誘をする同僚がいるのですが、人柄は良い人です。私は仲良くしてますが、仲良くできない人もいます。これに対してどう思いますか❓私は関係ない気がします。,0,0
2241,2026/1/24 2:47,YouTube,msj********,13時間34分,0,4,4.0,0,0,0.005,0.0,0.0,0.0,あと3日,https://detail.chiebukuro.yahoo.co.jp/qa/question_detail/q10324612105,ホロスタの夕刻ロベルが龍が如くシリーズの配信でプラチナの皿を見つけたときに歌う歌はなんなんですか？元曲を教えて欲しいです。,0,0
2242,2026/1/24 2:47,鉄道、列車、駅,dgt********,13時間34分,2,29,14.5,0,7,0.036,6.9,0.01,0.42,あと3日,https://detail.chiebukuro.yahoo.co.jp/qa/question_detail/q14324612104,「上野はおいらの心の駅だぁ」の意味合いを、できるだけ正しく教えてください。,0,0
2243,2026/1/24 2:47,メンタルヘルス,あ,13時間34分,0,22,22.0,0,0,0.027,0.0,0.0,0.03,あと3日,https://detail.chiebukuro.yahoo.co.jp/qa/question_detail/q11324612101,短気で衝動的な行動をしてしまう性格について。過去の家庭環境は関係ありますか？ 自分は短気で、感情が高ぶると衝動的に人を困らせる行動を取ってしまうことがあります。 例えば、バイトのLINEグループを感情...,0,0
2244,2026/1/24 2:47,アニメ,1150893594,13時間34分,5,34,6.8,0,1,0.042,14.71,0.0,0.39,あと3日,https://detail.chiebukuro.yahoo.co.jp/qa/question_detail/q12324612102,私はアニメの中で銀魂が1番好きで、本当に全ての長編に救われて来ました。 銀さんを中心として全てのキャラクターにそれぞれ侍の魂があって ほんとに大好きな作品です。 だからこそ2月に上映する「吉原大炎上」...,0,0
2245,2026/1/24 2:47,大学受験,安定合格,13時間34分,1,17,17.0,0,0,0.021,5.88,0.0,0.08,あと3日,https://detail.chiebukuro.yahoo.co.jp/qa/question_detail/q10324612100,愛知学院大学を受験する者です。 法学部と商学部それぞれ前期試験A、B、共通テストプラスを受験するのですが合格最低点を知りたいです！ また、共通テストの結果はニ教科133点でした。二時試験では何割取るこ...,0,0
2246,2026/1/24 2:47,政治、社会問題,bim********,13時間34分,8,64,8.0,0,6,0.079,12.5,0.01,0.79,あと3日,https://detail.chiebukuro.yahoo.co.jp/qa/question_detail/q14324612099,何のための選挙なんですか？ どこのマスコミも、解散理由が不明確、、、みたいに言ってます ・予算を先送り（「国民」が賛成すると言っていたのに） ・衆院1年半（まだ2年半の残余期間ある） ・750億のお金...,0,0
2247,2026/1/24 2:47,Instagram,んんん,13時間34分,1,18,18.0,0,0,0.022,5.56,0.0,0.08,あと3日,https://detail.chiebukuro.yahoo.co.jp/qa/question_detail/q13324612098,インスタグラムで愛犬のアカウントがあるのですが、他の大多数の方はフォローフォロワー共に300人以上いる印象です。 私の愛犬アカウントは現在、18投稿で10前後のいいね数、21人友達/30フォロワー/5...,0,0
2248,2026/1/24 2:46,家族関係の悩み,氏名非公開,13時間35分,9,175,19.4,0,5,0.215,5.14,0.04,0.95,あと3日,https://detail.chiebukuro.yahoo.co.jp/qa/question_detail/q12324612097,絶縁した義両親の介護問題について 話が長くなり半分愚痴も混ざりますがご了承ください。 結婚して１年の20代のものです。 義両親との関係が崩れ出したのは父の日の件からでした。 父の日のプレゼントを当日ま...,0,0
2249,2026/1/24 2:46,アニメ,jjp********,13時間35分,0,4,4.0,0,0,0.005,0.0,0.0,0.0,あと3日,https://detail.chiebukuro.yahoo.co.jp/qa/question_detail/q10324612095,ハイキューのコスモワールドのグッズは通販あると思いますか？,0,0
2250,2026/1/24 2:46,音楽,非公開,13時間35分,1,3,3.0,0,0,0.004,33.33,0.0,0.06,あと3日,https://detail.chiebukuro.yahoo.co.jp/qa/question_detail/q11324612096,嵐のtruthやmonsterのような曲が好きなのですが、このような感じの曲があれば教えてください。 嵐だけじゃなくて他のアーティストの曲で大丈夫です。,0,0
2251,2026/1/24 2:46,美容整形,acb71314d,13時間35分,0,2,2.0,0,0,0.002,0.0,0.0,0.0,あと3日,https://detail.chiebukuro.yahoo.co.jp/qa/question_detail/q14324612094,"顔の脂肪吸引について 顎下、頬、必要であればジョールをとる予定です。できるだけごっそりとって正面から見たときのライン、その次に顎下のペラさを求めています days新宿,gracia,アリエル大宮の3つ...",0,0
2252,2026/1/24 2:46,ヨガ、ピラティス,ash,13時間35分,1,10,10.0,0,0,0.012,10.0,0.0,0.07,あと3日,https://detail.chiebukuro.yahoo.co.jp/qa/question_detail/q13324612093,ホットヨガを初めて10日になります この10日間で4回通って、体重1キロ増えて体脂肪2パーセント増えました。 ヨガ後2時間は食事は控えてます。 なのになぜ体重も体脂肪も増えたのでしょうか？,0,0
