2180,2026/1/28 3:08,アルバイト、フリーター,あ,13時間13分,1,20,20.0,0,0,0.025,5.0,0.01,0.09,あと3日,https://detail.chiebukuro.yahoo.co.jp/qa/question_detail/q13324752458,金が稼ぎたい高2です 皆さんは学生の頃、月に最高なんぼ稼いだか 何をして稼いでいたか、アルバイトの場合月に 週どのぐらいシフトに入っていたか聞きたいです 定時制の高校で2月から4月までずっと休み (途...,0,0
2181,2026/1/28 3:08,恋愛相談,ade8ef6da,13時間13分,0,21,21.0,0,0,0.026,0.0,0.0,0.03,あと3日,https://detail.chiebukuro.yahoo.co.jp/qa/question_detail/q11324752456,好きな子に少し強く言い過ぎたらすぐ謝りますか？また、好きな子じゃなくてもすぐ謝りますか？ 好きな子じゃなくても謝る場合、好きな子に謝るときとの違いを教えてほしいです,0,0
2182,2026/1/28 3:08,家計、節約,aya********,13時間13分,5,67,13.4,1,3,0.084,7.46,0.01,0.64,あと3日,https://detail.chiebukuro.yahoo.co.jp/qa/question_detail/q10324752455,二人暮し、今のご時世、食費 生活費の支払いの時に同居人に一言 夜だけなのに食費高くね？もっと抑えられないの？ と言われました。 今のご時世、夜だけの食費で3万〜4万は高いですか？ 米は月1回の購入50...,0,0
2183,2026/1/28 3:07,学校の悩み,藪から棒を藪棒と略す人,13時間14分,3,18,6.0,0,0,0.023,16.67,0.0,0.21,あと3日,https://detail.chiebukuro.yahoo.co.jp/qa/question_detail/q14324752454,通信制高校の通学コースってどんな感じですかー？今はオンラインコースなんですけどちょっとだけ気になってます。,0,0
2184,2026/1/28 3:07,シニアライフ、シルバーライフ,my_********,13時間14分,6,20,3.3,0,0,0.025,30.0,0.0,0.4,あと3日,https://detail.chiebukuro.yahoo.co.jp/qa/question_detail/q13324752453,靴下やズボンを履く時、立ったままの人と座る人ではどちらが一般的でしょうか？,0,0
2185,2026/1/28 3:07,テレビ、DVD、ホームシアター,ほげほげぎえぴああああああ,13時間14分,2,21,10.5,0,0,0.026,9.52,0.0,0.15,あと3日,https://detail.chiebukuro.yahoo.co.jp/qa/question_detail/q12324752452,この動画内のテレビに写っている映像わかる人いませんか？ https://youtube.com/shorts/LCsOxadJFsk?si=PmYGAwaW2FWzEpBD,0,0
2186,2026/1/28 3:06,恋愛相談、人間関係の悩み,ID 非公開,13時間15分,2,28,14.0,0,0,0.035,7.14,0.0,0.16,あと3日,https://detail.chiebukuro.yahoo.co.jp/qa/question_detail/q10324752450,ストレートだけど同性のなんか魅力的な人に恋心を抱いたことがあるって言う人いますか？ 僕は完全にストレートなんですが、大学の同じ学科の人で同性なんだけどめっちゃ顔がタイプでスタイルも魅力的な人がいて本当...,0,0
2187,2026/1/28 3:06,音楽,あいす,13時間15分,0,7,7.0,0,0,0.009,0.0,0.0,0.01,あと3日,https://detail.chiebukuro.yahoo.co.jp/qa/question_detail/q14324752449,KAITO単体の曲とKAITOとレン2人の曲をできる限り教えてください！スノーマンや唱明者、みかぼし、Flaywayとかが好きです。明るい曲でも暗い曲でもなんでもいいです。 隠れた名曲とかが知りたいで...,0,0
2188,2026/1/28 3:06,職場の悩み,非公開,13時間15分,3,65,21.7,0,5,0.082,4.62,0.02,0.46,あと3日,https://detail.chiebukuro.yahoo.co.jp/qa/question_detail/q13324752448,年上の仕事仲間から「買ったけど着れない服があるんだけど良かったらもらってくれる？」と言われ、いただきました。 いつもいいものを着ている人なのでそこそこ値段もしたと思います。と言ってもちょっとおしゃれな...,0,0
2189,2026/1/28 3:06,特撮,a,13時間15分,1,40,40.0,0,0,0.05,2.5,0.02,0.11,不明,https://detail.chiebukuro.yahoo.co.jp/qa/question_detail/q12324752447,子供の頃ビデオで見たウルトラマンの映画が思い出せないし、検索してもでてきません。 色黒の少年達と、ウルトラマンが関わるお話だったと思うのですが… 画質も結構悪くて正確にはわからないのですが、おそらく1...,0,0
2190,2026/1/28 3:06,邦楽,知恵袋盛り上げ隊,13時間15分,10,46,4.6,0,0,0.058,21.74,0.0,0.69,あと3日,https://detail.chiebukuro.yahoo.co.jp/qa/question_detail/q11324752446,Song で思い浮かぶ曲は？,0,0
2191,2026/1/28 3:06,恋愛相談、人間関係の悩み,1559731902431,13時間15分,5,26,5.2,0,1,0.033,19.23,0.0,0.38,あと3日,https://detail.chiebukuro.yahoo.co.jp/qa/question_detail/q10324752445,人間関係についての相談です。 私にはとても仲の良い2歳下の男友達がいるのですが、その子から、「好きになったから付き合って欲しい」と言われました。異性として意識していないと思っていたのでびっくりして「本...,0,0
2192,2026/1/28 3:05,ネコ,めろ,13時間16分,0,7,7.0,0,0,0.009,0.0,0.0,0.01,あと3日,https://detail.chiebukuro.yahoo.co.jp/qa/question_detail/q14324752444,画像の赤ちゃんみたいに鳴くねこちゃんの本家様知ってる方いますか？？？(；；),0,0
2193,2026/1/28 3:05,恋愛相談、人間関係の悩み,非公開,13時間17分,3,50,16.7,0,1,0.063,6.0,0.01,0.29,あと3日,https://detail.chiebukuro.yahoo.co.jp/qa/question_detail/q13324752443,至急 いま横に彼女がいるんですが、勉強がうまくいかないらしくイライラしてます たまに当たられます 明日のテストがやばいらしく、オールで勉強するらしいです 一緒におきててって言われたので起きてるんですが...,0,0
2194,2026/1/28 3:05,避妊,1150495081,13時間17分,4,48,12.0,0,2,0.06,8.33,0.01,0.39,あと3日,https://detail.chiebukuro.yahoo.co.jp/qa/question_detail/q12324752442,大至急 低用量ピルを飲んでいればほぼ確実に妊娠することはないですか？ 1時間飲むのが遅れたりしちゃいますが、2時間以上遅れたことはありません 毎日しっかり飲んでいます。 始めて10日くらいです。,0,0
2195,2026/1/28 3:05,病気、症状,maj********,13時間17分,2,12,6.0,0,0,0.015,16.67,0.0,0.14,あと3日,https://detail.chiebukuro.yahoo.co.jp/qa/question_detail/q11324752441,夜にご飯を食べまくってしまい激しい運動をしてしまい お菓子を食べて 気持ち悪いので胃薬飲んで湯船入ったら 吐いてしまいました これは吐いて当たり前の行動ですか？,0,0
2196,2026/1/28 3:05,芸能人,1252925111,13時間17分,0,2,2.0,0,0,0.003,0.0,0.0,0.0,あと3日,https://detail.chiebukuro.yahoo.co.jp/qa/question_detail/q14324752439,真空ジェシカのまーちゃんごめんねのネタが入っているネタを教えてください,0,0
2197,2026/1/28 3:05,オンラインゲーム,wow********,13時間17分,1,68,68.0,0,2,0.085,1.47,0.06,0.22,不明,https://detail.chiebukuro.yahoo.co.jp/qa/question_detail/q10324752440,スプラトゥーン初心者です https://youtube.com/shorts/pyCia0tGqyE?si=PZjNIWPGsBiyRsXP この動画って慣性キャンセルできてますかね？これ上手くなれ...,0,0
2198,2026/1/28 3:04,職場の悩み,ひ,13時間18分,3,34,11.3,0,0,0.043,8.82,0.0,0.23,あと3日,https://detail.chiebukuro.yahoo.co.jp/qa/question_detail/q13324752438,①日頃からブツブツと文句を言う人 ②普段は言いたいことを我慢しつつ文句も何も言わずに働くけど、辞める時に怒りや不満を一気に爆発させる人 どっちがめんどくさいですか？,0,0
2199,2026/1/28 3:04,転職,bd3059917,13時間18分,0,4,4.0,0,0,0.005,0.0,0.0,0.01,あと3日,https://detail.chiebukuro.yahoo.co.jp/qa/question_detail/q12324752437,マイナビスカイディングのスカウト型転職サイトを利用した経験のある方がいましたら、以下の点についてご回答をお願いいたします！ ・転職前後の年収額の推移（転職前：年収600万円→転職後：年収750万円など...,0,0
2200,2026/1/28 3:04,インターネット接続,1153096365,13時間18分,3,59,19.7,0,0,0.074,5.08,0.01,0.26,不明,https://detail.chiebukuro.yahoo.co.jp/qa/question_detail/q11324752436,ルーターについて質問です。 ホームゲートウェイ（ドコモ光とくとくBBでRX600-mi）を使用しているのですが 二重ルーターにならないようにルーター（WG2600HS2）をブリッジモードにした所、 何...,0,0
2201,2026/1/28 3:04,コミック,oew********,13時間18分,1,28,28.0,0,0,0.035,3.57,0.01,0.1,あと3日,https://detail.chiebukuro.yahoo.co.jp/qa/question_detail/q10324752435,呪術廻戦、なぜジョウゴは宿儺と対面した時に「貴様」などと言ったのですか?,0,0
2202,2026/1/28 3:04,ご近所の悩み,kuh********,13時間18分,7,105,15.0,0,2,0.131,6.67,0.02,0.64,あと3日,https://detail.chiebukuro.yahoo.co.jp/qa/question_detail/q14324752434,隣人トラブル？についてです。 私はマンションに住んでいるのですが、集合ポストに名前や住所の記載のない封筒が入っていました。中を確認するととても汚い字で書いてあったため、全て解読することは不可能でしたが...,0,0
2203,2026/1/28 3:04,ダイエット,a35afc7aa,13時間18分,6,38,6.3,1,0,0.048,15.79,0.0,0.55,あと3日,https://detail.chiebukuro.yahoo.co.jp/qa/question_detail/q13324752433,お菓子を控えて週に1回だけ食べる様にしています この方法で結構痩せて来ました。 ダイエット成功の方法は3食バランス良くきちんと摂取して、間食を控えて、運動して、これで痩せますか？,0,0
2204,2026/1/28 3:04,菓子、スイーツ,c42a916d7,13時間18分,1,9,9.0,0,0,0.011,11.11,0.0,0.07,あと3日,https://detail.chiebukuro.yahoo.co.jp/qa/question_detail/q12324752432,1番好きなお菓子じゃがりこって人いませんか？,0,0
2205,2026/1/28 3:04,友人関係の悩み,1153212756,13時間18分,0,11,11.0,0,0,0.014,0.0,0.0,0.01,あと3日,https://detail.chiebukuro.yahoo.co.jp/qa/question_detail/q11324752431,男友達に誕プレを貰ったのでお礼も兼ねてバレンタイン辺りにお菓子+何かを贈りたいのですが、何が良いでしょうか。 大学生なので3000~5000位で考えてます。 ブランドとかにもそこそこ興味があるっぽいの...,0,0
2206,2026/1/28 3:03,美容整形,a22db6b62,13時間19分,0,4,4.0,0,0,0.005,0.0,0.0,0.0,あと3日,https://detail.chiebukuro.yahoo.co.jp/qa/question_detail/q10324752430,湘南美容外科って何であんなに安いんですか？,0,0
2207,2026/1/28 3:03,生き方、人生相談,b,13時間19分,2,19,9.5,0,0,0.024,10.53,0.0,0.15,あと3日,https://detail.chiebukuro.yahoo.co.jp/qa/question_detail/q14324752429,勉強や仕事で、要領が良い人・悪い人の特徴を教えてください。,0,0
2208,2026/1/28 3:03,ゲーム,lD非公開,13時間20分,1,21,21.0,0,0,0.026,4.76,0.01,0.09,あと3日,https://detail.chiebukuro.yahoo.co.jp/qa/question_detail/q13324752428,最近よく見てるTFTツイッチ配信者の配信見てたら唐突に(そういやこれ貰ったからみんなにもあげる！ )と配信チャットにコード5つほど貼り付けてて、急いでLOL開いてコピペしたけど当然全て先に取られてまし...,0,0
2209,2026/1/28 3:03,携帯型ゲーム全般,先生だいすき,13時間20分,3,47,15.7,0,2,0.059,6.38,0.01,0.32,あと3日,https://detail.chiebukuro.yahoo.co.jp/qa/question_detail/q12324752427,iPadでアークナイツ:エンドフィールドを開こうとするとゲームが始まる前に強制終了してしまいアプリが落とされてしまいます。 使ってる端末は iPad Pro(10.5インチ)で最新ver17.7.10...,0,0
2210,2026/1/28 3:03,派遣,kau********,13時間20分,2,19,9.5,0,0,0.024,10.53,0.0,0.15,あと3日,https://detail.chiebukuro.yahoo.co.jp/qa/question_detail/q11324752426,辞める会社にて一部継続して仕事を請け負う形式について 今の嘱託社員を退職して、派遣エンジニアに戻ろうかと思います。前職の仕事を一部受託して継続する際、どのような方法がありますでしょうか。 個人事業主と...,0,0
2211,2026/1/28 3:03,テーマパーク,なな,13時間20分,1,22,22.0,0,0,0.027,4.55,0.01,0.09,あと3日,https://detail.chiebukuro.yahoo.co.jp/qa/question_detail/q10324752425,今度、ミニファンを見に行きます！ 日曜に行くんですけど、3rdのフロート3辺りを取りたいと思っています。座って鑑賞したいのと、できるだけ前の方で座りたいとの事だったので何時間前に並び始めるのがベストで...,0,0
2212,2026/1/28 3:03,音楽,1052990101,13時間20分,1,37,37.0,1,1,0.046,2.7,0.02,0.27,あと3日,https://detail.chiebukuro.yahoo.co.jp/qa/question_detail/q13324752423,あるピアノ曲の曲名を知りたいです。 てーんてーんてれれーててーん という感じで始まります。素朴で静かでのどかな感じの曲調です。 自分のピアノで弾いてみてピンときた音階を上の旋律に当てはめると、 てーん...,0,0
2213,2026/1/28 3:03,国民健康保険,なー,13時間20分,1,18,18.0,0,0,0.022,5.56,0.0,0.08,あと3日,https://detail.chiebukuro.yahoo.co.jp/qa/question_detail/q14324752424,明日、国民保険加入の手続きをしに行こうとしてるんですが私が加入したい場合でも世代主（父親）の個人番号は記入しなければいけないんですか？ 詳しい方いましたら回答お願いします。,0,0
2214,2026/1/28 3:03,トレーニング,my_********,13時間20分,3,20,6.7,0,0,0.025,15.0,0.0,0.21,あと3日,https://detail.chiebukuro.yahoo.co.jp/qa/question_detail/q12324752422,腕立て伏せ20回×3セットやる場合、合間にはどんな筋トレを挟むのが良いでしょうか？,0,0
2215,2026/1/28 3:03,株式,柿,13時間20分,2,99,49.5,0,0,0.124,2.02,0.06,0.25,あと3日,https://detail.chiebukuro.yahoo.co.jp/qa/question_detail/q11324752421,株の配当金受け取りについて、助けてください、、 私は5年ほど前にSBI証券に軽い気持ちでポイントで株を買うことを初め、放置していました。 その後全く気にかけていなかったのですがこれまで配当金が載った用...,0,0
2216,2026/1/28 3:02,賃貸物件,lnv********,13時間21分,4,43,10.8,0,0,0.054,9.3,0.01,0.3,あと3日,https://detail.chiebukuro.yahoo.co.jp/qa/question_detail/q10324752420,4月から市の保育士の借り上げ社宅制度を利用するために物件探しを行おうとしていますが、何点か質問があります。 私は債務整理中であり、保育園側の名義で借りることはできますが、保証会社を利用する場合は自己負...,0,0
2217,2026/1/28 3:02,中古車,dai********,13時間21分,2,33,16.5,0,0,0.041,6.06,0.01,0.17,あと3日,https://detail.chiebukuro.yahoo.co.jp/qa/question_detail/q14324752419,50年以上前の車のサイドブレーキの故障について質問 よく言うステッキ式のサイドブレーキです 50年前のアメ車なのですが、しばらく乗ってなかったらブレーキ解除できなくなりました 引っ張ってもスカッと抜け...,0,0
2218,2026/1/28 3:02,生き方、人生相談,zua********,13時間21分,2,26,13.0,0,0,0.032,7.69,0.0,0.16,あと3日,https://detail.chiebukuro.yahoo.co.jp/qa/question_detail/q11324752416,人の上に立ってる人間は、腰が低いですね？,0,0
2220,2026/1/28 3:02,コスメ、美容,cd7e55f0c,13時間21分,1,26,26.0,0,0,0.032,3.85,0.01,0.09,あと3日,https://detail.chiebukuro.yahoo.co.jp/qa/question_detail/q14324752414,まつ毛パーマをやめたいです。 8月の初めにかけたのを最後にもう5ヶ月以上はかけてないのですが、まつ毛がずっとばらばらです。調べたら3ヶ月ほどで元に戻ると言われてるのがほとんどなのですが、いまだに上がっ...,0,0
2221,2026/1/28 3:02,学校の悩み,yahoo user,13時間21分,1,30,30.0,0,0,0.037,3.33,0.01,0.1,あと3日,https://detail.chiebukuro.yahoo.co.jp/qa/question_detail/q13324752413,数ヶ月後卒業式がある中３です。自分は中三になってから部活をやめているのですが、その時全て副顧問を介してやめているので顧問とは一言も喋っていない状態です。 自分は元々持病の関係で不登校で、練習も非常に遅...,0,0
2222,2026/1/28 3:02,邦楽,非公開,13時間21分,0,9,9.0,0,0,0.011,0.0,0.0,0.01,あと3日,https://detail.chiebukuro.yahoo.co.jp/qa/question_detail/q14324648494,"B'zの「The Best ""Pleasure""』『The Best ""Treasure""』 どちらの方が好きですか？",0,0
2223,2026/1/28 3:02,トレーディングカード,usu********,13時間21分,0,9,9.0,0,0,0.011,0.0,0.0,0.01,あと3日,https://detail.chiebukuro.yahoo.co.jp/qa/question_detail/q14324648614,コイン100枚です！ ファミリアとフェイラーのコラボ商品について質問です！ ファミリアから出ている大きい方のマルチケースをフリマアプリにて購入したのですが、中身（仕様）の写真が調べても出てこない（ファ...,0,0
2224,2026/1/28 3:02,邦楽,非公開,13時間21分,0,8,8.0,0,0,0.01,0.0,0.0,0.01,あと3日,https://detail.chiebukuro.yahoo.co.jp/qa/question_detail/q14324648509,L'Arc〜en〜Cielの『Ark』と『Ray』ならどっち派でしょうか？,0,0
2225,2026/1/28 3:02,X（旧Twitter）,erc********,13時間21分,0,18,18.0,0,0,0.022,0.0,0.0,0.02,あと3日,https://detail.chiebukuro.yahoo.co.jp/qa/question_detail/q14324648439,Xの過去のユーザー名を検索するサイトは無くなったのですか？ 1名懸賞垢にブロックされてたのですが、転生か気になりましたが、検索サイトが出てきませんでした。 私がブロックされる理由があるとすれば、たまに...,0,0
2226,2026/1/28 3:02,恋愛相談、人間関係の悩み,1253036453,13時間22分,2,66,33.0,0,0,0.082,3.03,0.03,0.21,あと3日,https://detail.chiebukuro.yahoo.co.jp/qa/question_detail/q14324648454,自分はバイセクシュアルだと思っています。 相手によって自分の雰囲気や立ち位置が変わり、ある人にはリードするタイプ、別の人にはリードされるタイプになります。 見た目も「かっこいい」と「かわいい」の両方を...,0,0
2227,2026/1/28 3:02,クレジットカード,osa********,13時間22分,1,50,50.0,0,1,0.062,2.0,0.03,0.16,不明,https://detail.chiebukuro.yahoo.co.jp/qa/question_detail/q14324648264,AppStoreで支払い方法にPayPayを追加しました。 その後しっかり残高なども確認をしてから、アプリ内購入をしたら、カードで支払っていたサブスクの料金(１個のみ)まで一緒にPayPayから引かれ...,0,0
2228,2026/1/28 3:02,大学受験,a122c0b37,13時間22分,0,93,93.0,0,0,0.116,0.0,0.0,0.12,あと3日,https://detail.chiebukuro.yahoo.co.jp/qa/question_detail/q14324648234,今年、岡山県の新見公立大学の地域福祉学科を受験するのですが、赤本がなく、面接でどういったことが聞かれるのかわからないので少しでも情報を知っている方は教えてくださると助かります 追伸:看護学科で過去にあ...,0,0
2229,2026/1/28 3:02,ライブ、コンサート,1150854891,13時間22分,0,15,15.0,1,0,0.019,0.0,0.0,0.14,あと3日,https://detail.chiebukuro.yahoo.co.jp/qa/question_detail/q14324648229,きゅるしてファンの方に質問です。 最近、きゅるしてのことを好きになったのですがチェキ会などのイベントは対象商品をどのくらい買えば当選するのでしょうか。普段は坂道界隈にいる身なので全くどんな界隈なのか分...,0,0
2230,2026/1/28 3:02,香水,わー,13時間22分,1,11,11.0,0,0,0.014,9.09,0.0,0.08,あと3日,https://detail.chiebukuro.yahoo.co.jp/qa/question_detail/q14324648184,AUX PARADISのFleurという香水の匂いに似た持続性のある香水を探しています。 どなたか詳しい方商品等教えていただきたいです。,0,0
2231,2026/1/28 3:02,ライブ、コンサート,winterwinter,13時間22分,0,45,45.0,0,0,0.056,0.0,0.0,0.06,あと3日,https://detail.chiebukuro.yahoo.co.jp/qa/question_detail/q14324648039,ローチケ 先着 一般販売について 発売開始前はどのページで待機ですか？ 先着勝ち取りたいのでコツ教えてください。,0,0
2232,2026/1/28 3:02,ライブ、コンサート,お,13時間22分,0,36,36.0,1,0,0.045,0.0,0.0,0.17,あと3日,https://detail.chiebukuro.yahoo.co.jp/qa/question_detail/q14324648069,Fruits ZipperおよびKawaii Labの有料会員のブラックリストについて質問です。 2月にKアリーナ横浜で行われるKawaii Lab. Sessionに友人とお互い別日に応募し両日当選...,0,0
2233,2026/1/28 3:02,洗濯、クリーニング,48542,13時間22分,2,17,8.5,0,0,0.021,11.76,0.0,0.15,あと3日,https://detail.chiebukuro.yahoo.co.jp/qa/question_detail/q14324647994,自分の好きなブランドのshareefの画像のような白シャツを買いました。そこで、襟元の黄ばみやシワ等をなるべくつけないようにするには、基本的にどうやって、どのくらいの頻度で洗濯すればいいですかね？ 最...,0,0
2235,2026/1/28 3:02,専門学校、職業訓練,c1dd7578a,13時間22分,0,22,22.0,0,0,0.027,0.0,0.0,0.03,あと3日,https://detail.chiebukuro.yahoo.co.jp/qa/question_detail/q14324647959,東京電子専門学校の情報処理科の一般入試に共テがダメだった時ように出願しようと思ったのですが、選抜方法が書類選考としか書かれておらず具体的に何をすればいいのか分かりません…資料もまだ届かなくて、 専門だ...,0,0
2236,2026/1/28 3:02,ゲーム,yut********,13時間22分,0,21,21.0,0,0,0.026,0.0,0.0,0.03,あと3日,https://detail.chiebukuro.yahoo.co.jp/qa/question_detail/q14324647949,Switch2に関して、スピーカーをBluetooth接続した場合は無線のコントローラーが2個までしか接続できない（有線から3個以上も可）とのことですが、 これはスピーカーをUSB端子で有線接続した場...,0,0
2237,2026/1/28 3:02,恋愛相談、人間関係の悩み,wqm********,13時間22分,1,54,54.0,1,0,0.067,1.85,0.04,0.25,あと3日,https://detail.chiebukuro.yahoo.co.jp/qa/question_detail/q13324648488,私は人と距離を置くことによって傷つかないようにしていることに最近気付きました。 元々孤独体質？で、子供の頃とかも愛されてる感覚が無くて、求めるがあまりちょっと攻撃的な言葉を使って突き放してみたり、｢ど...,0,0
2238,2026/1/28 3:02,恋愛相談、人間関係の悩み,ten********,13時間22分,0,18,18.0,0,0,0.022,0.0,0.0,0.02,あと3日,https://detail.chiebukuro.yahoo.co.jp/qa/question_detail/q13324648423,20代大学生です。 マチアプでしばらく話してる人がいるのですが、何かと褒めてくれたり(内面・言動的なところ？)、電話とかも楽しいとかいってくれたりして、顔合わせ(初回デート)も相手から誘ってくれました...,0,0
2239,2026/1/28 3:02,パズルゲーム,1051675633,13時間22分,0,368,368.0,0,0,0.458,0.0,0.0,0.46,あと3日,https://detail.chiebukuro.yahoo.co.jp/qa/question_detail/q13324648458,今のラインハルトのテンプレってスター入りかコラボ染めどっちが強いん？,0,0
2240,2026/1/28 3:02,邦楽,非公開,13時間22分,0,4,4.0,0,0,0.005,0.0,0.0,0.0,あと3日,https://detail.chiebukuro.yahoo.co.jp/qa/question_detail/q13324648463,L'Arc〜en〜Ciel のアルバム rayとaskどちらが好きですか？？,0,0
2241,2026/1/28 3:02,アニメ,James1950s,13時間22分,1,5,5.0,0,0,0.006,20.0,0.0,0.07,あと3日,https://detail.chiebukuro.yahoo.co.jp/qa/question_detail/q13324648078,GO！GO！アトムというアニメはフランスのアニメですか?,0,0
2242,2026/1/28 3:02,国内,非公開,13時間23分,2,21,10.5,0,1,0.026,9.52,0.0,0.19,あと3日,https://detail.chiebukuro.yahoo.co.jp/qa/question_detail/q13324648233,高知市って住みやすいですか？,0,0
2243,2026/1/28 3:02,ゲーム,U,13時間23分,0,23,23.0,0,0,0.029,0.0,0.0,0.03,あと3日,https://detail.chiebukuro.yahoo.co.jp/qa/question_detail/q13324648218,イナズマイレブンVで、○○ビルドが出やすいキャラの検索ができるサイトとかって存在しますか？,0,0
2244,2026/1/28 3:02,大学受験,非公開,13時間23分,2,56,28.0,0,0,0.07,3.57,0.02,0.19,あと3日,https://detail.chiebukuro.yahoo.co.jp/qa/question_detail/q13324648378,山梨県立大学と青山学院大学、共に合格出来たとしたらどちらに進学しますか？,0,0
2245,2026/1/28 3:02,芸能人,えんじいろ,13時間23分,0,100,100.0,0,0,0.124,0.0,0.0,0.12,あと3日,https://detail.chiebukuro.yahoo.co.jp/qa/question_detail/q13324648403,この人が誰か教えてください,0,0
2246,2026/1/28 3:02,バイク,c9103590d,13時間23分,1,31,31.0,0,0,0.039,3.23,0.01,0.1,あと3日,https://detail.chiebukuro.yahoo.co.jp/qa/question_detail/q13324648288,ゼファーχにサイドバッグをつけたいのですが専用のサポートが見つかりません。 皆さんはどのように取り付けましたか？,0,0
