1483,2026/1/26 19:12,バンド,あい,7時間18分,5,47,9.4,0,5,0.107,10.64,0.01,1.02,あと3日,https://detail.chiebukuro.yahoo.co.jp/qa/question_detail/q11324704731,軽音楽部のみなさんへ質問です。 次年度から軽音学部の部長を務める予定なのですが、今の軽音学部の現状が部活として破綻しており、これから改革していきたいと思っています。 現状は、新入生が部活に入ってきたら...,0,0
1484,2026/1/26 19:12,占い,Mya,7時間18分,0,6,6.0,0,0,0.014,0.0,0.0,0.01,あと3日,https://detail.chiebukuro.yahoo.co.jp/qa/question_detail/q10324704730,恋愛を占って下さい タロット希望ですが、良いものがあれば種類は問いません,0,0
1485,2026/1/26 19:12,大学受験,非表示,7時間18分,0,6,6.0,0,0,0.014,0.0,0.0,0.01,あと3日,https://detail.chiebukuro.yahoo.co.jp/qa/question_detail/q14324704729,今年高３になる者です。高３になるまでに国数英の基礎を完璧に固めておきたいです。各科目の基礎を完璧に固める方法や参考書などをしっている方がいれば教えて欲しいです。 今やっているのは数学は青チャ、英語はシ...,0,0
1486,2026/1/26 19:12,日用品、生活雑貨,bf3d594ff,7時間18分,0,2,2.0,0,0,0.005,0.0,0.0,0.0,あと3日,https://detail.chiebukuro.yahoo.co.jp/qa/question_detail/q11324704726,こちらBRAUN製ガスライターだそうですが、これの概要がどこにも載っておらずどれほどの価値のものなのかわからないのですがどなたか詳しいことを知っている方居ませんか？,0,0
1487,2026/1/26 19:12,Windows 10,k00********,7時間18分,1,10,10.0,0,0,0.023,10.0,0.0,0.14,あと3日,https://detail.chiebukuro.yahoo.co.jp/qa/question_detail/q13324704728,Windows11pro 25H2 質問１ ｴｸｽﾌﾟﾛｰﾗ-ﾌｫﾙﾀﾞ ｽﾀｰﾄにピン止されているﾌｫﾙﾀﾞ青い帯がついている 青い帯を外す方法を教えて下さい 質問２ プログラム内ｴｸｽﾌﾟﾛｰﾗｰ...,0,0
1488,2026/1/26 19:12,恋愛相談、人間関係の悩み,非公開,7時間18分,5,34,6.8,0,3,0.077,14.71,0.01,0.85,あと3日,https://detail.chiebukuro.yahoo.co.jp/qa/question_detail/q12324704727,なんで男の人って自分から振らないの？,0,0
1489,2026/1/26 19:12,ライブ、コンサート,xgc********,7時間18分,0,12,12.0,0,0,0.027,0.0,0.0,0.03,あと3日,https://detail.chiebukuro.yahoo.co.jp/qa/question_detail/q13324704723,ちゃんみなのAOD4のライブに行くのですが、ペンライトの販売はまだでしょうか 2/7がライブなのに遅いなと思って、、,0,0
1490,2026/1/26 19:12,インターネット接続,1150885151,7時間19分,0,0,0.0,0,0,0.0,0.0,0.0,0.0,あと3日,https://detail.chiebukuro.yahoo.co.jp/qa/question_detail/q10324704725,ネトフリについて ネトフリみていてカクカクしたり途切れたりしませんか？ すごいすとれすで。。 考えられる原因と対処法教えてほしいです。 WiFiを切っても途切れます。,0,0
1491,2026/1/26 19:12,アニメ,古い曲×イメソン,7時間19分,0,12,12.0,0,0,0.027,0.0,0.0,0.03,あと3日,https://detail.chiebukuro.yahoo.co.jp/qa/question_detail/q14324704724,何故L'Arc〜en〜Cielがハンターハンターの主題歌をやってないのですか? 世界観合いますよね?,0,0
1492,2026/1/26 19:12,ゲーム,ヤマト,7時間19分,2,13,6.5,0,0,0.03,15.38,0.0,0.26,あと3日,https://detail.chiebukuro.yahoo.co.jp/qa/question_detail/q12324704722,Forza Horizon 6つてグラセフみたいなゲームではなくただのレーシングゲームなんでしょうか？,0,0
1493,2026/1/26 19:12,貯金,t19********,7時間19分,2,25,12.5,1,1,0.057,8.0,0.01,0.58,不明,https://detail.chiebukuro.yahoo.co.jp/qa/question_detail/q11324704721,ゆうちょの振替口座と振替預金って違いますか？ 振替口座は、通帳を持たない口座で振り込んだお金は、ゆうちょが破綻しても全額保証の対象ですが、振替預金は、定期、普通預金の合計が2600万円を超えて預金する...,0,0
1494,2026/1/26 19:12,スロット,gfx********,7時間19分,2,34,17.0,0,1,0.077,5.88,0.01,0.37,あと3日,https://detail.chiebukuro.yahoo.co.jp/qa/question_detail/q10324704720,沖ドキDUOアンコールで質問なんですが、確定役でフリーズして超ドキにいったのですが、6連で終わりました。終了画面の示唆も特になかったので32ゲーム即やめでよかったですかね？,0,0
1495,2026/1/26 19:12,釣り,c44030621,7時間19分,3,25,8.3,0,0,0.057,12.0,0.0,0.4,あと3日,https://detail.chiebukuro.yahoo.co.jp/qa/question_detail/q14324704719,沼津市周辺で釣りができるスポットはありますか？できるだけ駅から近くて初心者でも行きやすい場所がいいです。 可能であればおすすめの仕掛けやどんな魚が釣れるかも教えて欲しいです。,0,0
1496,2026/1/26 19:12,大学,c4b10f8ec,7時間19分,0,21,21.0,0,0,0.048,0.0,0.0,0.05,あと3日,https://detail.chiebukuro.yahoo.co.jp/qa/question_detail/q13324704718,今年から寮に入る女子大学生です 寮の経験がある女性の方 教えてください(；；) 風呂は共同らしく、自分の部屋には無いそうです。 そこで質問なんですが、毛の処理はどこでしましたか？あと生理の時はどうして...,0,0
1497,2026/1/26 19:12,レディース腕時計、アクセサリー,あはう,7時間19分,1,11,11.0,0,0,0.025,9.09,0.0,0.14,あと3日,https://detail.chiebukuro.yahoo.co.jp/qa/question_detail/q12324704717,写真のような紐とチェーンがいっしょになっているブレスレットって何と呼べばいいのでしょうか？,0,0
1499,2026/1/26 19:11,子育ての悩み,shi********,7時間20分,0,8,8.0,0,0,0.018,0.0,0.0,0.02,あと3日,https://detail.chiebukuro.yahoo.co.jp/qa/question_detail/q13324704713,4歳7ヶ月と1歳7ヶ月の子供二人います。 下の子のイヤイヤ期が凄いイライラします。 仕事はストレス抱えても給料貰えるから良しって思えてたけど 育児はストレス抱える上に無賃だしなーんも生産性無くて本当に...,0,0
1500,2026/1/26 19:11,バラエティ、お笑い,少年の夢,7時間20分,5,183,36.6,0,22,0.415,2.73,0.15,2.47,あと3日,https://detail.chiebukuro.yahoo.co.jp/qa/question_detail/q12324704712,ナイトスクープの一件ですが正義の暴走になってませんか？ そもそも番組に依頼送ったのは長男だし 家族みんな楽しみにしてたんですよね放送 なぜか長男の気持ちを勝手に代弁してる視聴者多いし,0,0
1501,2026/1/26 19:11,英語,cc30e6e48,7時間20分,4,42,10.5,0,1,0.095,9.52,0.01,0.62,不明,https://detail.chiebukuro.yahoo.co.jp/qa/question_detail/q10324704710,中学英語です。 （英語で彼女と話しました）という文では I talked in English to her.は正解ですか？,0,0
1502,2026/1/26 19:11,自転車、サイクリング,wtw********,7時間20分,3,21,7.0,0,0,0.048,14.29,0.0,0.39,あと3日,https://detail.chiebukuro.yahoo.co.jp/qa/question_detail/q14324704709,自転車通行可の歩道を自転車で漕ぐ場合は車道寄りを徐行で漕げますよね?車道があって歩道があってその隣に車道か歩道か分からない道の所は左側通行ですか？それとも車道寄りで右側ですか？,0,0
1503,2026/1/26 19:11,ゲーム,a768483ad,7時間20分,0,3,3.0,0,0,0.007,0.0,0.0,0.01,あと3日,https://detail.chiebukuro.yahoo.co.jp/qa/question_detail/q13324704708,LOLの移動カーソル押した時に赤色のエフェクトが出て、ミニオンと相手チャンピオンに勝手にAAされてその後操作出来なくなるんですけどどうやったらなおりますか？ 通常時が緑で勝手にAAされて操作ができなく...,0,0
1504,2026/1/26 19:11,大学受験,まーちゃんまーちゃん,7時間20分,4,59,14.8,0,0,0.134,6.78,0.02,0.59,あと3日,https://detail.chiebukuro.yahoo.co.jp/qa/question_detail/q11324704706,学歴について 最近学歴の就職面での有利さを調べてみていたのですが実施のところ地方国公立と旧帝くらいの差がなければ結局のところどの大学に行こうとそこや院での頑張り、 研究成果次第という意見が大半だったの...,0,0
1505,2026/1/26 19:11,文学、古典,c8b7b87ee,7時間20分,1,3,3.0,0,0,0.007,33.33,0.0,0.12,あと3日,https://detail.chiebukuro.yahoo.co.jp/qa/question_detail/q12324704707,｢心憂く、あひ思さぬなり」の現代語訳と品詞分解教えてください。 この｢なり｣がなんなのかわからないです,0,0
1506,2026/1/26 19:11,高校数学,1152487419,7時間20分,4,43,10.8,0,0,0.098,9.3,0.01,0.55,あと3日,https://detail.chiebukuro.yahoo.co.jp/qa/question_detail/q13324704703,この問題の1/2n(2n+2)の分母の差は2だから1/2になるはずなのになぜ1/4と表されているのか分かりません。,0,0
1507,2026/1/26 19:11,日本史,ba7643eba,7時間21分,2,23,11.5,0,1,0.052,8.7,0.01,0.35,あと3日,https://detail.chiebukuro.yahoo.co.jp/qa/question_detail/q14324704704,何故最近では、豊臣秀吉が明るく陽気なヒーローから、ダークなサイコパスと言われることが多くなったのですか？,0,0
1508,2026/1/26 19:11,政治、社会問題,panda_copanda,7時間21分,2,39,19.5,0,0,0.088,5.13,0.02,0.31,あと3日,https://detail.chiebukuro.yahoo.co.jp/qa/question_detail/q10324704705,人生で初めて選挙に行きます。参政党に投票しようと思っているのですが、下記のサイトを見たところ東京ブロックに参政党の名前がありません。これはどういうことでしょうか？参政党には投票できないのですか？ ht...,0,0
1509,2026/1/26 19:11,iPhone,shi********,7時間21分,3,34,11.3,0,0,0.077,8.82,0.01,0.42,あと3日,https://detail.chiebukuro.yahoo.co.jp/qa/question_detail/q12324704702,SIMが入っていないiPhoneに電話が着信します。 iPhoneを3年前に7から14へ買い替えたのですが、14に着信があると同時にSIMが入っていない7の方にも着信が来ます。 何故こんなことが起こる...,0,0
1510,2026/1/26 19:11,政治、社会問題,ID公開,7時間21分,1,13,13.0,0,0,0.029,7.69,0.0,0.14,あと3日,https://detail.chiebukuro.yahoo.co.jp/qa/question_detail/q11324704701,チンピラや不良の後ろには反社が控えてますか？,0,0
1511,2026/1/26 19:11,病気、症状,k8qf3wz1m,7時間21分,0,13,13.0,0,0,0.029,0.0,0.0,0.03,あと3日,https://detail.chiebukuro.yahoo.co.jp/qa/question_detail/q10324704700,これはストレートネックだと思いますか？ ストレートネックじゃなかったらこんなコブないですか？,0,0
1512,2026/1/26 19:11,大学受験,bd47314d,7時間21分,0,24,24.0,0,0,0.054,0.0,0.0,0.05,あと3日,https://detail.chiebukuro.yahoo.co.jp/qa/question_detail/q14324704699,東京家政学院大学の一般入試1期2科目で英語と数学を受験しました。 大体どのくらい点数があったら合格しますか？ 自己採点をなんとなくChatGPTとしたのですが6割ちょっとで合格できるか不安です。 明日...,0,0
1514,2026/1/26 19:11,高校受験,b6ed32e3e,7時間21分,1,38,38.0,0,2,0.086,2.63,0.03,0.33,あと3日,https://detail.chiebukuro.yahoo.co.jp/qa/question_detail/q12324704697,明日受験があるんですけど…!! 今日受験者を確認したところ専願だけで志願者が1000人ほどいました。私が受ける高校は、専願、前期、後期全て合わせて募集人数が700人なのに… 私の偏差値は58で、私が志...,0,0
1515,2026/1/26 19:11,大学受験,aa4029750,7時間21分,0,24,24.0,0,0,0.054,0.0,0.0,0.05,あと3日,https://detail.chiebukuro.yahoo.co.jp/qa/question_detail/q11324704696,早稲田大学スポーツ科学部に共テ＋競技歴方式で出願した者です。 共テは81%で、河合塾のボーダーラインが去年より下がったこともありリサーチでは河合A、駿台ベネッセBでした。 私はクラブチームでサッカーを...,0,0
1516,2026/1/26 19:11,英語,つなまよおにぎり,7時間21分,1,86,86.0,0,0,0.195,1.16,0.17,0.31,あと3日,https://detail.chiebukuro.yahoo.co.jp/qa/question_detail/q10324704695,高校二年生です。先日、英検準2級を初めて受けました。英検を受ける1週間前に大好きな親戚が亡くなり、落ち込んでしまったこともあって、1週間しか勉強する時間を取れませんでした。 試験が終わって、ChatG...,0,0
1517,2026/1/26 19:11,生き方、人生相談,チェリアン,7時間21分,0,1,1.0,0,0,0.002,0.0,0.0,0.0,あと3日,https://detail.chiebukuro.yahoo.co.jp/qa/question_detail/q14324704694,寝てる間に自分の手が勝手にラップバトルを始めそうです。止める方法ってありますか？,0,0
1518,2026/1/26 19:11,料理、食材,wgd********,7時間21分,1,28,28.0,0,0,0.063,3.57,0.02,0.18,あと3日,https://detail.chiebukuro.yahoo.co.jp/qa/question_detail/q13324704693,餃子は見た目三日月というかクロワッサンのような見た目ですが 月餅のようなまんまるな餃子は無いのですか？ 餃子とは言わない？,0,0
1519,2026/1/26 19:11,懸賞、くじ,☆,7時間21分,0,3,3.0,0,0,0.007,0.0,0.0,0.01,あと3日,https://detail.chiebukuro.yahoo.co.jp/qa/question_detail/q12324704692,Xでシリアルコード買い取って応募完了したのですが、さすがにサイト偽造、シリアル偽造は無理なので本物ですよね、？ 他の人より安く譲り出てたので、不安なってきました,0,0
1520,2026/1/26 19:11,政治、社会問題,竜神,7時間21分,3,27,9.0,0,9,0.061,11.11,0.01,1.01,あと3日,https://detail.chiebukuro.yahoo.co.jp/qa/question_detail/q11324704691,高市早苗さんの笑顔より 川村たかしさんの笑顔が好きな私は、おかしいですか? 自民党 減税日本ゆうこく,0,0
1521,2026/1/26 19:11,職場の悩み,非公開,7時間21分,3,36,12.0,0,1,0.081,8.33,0.01,0.49,あと3日,https://detail.chiebukuro.yahoo.co.jp/qa/question_detail/q14324704689,24女です。 仕事で理不尽にお客さんに怒られてトイレで泣いてしまいました。 おじさんの声がトラウマになりそうです。 忘れる方法はありますか。,0,0
1522,2026/1/26 19:11,公務員試験,1252916966,7時間21分,1,12,12.0,0,0,0.027,8.33,0.0,0.14,あと3日,https://detail.chiebukuro.yahoo.co.jp/qa/question_detail/q13324704688,税関職員はカラコン、メイクはしてはいけないのですか？,0,0
1523,2026/1/26 19:11,携帯型ゲーム全般,b6ef0f635,7時間22分,1,51,51.0,0,0,0.115,1.96,0.06,0.23,あと3日,https://detail.chiebukuro.yahoo.co.jp/qa/question_detail/q12324704687,原神のスカークの編成について質問です。 今期はじめて螺旋１1層をすべて星3クリアできました。このまま１２層に行こうとしたのですがスカークのほうで火力が足りず星3クリアできませんでした。スカークは無凸無...,0,0
1524,2026/1/26 19:11,デジタル一眼レフ,c5033d6e2,7時間22分,2,16,8.0,0,1,0.036,12.5,0.0,0.33,あと3日,https://detail.chiebukuro.yahoo.co.jp/qa/question_detail/q11324704686,ニコンD500の設定について質問です。静止画撮影メニューで「フラッシュ発光」の設定が出来ない状況です。他のメニューは白字。フラッシュ発光メニューだけ灰色。シャッターは「S」にしても状況は変わりません。...,0,0
1525,2026/1/26 19:11,格闘技、武術全般,cev********,7時間22分,0,18,18.0,0,0,0.041,0.0,0.0,0.04,あと3日,https://detail.chiebukuro.yahoo.co.jp/qa/question_detail/q14324704684,新大学1年(現高3)の剣道の注目選手が行く大学を知ってる範囲で教えて欲しいです,0,0
1526,2026/1/26 19:11,恋愛相談、人間関係の悩み,b1eb9dab1,7時間22分,0,12,12.0,0,0,0.027,0.0,0.0,0.03,あと3日,https://detail.chiebukuro.yahoo.co.jp/qa/question_detail/q10324704685,高校1年の6月から高校3年の1月の後半まで付き合ってた彼女がいるんですけど、振られて別れて1週間も経ってないのに復縁したいです。どうしたらいいんでしょうか？ 卒業式も3月にあるしどれくらい期間を置いて...,0,0
1527,2026/1/26 19:11,飛行機、空港,********,7時間22分,4,86,21.5,0,0,0.194,4.65,0.04,0.65,あと3日,https://detail.chiebukuro.yahoo.co.jp/qa/question_detail/q13324704683,搭乗手続き後に来ない客って何してんの？？ 札幌地域の大雪の余波で、昨日と本日ともに、千歳空港は混乱してて、本日午後も欠航も重なり、全ての便で満席状態です。 キャンセル待ちをしている人も少なくないと思い...,0,0
1528,2026/1/26 19:11,恋愛相談、人間関係の悩み,b59c265ad,7時間22分,2,16,8.0,0,0,0.036,12.5,0.0,0.26,あと3日,https://detail.chiebukuro.yahoo.co.jp/qa/question_detail/q12324704682,高校生男です。 好きな子をデートに誘うといいよ！と毎回返してくれます。ですが、相手から誘ってくることはありません。 これは相手が単に受け身なだけなのでしょうか？,0,0
1529,2026/1/26 19:11,政治、社会問題,tam********,7時間22分,3,28,9.3,0,1,0.063,10.71,0.01,0.47,あと3日,https://detail.chiebukuro.yahoo.co.jp/qa/question_detail/q11324704681,自民党が単独で過半数取れなければ、1高市さんは100%辞任しますか？本人はそういう覚悟らしいですが 単独は過半数割れだけど、維新との連立で過半数超えるか、もしくは国民民主党とも連立を組んで過半数を超え...,0,0
1530,2026/1/26 19:10,就職活動,1152582336,7時間23分,1,25,25.0,0,3,0.056,4.0,0.01,0.37,あと3日,https://detail.chiebukuro.yahoo.co.jp/qa/question_detail/q10324704680,こんばんは。私は1年間高校の教員をしてきました。 元々アパレルが好きで、GUかUNIQLOに転職活動をしようと思っています。(地域正社員) しかし、ネットで調べる限りものすごい人手不足だからよっぽどの...,0,0
1531,2026/1/26 19:10,恋愛相談、人間関係の悩み,1053059590,7時間23分,1,25,25.0,0,0,0.056,4.0,0.01,0.17,あと3日,https://detail.chiebukuro.yahoo.co.jp/qa/question_detail/q14324704679,気になる人がいるんですけど、どうやって話しかければいいですか。 大学一年で同じ授業をとっている男の子のことが気になっています。理由は顔がとてもタイプだからです。共通の友達がいるわけでもないしインスタも...,0,0
1532,2026/1/26 19:10,トレーニング,えびわらー,7時間23分,3,13,4.3,0,0,0.029,23.08,0.0,0.37,あと3日,https://detail.chiebukuro.yahoo.co.jp/qa/question_detail/q13324704678,スクワットするとすぐに筋肉痛になるのですが、二頭筋をダンベルでやってますが筋肉痛になりません。筋トレはそれなりに疲れるぐらいやってますが、それでも筋肉痛なりません。 二頭筋は筋肉痛にならないのでしょう...,0,0
1533,2026/1/26 19:10,鉄道、列車、駅,b251a2764,7時間23分,4,35,8.8,0,6,0.079,11.43,0.01,0.93,不明,https://detail.chiebukuro.yahoo.co.jp/qa/question_detail/q12324704677,特急券でチケットレス割引で申し込んだら、乗車券の学割は使えませんか？学割の乗車券は紙の切符だと思うんです、、,0,0
1534,2026/1/26 19:10,ウイルス対策、セキュリティ対策,tom********,7時間23分,1,12,12.0,0,0,0.027,8.33,0.0,0.14,あと3日,https://detail.chiebukuro.yahoo.co.jp/qa/question_detail/q11324704676,画面共有・同期について質問です。 スマホのインターネット広告に女性の服の通販や 化粧品などの広告が出てきます。 ついにはPCに事務員パート募集の広告が流れました。 妻は今離婚に向けて職探しをしてる最中...,0,0
1535,2026/1/26 19:10,政治、社会問題,cha********,7時間23分,0,1,1.0,0,0,0.002,0.0,0.0,0.0,あと3日,https://detail.chiebukuro.yahoo.co.jp/qa/question_detail/q10324704675,豊田真由子さんは「改心」したと思いますか？,0,0
1536,2026/1/26 19:10,周辺機器,********,7時間23分,7,42,6.0,0,1,0.095,16.67,0.01,0.95,あと3日,https://detail.chiebukuro.yahoo.co.jp/qa/question_detail/q14324704674,（外付け）HDDとSSDの寿命について、SSDが主流となってからまだ10年も経っていないのかもしれませんが、体感としてはどちらの方が長持ちだと思いますか？ Dell製パソコン（2020年製）内臓のSS...,0,0
1537,2026/1/26 19:10,邦楽,凛晶,7時間23分,0,29,29.0,2,0,0.065,0.0,0.0,0.51,あと3日,https://detail.chiebukuro.yahoo.co.jp/qa/question_detail/q13324704673,どうしても思い出せない曲があります。 曲の雰囲気だけは覚えています。 歌詞は忘れました。ただ、サビは英語だったと思います。 数年前(おそらく5年以上前)にYouTubeでMVを視聴しました。 最近の曲...,0,0
1538,2026/1/26 19:10,発達障害,bf834fbcf,7時間23分,6,124,20.7,1,2,0.279,4.84,0.06,1.31,あと3日,https://detail.chiebukuro.yahoo.co.jp/qa/question_detail/q12324704672,うちの妻について質問です。 私の妻は音に敏感とゆーか、地獄耳とゆーか…耳が良いとゆーか…こっちは離れた部屋で子供と会話してるのに全部聞こえてたりするんです。テレビのボリュームも小さめな時があります。 ...,0,0
1539,2026/1/26 19:10,高校,1052799544,7時間24分,0,5,5.0,0,0,0.011,0.0,0.0,0.01,あと3日,https://detail.chiebukuro.yahoo.co.jp/qa/question_detail/q10324704670,【伊奈学園総合高校】 在校生の方、卒業生の方、音楽・書道・美術・工芸の芸術選択はどれがおすすめですか？ 気をつけるべきこと、後悔したことなど教えて頂きたいです！,0,0
1540,2026/1/26 19:10,恋愛相談,チェリアン,7時間24分,2,41,20.5,0,2,0.092,4.88,0.02,0.45,あと3日,https://detail.chiebukuro.yahoo.co.jp/qa/question_detail/q14324704669,好きな子の影を見るだけで理性が消滅し、壁と自分の影で会話しそうになります。普通に現実世界で生きる方法ってありますか？,0,0
1541,2026/1/26 19:10,就職活動,1052580424,7時間24分,0,5,5.0,0,0,0.011,0.0,0.0,0.01,あと3日,https://detail.chiebukuro.yahoo.co.jp/qa/question_detail/q13324704668,３日後受験なので応援してくれませんかT_T 面接と特色適性検査の受験で、10人ほど落ちますT_T 私元々作文苦手で特色適性検査できるかわかんないし面接だって練習いっぱいしてるけど本番で緊張しちゃうから...,0,0
1542,2026/1/26 19:10,ロシア語,Любовь,7時間24分,3,22,7.3,0,2,0.05,13.64,0.0,0.52,あと3日,https://detail.chiebukuro.yahoo.co.jp/qa/question_detail/q12324704667,Кошка радостно виляет хвостом. このロシア語を翻訳するとどういう意味ですか？,0,0
1543,2026/1/26 19:10,友人関係の悩み,すうぺ,7時間24分,2,20,10.0,0,0,0.045,10.0,0.0,0.27,あと3日,https://detail.chiebukuro.yahoo.co.jp/qa/question_detail/q11324704666,地元の友達に「すうぺ〇〇にいた？」って毎回言われるのが苦痛です。 私は地元にはほとんど友達がいないのですが、地元に帰ると同級生とかが私の友達に連絡して友達が私に連絡してくる感じです。 私は見られてるこ...,0,0
1544,2026/1/26 19:10,メイク、コスメ,なる,7時間24分,1,34,34.0,0,1,0.077,2.94,0.03,0.26,不明,https://detail.chiebukuro.yahoo.co.jp/qa/question_detail/q10324704665,一重メイク初心者です！ビューラーでまつ毛を上げる際にまつ毛同士で絡まる？事があったり、うねうねします。そしてマスカラをしても瞬きした時に瞼や涙袋にマスカラがつきます。 1.まつ毛を綺麗にあげるコツはな...,0,0
1545,2026/1/26 19:10,政治、社会問題,非公開ID,7時間24分,1,12,12.0,0,0,0.027,8.33,0.0,0.14,あと3日,https://detail.chiebukuro.yahoo.co.jp/qa/question_detail/q14324704664,高市早苗総理は、よくこのタイミングで解散してくれました。 枝野が予算委員長では、来年度予算がなかなか思うようにいかないですよね。 選挙後は誰が予算委員長になると思いますか,0,0
1546,2026/1/26 19:10,恋愛相談、人間関係の悩み,ggg********,7時間24分,1,19,19.0,0,1,0.043,5.26,0.01,0.22,あと3日,https://detail.chiebukuro.yahoo.co.jp/qa/question_detail/q12324704662,明日21時以降でデートなのですが、生理が来てしまいました。 普段お互い実家なので夜中から遊ぶことが多く、ドライブとかホテルがほとんどで… もしかしたら明日ホテルかもしれなくて生理ということを事前に言っ...,0,0
1547,2026/1/26 19:10,ドラゴンクエスト,lD非公開,7時間24分,0,17,17.0,0,0,0.038,0.0,0.0,0.04,あと3日,https://detail.chiebukuro.yahoo.co.jp/qa/question_detail/q11324704661,ドラクエ10オンラインのツボやランプ錬金の質問です。 結晶装備を鍛冶などで作れるようになったので、星3を売る前に自分で錬金してから売ろうかなと思ったんですが、ツボランプ錬金のキャラはまだ職人レベル10...,0,0
