763,2026/1/31 7:01,模型、プラモデル、ラジコン,bdd2c7d39,8時間18分,0,14,14.0,0,0,0.028,0.0,0.0,0.03,あと3日,https://detail.chiebukuro.yahoo.co.jp/qa/question_detail/q10324753990,POPカイドウとPOPキングを一緒に飾りたいのですがフィギュアケースの横幅、高さをどれほどのサイズを買えばいいか困ってます わかる方いらっしゃいますか？,0,0
764,2026/1/31 7:01,日本映画,gfh********,8時間18分,0,33,33.0,1,0,0.066,0.0,0.0,0.27,あと3日,https://detail.chiebukuro.yahoo.co.jp/qa/question_detail/q10324753985,エヴァやはたらく細胞の映画がテレビ放送可能ならスラムダンク劇場版もテレビでやりそうですか？,0,0
765,2026/1/31 7:01,職場の悩み,たかし,8時間18分,0,69,69.0,0,0,0.138,0.0,0.0,0.14,あと3日,https://detail.chiebukuro.yahoo.co.jp/qa/question_detail/q10324753860,「最初に断っておきます。わかりやすく書いたつもりですが、わからなかったらすいません。」で質問した者です。 ご回答くださった方ありがとうございます。 いまも毎日職場はストレスです。胃に来ます。 去っても...,0,0
766,2026/1/31 7:01,就職活動,b606a3751,8時間18分,0,28,28.0,0,0,0.056,0.0,0.0,0.06,あと3日,https://detail.chiebukuro.yahoo.co.jp/qa/question_detail/q10324753880,"アシックスの就活についてについていくつかご質問があります。 1,テスト内容はSPIでしょうか？英語の内容は含まれますか？ 2,アシックス本社を希望しているのですが、TOEICの点数がなくても内定もらえ...",0,0
767,2026/1/31 7:01,格闘技、武術全般,非公開,8時間18分,0,14,14.0,0,0,0.028,0.0,0.0,0.03,あと3日,https://detail.chiebukuro.yahoo.co.jp/qa/question_detail/q10324753825,柔道の組手技術を教えてください。身長を生かした戦い方で相四つと喧嘩四つどちらも。,0,0
768,2026/1/31 7:01,K-POP、アジア,非公開,8時間18分,1,153,153.0,1,0,0.307,0.65,0.47,0.61,あと3日,https://detail.chiebukuro.yahoo.co.jp/qa/question_detail/q10324753775,最近スキズ追えてなくて、今回なぜ炎上してるのかあまりわからないのですが、少し内容みるとメンバーが悪く言われるのは違う気がするのですが、？ 何があったのですか？ 前の東京ドームよりも荒れてるんですか？,0,0
769,2026/1/31 7:01,楽天市場,hir********,8時間18分,0,13,13.0,0,0,0.026,0.0,0.0,0.03,あと3日,https://detail.chiebukuro.yahoo.co.jp/qa/question_detail/q10324753700,楽天市場にて企業やお店などにプレゼントを贈るにはどうしたらいいですか？ 個人名入力がありますけど,0,0
770,2026/1/31 7:01,病気、症状,1251871262,8時間18分,0,57,57.0,0,0,0.114,0.0,0.0,0.11,あと3日,https://detail.chiebukuro.yahoo.co.jp/qa/question_detail/q10324753500,一般的に「脇は臭いやすい」「ワキガという病気がある」と言われていますが、私はこれまで自分の脇が臭いと感じたことがありません。また、他人の脇の匂いが気になったこともありません。 これは嗅覚がおかしいので...,0,0
771,2026/1/31 7:01,お酒、ドリンク,2525,8時間18分,0,11,11.0,0,0,0.022,0.0,0.0,0.02,あと3日,https://detail.chiebukuro.yahoo.co.jp/qa/question_detail/q10324753575,今どきの青汁ってどんな味ですか？ 甘くてさっぱりしてるのが増えたって聞きました、飲みやすい青汁も教えてほしいです。(紙パックで売ってるようなやつ),0,0
772,2026/1/31 7:01,インターネットショッピング,川端康nari,8時間18分,0,53,53.0,0,0,0.106,0.0,0.0,0.11,あと3日,https://detail.chiebukuro.yahoo.co.jp/qa/question_detail/q10324753660,今年の4月からアリエク・TEMU・SHEINなどの荷物は必ず消費税がかかるようになりますが、仮にアリエク・TEMU・SHEINなどから協力を拒否されたら、配達時に徴収という形になりますが、 このように...,0,0
773,2026/1/31 7:01,音楽,1053021154,8時間18分,0,27,27.0,0,0,0.054,0.0,0.0,0.05,あと3日,https://detail.chiebukuro.yahoo.co.jp/qa/question_detail/q10324753485,記憶が曖昧で正確な情報は言えませんが質問があります。ある友人が聴いていたアーティストを教えてほしいです。そのアーティストはYouTubeに音楽を投稿していますが、あまり再生数が伸びていないです。 多分...,0,0
774,2026/1/31 7:01,言葉、語学,Radiguet（ラディゲ）,8時間19分,0,9,9.0,0,0,0.018,0.0,0.0,0.02,あと3日,https://detail.chiebukuro.yahoo.co.jp/qa/question_detail/q10324753665,"Тот самолёт нарушил воздушное пространство нашей страны, поэтому мы сбили его. この文の意味は何ですか？",0,0
775,2026/1/31 7:01,病気、症状,mid********,8時間19分,0,14,14.0,0,0,0.028,0.0,0.0,0.03,あと3日,https://detail.chiebukuro.yahoo.co.jp/qa/question_detail/q12324851037,クローブ（和名：丁子）について教えて下さい。 クローブは殺菌作用により、喉の粘膜の炎症を鎮める自然療法、ホール（つぼみ）を1〜2粒、直接噛むことで成分が直接喉に作用します、とありますが、噛んだ後はどう...,0,0
776,2026/1/31 7:01,ヒト,gom********,8時間19分,1,10,10.0,0,0,0.02,10.0,0.0,0.12,あと3日,https://detail.chiebukuro.yahoo.co.jp/qa/question_detail/q10324753465,ヒト 睡眠中に沢山の夢を見るのでしょうか？ 朝目覚めて夢を覚えている時と覚えていない時の差が大きいです。 夢で疲れてあまり熟睡感がありません,0,0
777,2026/1/31 7:01,大学受験,1251913862,8時間19分,0,14,14.0,0,0,0.028,0.0,0.0,0.03,あと3日,https://detail.chiebukuro.yahoo.co.jp/qa/question_detail/q11324851036,私立大学の試験について。 国語の試験と油の試験があるのですが、英語の服を着て言っても大丈夫でしょうか？,0,0
778,2026/1/31 7:01,恋愛相談、人間関係の悩み,非公開,8時間19分,2,41,20.5,0,0,0.082,4.88,0.02,0.28,あと3日,https://detail.chiebukuro.yahoo.co.jp/qa/question_detail/q14324851034,ヤフー知恵袋は私非常に優秀な人の集まりと感じてます。 ホリエモンさんも絶賛してましたし、質問だけしかしないけどとても勉強なっております、今後も利用していきたくて、とても勉強なったか、とても嫌な思いした...,0,0
779,2026/1/31 7:01,大学受験,ふぃーと,8時間19分,1,15,15.0,0,0,0.03,6.67,0.0,0.13,あと3日,https://detail.chiebukuro.yahoo.co.jp/qa/question_detail/q10324851035,早稲田志望の高一です。 第一志望の学部を決めるので、社会科学部と商学部で迷っています。両方の特徴だったり雰囲気など知ってる方いましたら助かります。,0,0
780,2026/1/31 7:01,住宅,tou********,8時間19分,2,18,9.0,0,0,0.036,11.11,0.0,0.24,あと3日,https://detail.chiebukuro.yahoo.co.jp/qa/question_detail/q13324851033,建築関係の人に鉄筋ありますか？ みたいな電話がたまにあるのですがウチのホムセンでは異形丸棒という商品しかありません。 コレで良いのでしょうか？,0,0
781,2026/1/31 7:01,メイク、コスメ,2nlpy,8時間19分,3,23,7.7,0,1,0.046,13.04,0.0,0.41,あと3日,https://detail.chiebukuro.yahoo.co.jp/qa/question_detail/q12324851032,メイクの事での相談なんですけど、皆さん自分に合ったメイクってどうやって見つけてるんですか？自分に合ったメイクじゃないと中々いま化粧品が高くて買ったら無駄になるじゃないですか？,0,0
782,2026/1/31 7:01,ご近所の悩み,huu********,8時間19分,4,175,43.8,0,3,0.35,2.29,0.15,0.93,不明,https://detail.chiebukuro.yahoo.co.jp/qa/question_detail/q11324851031,騒音で警察を呼びました ・騒音自体は前からありましたが、年明けをしてから深夜〜早朝に掛けて兎に角五月蝿い。走ったり叩いたり色々です。軽く叩き返しても逆ギレでさらに叩いてくるので、結構頭おかしいんだと思...,0,0
783,2026/1/31 7:01,大学受験,1252791746,8時間19分,1,18,18.0,0,0,0.036,5.56,0.01,0.14,あと3日,https://detail.chiebukuro.yahoo.co.jp/qa/question_detail/q10324851030,高三です。 三重大の英語の過去問をやっているのですが、英作文対策をなにもやってきていなくて半分も取れません。 英作文がなくて和文英訳で長文からそのまま借用してくるような問題の年もあって、 そんなに時間...,0,0
784,2026/1/31 7:00,恋愛相談,c86b851bd,8時間20分,3,27,9.0,0,0,0.054,11.11,0.0,0.35,あと3日,https://detail.chiebukuro.yahoo.co.jp/qa/question_detail/q13324851028,調理実習の時にお皿を洗っていたら、袖が垂れてたら、好きな人が袖を無言でまくってくれたんですけど、これってどういう心理なんですか。 好きな人は料理が上手くて女子には基本優しいけど、私のことが嫌いらしいで...,0,0
785,2026/1/31 7:00,病気、症状,wln********,8時間20分,1,14,14.0,0,0,0.028,7.14,0.0,0.13,あと3日,https://detail.chiebukuro.yahoo.co.jp/qa/question_detail/q12324851027,嘔吐恐怖症です。 吐いたあとどう立ち直っているんですか？ 本当に凄いというか、理解できないです; お酒で失敗し続けてる人とか本当に尊敬します。 いつか自分にその時が来たときのために、 心に刻みたいので...,0,0
786,2026/1/31 7:00,政治、社会問題,b54d30402,8時間20分,1,39,39.0,0,1,0.078,2.56,0.03,0.24,あと3日,https://detail.chiebukuro.yahoo.co.jp/qa/question_detail/q11324851026,前回の衆議院選挙 参議院選挙。 自民ダメだわ そんな流れで。 「別にわからんけど 立憲民主に入れとくか？」 そんな 絶対 ここという考えでなく そんな簡単な流れで立憲民主となったと思うんですが。 代議...,0,0
787,2026/1/31 7:00,美容整形,Na:猫大好き,8時間20分,1,16,16.0,0,0,0.032,6.25,0.01,0.13,あと3日,https://detail.chiebukuro.yahoo.co.jp/qa/question_detail/q14324851024,ほくろ除去についていくつか質問です。 コスプレしたくてでも小さいホクロはお化粧でうっすらと消すことできますが、出っ張ってるほくろは消せないじゃないですかなので出っ張ってるほくろ眉毛のところと首後ろの出...,0,0
788,2026/1/31 7:00,コンビニ,スイーツが主食,8時間20分,1,7,7.0,0,2,0.014,14.29,0.0,0.23,あと3日,https://detail.chiebukuro.yahoo.co.jp/qa/question_detail/q12324851022,ヤンヤンつけボーコンビニでは何円しますか？,0,0
789,2026/1/31 7:00,世界史,Radiguet（ラディゲ）,8時間20分,2,27,13.5,0,4,0.054,7.41,0.01,0.49,あと3日,https://detail.chiebukuro.yahoo.co.jp/qa/question_detail/q13324851023,中世の戦場を支配した「騎士」を没落させたのは、銃ではなく「弓」だったのでしょうか？ 世界史の授業では、火器（鉄砲）の登場によって重装騎兵や騎士が時代遅れになったと習いました。しかし、百年戦争の「クレシ...,0,0
790,2026/1/31 7:00,本、雑誌,ナオシー,8時間21分,1,29,29.0,0,0,0.058,3.45,0.02,0.16,あと3日,https://detail.chiebukuro.yahoo.co.jp/qa/question_detail/q11324851021,ボンボンドロップシールに似た別のぷくぷくシールを入荷した店長さんの本屋はその後、どうなりましたか？？,0,0
791,2026/1/31 7:00,就職、転職,my_********,8時間21分,2,8,4.0,0,0,0.016,25.0,0.0,0.22,あと3日,https://detail.chiebukuro.yahoo.co.jp/qa/question_detail/q10324851020,高齢求職者のスキルアップと言いますが、また需要が一切無いパソコン教室なんてやるのですか？ そもそも今時の高齢者には十分にITスキルがあるのに。,0,0
792,2026/1/31 7:00,予備校、進学塾,b206db95a,8時間21分,1,63,63.0,0,0,0.126,1.59,0.08,0.23,あと3日,https://detail.chiebukuro.yahoo.co.jp/qa/question_detail/q14324851019,駿台では2月頃から高校生に向けて自習室を無料開放していますが、横浜校では何号館が対象なのでしょうか。また、学校に掲示してあった利用時間とホームページに載っている時間が異なります。 どちらが正しいのでし...,0,0
793,2026/1/31 7:00,邦楽,1151911746,8時間21分,9,99,11.0,0,0,0.198,9.09,0.02,1.09,あと3日,https://detail.chiebukuro.yahoo.co.jp/qa/question_detail/q13324851018,おはようございます知ってるかな？ の人です さて 今回の質問は きり といったら「〇〇〇〇」です 文字数は気にしません 曲名・人名でなくてもＯＫです 連想するものでＯＫ 一人１個でお願いします 自身は...,0,0
794,2026/1/31 7:00,生き方、人生相談,mai********,8時間21分,3,11,3.7,0,0,0.022,27.27,0.0,0.32,あと3日,https://detail.chiebukuro.yahoo.co.jp/qa/question_detail/q11324851016,みなさん外に出ず 何日間 家の中で過ごしたことありますか？ 僕は3日連続です 笑 普通ですかね？,0,0
795,2026/1/31 6:59,観光地、行楽地,ID 非公開,8時間22分,0,12,12.0,0,0,0.024,0.0,0.0,0.02,あと3日,https://detail.chiebukuro.yahoo.co.jp/qa/question_detail/q14324851014,3歳半の子供を連れてシンガポール旅行に行きます。 ベビーカーはあった方が便利でしょうか？,0,0
796,2026/1/31 6:59,俳優、女優,qzc********,8時間22分,5,35,7.0,0,4,0.07,14.29,0.0,0.8,あと3日,https://detail.chiebukuro.yahoo.co.jp/qa/question_detail/q10324851015,新垣結衣VS長澤まさみVS広末涼子 若い頃（全盛期）で一番可愛かったのは誰ですか？,0,0
797,2026/1/31 6:59,天文、宇宙,b18987319,8時間22分,4,93,23.2,0,1,0.185,4.3,0.04,0.64,あと3日,https://detail.chiebukuro.yahoo.co.jp/qa/question_detail/q13324851013,56億7000万年後に本当に高野山奥の院に例のお方は現れると思いますか？ その頃、地球はまだあるのだろうか？,0,0
798,2026/1/31 6:59,占い,FULL HOUSE,8時間22分,0,13,13.0,1,0,0.026,0.0,0.0,0.22,あと3日,https://detail.chiebukuro.yahoo.co.jp/qa/question_detail/q12324851012,家族の性格など見て下さい。 元々ちゃっかりした所のあった息子でしたが、都会に出て更にその部分｢人は、どうでもいい｣強くなったと思います。 友達は沢山いるのに、なぜ家族（男親） と上手く行かないんですか...,0,0
799,2026/1/31 6:59,海外,ID 非公開,8時間22分,1,15,15.0,0,0,0.03,6.67,0.0,0.13,あと3日,https://detail.chiebukuro.yahoo.co.jp/qa/question_detail/q12324851007,3歳半の子供を連れてシンガポール旅行に行きます。 ベビーカーはあった方が便利でしょうか？,0,0
800,2026/1/31 6:58,職業,非公開,8時間23分,3,9,3.0,0,0,0.018,33.33,0.0,0.32,あと3日,https://detail.chiebukuro.yahoo.co.jp/qa/question_detail/q11324851006,あなたはホストという職業に対して、どのような印象やエピソードをお持ちですか？,0,0
801,2026/1/31 6:58,政治、社会問題,Radiguet（ラディゲ）,8時間23分,1,21,21.0,0,3,0.042,4.76,0.01,0.32,あと3日,https://detail.chiebukuro.yahoo.co.jp/qa/question_detail/q10324851005,十字軍遠征は「信仰心」による聖戦だったのか、それとも「経済的利益」を狙った侵略だったのか？ 中世ヨーロッパの十字軍について疑問があります。当時の騎士や民衆が、命をかけてエルサレムを目指したのは純粋なキ...,0,0
802,2026/1/31 6:58,アニメ,非公開,8時間23分,0,7,7.0,0,0,0.014,0.0,0.0,0.01,あと3日,https://detail.chiebukuro.yahoo.co.jp/qa/question_detail/q13324851003,もしFakeのアルケイデスがApoのアキレウスと戦った場合、弱点の踵と軍神の戦帯などを除いてアルケイデスがアキレウスに傷を負わせられる手段はあるのでしょうか？ アキレウスは踵以外の肉体には神性が無けれ...,0,0
803,2026/1/31 6:58,福祉、介護,匿名,8時間23分,3,17,5.7,0,0,0.034,17.65,0.0,0.33,あと3日,https://detail.chiebukuro.yahoo.co.jp/qa/question_detail/q12324851002,私の祖父は高齢者施設に住んでいて、他の入居者は怒らないのに、 私の祖父だけ怒る事が多いみたいなのですが(施設長の男性は「毎日怒ってる訳じゃない」や「怒ってない日の方が多い」や「8割怒ってない」と言って...,0,0
804,2026/1/31 6:58,バラエティ、お笑い,Alex,8時間24分,4,59,14.8,0,2,0.117,6.78,0.02,0.63,あと3日,https://detail.chiebukuro.yahoo.co.jp/qa/question_detail/q11324851001,ナイトスクープ大家族炎上問題 あれって… ヤラセだったと番組側が認めましたが母親のSNSに投稿した文はそれ以前から問題になっていました。 真実はどうなのでしょうか？ 皆さんの意見を聞きたいと思います。,0,0
805,2026/1/31 6:58,iPhone,匿名,8時間24分,1,8,8.0,0,0,0.016,12.5,0.0,0.11,あと3日,https://detail.chiebukuro.yahoo.co.jp/qa/question_detail/q10324851000,iPhoneのアプリでおすすめのポーカーゲームってありますか？初心者でも遊びやすいものなんかがあれば嬉しいのですが……,0,0
806,2026/1/31 6:58,英語,knh********,8時間24分,3,28,9.3,0,1,0.056,10.71,0.01,0.41,あと3日,https://detail.chiebukuro.yahoo.co.jp/qa/question_detail/q13324850998,It's so simple yet so delicious. このyetは接続詞なのでしょうか？それとも副詞ですか？ https://eow.alc.co.jp/search?q=yet こちらで...,0,0
807,2026/1/31 6:58,政治、社会問題,Radiguet（ラディゲ）,8時間24分,0,8,8.0,0,0,0.016,0.0,0.0,0.02,あと3日,https://detail.chiebukuro.yahoo.co.jp/qa/question_detail/q12324850997,チンギス・ハーンは単なる「破壊者」ではなく、実は「グローバル化の先駆者」だったのでしょうか？ モンゴル帝国について教えてください。昔の教科書などでは「殺戮と破壊の軍団」というイメージが強かった気がしま...,0,0
808,2026/1/31 6:58,げっ歯類、ウサギ,匿名,8時間24分,2,11,5.5,0,0,0.022,18.18,0.0,0.22,あと3日,https://detail.chiebukuro.yahoo.co.jp/qa/question_detail/q11324850996,ゴールデンハムスターの老化について 今まで4匹のゴールデンハムスターを飼ってきて、初代メスはずっと耳から腫瘍が出続けつつ特に無治療のまま2年半とほぼ寿命で死にました 死ぬ1週間ほど前までは見た目に大き...,0,0
809,2026/1/31 6:58,取引相手とのトラブル,sss,8時間24分,1,26,26.0,0,0,0.052,3.85,0.01,0.15,あと3日,https://detail.chiebukuro.yahoo.co.jp/qa/question_detail/q10324850995,先日こちらの商品が届いたのですが開封してみると別の商品が入っていて返品申請したのですがもう一度こちらの商品を買うべきでしょうか,0,0
810,2026/1/31 6:57,海外,coc********,8時間25分,7,149,21.3,0,17,0.295,4.7,0.06,1.99,あと3日,https://detail.chiebukuro.yahoo.co.jp/qa/question_detail/q14324850994,中国の旅行について質問です。 前提として、全て自己判断なのは理解しています☺ 6月に上海ディズニーランドに行く予定にしていたのですが最近の日中関係のニュースをみて少し迷い始めました。旅行の目的は子供が...,0,0
811,2026/1/31 6:57,職場の悩み,.,8時間25分,5,68,13.6,0,3,0.135,7.35,0.02,0.81,あと3日,https://detail.chiebukuro.yahoo.co.jp/qa/question_detail/q13324850993,派遣社員です 長くなりますが 会社の立替について疑問があります 今勤めている会社は事務員の正社員の方が 切手代印紙代等を自腹で購入→一度立替→領収書等を経理のある他県に郵送→承認されれば会社指定で作っ...,0,0
812,2026/1/31 6:57,就職、転職,my_********,8時間25分,1,6,6.0,0,0,0.012,16.67,0.0,0.11,あと3日,https://detail.chiebukuro.yahoo.co.jp/qa/question_detail/q12324850992,高齢求職者が大量に余っているのに外国人労働者を導入するのは、高齢者の労働環境を悪化させるのが狙いなのですか？,0,0
813,2026/1/31 6:57,自動車,ボンゴフレンディと黒塗りの高級車,8時間25分,10,73,7.3,0,8,0.144,13.7,0.01,1.6,あと3日,https://detail.chiebukuro.yahoo.co.jp/qa/question_detail/q11324850991,アウディってどんな奴が乗ってるんですか？,0,0
814,2026/1/31 6:56,ゲーム,頑張る,8時間26分,0,12,12.0,0,0,0.024,0.0,0.0,0.02,あと3日,https://detail.chiebukuro.yahoo.co.jp/qa/question_detail/q10324850990,鳴潮について。 データ復旧をしたいのですが、課金履歴のみしか分からない場合はどうしようもないですよね… アカウントのメアド、UIDも分からないです。,0,0
815,2026/1/31 6:56,ラグビー、アメフト,you********,8時間26分,0,15,15.0,0,0,0.03,0.0,0.0,0.03,あと3日,https://detail.chiebukuro.yahoo.co.jp/qa/question_detail/q14324850989,NFLのサラリーキャップ制について 教えて下さい。 アメフトを観始めたばかりなのですが、 NFLのサラリーキャップ制の仕組みが 良く分からないので教えて下さい。 例えば、2026年シーズンが契約最終年...,0,0
817,2026/1/31 6:56,運転免許,1251468497,8時間26分,5,37,7.4,0,0,0.073,13.51,0.01,0.56,あと3日,https://detail.chiebukuro.yahoo.co.jp/qa/question_detail/q13324850988,今日卒業検定なのに雪積もってました 雪の上走るの初めてですどうしよう何か注意点ありますか？,0,0
818,2026/1/31 6:56,中学校,b89f3fd09,8時間27分,2,13,6.5,1,0,0.026,15.38,0.0,0.42,あと3日,https://detail.chiebukuro.yahoo.co.jp/qa/question_detail/q14324850984,中2ですおすすめの全教科勉強法教えて欲しいです！,0,0
819,2026/1/31 6:56,哲学、倫理,翠,8時間27分,2,46,23.0,0,0,0.091,4.35,0.02,0.29,あと3日,https://detail.chiebukuro.yahoo.co.jp/qa/question_detail/q13324850983,以下のテーマについては、哲学愛好家としても真剣に考えてみたほうがいいテーマなのではありませんか。 https://detail.chiebukuro.yahoo.co.jp/qa/question_d...,0,0
820,2026/1/31 6:56,法律相談,匿名希望,8時間27分,2,51,25.5,0,0,0.101,3.92,0.03,0.3,あと3日,https://detail.chiebukuro.yahoo.co.jp/qa/question_detail/q12324850982,内職をしておりましたが、この度の棚卸しで数が合わないといわれました。 合わない分の額（高額）を請求されていますが、内職の部屋は内職部屋というものをつくっていて真っさらな為、落ちていれば気付きますし、ま...,0,0
821,2026/1/31 6:56,政治、社会問題,Radiguet（ラディゲ）,8時間27分,3,47,15.7,0,6,0.093,6.38,0.01,0.74,あと3日,https://detail.chiebukuro.yahoo.co.jp/qa/question_detail/q11324850981,秦や隋はあんなに強大だったのに、なぜ短期間で滅びてしまったのでしょうか？ 中国史についての質問です。始皇帝の「秦」や、南北朝を統一した「隋」は、度量衡の統一や大運河の建設など、後世に残る偉大な功績を挙...,0,0
822,2026/1/31 6:55,鉄道、列車、駅,bdfe010a8,8時間28分,4,66,16.5,0,4,0.13,6.06,0.02,0.76,不明,https://detail.chiebukuro.yahoo.co.jp/qa/question_detail/q14324850979,東京駅で総武線快速に乗ってやってくる友人と東海道新幹線に乗るために合流したいのですが、どこを待ち合わせ場所にするべきですか？ 私はバスターミナル東京八重洲から行きます。また、バスで行く私が新幹線のチケ...,0,0
824,2026/1/31 6:55,コミュニケーションサービス,noj********,8時間28分,0,14,14.0,0,0,0.028,0.0,0.0,0.03,あと3日,https://detail.chiebukuro.yahoo.co.jp/qa/question_detail/q12324850977,SNSの投稿のコメントに 【、、。ら】と謎のコメントが… この意味ご存知な方はいらっしゃいますか？,0,0
825,2026/1/31 6:55,政治、社会問題,Radiguet（ラディゲ）,8時間28分,2,23,11.5,0,1,0.045,8.7,0.01,0.3,あと3日,https://detail.chiebukuro.yahoo.co.jp/qa/question_detail/q14324850974,現代のパレスチナ問題や中東の混乱は、すべて第一次世界大戦時のイギリスが原因なのですか？ 最近のニュースを見ていて中東情勢に興味を持ち、世界史を遡って調べています。そこで「三枚舌外交（フサイン・マクマホ...,0,0
826,2026/1/31 6:55,家族関係の悩み,chiebukurothanks,8時間28分,2,65,32.5,0,4,0.128,3.08,0.04,0.56,不明,https://detail.chiebukuro.yahoo.co.jp/qa/question_detail/q12324850972,親ではなく、兄弟姉妹や親戚と縁を切った人はいますか？,0,0
827,2026/1/31 6:55,オリンピック,IDナイショッペ,8時間28分,3,10,3.3,0,1,0.02,30.0,0.0,0.37,あと3日,https://detail.chiebukuro.yahoo.co.jp/qa/question_detail/q11324850971,⭐︎ オリンピック・ウインターゲームス★ まもなく、 2026 ミラノ・コルティナ 冬季オリンピック ですね！ 皆さんの冬季オリンピック、一番の思い出は何ですか？ トワ・エ・モア？？ ジャネット・リン...,0,0
828,2026/1/31 6:55,葬儀,20251227/1007,8時間28分,7,66,9.4,0,1,0.13,10.61,0.01,0.88,あと3日,https://detail.chiebukuro.yahoo.co.jp/qa/question_detail/q10324850970,なぜ墓を建てるのですか 自宅の仏壇で遺骨を祀ってはいけないのでしょうか？,0,0
