749,2026/1/26 19:34,ライブ、コンサート,c283d7010,6時間11分,0,12,12.0,0,0,0.032,0.0,0.0,0.03,あと3日,https://detail.chiebukuro.yahoo.co.jp/qa/question_detail/q11324705551,前回回答してくださった方のおかげでライブに当選し、今週末に行くことになりました！ すたぽら というアーティストのライブにいってきます！そこで、ポラリスの方々！私自身曲はたくさん聞きます！ですが、ライブ...,0,0
750,2026/1/26 19:34,転職,tmf********,6時間11分,0,9,9.0,0,0,0.024,0.0,0.0,0.02,あと3日,https://detail.chiebukuro.yahoo.co.jp/qa/question_detail/q14324705549,転職活動をしているのですが、私が男性の方が苦手でできれば女性のエージェントさんがいいと思いマイナビエージェントで良さそうな方がいて、この人に相談するボタンを押しましたが、 その後連絡来たのが男性からで...,0,0
751,2026/1/26 19:34,ギター、ベース,Bluesman,6時間11分,4,34,8.5,0,1,0.091,11.76,0.01,0.71,あと3日,https://detail.chiebukuro.yahoo.co.jp/qa/question_detail/q12324705547,歪み系エフェクターのゲインって9〜10時くらいが使いやすいですかね？ あまり歪み過ぎるとブーミーになっちゃって ちなみにエフェクツベーカリのクロワッサンとブルースドライバーの２台使いです 音楽的にはブ...,0,0
752,2026/1/26 19:34,恋愛相談、人間関係の悩み,gad********,6時間11分,6,76,12.7,0,0,0.204,7.89,0.03,1.01,あと3日,https://detail.chiebukuro.yahoo.co.jp/qa/question_detail/q11324705546,結婚するときは少しでも腑に落ちない点があれば別れた方がいいでしょうか？ また少しでも遊びたいという欲望があれば別れるしかないでしょうか？ 26歳男です。 アプリで知り合った女性と付き合って9ヶ月になり...,0,0
753,2026/1/26 19:34,恋愛相談、人間関係の悩み,a2e37661d,6時間12分,1,41,41.0,0,0,0.11,2.44,0.05,0.24,あと3日,https://detail.chiebukuro.yahoo.co.jp/qa/question_detail/q10324705545,マッチングアプリでは女は別人が来る。比較的ピン芸人の吉住系統の顔がくる。とエックスで見たけど、今日会った人がまさにこの顔でめっちゃ笑った。多いのな。どう思いますか？,0,0
754,2026/1/26 19:34,子育ての悩み,mam********,6時間12分,7,37,5.3,0,1,0.099,18.92,0.01,1.12,あと3日,https://detail.chiebukuro.yahoo.co.jp/qa/question_detail/q11324705541,子供の習い事は何歳から始めるのがいいと思いますか？ 上の子は今2歳で英語か体操をやらせたいなと思っていて下の子は今一歳でサッカーをやらせたいなと思っています。,0,0
755,2026/1/26 19:34,レディースシューズ,niixy,6時間12分,2,60,30.0,0,0,0.161,3.33,0.05,0.43,あと3日,https://detail.chiebukuro.yahoo.co.jp/qa/question_detail/q12324705542,靴履かなかったら無臭なのですが靴を数時間履いて脱ぐと臭いです。そうならないようにするにはどうしたらいいでしょうか？,0,0
756,2026/1/26 19:34,職場の悩み,非公開,6時間12分,1,32,32.0,0,0,0.086,3.12,0.03,0.22,あと3日,https://detail.chiebukuro.yahoo.co.jp/qa/question_detail/q10324705540,聞こえなかったふりは通用しますか？ 仕事中よく女性にちょっかいをかけてる人から何か言われましたが他の人と話していたので聞こえなかったふりをしてしまいました。 あからさますぎて無視だと思われたでしょうか...,0,0
757,2026/1/26 19:34,携帯型ゲーム全般,b3f2e12f4,6時間12分,0,16,16.0,0,0,0.043,0.0,0.0,0.04,あと3日,https://detail.chiebukuro.yahoo.co.jp/qa/question_detail/q14324705539,原神のエウルアの編成についての質問です。 現環境でエウルアの編成を組むと、どんな感じがいいのか教えていただきたいです。 今想定してる編成が、 エウルア（螭龍） イネファ（死闘） ミカ（西風） 雷電or...,0,0
759,2026/1/26 19:34,テーマパーク,Na:猫大好き,6時間12分,0,5,5.0,0,0,0.013,0.0,0.0,0.01,あと3日,https://detail.chiebukuro.yahoo.co.jp/qa/question_detail/q11324705536,めいどりーみんのバレンタインイベントに行こうとしてるのですが。1人でも楽しめますか？ 一緒に行く人が行けなくなってしまって、2回目の時も人見知り発動しちゃって声小さくなって「もう1回！」って聞き返され...,0,0
760,2026/1/26 19:34,恋愛相談、人間関係の悩み,cd2465a38,6時間12分,2,21,10.5,0,0,0.056,9.52,0.01,0.32,あと3日,https://detail.chiebukuro.yahoo.co.jp/qa/question_detail/q10324705535,女性の浮気の原因のほとんどはなんですか？,0,0
762,2026/1/26 19:34,英語,1149642834,6時間12分,0,18,18.0,0,0,0.048,0.0,0.0,0.05,あと3日,https://detail.chiebukuro.yahoo.co.jp/qa/question_detail/q13324705533,先日英検準2級を受けました。 必着日まで受験票が届かなかったので、WEB受験許可証を印刷して受けました。 もし1次試験に合格し2次試験を受ける場合、受験票と同時に送られる本人確認票が必要なのですが、私...,0,0
763,2026/1/26 19:34,冷蔵庫、キッチン家電,tak********,6時間12分,1,13,13.0,0,0,0.035,7.69,0.0,0.17,あと3日,https://detail.chiebukuro.yahoo.co.jp/qa/question_detail/q12324705532,シャープのヘルシオという電子レンジを15年ほど前に購入し、使用をしています。 機能的な部分は正常に使えていますが、一番使う「スタートボタン」がダメになってきて、強く押し込む・斜めから角度を変えて押し込...,0,0
764,2026/1/26 19:34,携帯型ゲーム全般,参考書巡りにハマる,6時間12分,0,3,3.0,0,0,0.008,0.0,0.0,0.01,あと3日,https://detail.chiebukuro.yahoo.co.jp/qa/question_detail/q11324705531,NBA2Kモバイルについて、 カリーが欲しいんですけど、このヘリオスリングはどこで入手可能ですか？,0,0
765,2026/1/26 19:34,家族関係の悩み,匿名,6時間12分,1,18,18.0,0,0,0.048,5.56,0.01,0.18,あと3日,https://detail.chiebukuro.yahoo.co.jp/qa/question_detail/q10324705530,貯金がない、専業主婦の女性は、旦那が突然病気になって、旦那が長期入院して、何らかの理由で旦那の通帳を取得出来なくて、旦那の口座からお金を下ろせなかったら、困りますか？,0,0
766,2026/1/26 19:34,中学受験,b9b2524b1,6時間12分,2,239,119.5,0,1,0.641,0.84,0.76,0.99,あと3日,https://detail.chiebukuro.yahoo.co.jp/qa/question_detail/q14324705529,私は2026南山女子中に落ちた者です。自己採点では、７割弱取れてました（配点は分かりませんが）。日能研のトライアルでもA判定だったので、ショックです。繰り上げって、どれくらい有りますか？,0,0
767,2026/1/26 19:34,大学受験,c8d0ac4ca,6時間12分,1,44,44.0,0,0,0.118,2.27,0.05,0.25,あと3日,https://detail.chiebukuro.yahoo.co.jp/qa/question_detail/q13324705528,東進の共テリサーチのD判定ってこれワンチャン受かったりするんですか？,0,0
768,2026/1/26 19:34,電子マネー、電子決済,dec********,6時間13分,0,8,8.0,0,0,0.021,0.0,0.0,0.02,あと3日,https://detail.chiebukuro.yahoo.co.jp/qa/question_detail/q12324705527,先日、友人と飲食店に行きレジで個別会計しました。 ①私はAとB、友人はCを注文 ②支払いミスで私がAのみQR決済 ③Bを追加で支払いしたかったがレジ操作を手間取っていたため、残額（BとC）を友人が支払...,0,0
769,2026/1/26 19:34,ライブ、コンサート,ルカ,6時間13分,0,6,6.0,0,0,0.016,0.0,0.0,0.02,あと3日,https://detail.chiebukuro.yahoo.co.jp/qa/question_detail/q11324705526,ZEROBASEONEのKアリーナでのアンコールコンサートのチケットのリセールはありますか？もしあるならどこのサイトでいつ行われますか？,0,0
770,2026/1/26 19:34,高校受験,1252227704,6時間13分,2,31,15.5,0,0,0.083,6.45,0.01,0.35,あと3日,https://detail.chiebukuro.yahoo.co.jp/qa/question_detail/q10324705525,本日、北海道学力コンクールの結果が届いたのですが、第一志望の高校の合格確率が91%でした。 ですが、元々その志望校に行くにはかなりギリギリの学力だと言われていたので道コンの結果も60〜70ぐらいの合格...,0,0
771,2026/1/26 19:34,メイク、コスメ,1053056059,6時間13分,3,12,4.0,0,0,0.032,25.0,0.0,0.43,あと3日,https://detail.chiebukuro.yahoo.co.jp/qa/question_detail/q14324705524,現在中学三年生の女です。 メイクを始めようと思っており、 ①バンビシリーズのスワングレーのカラコンが気になっています。メイク初心者でいきなりグレー系統いくのは大変...というか難しいでしょうか？ ②ス...,0,0
772,2026/1/26 19:33,住宅,1151814444,6時間14分,0,7,7.0,0,0,0.019,0.0,0.0,0.02,あと3日,https://detail.chiebukuro.yahoo.co.jp/qa/question_detail/q13324705523,マンションで一人暮らしをしている者です。お風呂上がりに換気扇を回すと下水のような臭いがします。1Kでお風呂がすぐ近くの場所にあるので臭いも強くて困っています。何か対処法あれば、教えていただきたいです。,0,0
773,2026/1/26 19:33,X（旧Twitter）,tgmwajv,6時間14分,1,24,24.0,0,1,0.064,4.17,0.02,0.28,あと3日,https://detail.chiebukuro.yahoo.co.jp/qa/question_detail/q12324705522,恋と深空オフイベの動画についてです 本国で開催されたオフイベで、シンさんのとても好きだった動画がTwitter上で消されており、探しましたが同じものを見つけられずにいます。TikTokやFaceboo...,0,0
774,2026/1/26 19:33,インターネットショッピング,sas********,6時間14分,1,33,33.0,0,0,0.088,3.03,0.03,0.22,あと3日,https://detail.chiebukuro.yahoo.co.jp/qa/question_detail/q11324705521,yahooのショップでダウンコートを購入しました。カード払いで決済をしてエラーもなく注文終了、後日発送されました。 配達日になっても届かないので配送状況を確認したところ「取り戻しのため差出人に返送」と...,0,0
775,2026/1/26 19:33,ギター、ベース,玉葉,6時間14分,0,5,5.0,0,0,0.013,0.0,0.0,0.01,あと3日,https://detail.chiebukuro.yahoo.co.jp/qa/question_detail/q10324705520,ポリフィアの曲を聴いて毎回発想力やテクニックに感動してます。 そこで気になったのですがもし現存するギタリストのうまさ総合力ランキングトップ5を作るとしたら、ティムヘンソンは入るでしょうか。 またトップ...,0,0
776,2026/1/26 19:33,福祉、介護,ab9b9c556,6時間14分,2,53,26.5,1,6,0.142,3.77,0.04,1.15,あと3日,https://detail.chiebukuro.yahoo.co.jp/qa/question_detail/q14324705519,知人に障害者雇用の人がいます。その人は、大学出て車の免許も取得したのに、なぜA型作業所の雇用になるのでしょうか？ 知人ですが高校もそんなに偏差値低くありません。(むしろ私の方がアホ高校出てますし、高卒...,0,0
777,2026/1/26 19:33,ヘアケア,1052649841,6時間14分,2,7,3.5,0,0,0.019,28.57,0.0,0.28,あと3日,https://detail.chiebukuro.yahoo.co.jp/qa/question_detail/q13324705518,男です。現在パーマをかけていて朝オイルとバームを混ぜてヘアセットをしてるのですが、夜になると乾いてしまいます。こちら仕方ないことでしょうか。髪の長さは鎖骨よりちょい下くらいです。,0,0
779,2026/1/26 19:33,ウイルス対策、セキュリティ対策,1252456382,6時間14分,4,32,8.0,0,1,0.085,12.5,0.01,0.7,あと3日,https://detail.chiebukuro.yahoo.co.jp/qa/question_detail/q10324705515,ラブホに行った際、根元が見えないこのタイプの充電器にiphoneを充電してしまったのですが、やはりウイルスに感染したりする可能性はありますか？すごく心配です。 根元が見えないので、根本は何と接続されて...,0,0
780,2026/1/26 19:33,本、雑誌,aabbcc,6時間14分,1,24,24.0,0,0,0.064,4.17,0.02,0.2,あと3日,https://detail.chiebukuro.yahoo.co.jp/qa/question_detail/q11324705516,『死亡遊戯で飯を食う。 』のスクラップビルのエピソードで、幽鬼が智恵に言葉をおぶって助けるように頼んだのは、まだチームに対して何も貢献してない智恵が最後の処刑投票の試練で圧倒的に不利になると思ってちょ...,0,0
781,2026/1/26 19:33,プロ野球,1051630936,6時間14分,4,39,9.8,0,0,0.104,10.26,0.01,0.64,あと3日,https://detail.chiebukuro.yahoo.co.jp/qa/question_detail/q13324705513,阪神タイガースは連覇に向けた対応を図っているのでしょうが一方侍Jに佐藤、森下、石井、坂本の４選手が選ばれました。 当然チームは４選手の派遣にOKを出したのでしょうがWBCに選ばれると選手へのペナントレ...,0,0
782,2026/1/26 19:33,ライブ、コンサート,回答求,6時間14分,0,10,10.0,0,0,0.027,0.0,0.0,0.03,あと3日,https://detail.chiebukuro.yahoo.co.jp/qa/question_detail/q12324705512,バンドのワンマンライブについてです。 今年のNovelbrightのホールツアーに申し込みました。 私はファンクラブには入っておらず、バンドのライブも行ったことなく、初めて申し込みます。 もし当たった...,0,0
783,2026/1/26 19:33,インターネット接続,J007,6時間14分,2,30,15.0,1,0,0.08,6.67,0.01,0.61,あと3日,https://detail.chiebukuro.yahoo.co.jp/qa/question_detail/q11324705511,宅パソコンをインタネットに接続し 一戸建て住宅内をWiFi接続にするには パスコン＋ルーター機器とほかに、 必要な機器は何ですか ソフトバンク商品の「モバレコAir」をコンセントに差し込めば インター...,0,0
784,2026/1/26 19:33,大学受験,1053165808,6時間14分,5,48,9.6,0,1,0.128,10.42,0.01,0.87,あと3日,https://detail.chiebukuro.yahoo.co.jp/qa/question_detail/q10324705510,大学の進学先を迷っています 私は学校に関わる仕事がしたいと考えていまして、武庫川女子大学の心理学科に入りスクールカウンセラーになるか佛教大学の歴史学部歴史学科に入り高校の教員の道に進むか悩んでいます。...,0,0
785,2026/1/26 19:33,ヘアスタイル,1151370800,6時間14分,2,23,11.5,0,0,0.061,8.7,0.01,0.33,あと3日,https://detail.chiebukuro.yahoo.co.jp/qa/question_detail/q14324705509,女子高生です おでこのあぶらに悩んでいます すぐに前髪がベタベタになってしまいすごく恥ずかしいです 毎時間パウダーみたいなものをやるのは大変で何かいい方法ありませんか？ なにか方法があればお願いします,0,0
786,2026/1/26 19:33,大学受験,大竹ありません,6時間15分,5,87,17.4,1,2,0.232,5.75,0.04,1.32,あと3日,https://detail.chiebukuro.yahoo.co.jp/qa/question_detail/q13324705508,至急お願いします 3浪で早慶下位学部と2浪で関関同立はどちらがいいですか？ すでに2浪している理由は1浪，現役の時は行きたい大学がなく全く勉強していなかったためです。 1浪目終盤に行きたい大学ができ，...,0,0
787,2026/1/26 19:33,災害,もっこりまん,6時間15分,3,28,9.3,0,0,0.075,10.71,0.01,0.47,あと3日,https://detail.chiebukuro.yahoo.co.jp/qa/question_detail/q12324705507,山火事（林野火災）の際、上空からヘリコプターが何か撒いているような映像をニュースで良く見かけますが、あれは何を撒いてるんですか？？ それから、意味あるんですか？（霧になって終わりのような気がするのです...,0,0
788,2026/1/26 19:33,恋愛相談、人間関係の悩み,nnnrg069,6時間15分,2,37,18.5,0,0,0.099,5.41,0.02,0.36,あと3日,https://detail.chiebukuro.yahoo.co.jp/qa/question_detail/q11324705506,今週末から半年付き合っているベトナム人の彼氏とベトナムに行くのに、直前で喧嘩しました。 日本で料理のための材料を買いにいくのがめんどくさい→無理に料理しなくていい→じゃあ料理しない→LINEの画像とい...,0,0
789,2026/1/26 19:33,家電、AV機器,edk********,6時間15分,0,20,20.0,0,0,0.053,0.0,0.0,0.05,あと3日,https://detail.chiebukuro.yahoo.co.jp/qa/question_detail/q10324705505,基板のこのテカテカはフラックスですか？それともコーティングですか？ ハンダゴテで既についてる故障したセンサーを新しいものと交換したいのですが、場合はそのままコテで熱して外して大丈夫ですか？ 回答宜しく...,0,0
790,2026/1/26 19:33,Windows 10,hig********,6時間15分,1,10,10.0,0,0,0.027,10.0,0.0,0.16,あと3日,https://detail.chiebukuro.yahoo.co.jp/qa/question_detail/q14324705504,GoogleMAPのコンパスを使用したくて、航空写真の地球表示を選択したいのですが、灰色で選択できません。 調べると、設定で ハードウェアアクセラレーターを有効にしないといけないのですが、グラフィック...,0,0
791,2026/1/26 19:33,菓子、スイーツ,kyo********,6時間15分,2,6,3.0,1,0,0.016,33.33,0.0,0.55,あと3日,https://detail.chiebukuro.yahoo.co.jp/qa/question_detail/q13324705503,冬アイスで代表的な商商品を教えてください,0,0
792,2026/1/26 19:33,恋愛相談、人間関係の悩み,あ,6時間15分,0,11,11.0,0,0,0.029,0.0,0.0,0.03,あと3日,https://detail.chiebukuro.yahoo.co.jp/qa/question_detail/q12324705502,女の子に質問。あなたの名前と写真が貼り付けられて釘を何本も打ち込まれた藁人形があなたの自宅マンションやアパートの玄関前に置かれてたらどう思いますか？,0,0
793,2026/1/26 19:33,病気、症状,...,6時間15分,2,31,15.5,1,0,0.083,6.45,0.01,0.61,あと3日,https://detail.chiebukuro.yahoo.co.jp/qa/question_detail/q11324705501,この骨の出っ張りはどうしたら解消できるでしょうか。 2年前に腰椎〜胸椎、仙骨、肋骨、骨盤など画像に写っている周辺の骨はほとんど折りました。 背中が固定されているためヨガや撚る動きができません。 足も駄...,0,0
794,2026/1/26 19:33,大学受験,エビの推し活,6時間15分,1,23,23.0,0,0,0.061,4.35,0.01,0.19,あと3日,https://detail.chiebukuro.yahoo.co.jp/qa/question_detail/q13324705498,高二早稲田志望です。解釈の参考書、英文熟考上下をやるか、解釈ポラリス1.2をやるか迷ってます。どちらがオススメですか。解釈は今まで動画でわかると入門英文問題精講をやりました。,0,0
795,2026/1/26 19:33,電子マネー、電子決済,rwr********,6時間15分,2,7,3.5,0,0,0.019,28.57,0.0,0.28,あと3日,https://detail.chiebukuro.yahoo.co.jp/qa/question_detail/q14324705499,PayPayの残高をPayPayクレジットでチャージした場合、PayPayクレジットからチャージしたPayPay支払いの残高はPayPayアカウントの友達登録している友人に送金できますか？ 例）2万円...,0,0
796,2026/1/26 19:33,大学受験,名無し,6時間15分,0,28,28.0,0,0,0.075,0.0,0.0,0.07,あと3日,https://detail.chiebukuro.yahoo.co.jp/qa/question_detail/q10324705500,法政大学経営学部の、共テ利用とA方式(学部別試験)に出願しました。共テ利用がボーダー＋110点でリサーチA判定でした。 親には「A方式受験するのやめてもいいんじゃない？」と言われたのですが、どう思いま...,0,0
797,2026/1/26 19:33,料理、食材,心技体,6時間15分,3,14,4.7,0,0,0.037,21.43,0.0,0.44,あと3日,https://detail.chiebukuro.yahoo.co.jp/qa/question_detail/q12324705497,最近知って毎日食べていますが ギリシャヨーグルトはコクが有りとても美味しいと感じました 但し安くないです 460円位します 皆様コク深いヨーグルトは好きですか？,0,0
798,2026/1/26 19:32,ゲーム,1052520346,6時間16分,1,20,20.0,0,0,0.053,5.0,0.01,0.19,不明,https://detail.chiebukuro.yahoo.co.jp/qa/question_detail/q11324705496,フォートナイトのブレインロットについて質問です。このクリスマスロス家とネオン家の相場はいくらぐらいになるでしょうか？,0,0
799,2026/1/26 19:32,将来の夢,チェリアン,6時間16分,2,8,4.0,0,0,0.021,25.0,0.0,0.29,あと3日,https://detail.chiebukuro.yahoo.co.jp/qa/question_detail/q10324705495,未来のステージで空中に浮かんで踊るとしたら、風や重力の影響ってどう計算すれば安全にパフォーマンスできますか？,0,0
800,2026/1/26 19:32,DTM,スーパーサイヤ,6時間16分,0,3,3.0,0,0,0.008,0.0,0.0,0.01,あと3日,https://detail.chiebukuro.yahoo.co.jp/qa/question_detail/q14324705494,Hollywood orchestra シリーズで パンはどこから確認出来るのでしょうか？ opusのどこを見てもわからないので、教えていただきたいです。,0,0
801,2026/1/26 19:32,大学,1052539159,6時間16分,0,3,3.0,0,0,0.008,0.0,0.0,0.01,あと3日,https://detail.chiebukuro.yahoo.co.jp/qa/question_detail/q13324705493,法政大学理系の人に質問です。春から法政大学に通うのですが、理系で学校からの貸与パソコンを使っている人の割合はどれくらいですか？ 私の家は所得で言うと平均よりは上なのですが、せっかく無料で貸してくれるな...,0,0
802,2026/1/26 19:32,ダイエット,もも,6時間17分,4,36,9.0,0,0,0.095,11.11,0.01,0.62,あと3日,https://detail.chiebukuro.yahoo.co.jp/qa/question_detail/q12324705492,ダイエット、目標達成したら終わり、にしてしまったらリバウンドまっしぐらなので、終わりがなくて辛いです。 食事と運動で8キロ痩せたけど、こっから食事てきとーにしたら苦労して痩せたのが台無しだって思ってあ...,0,0
803,2026/1/26 19:32,モンスターハンター,ID 非公開,6時間17分,4,32,8.0,0,0,0.085,12.5,0.01,0.61,あと3日,https://detail.chiebukuro.yahoo.co.jp/qa/question_detail/q10324705490,モンハンサンブレイクについてです。Xで見かけた写真なんですが、エルガドにヒノエ、ミノトがいるのは何ででしょう？そういう連れ歩きみたいな機能があるんですか？それともmodでしょうか？,0,0
804,2026/1/26 19:32,アニメ,1252111856,6時間17分,0,3,3.0,0,0,0.008,0.0,0.0,0.01,あと3日,https://detail.chiebukuro.yahoo.co.jp/qa/question_detail/q14324705489,秤vs鹿紫雲はアニメ第何話で放送されますか？,0,0
805,2026/1/26 19:32,アニメ,1052946928,6時間17分,1,31,31.0,0,2,0.082,3.23,0.03,0.37,不明,https://detail.chiebukuro.yahoo.co.jp/qa/question_detail/q13324705488,転スラの小説版と漫画版は内容とか違うのですか？小説の方はもう完結していると聞いたのですが……,0,0
806,2026/1/26 19:32,iPhone,11,6時間17分,2,14,7.0,0,0,0.037,14.29,0.0,0.3,あと3日,https://detail.chiebukuro.yahoo.co.jp/qa/question_detail/q12324705487,airpods pro3について イヤーチップはまだ出回っていない感じですか？ 風きり音を少し感じるので何とかしたいです。,0,0
807,2026/1/26 19:32,アニメ,初信【龍神】,6時間17分,1,38,38.0,0,3,0.101,2.63,0.04,0.47,あと3日,https://detail.chiebukuro.yahoo.co.jp/qa/question_detail/q11324705486,半世紀も前のアニメですが、もしかするとこういったアニメが学校よりも子供たちに学びと気付きを与えていたのかも知れませんね。 日本の他国を差別する民度の低い連中は見るべきではないでしょうか？ 同じ魔法でも...,0,0
808,2026/1/26 19:32,アニメ,musimusi,6時間17分,2,9,4.5,0,0,0.024,22.22,0.0,0.29,あと3日,https://detail.chiebukuro.yahoo.co.jp/qa/question_detail/q10324705485,プリキュアとラブライブ!で、あなたはどちらが好きですか？,0,0
809,2026/1/26 19:32,マインクラフト,1051900093,6時間17分,1,21,21.0,0,0,0.056,4.76,0.01,0.19,あと3日,https://detail.chiebukuro.yahoo.co.jp/qa/question_detail/q14324705484,マイクラのコマンドについて質問です。 統合版のマイクラでジャングルの場所を知りたいです。 /locate biome jungle と入力したら構文エラーが出てしまいます。 どこが間違えているのか教え...,0,0
810,2026/1/26 19:32,うつ病,1252462772,6時間17分,4,31,7.8,0,3,0.082,12.9,0.01,0.85,あと3日,https://detail.chiebukuro.yahoo.co.jp/qa/question_detail/q13324705483,精神科に行くべきか判断して欲しいです。 自分は月経前、最中、終わってから数日の期間に気分がひどく落ち込みます。その期間はリストカットや過食嘔吐を再発してしまいます。しかし自分は鬱病になったことがないの...,0,0
811,2026/1/26 19:32,転職,rob********,6時間17分,2,46,23.0,0,0,0.122,4.35,0.03,0.39,あと3日,https://detail.chiebukuro.yahoo.co.jp/qa/question_detail/q10324705480,以前、転職について相談させていただきましたが、再度質問させていただきます。前回の質問文を用いてになります。 人口およそ6万人程度のとある市の社会福祉協議会(以下A社協)に勤務しています。役職は係長級、...,0,0
