1503,2026/1/31 5:10,インターネットビジネス、SOHO,yum********,10時間57分,0,9,9.0,1,0,0.014,0.0,0.0,0.17,あと3日,https://detail.chiebukuro.yahoo.co.jp/qa/question_detail/q12324850167,無料AIセミナーの広告が沢山ありますが大丈夫？ 特典付き完全無料ZOOMでの講座が沢山あり、内容もしっかりした物の様に思います。 何故無料で受けられるのか？終了後に繰返し有料の何かの勧誘がないか？など...,0,0
1504,2026/1/31 5:10,ピアス,なんだろ。,10時間58分,2,28,14.0,0,0,0.043,7.14,0.01,0.19,あと3日,https://detail.chiebukuro.yahoo.co.jp/qa/question_detail/q10324850165,現在、ピアスが5個あいてます。もう1個開けたいなって思ってるんですがどこに開けたらかわいいですか？ 写真の黒点が開いてるところです。,0,0
1505,2026/1/31 5:10,競馬,凸,10時間58分,2,28,14.0,0,6,0.043,7.14,0.01,0.47,あと3日,https://detail.chiebukuro.yahoo.co.jp/qa/question_detail/q14324850164,凸の一日一問！（第1487問） 【POG指名馬出走？】 土曜京都7R3歳1勝クラス 砂1800m ◎①カムアップローゼス（吉村） POG指名馬です！ 単勝を買って応援します！ 母系にファレノプシス、 ...,0,0
1506,2026/1/31 5:10,シニアライフ、シルバーライフ,翠,10時間58分,4,39,9.8,0,2,0.059,10.26,0.01,0.45,あと3日,https://detail.chiebukuro.yahoo.co.jp/qa/question_detail/q13324850163,私の上から目線度は平均的なところでしょうか。,0,0
1507,2026/1/31 5:10,恋愛相談、人間関係の悩み,emi,10時間58分,3,20,6.7,0,0,0.03,15.0,0.0,0.26,あと3日,https://detail.chiebukuro.yahoo.co.jp/qa/question_detail/q12324850162,マチアプで、初デートの場所や日時を勝手に決める人が居ますが、その人と会うの辞めた方が良いでしょうか？,0,0
1508,2026/1/31 5:10,バラエティ、お笑い,hir********,10時間58分,1,14,14.0,0,0,0.021,7.14,0.0,0.1,あと3日,https://detail.chiebukuro.yahoo.co.jp/qa/question_detail/q11324850161,ピコ太郎のペンパイナッポーアッポーペンが数年前に海外でも流行りましたが、どういった点が面白いのですか？,0,0
1510,2026/1/31 5:10,ピアス,あ,10時間58分,1,26,26.0,0,0,0.039,3.85,0.01,0.12,あと3日,https://detail.chiebukuro.yahoo.co.jp/qa/question_detail/q14324850159,このインダスの下側、排除始まっていますよね...？ インダス用として使うのを辞めるとして、このホール単独でいい感じに使えそうでしょうか？おすすめのピアスがあれば教えていただきたいです。 難しそうだった...,0,0
1511,2026/1/31 5:10,恋愛相談、人間関係の悩み,tatj pdgd,10時間58分,3,59,19.7,0,0,0.09,5.08,0.02,0.32,あと3日,https://detail.chiebukuro.yahoo.co.jp/qa/question_detail/q13324850158,中絶を経験しその後別れた人達はどうやって生きていますか？ 去年の6月に妊娠発覚し私の知らないとこで堕ろす方向で話が進んでいました、私の意見などなく。 私は1人でも産みたいと気持ちがずっとありました。 ...,0,0
1512,2026/1/31 5:09,病気、症状,tat********,10時間59分,1,16,16.0,0,0,0.024,6.25,0.0,0.1,あと3日,https://detail.chiebukuro.yahoo.co.jp/qa/question_detail/q10324850155,鼻の穴についての質問です。 何年も前からなのですが鼻の穴の中の入り口付近にニキビみたいな物ができて痛いです。膿のような物も出てきて固まるので鼻の穴を塞いでしまうし臭いです。 耳鼻科へも行きましたが原因...,0,0
1513,2026/1/31 5:09,子育ての悩み,cb039fdc0,10時間59分,3,41,13.7,0,1,0.062,7.32,0.01,0.33,あと3日,https://detail.chiebukuro.yahoo.co.jp/qa/question_detail/q14324850154,赤ちゃんのお世話をほとんど出来ていません。 最近夜中に起きるんですが一目散にわたしの母の方にハイハイしていきます。 仕方ないですよね？母がほとんどお世話してます もうわたしは不必要でしょうか。 最初は...,0,0
1514,2026/1/31 5:08,スーパーマーケット,1252159508,11時間0分,1,20,20.0,1,0,0.03,5.0,0.01,0.26,あと3日,https://detail.chiebukuro.yahoo.co.jp/qa/question_detail/q13324850153,駅から家までの道にスーパーやドラッグストアが無く、車もないのであまり買い物に行く気が起きず、ネットスーパーを検討しています。 パルシステムなどの生協、イオンネットスーパー、ウーバー、Amazonのライ...,0,0
1515,2026/1/31 5:07,家族関係の悩み,1251082823,11時間1分,3,76,25.3,0,3,0.115,3.95,0.03,0.48,あと3日,https://detail.chiebukuro.yahoo.co.jp/qa/question_detail/q12324850152,夫婦喧嘩で警察沙汰になりました 「うるさいぞ。」、と言って 下の階の人が旦那に「警察呼ぼうか？」 と聞いたら主人はなんと、「頼むわ。」 と言いました。 私は自分で近くの派出所に行って 事の次第を説明し...,0,0
1516,2026/1/31 5:07,バスケットボール,bun********,11時間1分,0,9,9.0,0,0,0.014,0.0,0.0,0.01,あと3日,https://detail.chiebukuro.yahoo.co.jp/qa/question_detail/q11324850151,八村塁ってアメリカ人から見ると東洋的な風貌なんですか？,0,0
1517,2026/1/31 5:07,iPhone,*,11時間1分,2,42,21.0,0,1,0.063,4.76,0.01,0.26,あと3日,https://detail.chiebukuro.yahoo.co.jp/qa/question_detail/q14324850149,Apple ID アカウントについてです。 メールアドレスとパスワードはちゃんとメモしてます。ですが今のiPhoneがぶっ壊れたとき、次のiPhoneにデータ移行ってできるのでしょうか？ 2ファクタ認...,0,0
1518,2026/1/31 5:06,オーディオ,ffu********,11時間2分,2,21,10.5,0,0,0.032,9.52,0.0,0.18,あと3日,https://detail.chiebukuro.yahoo.co.jp/qa/question_detail/q13324850148,至急質問です。 アンカーSoundCore2のスピーカーを2年ほど前から使用しています。最近充電できないことが多く、ただ気が付けば充電できていることやノイズ音等はなかったためそのまま使っていました。常...,0,0
1519,2026/1/31 5:06,Instagram,tjgtm2j,11時間2分,3,52,17.3,0,0,0.078,5.77,0.01,0.3,あと3日,https://detail.chiebukuro.yahoo.co.jp/qa/question_detail/q12324850147,インスタは消えるメッセージって警察に押収されたら復元できるんですか？、,0,0
1520,2026/1/31 5:06,家族関係の悩み,非公開,11時間2分,7,74,10.6,0,5,0.112,9.46,0.01,0.86,あと3日,https://detail.chiebukuro.yahoo.co.jp/qa/question_detail/q11324850146,毎日高校生の長男のお弁当作って冷凍食品に頼らず４〜5品は作ってる。でも給食が恋しいと何度か言われた。やる気失せてきた。 次男の中学生の弟に、長男が高校生の弁当憧れるか聞いていて、弟は「いや、憧れない」...,0,0
1522,2026/1/31 5:05,ライブ、コンサート,c49366uytrf,11時間4分,1,18,18.0,0,0,0.027,5.56,0.0,0.1,あと3日,https://detail.chiebukuro.yahoo.co.jp/qa/question_detail/q13324850143,【大至急】 ツタロックフェス2026に当選しました。イープラスでの購入です。 休養で行けなくなってしまいました。チケジャムでのリセールはできるのでしょうか？？ 私のものと友達のもの、2枚を他の方に譲渡...,0,0
1523,2026/1/31 5:05,政治、社会問題,bfl********,11時間4分,6,53,8.8,0,1,0.08,11.32,0.01,0.58,あと3日,https://detail.chiebukuro.yahoo.co.jp/qa/question_detail/q12324850142,高市早苗はレジの設定に1年は必要と言ってのに、最近、新しい情報を何処から仕入れて半年位で出来ると頭脳をアップデート出来たのでしょうか？,0,0
1524,2026/1/31 5:04,恋愛相談、人間関係の悩み,b64e635da,11時間5分,5,94,18.8,0,9,0.141,5.32,0.03,0.92,あと3日,https://detail.chiebukuro.yahoo.co.jp/qa/question_detail/q10324850140,同棲している彼に浮気されました！彼の今までの彼女たちみんな彼の浮気で別れています 私は尽くしてきたし、明るい未来に進みたいです！ 応援の言葉ください！,0,0
1525,2026/1/31 5:04,小・中学校、高校,aaa********,11時間5分,1,9,9.0,0,0,0.014,11.11,0.0,0.09,あと3日,https://detail.chiebukuro.yahoo.co.jp/qa/question_detail/q13324850138,田園調布雙葉中学校・高等学校 は賢い学校ですか？,0,0
1526,2026/1/31 5:04,哲学、倫理,妖怪 厨2壁,11時間5分,7,49,7.0,0,0,0.074,14.29,0.01,0.6,あと3日,https://detail.chiebukuro.yahoo.co.jp/qa/question_detail/q12324850137,【お金】実は、偽の幸せだと思いますか？,0,0
1527,2026/1/31 5:04,家族関係の悩み,非公開,11時間5分,1,11,11.0,0,0,0.017,9.09,0.0,0.09,あと3日,https://detail.chiebukuro.yahoo.co.jp/qa/question_detail/q11324850136,2月にお母さんの誕生日とおばあちゃんの誕生日があるんですけど、それぞれに何買ってあげたらいいと思いますか？ 予算はそれぞれ2000円以下位です。 おばあちゃんにはショルダーバッグを買ってあげたかったの...,0,0
1528,2026/1/31 5:04,資産運用、投資信託、NISA,20251227/1007,11時間5分,0,6,6.0,0,0,0.009,0.0,0.0,0.01,あと3日,https://detail.chiebukuro.yahoo.co.jp/qa/question_detail/q10324850135,CFDの日経平均は現物や225先物と微妙に価格差がありますが公設市場と裁定取引はできますか？,0,0
1529,2026/1/31 5:04,お酒、ドリンク,ぬ,11時間5分,1,6,6.0,0,0,0.009,16.67,0.0,0.08,あと3日,https://detail.chiebukuro.yahoo.co.jp/qa/question_detail/q14324850134,GX22で-5℃設定にすれば生酒でも保存期間は伸びますか？買いすぎて飲み切れる気がしません。 凍ってしまいそうで不安です。,0,0
1530,2026/1/31 5:04,ダイエット,ckd********,11時間5分,4,40,10.0,0,0,0.06,10.0,0.01,0.36,あと3日,https://detail.chiebukuro.yahoo.co.jp/qa/question_detail/q11324850131,今ダイエット中ですが、体重がなかなか落ちません。ほとんど食ってないのにです。 紅茶やお茶はわりと自由に飲んでしまっているからでしょうか？ どうすれば体重が落ちますか？,0,0
1531,2026/1/31 5:03,ゲーム,1052452015,11時間6分,0,6,6.0,0,0,0.009,0.0,0.0,0.01,あと3日,https://detail.chiebukuro.yahoo.co.jp/qa/question_detail/q10324850130,イナイレVについて質問です ど根性クラブ、ど根性キャッチを入手するにはどうしたらいいですか？ それか元から使える選手はいますか？,0,0
1532,2026/1/31 5:03,友人関係の悩み,非公開,11時間6分,5,31,6.2,0,1,0.046,16.13,0.0,0.47,あと3日,https://detail.chiebukuro.yahoo.co.jp/qa/question_detail/q13324850128,友達からのLINEで旦那の愚痴がしんどい 専業主婦で旦那は頑張って働いているように思えるのですが 子育てを全くやらない 金を使わせてくれない 性行為が嫌だ などの理由で離婚も考えているそうです 正直、...,0,0
1533,2026/1/31 5:03,病気、症状,a10b86229,11時間6分,2,17,8.5,0,0,0.025,11.76,0.0,0.18,あと3日,https://detail.chiebukuro.yahoo.co.jp/qa/question_detail/q12324850127,階段を踏み外し、4.5段背中に打ち付けていて痛みがどのくらい続くようでしたら病院行った方がいいですか？,0,0
1534,2026/1/31 5:03,おもちゃ,bla********,11時間7分,3,29,9.7,0,0,0.043,10.34,0.0,0.27,あと3日,https://detail.chiebukuro.yahoo.co.jp/qa/question_detail/q11324850126,ここ1年くらいゲーセンのプライズフィギュアを取るのが趣味になりつつありますが 最近はそのプライズフィギュアが100体くらいになり、部屋を圧迫しつつあります。 獲得して満足してしまうので未開封のまま放置...,0,0
1535,2026/1/31 5:02,英語,can********,11時間8分,8,73,9.1,0,2,0.109,10.96,0.01,0.8,あと3日,https://detail.chiebukuro.yahoo.co.jp/qa/question_detail/q10324850125,"お尋ねします。 I entered my office, and found a gentleman seated by the table. （『Sherlock Holmes Short Stor...",0,0
1536,2026/1/31 5:02,声優,a23b5d4e9,11時間8分,1,16,16.0,0,0,0.024,6.25,0.0,0.1,あと3日,https://detail.chiebukuro.yahoo.co.jp/qa/question_detail/q13324850123,声優に詳しい人に質問です。 この男性声優達の中で人気、演技力、唯一無二の個性、業界や先輩からの評価の高さ順でランキング作るならどんな風になるか教えてください。理由もあれば教えてください。ファン視点なし...,0,0
1537,2026/1/31 5:02,恋愛相談、人間関係の悩み,lD非公開,11時間8分,0,9,9.0,0,0,0.013,0.0,0.0,0.01,あと3日,https://detail.chiebukuro.yahoo.co.jp/qa/question_detail/q11324850121,ディスコで個人通話している時3分間相手が不在だと自動切断されるのは知っているのですが、その場合チャットには確実にこの通話は相手がいないまま3分以上経過しています。というチャットが表示されるのですか？,0,0
1538,2026/1/31 5:02,Yahoo!サービス,めん,11時間8分,1,11,11.0,0,0,0.016,9.09,0.0,0.09,あと3日,https://detail.chiebukuro.yahoo.co.jp/qa/question_detail/q10324850120,Twitterにあげた投稿とは別の物を画像検索すると出てくるようになってしまいました、、 非公開にしたり投稿削除したんですけどYahooジャパンってとこで出てくるのだけ消えないです‬、画像検索で出てこ...,0,0
1539,2026/1/31 5:02,恋愛相談、人間関係の悩み,非公開,11時間8分,2,26,13.0,0,1,0.039,7.69,0.01,0.23,あと3日,https://detail.chiebukuro.yahoo.co.jp/qa/question_detail/q13324850118,家族が反対する恋人 めちゃくちゃ信用してて、人間性も大好きな自分の妹が、多分やめといた方がいいっていう恋人は本当にやめといた方がいいと思いますか？ 猛反対とかじゃなくて違和感があるからやめといた方がい...,0,0
1540,2026/1/31 5:02,海外生活,非行会,11時間8分,10,30,3.0,0,7,0.045,33.33,0.0,1.11,あと3日,https://detail.chiebukuro.yahoo.co.jp/qa/question_detail/q12324850117,アメリカに住むメリットってなんですか？ 危ないし高いしホームレス多いし汚いし娯楽少ないし フレンドリーといっても日本もフレンドリーな人多いし、何よりアメリカ人より意見押し付けたりしないし過干渉じゃない...,0,0
1541,2026/1/31 5:02,職場の悩み,a******,11時間8分,0,14,14.0,0,0,0.021,0.0,0.0,0.02,あと3日,https://detail.chiebukuro.yahoo.co.jp/qa/question_detail/q11324850116,場所によるかもしれないけど 同期同士で仲良くワイワイやってる感じなのも最初だけで数年目とかになってくると、普通は廃れていきますか。,0,0
1542,2026/1/31 5:02,海外,c52ede794,11時間8分,1,22,22.0,0,0,0.033,4.55,0.01,0.11,あと3日,https://detail.chiebukuro.yahoo.co.jp/qa/question_detail/q10324850115,国際線にのって韓国へ行くのですが、ウエットトラスト(潤滑剤)はスーツケースにいれて持っていけますでしょうか？ 彼氏と旅行なのですが、彼氏には潤滑剤を使っていることを秘密にしているので、どうしたらいいか...,0,0
1543,2026/1/31 5:02,ストレス,ハニーレモン,11時間8分,2,41,20.5,0,3,0.061,4.88,0.01,0.34,あと3日,https://detail.chiebukuro.yahoo.co.jp/qa/question_detail/q14324850114,夜ベッドで寝付けません 生活大変なのに旦那の隣で寝るのか…とか ストレスが溜まってるんでしょうか 何度も実家に帰ってますが、また帰った方が いいですか？,0,0
1544,2026/1/31 5:02,フェリー、港,bfbdfc6c0,11時間8分,2,26,13.0,0,0,0.039,7.69,0.01,0.19,あと3日,https://detail.chiebukuro.yahoo.co.jp/qa/question_detail/q13324850113,昔、造船所に工場見学したときに見せてもらった大型の船に、最大３０キロ先まで見える双眼鏡が置いてあったのですが、どういった時に海上で３０キロ先を見るんですか？,0,0
1545,2026/1/31 5:02,大相撲,ben********,11時間8分,0,13,13.0,0,0,0.019,0.0,0.0,0.02,あと3日,https://detail.chiebukuro.yahoo.co.jp/qa/question_detail/q12324850112,「安青錦」こそ「戦闘竜」ではありませんか？,0,0
1546,2026/1/31 5:02,冷蔵庫、キッチン家電,kin********,11時間8分,0,28,28.0,0,0,0.042,0.0,0.0,0.04,あと3日,https://detail.chiebukuro.yahoo.co.jp/qa/question_detail/q14324753064,パナソニックの食洗機を使用しています。 品番NP-P45VD3シリーズ ある日突然食洗機内にネジが二本落ちていました。 庫内を見てもどこもネジが取れているのは発見出来ず、使用には問題なくそのまま使用を...,0,0
1547,2026/1/31 5:02,ファッション,匿名,11時間8分,0,37,37.0,0,0,0.055,0.0,0.0,0.06,あと3日,https://detail.chiebukuro.yahoo.co.jp/qa/question_detail/q14324753029,お願い‼️ このズボンどこで買えるか 分かる人いませんか‼️,0,0
1548,2026/1/31 5:02,テーマパーク,a5e0ba219,11時間8分,0,86,86.0,0,0,0.129,0.0,0.0,0.13,あと3日,https://detail.chiebukuro.yahoo.co.jp/qa/question_detail/q14324752819,メロンチケットのキャンセル拾いをしたいのですが、大体何時頃に出るかわかる方教えて頂きたいですm(_ _)m melonticket チケッティング,0,0
1549,2026/1/31 5:02,邦楽,非公開,11時間9分,2,25,12.5,1,0,0.037,8.0,0.0,0.34,不明,https://detail.chiebukuro.yahoo.co.jp/qa/question_detail/q14324752824,L'Arc〜en〜Cielの新作は2026年内に出ると思われますか？,0,0
1550,2026/1/31 5:01,シニアライフ、シルバーライフ,砂糖 茶,11時間10分,1,17,17.0,0,0,0.025,5.88,0.0,0.1,あと3日,https://detail.chiebukuro.yahoo.co.jp/qa/question_detail/q13324752993,寺内貫太郎一家番外編では、 誰が登場したか覚えていますか？,0,0
1551,2026/1/31 5:01,メイク、コスメ,c57057524,11時間10分,0,27,27.0,0,0,0.04,0.0,0.0,0.04,あと3日,https://detail.chiebukuro.yahoo.co.jp/qa/question_detail/q13324752853,アイブロウ開けてから1ヶ月経ちましたこれって排除されてきてますかね？,0,0
1552,2026/1/31 5:01,生理,par********,11時間10分,1,21,21.0,0,0,0.031,4.76,0.01,0.11,あと3日,https://detail.chiebukuro.yahoo.co.jp/qa/question_detail/q13324752783,生理前の不調で仕事を休むのは甘えでしょうか？ 今朝仕事に行こうとすると、吐き気が酷く倦怠感もひどく休んでしまいました。 一日中何も出来ずいえにいただけでした。 夜も明日のことを考えると吐き気がしあがっ...,0,0
1553,2026/1/31 5:01,イベント、フェス,tor********,11時間10分,0,13,13.0,0,0,0.019,0.0,0.0,0.02,あと3日,https://detail.chiebukuro.yahoo.co.jp/qa/question_detail/q12324753062,各地の寒中禊で白装束の女性参加者を写真撮影してもあまり不快にならないのは何か原因ありますか？他のモータースポーツショウや高校、大学の女子参加のイベントはかなり写真撮影してますので。,0,0
1554,2026/1/31 5:01,メイク、コスメ,非公開,11時間10分,1,9,9.0,0,0,0.013,11.11,0.0,0.09,あと3日,https://detail.chiebukuro.yahoo.co.jp/qa/question_detail/q12324752857,ヴィジュアル系やゴシック系のメイク、リップはどんなものがおすすめですか？ また、具体的にものを教えて頂けたら嬉しいです。,0,0
1555,2026/1/31 5:01,高校受験,tom********,11時間10分,0,35,35.0,0,0,0.052,0.0,0.0,0.05,あと3日,https://detail.chiebukuro.yahoo.co.jp/qa/question_detail/q12324753012,間もなく高校の特色選抜受験があり、同日に個人面接が2回という試験内容なのですが、1回は通常の面接だとして2回目はどういった面接が考えられるのでしょうか。 その高校は特色受験の応募条件として、学力(内申...,0,0
1556,2026/1/31 5:01,職場の悩み,よ,11時間10分,1,81,81.0,0,0,0.121,1.23,0.1,0.2,あと3日,https://detail.chiebukuro.yahoo.co.jp/qa/question_detail/q12324753027,タイミーについての質問です。 明日の仕事に急用で行けなくなってしまいました。 前回風邪を引いて休んだ分のペナルティが5あり、今回キャンセルすると＋3で8Pになるため利用制限がかかってしまいます。 この...,0,0
1557,2026/1/31 5:01,大学受験,1152568452,11時間10分,0,60,60.0,0,0,0.089,0.0,0.0,0.09,あと3日,https://detail.chiebukuro.yahoo.co.jp/qa/question_detail/q12324752972,立命館大学法学部を共通テスト３教科併用で出願しました。共通テストの点数が高い2科目は、日本史が94点、現代文が100点換算で85点でした。 立命館大学の国語と英語を素点でどのくらい取れば受かると思いま...,0,0
1558,2026/1/31 5:01,コスメ、美容,1150741494,11時間10分,0,11,11.0,0,0,0.016,0.0,0.0,0.02,あと3日,https://detail.chiebukuro.yahoo.co.jp/qa/question_detail/q12324752917,ミュームひとめぼれのワンマンスが無くなってしまいましたが、あれに似たワンマンスがあれば教えて欲しいです。,0,0
1559,2026/1/31 5:01,家族関係の悩み,匿名,11時間10分,0,5,5.0,0,0,0.007,0.0,0.0,0.01,あと3日,https://detail.chiebukuro.yahoo.co.jp/qa/question_detail/q11324850111,女性に、両親がいる事を前提で話さないほうがいいですか？,0,0
1560,2026/1/31 5:01,ゲーム,aar********,11時間10分,0,12,12.0,0,0,0.018,0.0,0.0,0.02,あと3日,https://detail.chiebukuro.yahoo.co.jp/qa/question_detail/q12324752852,ピオフィオーレの晩鐘のスマホアプリ版をプレイしているのですが ニコラルートで攻略をみてやっているはずが、Chapter8でDolceではなくSalatoに行ってしまいます。分岐の選択は間違えていないは...,0,0
1561,2026/1/31 5:01,カラオケ,c8a591110,11時間10分,1,17,17.0,0,0,0.025,5.88,0.0,0.1,あと3日,https://detail.chiebukuro.yahoo.co.jp/qa/question_detail/q11324752831,まねきねこのアプリ 来店数に応じて貰える、室料10%オフクーポンは朝カラでは使えますか？,0,0
1562,2026/1/31 5:01,レディース全般,kot********,11時間10分,1,28,28.0,0,0,0.042,3.57,0.01,0.12,あと3日,https://detail.chiebukuro.yahoo.co.jp/qa/question_detail/q11324753116,昔あった女性の下着ブランドの名前が 思い出せません。 当時栃木県宇都宮市の ララスクエア(現駅前ソラリエ？)に入っていました。 時期は2015年頃だと思います。 ショッパーはピンク色だと思います。 エ...,0,0
1563,2026/1/31 5:01,菓子、スイーツ,mub********,11時間10分,1,22,22.0,0,0,0.033,4.55,0.01,0.11,あと3日,https://detail.chiebukuro.yahoo.co.jp/qa/question_detail/q11324753006,クッキーを焼きたいのですが、焼く前のクッキー生地は冷蔵保存の場合どれくらい日持ちするのでしょうか？ また、焼いた後のクッキーは常温保存でどれくらい日持ちするのでしょうか？,0,0
1564,2026/1/31 5:01,洋楽,1052074987,11時間10分,0,21,21.0,0,0,0.031,0.0,0.0,0.03,あと3日,https://detail.chiebukuro.yahoo.co.jp/qa/question_detail/q11324752801,16年頃前にNARUTOのサスケとサクラのイラスト動画で流れていた曲が分からなくわかる人がいたら教えて欲しいです 歌っているのは女性 バラード洋楽 ミディアムバラード,0,0
1565,2026/1/31 5:01,メイク、コスメ,非公開,11時間11分,1,13,13.0,0,0,0.019,7.69,0.0,0.09,あと3日,https://detail.chiebukuro.yahoo.co.jp/qa/question_detail/q10324752850,ヴィジュアル系やゴシック系のメイク、アイシャドウはどんなものがおすすめですか？ また、具体的にものを教えて頂けたら嬉しいです。,0,0
1566,2026/1/31 5:01,メイク、コスメ,非公開,11時間11分,1,10,10.0,0,0,0.015,10.0,0.0,0.09,あと3日,https://detail.chiebukuro.yahoo.co.jp/qa/question_detail/q10324752845,ヴィジュアル系やゴシック系のメイク、眉マスカラはどんなものがおすすめですか？ また、具体的にものを教えて頂けたら嬉しいです。,0,0
1567,2026/1/31 5:01,MLB,por********,11時間11分,0,8,8.0,0,0,0.012,0.0,0.0,0.01,あと3日,https://detail.chiebukuro.yahoo.co.jp/qa/question_detail/q10324752970,xで出てくる大谷？が教室で勉強してるみたいな動画って何の動画ですか？,0,0
1568,2026/1/31 5:01,ミュージック,cr********,11時間11分,0,29,29.0,0,0,0.043,0.0,0.0,0.04,あと3日,https://detail.chiebukuro.yahoo.co.jp/qa/question_detail/q10324752885,Amazon musicについて Amazon prime会員になってから、以前ダウンロードした曲をオフラインで聴いていますが、停止しなくても勝手に音楽が止まってしまいます ちなみに、unlimite...,0,0
1569,2026/1/31 5:01,バラエティ、お笑い,por********,11時間11分,0,5,5.0,0,0,0.007,0.0,0.0,0.01,あと3日,https://detail.chiebukuro.yahoo.co.jp/qa/question_detail/q10324752960,千葉テレのトゥーモのはなわの回に一緒にでてる女性はだれですか？？,0,0
1570,2026/1/31 5:01,テレビゲーム全般,1150468447,11時間11分,0,10,10.0,0,0,0.015,0.0,0.0,0.01,あと3日,https://detail.chiebukuro.yahoo.co.jp/qa/question_detail/q10324752855,デススト2で黄金カイラル・クリーチャーが再出現するまでの時間はどのくらいですか？,0,0
