751,2026/1/27 6:58,友人関係の悩み,1052006971,7時間54分,0,20,20.0,0,0,0.042,0.0,0.0,0.04,あと3日,https://detail.chiebukuro.yahoo.co.jp/qa/question_detail/q14324720704,会話について質問です。 私の友人によく話を遮って自分の話をしてくる方がいます。私は話すことが苦手ですがその子はたくさん話題も持ち合わせていますし、おもしろかった話を他人にも伝わるようにおもしろおかしく...,0,0
752,2026/1/27 6:58,ご近所の悩み,非公開,7時間54分,3,68,22.7,0,1,0.143,4.41,0.03,0.52,あと3日,https://detail.chiebukuro.yahoo.co.jp/qa/question_detail/q12324720702,【近所の女子大生を好きになった】 私は58歳で独身の参政党支持者です。近所に住む20歳の綺麗な女子大生を好きになったのでぜひとも彼女にしたいのですがどんな感じで近づけばいいでしょうか？,0,0
754,2026/1/27 6:58,イヌ,ID 非公開,7時間54分,1,4,4.0,0,0,0.008,25.0,0.0,0.11,あと3日,https://detail.chiebukuro.yahoo.co.jp/qa/question_detail/q10324720700,ドッグフードの原材料表示における「ミール」「副産物」という表記は、栄養学的にどう評価すべきですか？,0,0
755,2026/1/27 6:58,懸賞、くじ,ものみんた,7時間54分,0,9,9.0,0,0,0.019,0.0,0.0,0.02,あと3日,https://detail.chiebukuro.yahoo.co.jp/qa/question_detail/q14324720699,ナンバーズ4で2025年11月11日からダブル数字(1184 )やトリプル数字(9991)が続き、シングル数字(1478のようなもの)が出ていませんでしたが、 過去に最長でシングル数字が出なかった最長...,0,0
756,2026/1/27 6:57,ボートレース（競艇）,T・Aエジソン,7時間55分,3,9,3.0,0,0,0.019,33.33,0.0,0.33,あと3日,https://detail.chiebukuro.yahoo.co.jp/qa/question_detail/q13324720698,1月27日津競艇6Rの買い目を教えて下さい。,0,0
757,2026/1/27 6:57,特撮,まさかず@梅は咲いたか、桜はまだ,7時間55分,1,9,9.0,0,4,0.019,11.11,0.0,0.38,あと3日,https://detail.chiebukuro.yahoo.co.jp/qa/question_detail/q12324720697,ＭＷは見とくべき作品？,0,0
758,2026/1/27 6:57,釣り,あっぷる,7時間55分,11,77,7.0,0,1,0.162,14.29,0.01,1.38,あと3日,https://detail.chiebukuro.yahoo.co.jp/qa/question_detail/q11324720696,エギングしてみたいんですけど専用ロッドじゃなくてBASS TRACKER EVというバス用のロッド1.8mじゃできないでしょうか？リールはA-MAX2500です。,0,0
759,2026/1/27 6:57,政治、社会問題,非公開,7時間55分,2,32,16.0,0,0,0.067,6.25,0.01,0.28,あと3日,https://detail.chiebukuro.yahoo.co.jp/qa/question_detail/q10324720695,【至急】スパイ防止法の危険な点をどう思いますか？ スパイ防止法の危険な点は、国家安全保障の名の下で個人の権利や民主主義の基盤が侵食されやすい点にある。以下、主な問題点を整理して解説する。 第一に、定義...,0,0
760,2026/1/27 6:57,鉄道、列車、駅,知恵袋のユーザー,7時間55分,1,18,18.0,0,0,0.038,5.56,0.01,0.14,あと3日,https://detail.chiebukuro.yahoo.co.jp/qa/question_detail/q14324720694,伯備線新見ー米子間の普通列車の本数は上越国境（上越線水上ー越後中里間）並みに本数が少ないのですか？,0,0
761,2026/1/27 6:57,X（旧Twitter）,ものみんた,7時間55分,0,5,5.0,0,0,0.011,0.0,0.0,0.01,あと3日,https://detail.chiebukuro.yahoo.co.jp/qa/question_detail/q13324720693,Xをアップデートしたら、DMの機能がかわり、DMが来ても通知が出なくなったのですが、通知が出るようにするにはどうしたら良いですか？,0,0
762,2026/1/27 6:57,職場の悩み,非公開,7時間55分,1,15,15.0,0,0,0.032,6.67,0.0,0.14,あと3日,https://detail.chiebukuro.yahoo.co.jp/qa/question_detail/q12324720692,精神的ストレスで仕事を何日か休んだ事ある人はいますか？,0,0
763,2026/1/27 6:57,イヌ,ID 非公開,7時間56分,0,1,1.0,0,0,0.002,0.0,0.0,0.0,あと3日,https://detail.chiebukuro.yahoo.co.jp/qa/question_detail/q11324720691,犬の問題行動において、情動（感情）由来の行動と学習された行動を区別することが重要な理由は何ですか？,0,0
764,2026/1/27 6:57,バイク,1052412769,7時間56分,3,9,3.0,0,0,0.019,33.33,0.0,0.33,あと3日,https://detail.chiebukuro.yahoo.co.jp/qa/question_detail/q10324720690,2000年代初期のドラスタとビラーゴ250の1996年製って性能やメンテのしやすさに大差ないですか？,0,0
765,2026/1/27 6:57,職場の悩み,るー,7時間56分,2,61,30.5,0,0,0.128,3.28,0.04,0.34,あと3日,https://detail.chiebukuro.yahoo.co.jp/qa/question_detail/q14324720689,コンカフェ嬢です。今日お客さんを怒らせてしまいました。その方は、よく来てくれる同年代の常連さんの先輩で、初めて店に来ていました。おそらく40代くらいの男性です。 怒らせてしまった経緯としては、その方は...,0,0
766,2026/1/27 6:57,政治、社会問題,非公開,7時間56分,3,34,11.3,0,3,0.071,8.82,0.01,0.57,あと3日,https://detail.chiebukuro.yahoo.co.jp/qa/question_detail/q12324720687,徴兵制を嫌がる若者の心理は何ですか？私は60歳で独身の参政党支持者ですが30歳くらいまでの男女に3年間くらいの兵役を課すことには大賛成です。 今時の若者は強制的に軍に入れて心身を鍛えて愛国心を植え付け...,0,0
767,2026/1/27 6:56,大学受験,b3dd48bd2,7時間57分,2,12,6.0,0,0,0.025,16.67,0.0,0.23,あと3日,https://detail.chiebukuro.yahoo.co.jp/qa/question_detail/q11324720686,東邦大学理学部物理学科の共テ利用は、どれくらい取れていれば安心できますか？ バンザイと選太君でA判定だとどうですか？,0,0
768,2026/1/27 6:56,ギター、ベース,iit********,7時間57分,3,36,12.0,0,0,0.075,8.33,0.01,0.39,あと3日,https://detail.chiebukuro.yahoo.co.jp/qa/question_detail/q10324720685,スラッシュメタルは単に速いというわけではなくボーカルよりもザクザクとした攻撃的なギターリフを重視しているとのことですが、スピードメタルは逆に速さが特徴的なのでしょうか？,0,0
769,2026/1/27 6:56,アルバイト、フリーター,、,7時間57分,1,46,46.0,0,0,0.096,2.17,0.04,0.2,不明,https://detail.chiebukuro.yahoo.co.jp/qa/question_detail/q14324720684,20代男です。 焼肉屋アルバイトの採用後についてなんですが 昨日の夜に店長ではなくエリアチーフから面接していただいて即採用になり今後の出勤については店長からいつ出勤出来ますかの相談がLINEで来るので...,0,0
770,2026/1/27 6:56,女性アイドル,ものみんた,7時間57分,0,5,5.0,0,0,0.01,0.0,0.0,0.01,あと3日,https://detail.chiebukuro.yahoo.co.jp/qa/question_detail/q13324720683,今から3年前に行われたとあるアイドル(現、カワラボの某グループ所属)の卒業ライブでの話です。 卒業するメンバーには前世がありました。 そのときの相棒(二人組だったので)をゲストに呼んだのですが、その際...,0,0
771,2026/1/27 6:56,アニメ,古い曲×イメソン,7時間57分,2,28,14.0,1,4,0.059,7.14,0.01,0.73,あと3日,https://detail.chiebukuro.yahoo.co.jp/qa/question_detail/q12324720682,皆さんは音楽を聴く際、「この歌、このアニメに合ってる!」とか思いついたりしないんですか？ 自分はよくあるんですけど,0,0
772,2026/1/27 6:56,タブレット端末,aef97e865,7時間57分,0,2,2.0,0,0,0.004,0.0,0.0,0.0,あと3日,https://detail.chiebukuro.yahoo.co.jp/qa/question_detail/q11324720681,M50HD TLA007というタブレットのパスワードを忘れてしまって、データが消えてもいいから初期化しようと「電源 音量－」を同時に押したのですが、リカバリーモードというものに入らないです。 音量＋は...,0,0
773,2026/1/27 6:56,イヌ,ID 非公開,7時間57分,0,1,1.0,0,0,0.002,0.0,0.0,0.0,あと3日,https://detail.chiebukuro.yahoo.co.jp/qa/question_detail/q14324720679,犬の穀物不使用（グレインフリー）フードと拡張型心筋症（DCM）の関連が議論される理由は何ですか？,0,0
774,2026/1/27 6:56,恋愛相談、人間関係の悩み,非公開,7時間57分,2,65,32.5,0,2,0.136,3.08,0.04,0.47,あと3日,https://detail.chiebukuro.yahoo.co.jp/qa/question_detail/q10324720680,至急！回答急募です。 付き合って2ヶ月目の彼氏に仕事頑張ってってLINEしたらありがとう！だけ返信きました。 付き合う前の2、3ヶ月も付き合ってからもLINEが途切れたことは1度もないです。 何か返信...,0,0
775,2026/1/27 6:56,政治、社会問題,非公開,7時間57分,0,6,6.0,0,0,0.013,0.0,0.0,0.01,あと3日,https://detail.chiebukuro.yahoo.co.jp/qa/question_detail/q13324720678,【大至急】緊急事態条項（国会機能維持条項）の多くの危険な点をどう思いますか？ ・権力が一時的ではなく恒常的に集中する危険がある（「緊急」が延長・乱用されやすい） ・立法府や司法のチェックが弱まり、行政...,0,0
776,2026/1/27 6:56,鉄道、列車、駅,知恵袋のユーザー,7時間57分,5,70,14.0,0,9,0.147,7.14,0.02,1.23,あと3日,https://detail.chiebukuro.yahoo.co.jp/qa/question_detail/q12324720677,上越新幹線の上越ってどういう意味ですか？,0,0
777,2026/1/27 6:56,恋愛相談、人間関係の悩み,匿名,7時間57分,0,7,7.0,1,0,0.015,0.0,0.0,0.22,あと3日,https://detail.chiebukuro.yahoo.co.jp/qa/question_detail/q11324720676,私(女)は、小学生の時は全然怒らなかった為に女子Aに虐められて、中学生の時は小学生の時にAに虐められた反動で学校でしょっちゅう問題行動を起こして学校を出席停止にされて、 高校生の時は、学校には行かなく...,0,0
778,2026/1/27 6:56,オーディオ,*****,7時間57分,2,20,10.0,0,1,0.042,10.0,0.0,0.31,あと3日,https://detail.chiebukuro.yahoo.co.jp/qa/question_detail/q10324720675,ヘッドホンとイヤホンどちらを購入するかを悩んでいます。 以前使っていたsoundcore liberty4を洗濯して破壊してしまった為、現在はEarpodsを使用しているのですが、有線だとやはりコード...,0,0
779,2026/1/27 6:56,ポケットモンスター,ぽん太55,7時間57分,1,24,24.0,0,0,0.05,4.17,0.01,0.15,あと3日,https://detail.chiebukuro.yahoo.co.jp/qa/question_detail/q13324720673,ジム置きして、1時間弱なのに、 6体のポケモンにきのみ21個入れらて いました。 もし、やられたら、何個追加出来るの？ 金の実以外 砂目的？捨て場？,0,0
780,2026/1/27 6:56,K-POP、アジア,S,7時間58分,0,13,13.0,0,0,0.027,0.0,0.0,0.03,あと3日,https://detail.chiebukuro.yahoo.co.jp/qa/question_detail/q12324720672,nct wishユウシのバブルニャンを買いたいんですけど、偽物と本物の見分け方ってありますか？,0,0
781,2026/1/27 6:55,ニュース、事件,非公開ID,7時間59分,0,2,2.0,0,0,0.004,0.0,0.0,0.0,あと3日,https://detail.chiebukuro.yahoo.co.jp/qa/question_detail/q10324720670,埼京線十条赤羽間でなぜ17歳の青年はハサミを振り回したのか気になる方はいますか,0,0
782,2026/1/27 6:55,政治、社会問題,非公開,7時間59分,0,10,10.0,0,0,0.021,0.0,0.0,0.02,あと3日,https://detail.chiebukuro.yahoo.co.jp/qa/question_detail/q14324720669,スパイ防止法の危ない点をどう思いますか？ ・「スパイ」の定義が曖昧になりやすく、政府に都合の悪い行為や発言まで対象に含まれる危険がある ・国家機密の範囲が広く設定されると、何が違法か国民に分からなくな...,0,0
783,2026/1/27 6:55,ボートレース（競艇）,T・Aエジソン,7時間59分,3,6,2.0,0,0,0.013,50.0,0.0,0.32,あと3日,https://detail.chiebukuro.yahoo.co.jp/qa/question_detail/q13324720668,1月27日津競艇5Rの買い目を教えて下さい。,0,0
784,2026/1/27 6:55,イヌ,ID 非公開,7時間59分,0,3,3.0,0,0,0.006,0.0,0.0,0.01,あと3日,https://detail.chiebukuro.yahoo.co.jp/qa/question_detail/q12324720667,犬の問題行動において、情動（感情）由来の行動と学習された行動を区別することが重要な理由は何ですか？,0,0
785,2026/1/27 6:55,X（旧Twitter）,ものみんた,7時間59分,0,3,3.0,0,0,0.006,0.0,0.0,0.01,あと3日,https://detail.chiebukuro.yahoo.co.jp/qa/question_detail/q11324720666,Xの坊主の選手権は不正の温床ですか？,0,0
786,2026/1/27 6:55,モンスターハンター,a5e3a5da,7時間59分,4,106,26.5,0,5,0.221,3.77,0.06,0.95,あと3日,https://detail.chiebukuro.yahoo.co.jp/qa/question_detail/q13324720663,モンハンワイルズについて 最終アプデってとっくに来てますよね？ なんかワイルズ評価悪かったけど最終アプデで評価変わりましたか？ 最近ps5を買ってワイルズ買おうと思ってるので教えて欲しいです！,0,0
787,2026/1/27 6:55,鉄道、列車、駅,知恵袋のユーザー,7時間59分,1,33,33.0,0,2,0.069,3.03,0.02,0.3,あと3日,https://detail.chiebukuro.yahoo.co.jp/qa/question_detail/q11324720661,日本全国のJR在来線路線で最も普通列車の本数が少ない区間はどこですか？ ちなみに石勝線の新夕張ー新得間の普通列車が走ってない区間は除いてください。,0,0
788,2026/1/27 6:55,政治、社会問題,非公開,7時間59分,0,4,4.0,0,0,0.008,0.0,0.0,0.01,あと3日,https://detail.chiebukuro.yahoo.co.jp/qa/question_detail/q10324720660,【大至急】緊急事態条項（国会機能維持条項）の危険性をどう思いますか？ 緊急事態条項、特に「国会機能維持条項」と呼ばれるものの危険性は、国家権力の集中と民主的統制の弱体化にある。表向きには「非常時におけ...,0,0
789,2026/1/27 6:54,職場の悩み,匿名希望,8時間0分,1,23,23.0,0,0,0.048,4.35,0.01,0.15,あと3日,https://detail.chiebukuro.yahoo.co.jp/qa/question_detail/q14324720659,現在大学生で今まで色々な職種のバイトをしていたのですが、身体的な病気と苦手な対人による恐怖で体調を崩したり夜中眠れなかったりしてしまい新しい職場に入っては辞めてを繰り返しており、 精神科の勧めで就労支...,0,0
790,2026/1/27 6:54,女性アイドル,ものみんた,8時間0分,0,2,2.0,0,0,0.004,0.0,0.0,0.0,あと3日,https://detail.chiebukuro.yahoo.co.jp/qa/question_detail/q13324720658,前世のアイドル活動を黒歴史と考えてるアイドルが、前世の事務所のアイドルと共演したり、前世の事務所のアイドルが自身の事務所に移籍してきたときに一緒に写真を撮ることをどう思いますか？,0,0
791,2026/1/27 6:54,恋愛相談、人間関係の悩み,1151232725,8時間0分,4,32,8.0,0,0,0.067,12.5,0.01,0.48,あと3日,https://detail.chiebukuro.yahoo.co.jp/qa/question_detail/q12324720657,大人複数人で小学生や中学生や高校生の子供をいじめるのは、いじめか虐待かどちらになりますか？,0,0
792,2026/1/27 6:54,病院、検査,もずく,8時間0分,3,43,14.3,0,0,0.089,6.98,0.01,0.4,あと3日,https://detail.chiebukuro.yahoo.co.jp/qa/question_detail/q11324720656,会社から診断書提出を求められても従業員側が拒否したら拒否することはできますか？ また、病欠した日の診断書を別日に病院へ行ってもらうことはできないのでしょうか？,0,0
793,2026/1/27 6:54,イヌ,ID 非公開,8時間0分,0,2,2.0,0,0,0.004,0.0,0.0,0.0,あと3日,https://detail.chiebukuro.yahoo.co.jp/qa/question_detail/q10324720655,ドッグフードの押出加工（エクストルージョン）が、脂肪酸やビタミンの安定性に与える影響は何ですか？,0,0
794,2026/1/27 6:54,恋愛相談、人間関係の悩み,なんくるないさー,8時間0分,6,39,6.5,0,0,0.081,15.38,0.01,0.7,あと3日,https://detail.chiebukuro.yahoo.co.jp/qa/question_detail/q14324720654,人間って辛いこと、苦しいことあるの？みんな？,0,0
795,2026/1/27 6:54,ゲーム,cal********,8時間1分,1,13,13.0,0,0,0.027,7.69,0.0,0.13,あと3日,https://detail.chiebukuro.yahoo.co.jp/qa/question_detail/q13324720653,ハートピアというゲームの質問です。 建築をしているのですが、建築モードを解除すると出てくる白いペンキ?のようなものがあります。 これはなんでしょうか？初めての建築なので私が操作する中でやってしまってい...,0,0
796,2026/1/27 6:54,ライブ、コンサート,1153028355,8時間1分,1,14,14.0,0,0,0.029,7.14,0.0,0.13,あと3日,https://detail.chiebukuro.yahoo.co.jp/qa/question_detail/q12324720652,ヨルシカのLIVE tour「一人称」について質問です 同行者会員の抽選に2日間応募して、1日目のA席が当たりました。 同行者非会員の抽選で2日目を申し込もうと思っているのですが、S席のみで申し込むか...,0,0
797,2026/1/27 6:54,デジタル一眼レフ,jry********,8時間1分,11,103,9.4,0,9,0.214,10.68,0.02,1.91,あと3日,https://detail.chiebukuro.yahoo.co.jp/qa/question_detail/q10324720650,カメラを始めたいと思っているのですが、一眼レフミラーレスで10万円台のものはありますか？ おすすめあったら教えてほしいです。 初心者なので、どれくらいの画質はあったほうがいいなど、特徴や購入する際の注...,0,0
798,2026/1/27 6:54,レディース全般,tar********,8時間1分,0,6,6.0,0,0,0.012,0.0,0.0,0.01,あと3日,https://detail.chiebukuro.yahoo.co.jp/qa/question_detail/q14324720649,タイGLカップルのLingormがそれぞれ手がけているブランド、Always wanderとKeep silent、そして2人のコラボブランド、Keep the wanderについて。 上記ブランドの...,0,0
799,2026/1/27 6:54,政治、社会問題,非公開,8時間1分,1,22,22.0,0,0,0.046,4.55,0.01,0.15,あと3日,https://detail.chiebukuro.yahoo.co.jp/qa/question_detail/q13324720648,もし徴兵制を実施するなら、不公平を避けるために男女共に行うべきです。苦しい兵役を通じて若い時間を国に捧げる人と、そうでない人の権利が同じままでは、納得感が得られません。 不公平な制度は、いずれ国民の大...,0,0
800,2026/1/27 6:54,ポケットモンスター,jjaptdap,8時間1分,0,8,8.0,0,0,0.017,0.0,0.0,0.02,あと3日,https://detail.chiebukuro.yahoo.co.jp/qa/question_detail/q12324720647,ポケパークカントーは第5世代までしか知らない人でも楽しめますか？,0,0
801,2026/1/27 6:54,プレイステーション4,非公開,8時間1分,1,4,4.0,0,0,0.008,25.0,0.0,0.11,あと3日,https://detail.chiebukuro.yahoo.co.jp/qa/question_detail/q11324720646,「龍が如く極３」が今になって発売されるようになったのは「９」の舞台が沖縄になるという伏線でしょうか？,0,0
802,2026/1/27 6:54,派遣、アルバイト、パート,1053229063,8時間1分,2,11,5.5,0,0,0.023,18.18,0.0,0.23,あと3日,https://detail.chiebukuro.yahoo.co.jp/qa/question_detail/q10324720645,食品工場で働いたことある方？,0,0
803,2026/1/27 6:53,イヌ,ID 非公開,8時間2分,0,1,1.0,0,0,0.002,0.0,0.0,0.0,あと3日,https://detail.chiebukuro.yahoo.co.jp/qa/question_detail/q14324720644,犬の行動の「消去バースト」が起こるメカニズムと、トレーニング現場での適切な対応方法を説明してください。,0,0
804,2026/1/27 6:53,飲食店,mok********,8時間2分,4,30,7.5,0,0,0.062,13.33,0.0,0.48,あと3日,https://detail.chiebukuro.yahoo.co.jp/qa/question_detail/q13324720643,札幌雪まつりに、平日に行く予定です。 この時に回転寿司に行く予定なのですが、どこに行こうか迷ってます。 トリトン、根室はな丸、まつりや、が今のところ候補です。色々調べたけど、どこも良さそうで、迷ってま...,0,0
805,2026/1/27 6:53,政治、社会問題,非公開,8時間2分,0,6,6.0,0,0,0.012,0.0,0.0,0.01,あと3日,https://detail.chiebukuro.yahoo.co.jp/qa/question_detail/q12324720642,【大至急】スパイ防止法の危険性をどう思いますか？ ・「国家機密」「安全保障情報」などの定義が曖昧になりやすく、政府の解釈次第で処罰範囲が拡大する危険がある ・政権や国家機関に不都合な情報の公開や批判が...,0,0
806,2026/1/27 6:53,飲食店,1053229063,8時間2分,0,5,5.0,0,0,0.01,0.0,0.0,0.01,あと3日,https://detail.chiebukuro.yahoo.co.jp/qa/question_detail/q11324720641,スシローのキッチン従業員のマスクは頭掛けマスクですか？,0,0
807,2026/1/27 6:53,カフェ、喫茶,chi********,8時間2分,1,8,8.0,0,0,0.017,12.5,0.0,0.12,あと3日,https://detail.chiebukuro.yahoo.co.jp/qa/question_detail/q10324720640,吉祥寺に詳しい方教えてください！ １０席とかではなく、全体的に広めのカフェはありますか？ ソファー席や横並びに座れる席があったら嬉しくて、コピスの近くだとなお嬉しいです！ コーヒーあまり飲めないので、...,0,0
808,2026/1/27 6:53,女性アイドル,ものみんた,8時間2分,0,1,1.0,0,0,0.002,0.0,0.0,0.0,あと3日,https://detail.chiebukuro.yahoo.co.jp/qa/question_detail/q14324720639,ヲタクがコールを勝手に変えるのはありなのですか？ とあるアイドル現場での話です。 今から２年ほど前にアイドルグループXが新曲を披露しました。その際、メンバーからコールはこう入れてほしいということを言わ...,0,0
809,2026/1/27 6:53,恋愛相談、人間関係の悩み,1052974738,8時間2分,5,117,23.4,0,0,0.242,4.27,0.06,0.76,あと3日,https://detail.chiebukuro.yahoo.co.jp/qa/question_detail/q13324720638,至急です。 彼女と別れるべきだと思っています。 私は会ったり電話したりするのがたまにでいいタイプなのですが、彼女はたくさんすればするほどいいタイプです。 自分はそれに合わせたくて、幸せにしたくて頑張っ...,0,0
810,2026/1/27 6:53,アルバイト、フリーター,1052588740,8時間2分,2,27,13.5,0,4,0.056,7.41,0.01,0.51,あと3日,https://detail.chiebukuro.yahoo.co.jp/qa/question_detail/q12324720637,高３女子です。 今月卒業式で卒業した次の日からバイトをします。 セブンの面接に行くのですが、証明写真が必要なんです。 それで今日撮りに行くのですが、髪の毛って下ろして撮っていいんでしょうか？ 長さは鎖...,0,0
811,2026/1/27 6:53,恋愛相談、人間関係の悩み,sunusunu666,8時間3分,6,26,4.3,0,1,0.054,23.08,0.0,0.74,あと3日,https://detail.chiebukuro.yahoo.co.jp/qa/question_detail/q11324720636,6歳差は年齢差があるなと感じますか？,0,0
812,2026/1/27 6:53,病気、症状,c51e1826c,8時間3分,1,6,6.0,0,0,0.012,16.67,0.0,0.12,あと3日,https://detail.chiebukuro.yahoo.co.jp/qa/question_detail/q10324720635,緊張とかしてなくても顔が赤くなるのは赤面症ですか。 動いて暑くなるのもあると思いますが、赤面症ではなく普通の事なのでしょうか。顔の真ん中のゾーンがすぐ赤くなります、昼間くらいになるとですかね。前々から...,0,0
813,2026/1/27 6:52,派遣、アルバイト、パート,1053229063,8時間4分,0,1,1.0,0,0,0.002,0.0,0.0,0.0,あと3日,https://detail.chiebukuro.yahoo.co.jp/qa/question_detail/q13324720633,食品工場の作業開始までの準備好きな方いませんか？,0,0
814,2026/1/27 6:52,男性アイドル,1250034188,8時間4分,1,29,29.0,0,1,0.06,3.45,0.02,0.22,あと3日,https://detail.chiebukuro.yahoo.co.jp/qa/question_detail/q14324720634,最近SnowManにハマったのですが、メンバーがクラクラという曲の鑑賞会をしている動画はどこで見られますか？,0,0
815,2026/1/27 6:52,大学受験,非公開,8時間4分,5,65,13.0,0,0,0.134,7.69,0.02,0.65,あと3日,https://detail.chiebukuro.yahoo.co.jp/qa/question_detail/q12324720632,中学受験までしたのに偏差値45の私立大学で教師を目指すのはやばいですか。,0,0
816,2026/1/27 6:52,鉄道、列車、駅,知恵袋のユーザー,8時間4分,0,17,17.0,0,0,0.035,0.0,0.0,0.04,あと3日,https://detail.chiebukuro.yahoo.co.jp/qa/question_detail/q11324720631,北陸新幹線で工事の難所だった区間は碓氷峠トンネル、飯山トンネル、新親不知トンネル、加越トンネル、新北陸トンネルの5カ所ですか？,0,0
817,2026/1/27 6:52,国内,篠田せつ,8時間4分,0,6,6.0,0,0,0.012,0.0,0.0,0.01,あと3日,https://detail.chiebukuro.yahoo.co.jp/qa/question_detail/q14324720629,目黒区の洗足を知ってる方にお聞きしたいのですが なぜプライドが高くて、ちょっと感じ悪い人が多いんですか？ 用があってこちらに来た時にあまりにも人の目を気にする人が多いのとたしなめるような目が多いので驚...,0,0
818,2026/1/27 6:52,派遣、アルバイト、パート,金20個銀12個銅13個計45個,8時間4分,0,3,3.0,0,0,0.006,0.0,0.0,0.01,あと3日,https://detail.chiebukuro.yahoo.co.jp/qa/question_detail/q10324720630,食品工場って休憩中以外ほぼずっとマスクは着けてますか？,0,0
