2133,2026/1/26 18:58,政治、社会問題,bcdd75ccf,8時間12分,8,119,14.9,0,5,0.242,6.72,0.04,1.36,あと3日,https://detail.chiebukuro.yahoo.co.jp/qa/question_detail/q13324704268,日本に外国人が来るのが嫌なんですけど、分かる方いますか？ 今高二です。去年に東京に用事があって1人で旅行した時があったんです。 1人で北海道から東京への旅だったので不安でしたけど飛行機とかホテルとかは...,0,0
2134,2026/1/26 18:58,友人関係の悩み,afc939a05,8時間12分,1,18,18.0,0,0,0.037,5.56,0.01,0.14,あと3日,https://detail.chiebukuro.yahoo.co.jp/qa/question_detail/q12324704267,ムカつくことがあったので聞いて欲しいです。 今日、部活中に友達からマイネーム貸してくれないかと言われ何か困ってるかと思いマイネーム（マジック）を貸したのですが、勝手にカイロに絵を描くのに使われて悲しい...,0,0
2135,2026/1/26 18:58,アニメ,胃,8時間12分,4,37,9.2,0,0,0.075,10.81,0.01,0.48,あと3日,https://detail.chiebukuro.yahoo.co.jp/qa/question_detail/q10324704265,葬送のフリーレンについて質問です ヒンメルのお葬式で、フリーレンに悲しい顔1つしないで薄情だと言った人がいますが、なぜフリーレンにだけ言ったんですか？？？そのあとハイターにブーイング的なノリで言ってる...,0,0
2136,2026/1/26 18:58,レディース全般,c32cdb9cb,8時間12分,0,6,6.0,0,0,0.012,0.0,0.0,0.01,あと3日,https://detail.chiebukuro.yahoo.co.jp/qa/question_detail/q11324704266,GRLのミニスカで比較的丈が長い商品ありますか？ 一度買ったことがあるんですけど、短すぎて外で履ける長さじゃなかったんですよね 身長164です,0,0
2137,2026/1/26 18:58,インターネットショッピング,はーち,8時間12分,0,2,2.0,0,0,0.004,0.0,0.0,0.0,あと3日,https://detail.chiebukuro.yahoo.co.jp/qa/question_detail/q14324704264,大至急お願いします 今日シロルの洗顔が届いたのですがコンビニ払いをしたら直ぐに2個目が来る前に解約出来ますかね ほんとに心配です。返信よろしくお願いします,0,0
2138,2026/1/26 18:58,コンタクトレンズ、視力矯正,mhkgwn,8時間12分,2,19,9.5,0,1,0.039,10.53,0.0,0.3,あと3日,https://detail.chiebukuro.yahoo.co.jp/qa/question_detail/q13324704263,カラコンの洗浄・保存液をどこかに忘れてきてしまったのですが、自宅で一晩だけ保存したいです。 未開封のワンデーカラコンはたくさんもっているのですが、それで保存することはできますか？調べたので危険だという...,0,0
2139,2026/1/26 18:58,模型、プラモデル、ラジコン,shi********,8時間12分,1,22,22.0,0,0,0.045,4.55,0.01,0.15,あと3日,https://detail.chiebukuro.yahoo.co.jp/qa/question_detail/q12324704262,こういう模型を作るのに、点でつけてすぐに強力に付く接着剤はどのようなものを使っているのですか？ また、これを作っている紙みたいな材料はなんですか？,0,0
2140,2026/1/26 18:58,鉄道、列車、駅,cdk********,8時間12分,1,36,36.0,0,0,0.073,2.78,0.03,0.17,あと3日,https://detail.chiebukuro.yahoo.co.jp/qa/question_detail/q11324704261,東海道新幹線の最高時速285km/hとありますが、これは運転の許容速度だと思っていいですか？ 実質280～283km/hぐらいの間でスピードをコントロールしているような運転になるのでしょうか（285k...,0,0
2141,2026/1/26 18:58,恋愛相談、人間関係の悩み,1251931562,8時間12分,6,62,10.3,0,18,0.126,9.68,0.01,1.83,あと3日,https://detail.chiebukuro.yahoo.co.jp/qa/question_detail/q10324704260,29歳のOLです。 親から 一度も奢ろうとしない5歳歳上彼氏は結婚してからもケチになるからやめた方がいいと言われました。 いつも割り勘ならすごい親として不安になる。女性差別とは言わないけど、もう社会人...,0,0
2142,2026/1/26 18:58,恋愛相談,c1a4cee54,8時間12分,4,35,8.8,0,0,0.071,11.43,0.01,0.48,あと3日,https://detail.chiebukuro.yahoo.co.jp/qa/question_detail/q13324704258,2個下(23歳)の彼氏と同棲して1年です。 彼はほぼ夜勤なので帰ってきてから午後から寝てますがわたしが毎日夜ご飯を出来立てで食べて欲しくて起こしてもまったく起きません。 弁当箱も夜勤用に2つ作ってます...,0,0
2143,2026/1/26 18:58,自転車、サイクリング,1150224120,8時間12分,4,28,7.0,0,2,0.057,14.29,0.0,0.58,あと3日,https://detail.chiebukuro.yahoo.co.jp/qa/question_detail/q14324704259,変速が機械式、電動の他にこの2つのの違いってなにかありますか？フレームの違いはなんですか？,0,0
2144,2026/1/26 18:58,ポケットモンスター,のの,8時間12分,2,30,15.0,0,0,0.061,6.67,0.01,0.26,あと3日,https://detail.chiebukuro.yahoo.co.jp/qa/question_detail/q12324704257,ポケモンカードについての質問です。 ①実戦を始めるにあたり買い揃えるべき物は何ですか？また、ジムバトルや大会等に出る際に気をつける事や暗黙の了解があれば教えていただきたいです。ポケモンカードというかほ...,0,0
2145,2026/1/26 18:58,恋愛相談、人間関係の悩み,b3bb9b265,8時間13分,0,13,13.0,0,0,0.026,0.0,0.0,0.03,あと3日,https://detail.chiebukuro.yahoo.co.jp/qa/question_detail/q11324704256,皆さんにお聞きしたいことがあります 私は、今彼氏がいるのですが、ゲームのスキンを 彼氏の女友達が欲しがってるから立て替えてあげたいと 言っていました。その女友達は、仕事してなくて収入がないため自分では...,0,0
2146,2026/1/26 18:58,受験、進学,1153064814,8時間13分,1,5,5.0,0,0,0.01,20.0,0.0,0.11,あと3日,https://detail.chiebukuro.yahoo.co.jp/qa/question_detail/q10324704255,春から早大学院に進学するものです。 自己推薦で入学したのですが、過去問では200点前後を取れていました。 そこで入学前にやっといた方がいいことを教えていただけると嬉しいです。 数学は好きで得意な方です...,0,0
2147,2026/1/26 18:58,生き方、人生相談,112331947711.,8時間13分,3,17,5.7,0,0,0.034,17.65,0.0,0.34,あと3日,https://detail.chiebukuro.yahoo.co.jp/qa/question_detail/q14324704254,ゴキブリって屋外にも生息してることあるんですか？ 家の中にしか現れないと思ってました 今日の昼頃、外を散歩してたら、砂利の近くにこんなゴキブリがいました。,0,0
2148,2026/1/26 18:58,男性アイドル,lunatica,8時間13分,2,27,13.5,0,2,0.055,7.41,0.01,0.38,あと3日,https://detail.chiebukuro.yahoo.co.jp/qa/question_detail/q12324704252,すとぷりの、さとみさんが活動休止（？）した理由って結局なんでしょう。 本人の気持ちのズレとありますが、 当時のすとぷりの動画で嫌そうな企画を調べてみたところ、 東京100kmがあったようですが、 本人...,0,0
2149,2026/1/26 18:58,外国映画,1052562292,8時間13分,5,58,11.6,0,0,0.118,8.62,0.01,0.62,あと3日,https://detail.chiebukuro.yahoo.co.jp/qa/question_detail/q10324704250,フランス映画の特徴って、なんでしょう？,0,0
2150,2026/1/26 18:58,邦楽,c5c2cf671,8時間13分,5,29,5.8,1,0,0.059,17.24,0.0,0.77,あと3日,https://detail.chiebukuro.yahoo.co.jp/qa/question_detail/q11324704251,斉藤和義のおすすめの曲教えて下さい!! このような雰囲気の曲がいいです https://youtu.be/0q9Hm55VIjE?si=UKd-wl8YmRyxhp1f,0,0
2151,2026/1/26 18:58,カフェ、喫茶,512873345421,8時間13分,1,17,17.0,0,0,0.034,5.88,0.01,0.14,あと3日,https://detail.chiebukuro.yahoo.co.jp/qa/question_detail/q13324704248,ゴンチャのポイントカードについて質問です。あとちょっとで全部溜まったのにこれはもう使えませんか？,0,0
2152,2026/1/26 18:58,運転免許,b7a2d39ba,8時間13分,3,29,9.7,0,0,0.059,10.34,0.01,0.36,あと3日,https://detail.chiebukuro.yahoo.co.jp/qa/question_detail/q12324704247,免許を取れる年齢になったのですが色弱があります。 色弱のテストというのはいつ行われるのでしょうか? 事前に申告した方がいいですか?,0,0
2153,2026/1/26 18:58,株式,nya********,8時間13分,2,31,15.5,0,0,0.063,6.45,0.01,0.26,あと3日,https://detail.chiebukuro.yahoo.co.jp/qa/question_detail/q10324704245,イオンラウンジについて質問です 今現在夫が株主でオーナーズカードを持っています。アイイオンには私の携帯でオーナーズカードを登録しています。子供が大きくなってきたので、夫がいない時でも子供2人と私の3人...,0,0
2154,2026/1/26 18:58,友人関係の悩み,aae1aaf09,8時間13分,4,36,9.0,0,0,0.073,11.11,0.01,0.48,あと3日,https://detail.chiebukuro.yahoo.co.jp/qa/question_detail/q11324704246,至急お願いしたいです。みなさんは友達はどこからだと考えていますか？ 普段は一緒にいて心地いいけど極稀に傷つくような発言をしてくる人や、あなたの愚痴を知らないところで言う人などのことは、どのように考えて...,0,0
2155,2026/1/26 18:58,労働条件、給与、残業,あ,8時間13分,2,7,3.5,0,0,0.014,28.57,0.0,0.22,あと3日,https://detail.chiebukuro.yahoo.co.jp/qa/question_detail/q14324704244,皆さんの一日の労働時間を教えてください,0,0
2156,2026/1/26 18:57,パソコン,cc9dd3f75,8時間14分,1,12,12.0,0,0,0.024,8.33,0.0,0.13,あと3日,https://detail.chiebukuro.yahoo.co.jp/qa/question_detail/q12324704242,至急です！！ 家の(父の)パソコンで、エクスプローラーで自分のアカウントでログインしたく、Geminiで調べてでてきた「ctrl＋alt＋del」を押してみると、画面真っ暗になりなにも動かなくなってし...,0,0
2157,2026/1/26 18:57,英語,b52ac4cbe,8時間14分,1,35,35.0,0,0,0.071,2.86,0.02,0.17,あと3日,https://detail.chiebukuro.yahoo.co.jp/qa/question_detail/q11324704241,英検について 準二級です。自己採点が リーディング25問 ライティング不明 リスニング26問 でした。 ライティングどのくらいできれば受かってるでしょうか？,0,0
2158,2026/1/26 18:57,家具、インテリア,c5aa28896,8時間14分,1,9,9.0,0,0,0.018,11.11,0.0,0.12,あと3日,https://detail.chiebukuro.yahoo.co.jp/qa/question_detail/q10324704240,照明の調光について質問です。 天井にライティングレールがありスイッチには調光器がついています。 ソケットはすでにいくつかありますが電球はありません。 ソケットの調光対応については不明です。 調光対応電...,0,0
2159,2026/1/26 18:57,政治、社会問題,wgd********,8時間14分,0,3,3.0,0,0,0.006,0.0,0.0,0.01,あと3日,https://detail.chiebukuro.yahoo.co.jp/qa/question_detail/q14324704239,悪いのはマスコミだ。 悪いのは学校教育だ。 戸塚宏氏の意見に賛同しますか？,0,0
2160,2026/1/26 18:57,運転免許,あ,8時間14分,4,59,14.8,0,1,0.119,6.78,0.02,0.58,あと3日,https://detail.chiebukuro.yahoo.co.jp/qa/question_detail/q12324704237,MT車で半クラから少し踏んで切るのと完全に最後まで踏んで切るのって違いあるんでしょうか？,0,0
2161,2026/1/26 18:57,大学受験,s,8時間15分,0,1,1.0,0,0,0.002,0.0,0.0,0.0,あと3日,https://detail.chiebukuro.yahoo.co.jp/qa/question_detail/q13324704238,英熟語帳について 英熟語always1001と頻出英熟語問題1000 だったらどっちが良いですか？ 東京科学大学志望です このふたつの中でお願いします,0,0
2162,2026/1/26 18:57,交通、運転マナー,魔瑠瑚夢慧駒諏(笑),8時間15分,3,24,8.0,0,0,0.048,12.5,0.0,0.35,不明,https://detail.chiebukuro.yahoo.co.jp/qa/question_detail/q10324704235,公共の交通機関を利用中、白杖をついた方が乗って来た時、席を譲っていますか。 と言うか、 公共の交通機関を利用中、白杖をついた方が乗って来た時、席を譲るべきなんですか。,0,0
2163,2026/1/26 18:57,政治、社会問題,非公開,8時間15分,3,45,15.0,0,15,0.091,6.67,0.01,1.3,あと3日,https://detail.chiebukuro.yahoo.co.jp/qa/question_detail/q11324704236,福井県知事選の当選者ってヤバい人ですか！？ 早速失言がありましたね。,0,0
2164,2026/1/26 18:57,職場の悩み,安令和,8時間15分,3,29,9.7,0,5,0.059,10.34,0.01,0.66,あと3日,https://detail.chiebukuro.yahoo.co.jp/qa/question_detail/q14324704234,社長や経営者って偉そうな態度取る人多くないですか？ なぜ社長や経営者って目下の人や相手によって態度変えるのですか？,0,0
2165,2026/1/26 18:57,病気、症状,1053256876,8時間15分,2,11,5.5,0,0,0.022,18.18,0.0,0.22,あと3日,https://detail.chiebukuro.yahoo.co.jp/qa/question_detail/q13324704233,半年で体重が20キロ増加 食事はそんなにとっていないし、運動もしているのですが、体重が20キロ増えてしまいました。現在高校生です。 何か病気でしょうか。 ハロぺリドールを飲んでいますが、そんなに体重が...,0,0
2166,2026/1/26 18:57,賃貸物件,ete********,8時間15分,4,45,11.2,0,6,0.091,8.89,0.01,0.86,あと3日,https://detail.chiebukuro.yahoo.co.jp/qa/question_detail/q12324704232,上階の騒音で悩んでいます。 ご意見をお聞かせください。 昨年夏に賃貸マンションに引っ越して、あまりにも上階からの騒音が続き、すぐに管理会社に相談しました。 騒音は何かを叩きつける音やドリル音でした。 ...,0,0
2167,2026/1/26 18:57,携帯型ゲーム全般,bac71791,8時間15分,1,11,11.0,0,0,0.022,9.09,0.0,0.12,あと3日,https://detail.chiebukuro.yahoo.co.jp/qa/question_detail/q11324704231,今初めても遅くないスマホゲームを教えて欲しいです。 容量は15ギガくらいでお願いします,0,0
2168,2026/1/26 18:57,学校の悩み,はなまる,8時間15分,1,23,23.0,0,1,0.046,4.35,0.01,0.21,あと3日,https://detail.chiebukuro.yahoo.co.jp/qa/question_detail/q10324704230,悩み相談です。文が少し長くなります。 私は今学生で、調理実習を家庭科の時間に行っています。私の班は4人いるなか、女子は私だけで他3人は全員男子です。しかもその男子はクラスでもずっとふざけたりしている人...,0,0
2169,2026/1/26 18:57,テレビ、DVD、ホームシアター,olz********,8時間15分,3,38,12.7,0,4,0.077,7.89,0.01,0.62,あと3日,https://detail.chiebukuro.yahoo.co.jp/qa/question_detail/q14324704229,東芝のREGZAのテレビの修理の保証についてです。 画面中央の内側に黒い点があり、修理に出そうと思うのですが、インターネットで購入したということもあり、保証書はありますが何も記入されていません。購入履...,0,0
2170,2026/1/26 18:57,レディースバッグ、財布、小物類,a4d4a5d95,8時間15分,0,5,5.0,0,0,0.01,0.0,0.0,0.01,あと3日,https://detail.chiebukuro.yahoo.co.jp/qa/question_detail/q12324704227,ルイヴィトンポルトフォイユ・リサとクレア 値段はクレアのほうが高いですが、機能てきにそこまで変わりますか？小銭の部分くらいかな？と思うのだけど^ ^ちなみに小銭はいれないためつかいません,0,0
2171,2026/1/26 18:57,特撮,まさかず@梅は咲いたか、桜はまだ,8時間15分,0,15,15.0,0,0,0.03,0.0,0.0,0.03,あと3日,https://detail.chiebukuro.yahoo.co.jp/qa/question_detail/q13324704228,悪の方に共感したといえば？,0,0
2172,2026/1/26 18:57,資格,dlo********,8時間15分,1,8,8.0,0,0,0.016,12.5,0.0,0.12,不明,https://detail.chiebukuro.yahoo.co.jp/qa/question_detail/q11324704226,メンタル士心理カウンセラーの勉強を最近始めたんですけど、カタカナの専門用語がなかなか頭に入らなくて苦労しています。ノートに書き出すのと、ひたすらテキストを読むのと、どっちが覚えやすいとかありますかね。...,0,0
2174,2026/1/26 18:57,ポケットモンスター,a3c7ed044,8時間15分,0,19,19.0,0,0,0.038,0.0,0.0,0.04,あと3日,https://detail.chiebukuro.yahoo.co.jp/qa/question_detail/q10324704225,有識者の方に質問です。 DSソフトポケットモンスター ダイアモンドパールプラチナ における化石ポケモンの色違い厳選について ①目的の化石を入手する ②化石の復元を依頼する ③色違いでなければリセットし...,0,0
2175,2026/1/26 18:57,オーディオ,ac2ddcc02,8時間15分,0,8,8.0,0,0,0.016,0.0,0.0,0.02,あと3日,https://detail.chiebukuro.yahoo.co.jp/qa/question_detail/q13324704223,至急お願いします！ SwitchのBluetoothでイヤホンを使ったのですが 誤って解除してしまいました。また繋げようと思ったのですが繋がらずとりあえずゲームしようと思ったら音が聞こえませんでした。...,0,0
2176,2026/1/26 18:57,インターネットサービス,暇じゃない暇人,8時間15分,2,6,3.0,0,0,0.012,33.33,0.0,0.21,あと3日,https://detail.chiebukuro.yahoo.co.jp/qa/question_detail/q10324704220,チャットGPTと、grokはどちらの方が優秀で、使い勝手がいいのでしょうか？,0,0
2177,2026/1/26 18:57,邦楽,c5c2cf671,8時間15分,0,9,9.0,1,0,0.018,0.0,0.0,0.22,あと3日,https://detail.chiebukuro.yahoo.co.jp/qa/question_detail/q13324704218,ヨルシカのおすすめの曲教えて下さい!! このような雰囲気の曲がいいです https://youtu.be/a8INIhPz2J8?si=stzpvoTgP1P7t7WA,0,0
2178,2026/1/26 18:57,ネットバンキング,kik********,8時間15分,1,12,12.0,0,0,0.024,8.33,0.0,0.12,あと3日,https://detail.chiebukuro.yahoo.co.jp/qa/question_detail/q12324704217,地銀のインターネットバンキングを契約して使っていますが、銀行から海外からのアクセスを全て制限しますと連絡が来ました。 近く長期で海外へ出張に行くので困っています。自分が渡航する時期には使えなくなってい...,0,0
2179,2026/1/26 18:57,政治、社会問題,tom********,8時間16分,1,10,10.0,0,0,0.02,10.0,0.0,0.12,あと3日,https://detail.chiebukuro.yahoo.co.jp/qa/question_detail/q11324704216,子供を虐待して56した親の事件は、 テレビなどでは痛ましい悲劇として扱われるが、 その後はクズ親を刑務所に入れて終わり 後は何もなかったような日常が流れて行く と言うのはクズ親の子なら成長しても碌でも...,0,0
2180,2026/1/26 18:57,パソコン,カイセンモン,8時間16分,8,57,7.1,0,11,0.115,14.04,0.01,1.58,あと3日,https://detail.chiebukuro.yahoo.co.jp/qa/question_detail/q10324704215,今の小中高生は、家にパソコンが有る人が多いんですかね? 私達が子供の頃より、ITやデジタル機器に詳しいとか精通していたり、授業でタブレットとか使う機会が多い人もいるのかなとは思いますが、ご家庭はどうな...,0,0
2181,2026/1/26 18:57,飲食店,名無し,8時間16分,3,22,7.3,0,0,0.044,13.64,0.0,0.35,あと3日,https://detail.chiebukuro.yahoo.co.jp/qa/question_detail/q14324704214,よく豚骨ラーメンのお店に行くと麺の硬さが選べます！みたいなこと書いてますが、豚骨ラーメンでなく、麺の硬さ選べますと書いてないラーメン屋でも硬さって選べるんでしょうか？,0,0
2182,2026/1/26 18:57,政治、社会問題,はら,8時間16分,4,26,6.5,0,2,0.052,15.38,0.0,0.58,あと3日,https://detail.chiebukuro.yahoo.co.jp/qa/question_detail/q13324704213,ギャンブル等依存症対策 ギャンブル依存症って？ 借金もしないで、生活にも支障なければ、ギャンブル依存症とは言えないのでしょうか 例えば、金融資産が億ある人が、ギャンブルに数千万使う,0,0
2183,2026/1/26 18:57,タブレット端末,rga********,8時間16分,2,8,4.0,0,0,0.016,25.0,0.0,0.22,あと3日,https://detail.chiebukuro.yahoo.co.jp/qa/question_detail/q11324704211,手書きできるタブレットについての質問です。 私は今大学生で、pdfで配布される講義のノートに手書きできるようにしたいのでノート代わりのタブレットの購入を検討しています。 色々見ると手書きするにはiPa...,0,0
2184,2026/1/26 18:57,小説,1052562292,8時間16分,3,44,14.7,0,0,0.089,6.82,0.01,0.39,あと3日,https://detail.chiebukuro.yahoo.co.jp/qa/question_detail/q12324704212,フランス小説の特徴って、なんでしょう？,0,0
2185,2026/1/26 18:57,恋愛相談、人間関係の悩み,12539924850,8時間16分,0,19,19.0,0,0,0.038,0.0,0.0,0.04,あと3日,https://detail.chiebukuro.yahoo.co.jp/qa/question_detail/q10324704210,好きになる人の顔が全員似てます でもその顔がタイプっていうわけでは全くありません どの人も正直最初は別に顔そこまでかっこよくないなと思いながら、性格で好きなって付き合ったりしてからフィルターがかかって...,0,0
2186,2026/1/26 18:57,病気、症状,はね,8時間16分,3,56,18.7,0,0,0.113,5.36,0.02,0.41,あと3日,https://detail.chiebukuro.yahoo.co.jp/qa/question_detail/q14324704209,精神科病院の外来に通うものです。 主治医に不満があります。 全く薬の事を相談できません。 相談しようとすると、責められます。 ある理由を言って、主治医を変えてもらうべきでしょうか？,0,0
2187,2026/1/26 18:57,メンズ全般,1150770564,8時間16分,1,55,55.0,0,3,0.111,1.82,0.06,0.39,あと3日,https://detail.chiebukuro.yahoo.co.jp/qa/question_detail/q13324704208,私はこのようなファッションが好きなのですが、アメカジまでは行かないし、どちらかというとスケーターファッションに近いのかな？ と思っています。ですが、スケーターファッションで検索するとかなりダボっとした...,0,0
2188,2026/1/26 18:57,商品の発送、受け取り,1153354797,8時間16分,0,16,16.0,0,0,0.032,0.0,0.0,0.03,あと3日,https://detail.chiebukuro.yahoo.co.jp/qa/question_detail/q11324704206,psa鑑定にてたった今受け取り連絡あって３つの提出物見ると全て保留中となっているのですが、何かあったのでしょうか？ それとも受け取りしたばかりなのでこの画面表示は正常なのでしょうか？,0,0
2189,2026/1/26 18:57,CM,dr_********,8時間16分,0,12,12.0,0,0,0.024,0.0,0.0,0.02,あと3日,https://detail.chiebukuro.yahoo.co.jp/qa/question_detail/q14324704204,2000年代のCMだったと思います 暗い背景に無音から始まってバッハの無伴奏ヴァイオリン・パルティータ第1番 ロ短調 BWV1002 という組曲の中の第5楽章（サラバンド）が流れ始めるのですが、 渋い...,0,0
2190,2026/1/26 18:57,物理学,1150088182,8時間16分,2,25,12.5,0,0,0.05,8.0,0.01,0.25,あと3日,https://detail.chiebukuro.yahoo.co.jp/qa/question_detail/q10324704205,電磁気学、ガウスの法則について質問です。 ガウスの法則がどのようなものか理解していますが、少し質問させてください。 写真のような同心導体球を考えます。 内球に電荷Qを与えたとします。まず、外球がないと...,0,0
2191,2026/1/26 18:56,中学数学,ando,8時間17分,3,37,12.3,0,0,0.074,8.11,0.01,0.37,あと3日,https://detail.chiebukuro.yahoo.co.jp/qa/question_detail/q13324704203,仕入れ値400円の商品に200円の利益をつけて定価としましたが、実際には定価の2割引で販売したところ、売れ残りが20個あり、利益は6000円でした。仕入れた個数は何個か。 この中学校数学の問題ですが、...,0,0
2192,2026/1/26 18:56,ライブ、コンサート,fox********,8時間17分,0,15,15.0,0,0,0.03,0.0,0.0,0.03,あと3日,https://detail.chiebukuro.yahoo.co.jp/qa/question_detail/q12324704202,矢沢永吉学割返金手続きについて 学割の申請をコンサート終演後にして、翌月末に返金手続きのページが来るらしいんですけど、どこのページに来るんでしょうか。,0,0
2193,2026/1/26 18:56,スーパーマーケット,wor********,8時間17分,6,41,6.8,0,1,0.082,14.63,0.01,0.74,あと3日,https://detail.chiebukuro.yahoo.co.jp/qa/question_detail/q10324704200,スーパーのセルフレジで1点だけバーコードスキャンされずに持ち帰ってしまったようなのですが、これは万引きにあたりますか？家に帰ってレシートを確認して気が付きました。 どう対処するのが無難でしょうか？,0,0
2194,2026/1/26 18:56,英語,義波,8時間17分,1,95,95.0,0,1,0.191,1.05,0.18,0.35,あと3日,https://detail.chiebukuro.yahoo.co.jp/qa/question_detail/q11324704201,英検2級を受けました‼️Reading6.7割でListening6割だったんですけどこれって順調ですか⁉️‬(><)‎Writingは6割ぐらいとってたら合格できますかね❓有識者の方教えてください‼...,0,0
2195,2026/1/26 18:56,高校受験,adc62172f,8時間18分,1,39,39.0,0,0,0.078,2.56,0.03,0.18,不明,https://detail.chiebukuro.yahoo.co.jp/qa/question_detail/q14324704199,私立高校クラブ推薦で合格確約をもらったら、倍率が3倍でもそれが理由で落とされることとかはないですか,0,0
