1487,2026/1/24 4:30,車検、メンテナンス,amv********,11時間1分,4,35,8.8,0,0,0.053,11.43,0.0,0.35,あと3日,https://detail.chiebukuro.yahoo.co.jp/qa/question_detail/q10324612835,全長式車高調のトラブル フロントのストラット形状の全長式車高調のトラブルです。上はピロボールになってます。 恐らくショックの上のピロボール部分の締結が緩んでいて、かつピロボールの滑りが悪い？状態でした...,0,0
1488,2026/1/24 4:30,スマートフォン,ダダ,11時間1分,2,35,17.5,0,0,0.053,5.71,0.01,0.2,あと3日,https://detail.chiebukuro.yahoo.co.jp/qa/question_detail/q14324612834,緊急ですがiPhoneを初期化をするときに 最後のパスワードをうつ画面でオフにする を押したのですが画面が少し動かなくなり もう一度やり直そうとしてホーム画面 戻ったら急に画面が暗くなりアップルの り...,0,0
1489,2026/1/24 4:30,哲学、倫理,レモン,11時間1分,12,66,5.5,0,1,0.1,18.18,0.01,1.05,あと3日,https://detail.chiebukuro.yahoo.co.jp/qa/question_detail/q13324612833,結局、人は一生、孤独だという考え方は合っているのでしょうか？ 「孤独こそが人生の当たり前」という考え方。 ネットで「人生で悟った真理」として、次のような言葉を見かけました。 ​「孤独こそが人生の常態（...,0,0
1490,2026/1/24 4:30,恋愛相談、人間関係の悩み,非公開,11時間1分,0,24,24.0,0,0,0.036,0.0,0.0,0.04,あと3日,https://detail.chiebukuro.yahoo.co.jp/qa/question_detail/q12324612832,来週の日曜日に休みか聞いたら「休みやけど家の用事がある」って言われました。そんなこと言われたら既婚者じゃないかって疑っても仕方ないですよね？ ましてやマチアプで知り合ったバツイチ子持ち子供と一緒に実家...,0,0
1491,2026/1/24 4:29,就職、転職,my_********,11時間2分,2,8,4.0,0,0,0.012,25.0,0.0,0.16,あと3日,https://detail.chiebukuro.yahoo.co.jp/qa/question_detail/q11324612831,デスクワークの公務員から65歳で派遣の土木作業員に再就職した場合、どういった辛さがありますか？,0,0
1492,2026/1/24 4:29,バンド,.,11時間2分,0,3,3.0,0,0,0.005,0.0,0.0,0.0,あと3日,https://detail.chiebukuro.yahoo.co.jp/qa/question_detail/q10324612830,Vaundyのインディーズデビュー日とメジャーデビュー日はいつですか？,0,0
1493,2026/1/24 4:29,菓子、スイーツ,みかん,11時間2分,2,25,12.5,0,0,0.038,8.0,0.0,0.19,あと3日,https://detail.chiebukuro.yahoo.co.jp/qa/question_detail/q14324612829,至急！ バレンタインにシフォンケーキを持っていきたいのですが、おすすめのラッピング方法はありますか？ ワンホールで渡す予定です。上になにかクリームかチョコをかけて渡す予定です。たくさん学校に持っていき...,0,0
1494,2026/1/24 4:29,外国映画,c5096c0f3,11時間2分,1,14,14.0,0,0,0.021,7.14,0.0,0.1,不明,https://detail.chiebukuro.yahoo.co.jp/qa/question_detail/q13324612828,ドクター・ストレンジマルチバースオブマッドネスを見ました。 感想はスカーレットウィッチが別世界のワンダに入り込んだ時にアメリカとドクター・ストレンジを探しに行くときは冷酷な感じだったけど子供たちを前に...,0,0
1495,2026/1/24 4:29,恋愛相談、人間関係の悩み,非公開,11時間2分,3,30,10.0,0,0,0.045,10.0,0.0,0.27,あと3日,https://detail.chiebukuro.yahoo.co.jp/qa/question_detail/q12324612827,少しバカにする言い方を教えてください、 例えばパチンコばかりする人をパチンカス ゲームばかりする人はなんていいますか？,0,0
1496,2026/1/24 4:29,釣り,dai********,11時間2分,4,64,16.0,0,0,0.097,6.25,0.02,0.4,あと3日,https://detail.chiebukuro.yahoo.co.jp/qa/question_detail/q11324612826,シカゲロウシリーズは釣れますか？100Fを購入しようと思ったのですが値段がとても高く迷っています。シーバスが表層を意識していればとても釣れると言われてますが、実際どうなんでしょうか？,0,0
1497,2026/1/24 4:28,恋愛相談、人間関係の悩み,あ,11時間3分,4,34,8.5,0,0,0.051,11.76,0.0,0.35,あと3日,https://detail.chiebukuro.yahoo.co.jp/qa/question_detail/q10324612825,高校2年生女です 恋愛経験が全くありません やばいですか？ 周りはみんな付き合ってる人がいたり好きな人がいたり楽しそうです,0,0
1498,2026/1/24 4:28,シニアライフ、シルバーライフ,1539620l906,11時間3分,1,23,23.0,0,0,0.035,4.35,0.01,0.11,あと3日,https://detail.chiebukuro.yahoo.co.jp/qa/question_detail/q14324612824,今の日本で、もし制度上の優遇がなくて子供もいなかったとしたら、結婚する人は5％以下くらいなのですか？,0,0
1499,2026/1/24 4:28,車、高速道路,1050220055,11時間3分,1,34,34.0,0,1,0.051,2.94,0.02,0.17,あと3日,https://detail.chiebukuro.yahoo.co.jp/qa/question_detail/q13324612823,首都高を幸浦から乗って、大黒JCT、生麦JCT、石川町JCTをぐるっと回って杉田で降りたら300円で乗れますか？,0,0
1500,2026/1/24 4:28,俳優、女優,ぱぷりか,11時間3分,1,14,14.0,0,0,0.021,7.14,0.0,0.1,あと3日,https://detail.chiebukuro.yahoo.co.jp/qa/question_detail/q11324612821,縦型中国ドラマショートについて質問です。 GoodShortというアプリで配信されている 「復讐の花を咲かす姫様」というドラマの 世子役の俳優さんが気になっています。 調べても出てこず、知っている方い...,0,0
1501,2026/1/24 4:27,政治、社会問題,翠,11時間4分,4,45,11.2,0,90,0.068,8.89,0.01,4.42,あと3日,https://detail.chiebukuro.yahoo.co.jp/qa/question_detail/q14324612819,選挙に受かると、言論の府と呼ばれるところで茶番劇をやってもいいという特権が与えられるのだと考えてよいのでしょうか。,0,0
1502,2026/1/24 4:27,恋愛相談、人間関係の悩み,さくら,11時間5分,4,23,5.8,0,0,0.035,17.39,0.0,0.33,あと3日,https://detail.chiebukuro.yahoo.co.jp/qa/question_detail/q13324612818,このままこの関係を続けるべきなのか悩んでいます。別れて一年経つ元彼と12月からまた関わり始めました。と言っても何度かやり直そうとした事があります。 別れたのは去年の3月ですが、6月に私の方から少し喧嘩...,0,0
1503,2026/1/24 4:27,ダイエット,1151131356,11時間5分,4,29,7.2,0,6,0.044,13.79,0.0,0.61,あと3日,https://detail.chiebukuro.yahoo.co.jp/qa/question_detail/q12324612817,パートナーもカレカノも好きな人もいないのにお腹が太ってるのを気にする人って何でですか？？？ 誰にも見せないならお腹の脂肪なんてどうってことなくないですか？健康に害があるから健康維持のため痩せたいとか着...,0,0
1504,2026/1/24 4:27,就職、転職,my_********,11時間5分,4,18,4.5,0,1,0.027,22.22,0.0,0.37,あと3日,https://detail.chiebukuro.yahoo.co.jp/qa/question_detail/q11324612816,デスクワークの公務員から65歳で派遣の介護職に再就職した場合、どういった辛さがありますか？,0,0
1505,2026/1/24 4:27,レディース全般,匿名,11時間5分,2,35,17.5,1,1,0.053,5.71,0.01,0.4,あと3日,https://detail.chiebukuro.yahoo.co.jp/qa/question_detail/q10324612815,正装しなくちゃいけないのですが、私はかなりのデブです。 閲覧いただきありがとうございますm(_ _)m 私は30歳女性、身長155cm、体重103kgもあります。 近々、正装して出向かなくてはならない...,0,0
1506,2026/1/24 4:27,外国為替、FX,あ,11時間5分,5,42,8.4,0,0,0.063,11.9,0.01,0.44,あと3日,https://detail.chiebukuro.yahoo.co.jp/qa/question_detail/q14324612814,FXの練習アプリはどれがおすすめですか？,0,0
1507,2026/1/24 4:27,飲食店,kik********,11時間5分,2,36,18.0,0,0,0.054,5.56,0.01,0.2,あと3日,https://detail.chiebukuro.yahoo.co.jp/qa/question_detail/q13324612813,よく飲食店(定食屋さん）でノロウイルスなどで営業禁止などの報道がありますが、お客さんへの補償(通院費等）はどうしているのでしょうか？何かそういう保険があるのでしょうか？,0,0
1508,2026/1/24 4:27,車検、メンテナンス,bjr********,11時間5分,4,42,10.5,0,2,0.063,9.52,0.01,0.45,あと3日,https://detail.chiebukuro.yahoo.co.jp/qa/question_detail/q12324612812,コンプレッサーの凍結防止について質問です。 冬期のコンプレッサーの凍結防止に水道凍結防止帯をコンプレッサーのタンク本体にに数本巻くと良いのかな？と考えました。 タンクからの配管には水道 凍結防止帯を巻...,0,0
1509,2026/1/24 4:27,Android,lD非公開,11時間5分,1,16,16.0,1,0,0.024,6.25,0.0,0.25,あと3日,https://detail.chiebukuro.yahoo.co.jp/qa/question_detail/q11324612811,Androidユーザーです（AQUOS wish3）。 画像左下の自動回転を促すアイコンが時折出てきて非常に邪魔です。これを出てこない様にする方法はありますか？ 尚、普段は自動回転をオフにしています。,0,0
1510,2026/1/24 4:27,大学受験,匿名,11時間5分,6,5155,859.2,3,31,7.745,0.12,64.54,10.03,あと3日,https://detail.chiebukuro.yahoo.co.jp/qa/question_detail/q10324612810,MARCHと関関同立について 難易度 明治＞同志社 青学 立教＞中央 法政＞関関立 就職 同志社＞＝明治＞青学 関学 立命 立教 中央＞関大 法政 であってますか？,0,0
1511,2026/1/24 4:26,飲食店,h9fuhweiruhfiasu,11時間6分,5,109,21.8,0,5,0.163,4.59,0.04,0.76,あと3日,https://detail.chiebukuro.yahoo.co.jp/qa/question_detail/q14324612809,お寿司について… ちょっと最近人間関係で面倒くさいなぁと感じる方が身近に出てきて、なんとなく質問してみたくなりました。 私は普通にお寿司が大好きで、回転寿司は勿論、街のお寿司屋さんにもよく行きます。高...,0,0
1512,2026/1/24 4:26,バイク,1149918118,11時間6分,0,20,20.0,0,0,0.03,0.0,0.0,0.03,あと3日,https://detail.chiebukuro.yahoo.co.jp/qa/question_detail/q13324612808,cbr400fまたはcbx400fに詳しい方教えてください クラッチをバラしていたところ、 プライマリーチェーンが伸びており、ガタがありました クラッチハウジングのガタも確認しましたが、 チェーンのガ...,0,0
1513,2026/1/24 4:26,ビジネス書,20251227/1007,11時間6分,0,6,6.0,0,0,0.009,0.0,0.0,0.01,あと3日,https://detail.chiebukuro.yahoo.co.jp/qa/question_detail/q12324612807,東大出は学力偏重なのでユダヤ人ほどビジネスでは成功できないのですか？,0,0
1514,2026/1/24 4:26,家族関係の悩み,1251657782,11時間6分,4,34,8.5,0,0,0.051,11.76,0.0,0.35,あと3日,https://detail.chiebukuro.yahoo.co.jp/qa/question_detail/q11324612806,19歳男です。 今日父と腕相撲をして人生で初めて勝ちました。嬉しくなかったです。それよりか父が負けず嫌いな性格を知っていたので申し訳ない気持ちと寂しい気持ちがこみ上げてきました。 昔は全く歯が立たない...,0,0
1515,2026/1/24 4:26,海外,b8fea63e7,11時間6分,4,21,5.2,0,2,0.031,19.05,0.0,0.42,あと3日,https://detail.chiebukuro.yahoo.co.jp/qa/question_detail/q10324612805,二月の後半に彼女とセブ島に旅行に行きたいと考えています。 予約はtrip .comでホテルとのセットで取ろうと思っているのですが、初めての海外旅行なのでおすすめの航空券とホテルの予約サイトなどがあれば...,0,0
1516,2026/1/24 4:25,iPhone,mix********,11時間7分,2,16,8.0,0,0,0.024,12.5,0.0,0.17,あと3日,https://detail.chiebukuro.yahoo.co.jp/qa/question_detail/q14324612804,iPhoneの写真アプリで動画などをサイズの大きい順に並べることはできますか？ 現在↓ iPhone12 IOS18.6,0,0
1517,2026/1/24 4:25,住宅,a4f58b119,11時間8分,1,17,17.0,0,0,0.025,5.88,0.0,0.1,あと3日,https://detail.chiebukuro.yahoo.co.jp/qa/question_detail/q13324612803,イライラしているので今直ぐに回答をお願いします。このようなフローリングの部屋が床上浸水になるとしたらどのようなイメージとなりますか。合成にして欲しいです,0,0
1518,2026/1/24 4:25,アルバイト、フリーター,1149995210,11時間8分,1,46,46.0,0,0,0.069,2.17,0.03,0.14,不明,https://detail.chiebukuro.yahoo.co.jp/qa/question_detail/q12324612802,今やっているバイトなんですが昨日、来月のシフトが出たので見たら、今までは面接時に言っていた条件通りの夕方出勤の週２回だったのですが、来月のシフトでは週３回のところがあったり、 午前勤務が入ってあったり...,0,0
1519,2026/1/24 4:24,就職、転職,my_********,11時間9分,2,6,3.0,0,0,0.009,33.33,0.0,0.16,あと3日,https://detail.chiebukuro.yahoo.co.jp/qa/question_detail/q11324612801,デスクワークの公務員から65歳で派遣の軽作業に再就職した場合、どういった辛さがありますか？,0,0
1520,2026/1/24 4:24,テレビ、ラジオ,pan********,11時間9分,1,10,10.0,0,1,0.015,10.0,0.0,0.13,あと3日,https://detail.chiebukuro.yahoo.co.jp/qa/question_detail/q10324612800,「徹子の部屋」観た後、続けて「DAIGOも台所」観ている人いるのかなぁ？,0,0
1521,2026/1/24 4:24,土地,rcs********,11時間9分,0,10,10.0,0,0,0.015,0.0,0.0,0.01,あと3日,https://detail.chiebukuro.yahoo.co.jp/qa/question_detail/q13324612798,借地に自分の家を建てるメリットは何でしょうか？ 毎月土地代を払って借りてた方が、土地の取得費や税金を考えた時は結果的に安く済むということでしょうか？,0,0
1522,2026/1/24 4:24,アニメ,ひ,11時間9分,0,69,69.0,0,0,0.103,0.0,0.0,0.1,あと3日,https://detail.chiebukuro.yahoo.co.jp/qa/question_detail/q11324612796,怖いです。超かぐや姫。あんなず〜っとCMとかMVのアニメ見せられてるような中身のないアニメが絶賛されていることが。 どこが面白いんですか？,0,0
1523,2026/1/24 4:23,自転車、サイクリング,aa275bfa6,11時間10分,5,54,10.8,0,11,0.081,9.26,0.01,0.94,不明,https://detail.chiebukuro.yahoo.co.jp/qa/question_detail/q10324612795,自転車とかバイクでパルクール？してる動画をよく見かけるんですが、高いとこから降りる時お尻痛くないんですか？,0,0
1524,2026/1/24 4:23,病気、症状,たなぼた,11時間10分,4,23,5.8,0,0,0.034,17.39,0.0,0.33,あと3日,https://detail.chiebukuro.yahoo.co.jp/qa/question_detail/q14324612794,階段を登り降りするのが苦手なのですが解決方法ありますか？ 1.2年前くらいから階段を降りる時にゆっくり一段一段降りてるのに落ちた感覚がしてしまってうまく降りられない時が多くなりました。 ですがここ最近...,0,0
1525,2026/1/24 4:23,中学受験,1252109615,11時間10分,2,24,12.0,0,0,0.036,8.33,0.0,0.18,あと3日,https://detail.chiebukuro.yahoo.co.jp/qa/question_detail/q13324612793,卒業アルバムになるのと、受験の願書に貼る写真を撮ったんですけど、願書に貼るやつはニキビが目立ってました。卒業アルバムも同じように目立ちますか？,0,0
1526,2026/1/24 4:23,iPhone,mix********,11時間10分,2,33,16.5,0,0,0.049,6.06,0.01,0.2,あと3日,https://detail.chiebukuro.yahoo.co.jp/qa/question_detail/q11324612791,iCloudでバックアップを取って初期化したら全て元通りになりますか？ 本体のストレージがもうパンパンで身動き出来ない状態です。で内訳をみると、システムデータが75もありました。 クリアキャッシュなど...,0,0
1527,2026/1/24 4:23,大学受験,ae60823a6,11時間10分,0,29,29.0,0,0,0.043,0.0,0.0,0.04,あと3日,https://detail.chiebukuro.yahoo.co.jp/qa/question_detail/q10324612790,親の意向で関学を後期の共テ利用で受けようと思っています。 英語R96 英語L78 生物91 生物基礎50 化学基礎27 傾斜後 文系学部86.8% 国際学部89.6% で受けようと思ってます。 どの学...,0,0
1528,2026/1/24 4:23,英語,ナリトク,11時間10分,0,21,21.0,0,0,0.031,0.0,0.0,0.03,あと3日,https://detail.chiebukuro.yahoo.co.jp/qa/question_detail/q14324612789,英語の勉強をしていて、研究社から出版されている辞書や参考書と縁があることが多いのですが、研究社は、岩波書店と同様に東大の巣窟ですか？,0,0
1529,2026/1/24 4:22,資格,1252846718,11時間11分,2,8,4.0,0,0,0.012,25.0,0.0,0.16,あと3日,https://detail.chiebukuro.yahoo.co.jp/qa/question_detail/q13324612788,日本情報処理検定表計算３級を合格しましたが、２月に、表計算準２級へ受験するし、今後、表計算２級、準１級も、合格出来そうですか？私は聴覚障害者ですが、普通科高校の偏差値38です,0,0
1530,2026/1/24 4:22,超常現象、オカルト,翠,11時間11分,5,81,16.2,0,43,0.121,6.17,0.02,2.41,あと3日,https://detail.chiebukuro.yahoo.co.jp/qa/question_detail/q12324612787,むかしからですが、冬に雪が積もり出すと感覚が鋭くなり、天まで行くような感覚になる一方で、この世に未練や執着があるためか、解脱にブレーキを掛けようとする働きが心に起ります。 やっぱりあの世もいいかもしれ...,0,0
1531,2026/1/24 4:22,高校受験,cd32eed46,11時間11分,2,51,25.5,0,0,0.076,3.92,0.02,0.22,あと3日,https://detail.chiebukuro.yahoo.co.jp/qa/question_detail/q11324612786,進路について質問です 私は今木更津の中学2年です。 そろそろ高校受験のことについて考えているのですが、志望校が絞りきれません。 偏差値は恐らく55〜65のくらい（苦手分野と得意分野が極端）で、高校生活...,0,0
1532,2026/1/24 4:21,マラソン、陸上競技,秋霜烈日,11時間12分,2,22,11.0,0,0,0.033,9.09,0.0,0.18,あと3日,https://detail.chiebukuro.yahoo.co.jp/qa/question_detail/q14324612784,最悪です 棒高跳びの棒を股間にくらいました。 大勢の女子が指さして笑うんです 「あいつ、もうダメじゃん♪」と… 一生懸命な俺を笑う資格あるんですか？ 笑った女の顔は覚えたからな,0,0
1533,2026/1/24 4:21,法律相談,b608a30f,11時間13分,1,15,15.0,0,0,0.022,6.67,0.0,0.1,あと3日,https://detail.chiebukuro.yahoo.co.jp/qa/question_detail/q12324612782,16歳の息子が、今年の5月に自転車窃盗をし、8月頃に小学校に侵入し、それは小学校側の許しも得ており、大事になっていないようです。 11月頃に息子が窃盗した原付を、少し仲の良かった不良の友達に取られてし...,0,0
1534,2026/1/24 4:20,結婚,知恵袋のユーザー,11時間14分,6,98,16.3,2,4,0.145,6.12,0.02,1.06,あと3日,https://detail.chiebukuro.yahoo.co.jp/qa/question_detail/q11324612781,緊急です。 新潟県柏崎市住みです。 今日東京で弟の結婚式があるのですが信越本線柏崎ー長岡間が大雪で終日運転見合わせが決まってしまいました。 本来なら柏崎から長岡まで普通列車、長岡から東京まで上越新幹線...,0,0
1535,2026/1/24 4:20,芸能人,gptddximt,11時間14分,6,48,8.0,0,0,0.071,12.5,0.01,0.52,あと3日,https://detail.chiebukuro.yahoo.co.jp/qa/question_detail/q14324612779,そもそも和田あき子って何であんなに威張っていたんですか？ アッコにお任せという長寿番組があるのは知ってます 他は？,0,0
1536,2026/1/24 4:20,恋愛相談、人間関係の悩み,c7ef02c1c,11時間14分,1,22,22.0,0,0,0.033,4.55,0.01,0.11,あと3日,https://detail.chiebukuro.yahoo.co.jp/qa/question_detail/q13324612778,付き合って3ヶ月の年上の男性がいます 年は9歳離れていて、ENFPの忠犬ハチ公です 彼は、私が出会った人の中で1番と言えるほどすごくいい人です。誰にでも分け隔てなく優しく、フレンドリーで私のわがままも...,0,0
1537,2026/1/24 4:20,Yahoo!知恵袋,a4f58b119,11時間14分,1,4,4.0,0,1,0.006,25.0,0.0,0.12,あと3日,https://detail.chiebukuro.yahoo.co.jp/qa/question_detail/q12324612777,知恵袋の削除基準でみなさまは、どんな事が一番気になることがありますか,0,0
1538,2026/1/24 4:20,100円ショップ,1250388372,11時間14分,1,100,100.0,0,2,0.148,1.0,0.15,0.31,不明,https://detail.chiebukuro.yahoo.co.jp/qa/question_detail/q11324612776,キャンドゥのホチキスみたいなハンディミシンは右利き専用ですか？,0,0
1539,2026/1/24 4:19,洋楽,kin********,11時間15分,3,37,12.3,0,0,0.055,8.11,0.01,0.28,あと3日,https://detail.chiebukuro.yahoo.co.jp/qa/question_detail/q14324612774,昔聞いた洋楽の曲名を思い出せないでいます。 ・少し、女性か子供の歌声みたいなのが入っていたような… ・おそらくサビで、 「エバエバー エバエバー エバエバー」か、 「ネバネバー ネバネバー ネバネバー...,0,0
1540,2026/1/24 4:19,転職,cgh********,11時間15分,2,28,14.0,0,0,0.041,7.14,0.01,0.19,あと3日,https://detail.chiebukuro.yahoo.co.jp/qa/question_detail/q12324612772,在職しながらの転職中のメンタルケアについて。 25歳、女性、メーカー勤務です。今の会社は新卒として入社し、約2年ほど働いています。 今の会社がまぁブラック(笑)でして、みなし残業30時間で毎月60〜8...,0,0
1541,2026/1/24 4:19,飲食店,tet********,11時間15分,4,44,11.0,0,0,0.065,9.09,0.01,0.36,あと3日,https://detail.chiebukuro.yahoo.co.jp/qa/question_detail/q11324612771,松屋で、牛めしの持ち帰りをした時に味噌汁がついてこない理由。 それは帰る途中で味噌汁がこぼれる、漏れるなどのトラブルに対する配慮と、そのことへのクレームを想定してのことですか？,0,0
1542,2026/1/24 4:19,一人暮らし、シングルライフ,レモン,11時間15分,4,30,7.5,0,0,0.044,13.33,0.0,0.34,あと3日,https://detail.chiebukuro.yahoo.co.jp/qa/question_detail/q14324612769,最近、「孤独の行き着く先は、孤独を受け入れ、一人を楽しむことだ」という文章を読みました。 ​そこには、「無理に誰かと繋がって表面的な付き合いをするよりも、一人で自分と向き合う時間（質の高い孤独）を持つ...,0,0
1543,2026/1/24 4:19,恋愛相談、人間関係の悩み,匿名,11時間15分,5,125,25.0,0,10,0.185,4.0,0.05,1.0,あと3日,https://detail.chiebukuro.yahoo.co.jp/qa/question_detail/q13324612768,別れた後、彼または彼女が他の異性と身体の関係を持っていたら嫌だなと思う人いますか？ 別れている間のことだから、何をしようが問題ないと理屈ではわかるのですが、付き合っている時は私一筋で、あんなに私のこと...,0,0
1544,2026/1/24 4:18,学校の悩み,1051640875,11時間16分,1,22,22.0,0,0,0.033,4.55,0.01,0.11,あと3日,https://detail.chiebukuro.yahoo.co.jp/qa/question_detail/q12324612767,髪染め・パーマ・ピアス禁止校則は緩和すべきだと思いますか？ 私は現在高校の生徒会役員をしております。取り組みとして、身だしなみ関連の校則緩和を挙げました。 そこで、学校の教育目標・法的根拠・社会的動向...,0,0
1545,2026/1/24 4:18,K-POP、アジア,1052748700,11時間16分,1,29,29.0,0,1,0.043,3.45,0.01,0.16,あと3日,https://detail.chiebukuro.yahoo.co.jp/qa/question_detail/q11324612766,BTSのワルツの応募をしたのですが、メールからじゃなくて写真の所から当落確認して入金はできますか？,0,0
1546,2026/1/24 4:18,職場の悩み,ナリトク,11時間16分,2,16,8.0,0,6,0.024,12.5,0.0,0.44,あと3日,https://detail.chiebukuro.yahoo.co.jp/qa/question_detail/q10324612765,なぜ、一流の仕事をする人は、趣味の分野でも、一流であることが多いのですか？,0,0
1547,2026/1/24 4:18,プロレス,ozm********,11時間16分,5,22,4.4,0,1,0.032,22.73,0.0,0.45,あと3日,https://detail.chiebukuro.yahoo.co.jp/qa/question_detail/q14324612764,富豪2夢路 このリングネームをどう思う？,0,0
1548,2026/1/24 4:18,大学受験,非公開,11時間17分,1,112,112.0,0,0,0.165,0.89,0.19,0.24,不明,https://detail.chiebukuro.yahoo.co.jp/qa/question_detail/q13324612763,共通テスト追試験を受けるものです。 追試の書類に時間割が書いたものがなく 持ち物なども書いてないので 何時に何を持ってけばいいか分かりません。 時間割も集合時間も本試と同じなの でしょうか？,0,0
1549,2026/1/24 4:18,家族関係の悩み,翠,11時間17分,2,50,25.0,0,6,0.074,4.0,0.02,0.49,あと3日,https://detail.chiebukuro.yahoo.co.jp/qa/question_detail/q12324612762,昨日も雪かきは奥さまがやってくれました。 お陰で車も出しやすかったです。 日頃の奥さまの働きぶりに感謝してますか？,0,0
