193,2026/1/22 4:19,マインクラフト,1150314052,49分,0,4,4.0,0,0,0.081,0.0,0.0,0.08,あと3日,https://detail.chiebukuro.yahoo.co.jp/qa/question_detail/q10324546415,マイクラpeに関する質問です。このバージョンでコントローラー画面を十字にしたいのですが、どうすればできるようになるのでしょうか,0,0
194,2026/1/22 4:19,海外ドラマ,SSSSSSS,49分,1,12,12.0,0,0,0.243,8.33,0.03,1.23,あと3日,https://detail.chiebukuro.yahoo.co.jp/qa/question_detail/q14324546414,あるドラマのタイトル教えてください ターミネーター２の液体型の敵キャラと似ている液体型に変身できるアメリカのコメディドラマが教えてくださいターミネーターではないです,0,0
195,2026/1/22 4:19,ニュース、事件,hir********,49分,0,2,2.0,0,0,0.04,0.0,0.0,0.04,あと3日,https://detail.chiebukuro.yahoo.co.jp/qa/question_detail/q13324546413,ユーチューブの知恵袋では、もっとも公明党がひどい ということが解りますよね？,0,0
196,2026/1/22 4:18,ファーストフード,usa********,50分,2,10,5.0,0,0,0.198,20.0,0.01,2.14,あと3日,https://detail.chiebukuro.yahoo.co.jp/qa/question_detail/q12324546412,あなたがロッテリアに行かなくなったのは何時ですか？ 80年代までマックと肩を並べてると思ったのですが、90年代に失速して、メニューを一新した辺りからですかね？ 30年以上行ってないと思います。,0,0
197,2026/1/22 4:18,ファッション,匿名,50分,1,7,7.0,0,0,0.138,14.29,0.01,1.11,あと3日,https://detail.chiebukuro.yahoo.co.jp/qa/question_detail/q11324546411,【ミニスカートを穿いている事好きで、顔が可愛い女性】は、顔がかっこいい男性好きな人が多いですか？ ※大学生の場合,0,0
198,2026/1/22 4:18,宝塚,匿名,50分,0,4,4.0,0,0,0.079,0.0,0.0,0.08,あと3日,https://detail.chiebukuro.yahoo.co.jp/qa/question_detail/q10324546410,宝塚の夢白あやちゃんは退団後、東宝などのミュージカルに来ると思いますか？個人的にまだまだ色々な役を見たいとおもっているので皆さんの予想を聞かせて欲しいです！,0,0
199,2026/1/22 4:18,メンタルヘルス,qbl********,50分,2,22,11.0,0,0,0.434,9.09,0.05,2.36,あと3日,https://detail.chiebukuro.yahoo.co.jp/qa/question_detail/q14324546409,大人でこのような質問をするのは恥ずかしいのですが、睡眠に関して相談したいことがあります。私は24歳の女です。 睡眠に関してずっと悩んでいたことがあります。それは1人で眠ることができないということです。...,0,0
200,2026/1/22 4:18,性病、性感染症,1150572982,50分,1,5,5.0,0,0,0.099,20.0,0.0,1.06,あと3日,https://detail.chiebukuro.yahoo.co.jp/qa/question_detail/q13324546408,至急 淋病の点滴治療って所要時間どのくらいですか？明日仕事前に病院に行くので知りたいのですが、調べても5分〜1時間とでて困ってます。 先ず5分で終わるなんてことありますか？,0,0
201,2026/1/22 4:18,ゲーム,1252750265,50分,0,3,3.0,0,0,0.059,0.0,0.0,0.06,あと3日,https://detail.chiebukuro.yahoo.co.jp/qa/question_detail/q12324546407,原神LunaⅢのイベントアイテム、「整理されたノート」はイベント後消えてしまうアイテムですか？ 読みたいのですが、取り逃してしまいました。,0,0
202,2026/1/22 4:18,オンラインゲーム,ner********,50分,2,2,1.0,0,0,0.039,100.0,0.0,1.97,あと3日,https://detail.chiebukuro.yahoo.co.jp/qa/question_detail/q11324546406,OW2で質問です キャクターのHPについてです ・白HP・青いシールド・タンクのHPの違いについて教えて欲しいです タンクのHPは単発ドカンより連射を食らうほうが安いくらいの知識しかなくって....,0,0
203,2026/1/22 4:18,メンズ全般,ton********,50分,0,1,1.0,0,0,0.02,0.0,0.0,0.02,あと3日,https://detail.chiebukuro.yahoo.co.jp/qa/question_detail/q10324546405,リーバイス501XX復刻現行で、スリムな物はありますか？ アメカジは好きではなく、太いストレートパンツも好みではないです。品のあるくらいの太さはありませんか？ また、同等に育つ？色落ちするなら、他メー...,0,0
204,2026/1/22 4:18,アルバイト、フリーター,dkt********,50分,0,1,1.0,0,0,0.02,0.0,0.0,0.02,あと3日,https://detail.chiebukuro.yahoo.co.jp/qa/question_detail/q14324546404,アエナで働いている、働いていた方教えてください。 ①アエナの店舗スタッフ(バイト)は検便しますか？ ②バイトのオリエンテーションは関西店舗採用でも東京の本社まで行がなければなりませんか？,0,0
205,2026/1/22 4:17,ゲーム,Ycuvuhuhuu,52分,0,2,2.0,0,0,0.038,0.0,0.0,0.04,あと3日,https://detail.chiebukuro.yahoo.co.jp/qa/question_detail/q13324546403,至急、Switch2を買ったもののスリープして20分位すると電源が入らなくなります、お陰でソフトのダウンロードも出来ないです、長押しして再起動にすると電源は入るのですがこれは不良品ですか？ じゅうでん...,0,0
206,2026/1/22 4:17,文学、古典,1252053740,52分,1,2,2.0,0,0,0.038,50.0,0.0,0.98,あと3日,https://detail.chiebukuro.yahoo.co.jp/qa/question_detail/q12324546402,現代語訳お願いします。 外國官判事ヨリ外國官副知事（大阪出張）大隈八太郎宛 御一新以後ノ一分銀、二分金及計畫中ノ新貨幣ノ量目等照會ノ件 附屬書 貨幣ニ關スル照會事項 以急飛致啓上候然は御承知之通過日以...,0,0
207,2026/1/22 4:17,恋愛相談、人間関係の悩み,匿名希望,52分,3,18,6.0,1,4,0.345,16.67,0.02,7.3,あと3日,https://detail.chiebukuro.yahoo.co.jp/qa/question_detail/q11324546401,推しに年齢って関係あります？？ 私は30前半の女やってます。 私の推しはとある俳優さんですが 干支か私と同じです（私が上） なので歳はくっそほど離れています。 その俳優さんは顔も演技もどタイプで 一目...,0,0
208,2026/1/22 4:17,ゲーム,フライゴン大好きな人,52分,0,2,2.0,0,0,0.038,0.0,0.0,0.04,あと3日,https://detail.chiebukuro.yahoo.co.jp/qa/question_detail/q10324546400,スト6についての質問です。ヴァイパーに中距離でセービングをされた時の対処法を教えてください。ダルシムを使っているのですが何をすればいいか分からず前ステで近づかれます。,0,0
