733,2026/1/28 6:59,恋愛相談、人間関係の悩み,ein********,7時間49分,6,37,6.2,0,0,0.079,16.22,0.0,0.72,あと3日,https://detail.chiebukuro.yahoo.co.jp/qa/question_detail/q10324753970,女性に質問です 変な男（清潔感がない、明らかにヤリモク等）に好かれると自己肯定感は下がりますか？,0,0
734,2026/1/28 6:59,アルバイト、フリーター,c4aa95c2f,7時間49分,1,27,27.0,0,0,0.058,3.7,0.02,0.16,あと3日,https://detail.chiebukuro.yahoo.co.jp/qa/question_detail/q14324753969,今現在別の仕事を探してて 25で男です 正社員で仕事してましたが辞めてしまいました。 近くに、吉野家の正社員、ゲームセンター、100均、すき家の正社員などあるんですが あいにく未経験です 実際仕事した...,0,0
735,2026/1/28 6:59,アニメ、コミック,c276936eb,7時間49分,0,8,8.0,0,0,0.017,0.0,0.0,0.02,あと3日,https://detail.chiebukuro.yahoo.co.jp/qa/question_detail/q13324753968,彼は何というキャラクターですか？ 性格なども教えていきたいです。,0,0
736,2026/1/28 6:59,学校の悩み,c38ac2fe8,7時間49分,0,13,13.0,0,0,0.028,0.0,0.0,0.03,あと3日,https://detail.chiebukuro.yahoo.co.jp/qa/question_detail/q10324753965,私は中1で、別室登校をしています。 最近部活に行き始めたのですが、友達はいるものの、他の友達と楽しそうに話しているのを見ると居心地が悪くなってしまい、部活に行くのが辛くなってきました。 このまま続けた...,0,0
737,2026/1/28 6:59,恋愛相談、人間関係の悩み,「謝」,7時間49分,1,15,15.0,0,0,0.032,6.67,0.0,0.14,あと3日,https://detail.chiebukuro.yahoo.co.jp/qa/question_detail/q11324753966,25.6歳の人が 「30代くらいかと思っていたよ！」と言われたりした場合 つまりは30歳より上、30歳以上に見られていた ということになりますか？ 30代 30歳〜39歳ですから。,0,0
738,2026/1/28 6:59,職場の悩み,30代独身,7時間49分,2,40,20.0,0,0,0.085,5.0,0.02,0.3,あと3日,https://detail.chiebukuro.yahoo.co.jp/qa/question_detail/q14324753964,職場にいる「何故かイラッとして、よく考えたら仕事でよく怒られている人」の特徴を教えてください。,0,0
739,2026/1/28 6:58,スマートフォン,c10346864,7時間50分,1,3,3.0,0,0,0.006,33.33,0.0,0.11,あと3日,https://detail.chiebukuro.yahoo.co.jp/qa/question_detail/q13324753963,爆熱SOCや発熱問題でアップデートしてしまって短時間性能が少し低下する代わりに長時間安定稼働するようにしたスマホはAndroidもiPhoneも、 寒冷地や今の冬の時期でスキー場や冬山登山などに行く場...,0,0
740,2026/1/28 6:58,鉄道、列車、駅,mak********,7時間50分,2,33,16.5,0,7,0.07,6.06,0.01,0.73,あと3日,https://detail.chiebukuro.yahoo.co.jp/qa/question_detail/q11324753961,子供が、郊外学習で都心に行きます。 東京フリー切符を渡されるそうなのですが、 Suicaで区間外から乗車する場合、青梅〜西荻窪区間を西荻窪で下車して清算するで合ってますでしょうか？ それとも、そのまま...,0,0
741,2026/1/28 6:58,iPhone,c95174b44,7時間50分,4,38,9.5,0,0,0.081,10.53,0.01,0.5,あと3日,https://detail.chiebukuro.yahoo.co.jp/qa/question_detail/q12324753962,【至急】 この時代にiPhone12から中古iPhonexsmaxに替えようと思うのですがアリですか？,0,0
742,2026/1/28 6:58,ポータブル音楽プレーヤー,？？？？？,7時間50分,3,24,8.0,0,0,0.051,12.5,0.0,0.37,あと3日,https://detail.chiebukuro.yahoo.co.jp/qa/question_detail/q10324753960,おすすめワイヤレスイヤホンについて いま現在AppleのAirPods pro2を使ってます 音質を底上げしたいのとノイキャンを上げたいというので二台目を買いたいと思ってます おすすめ等何がありますか...,0,0
743,2026/1/28 6:58,恋愛相談、人間関係の悩み,匿名,7時間50分,1,9,9.0,0,0,0.019,11.11,0.0,0.13,あと3日,https://detail.chiebukuro.yahoo.co.jp/qa/question_detail/q14324753959,男子Aは、ネットで女子Bと知り合った翌日に、女子Bの家に行きたいと言って、女子Bは許可して、女子Bと直接会ったら、女子Bの顔を可愛くないと思って、なのに、女子Bに触ったり、 女子Bのスカートをめくった...,0,0
744,2026/1/28 6:58,メンタルヘルス,北かぜから太陽,7時間51分,1,8,8.0,0,0,0.017,12.5,0.0,0.12,あと3日,https://detail.chiebukuro.yahoo.co.jp/qa/question_detail/q12324753957,寝起きに憂鬱なる方。どう解消してますか？ 仕事もやる気なく、脳裏にやらなきゃいけないことが頭を駆け抜けるんです。,0,0
745,2026/1/28 6:58,女性アイドル,zod********,7時間51分,1,62,62.0,0,0,0.132,1.61,0.08,0.24,不明,https://detail.chiebukuro.yahoo.co.jp/qa/question_detail/q11324753956,これ誰かわかる方いますか？,0,0
746,2026/1/28 6:58,バンド,1151315794,7時間51分,0,6,6.0,0,0,0.013,0.0,0.0,0.01,あと3日,https://detail.chiebukuro.yahoo.co.jp/qa/question_detail/q10324753955,バンド ASIAN KUNG-FU GENERATIONのボーカル後藤正文の身長は実際どれ程ですか？ 会った事ある人いませんか？ 音楽 バンド アジカン,0,0
747,2026/1/28 6:57,カフェ、喫茶,1253352488,7時間52分,0,13,13.0,0,0,0.028,0.0,0.0,0.03,あと3日,https://detail.chiebukuro.yahoo.co.jp/qa/question_detail/q14324753954,至急！ スタバのフラペチーノのトールサイズがカップごと入るタンブラーを教えてください。,0,0
748,2026/1/28 6:57,病院、検査,紀伊半島在住のさな,7時間52分,0,38,38.0,0,0,0.08,0.0,0.0,0.08,あと3日,https://detail.chiebukuro.yahoo.co.jp/qa/question_detail/q13324753953,年齢が40代までの男性と女性の尿が混じるとどうなりますか？ 特にお互い妊娠に適した年齢とか妊娠できる年齢の時は年齢も若いためまだ腎臓は尿を濾し出す力が強いと泌尿器科の先生が言っていました。 男性と女性...,0,0
749,2026/1/28 6:57,コミック,ba171311f,7時間52分,0,22,22.0,0,0,0.047,0.0,0.0,0.05,あと3日,https://detail.chiebukuro.yahoo.co.jp/qa/question_detail/q11324753951,漫画のタイトルについて質問です。 昔読んだ少女コミックのタイトルが思い出せません。 内容は幼馴染の学生の恋愛なのですが 男の子がモテモテで、いろんな女の子たちの乳首を指押すという…人には聞きにくい物で...,0,0
750,2026/1/28 6:57,アルバイト、フリーター,c4aa95c2f,7時間52分,1,24,24.0,0,0,0.051,4.17,0.01,0.16,あと3日,https://detail.chiebukuro.yahoo.co.jp/qa/question_detail/q10324753950,今月までに35000円必要なんですが 先ほどシェアフル、タイミーも見たんですが なくて 他はないですか？ わかる方いますか？ バイトルは担当者待ちです 色々な意見を貰ってやってますが解決できてないです,0,0
751,2026/1/28 6:57,日用品、生活雑貨,フローズヴィトニル,7時間52分,1,12,12.0,0,1,0.025,8.33,0.0,0.19,あと3日,https://detail.chiebukuro.yahoo.co.jp/qa/question_detail/q12324753952,シールってそんなに必死に集めるものなんですか？ もちろん自分も、好きなキャラクターとか気に入ったデザインのものが売っていたら買うこともありますが、最近の流行？は意味がわかりません。,0,0
752,2026/1/28 6:57,テーマパーク,emama,7時間52分,2,17,8.5,0,0,0.036,11.76,0.0,0.25,あと3日,https://detail.chiebukuro.yahoo.co.jp/qa/question_detail/q13324753948,服装についての質問です。 3月の上旬にユニバーサルへ行くのですがピーコートは暑く感じますか？？ どんな上着がBESTなのでしょうか。,0,0
753,2026/1/28 6:57,YouTube,Mr.**********,7時間52分,1,14,14.0,0,0,0.03,7.14,0.0,0.14,あと3日,https://detail.chiebukuro.yahoo.co.jp/qa/question_detail/q12324753947,恐怖の深夜番組 youtubeで恐ろしい深夜番組のテロップを見つけたのですが、タイトルや放送時期、詳しい放送内容が分かりません。 ttps://www.youtube.com/watch?v=X1YB...,0,0
754,2026/1/28 6:57,受験、進学,lgosojt,7時間52分,1,19,19.0,0,0,0.04,5.26,0.01,0.15,あと3日,https://detail.chiebukuro.yahoo.co.jp/qa/question_detail/q11324753946,高校を休みすぎて専門学校いけるか不安です。 進学は名古屋モード学園か名古屋ビジネスアカデミーにしようか悩んでいます。2年間で16回ぐらい休んでます。理由は過敏性腸症候群です。評点平均は3.5です。 休...,0,0
755,2026/1/28 6:57,ウイルス対策、セキュリティ対策,非公開,7時間52分,4,58,14.5,0,2,0.123,6.9,0.02,0.67,あと3日,https://detail.chiebukuro.yahoo.co.jp/qa/question_detail/q10324753945,ウイルスバスタークラウドについて PC無知です。 今まで 古い4ギガのPCを 使っていました。 ネットショッピング・証券取引を利用したいので 決済保護のあるウイルスバスタークラウドを利用していましたが...,0,0
756,2026/1/28 6:57,物理学,AIロイヤルマスター押切優勢,7時間52分,0,17,17.0,0,0,0.036,0.0,0.0,0.04,あと3日,https://detail.chiebukuro.yahoo.co.jp/qa/question_detail/q13324753943,電気 こちらの問題について詳しく教えて頂きたいです。 よろしくお願いします,0,0
757,2026/1/28 6:57,数学,bd8283555,7時間52分,3,45,15.0,0,0,0.095,6.67,0.01,0.41,あと3日,https://detail.chiebukuro.yahoo.co.jp/qa/question_detail/q12324753942,この問題の(1)について。 a^a=10^2aの所までは分かるのですが、何故そこから常用対数を取って計算する思考になるのかが分かりません。 数学が出来る人ってどういう時に対数を取りたいと思うのでしょう...,0,0
758,2026/1/28 6:57,美容整形,caed88d75,7時間52分,0,4,4.0,0,0,0.008,0.0,0.0,0.01,あと3日,https://detail.chiebukuro.yahoo.co.jp/qa/question_detail/q11324753941,額ヒアル受けたことある方に質問です。 昨日額ヒアルを3cc打ったのですが後悔してます。カウンセリングだけのつもりで行ったのですが押しに負け当日打つ事になりました。 仕上がりは凄くきれいで全然腫れていな...,0,0
759,2026/1/28 6:57,自動車,mpa********,7時間52分,2,28,14.0,0,0,0.059,7.14,0.01,0.27,あと3日,https://detail.chiebukuro.yahoo.co.jp/qa/question_detail/q10324753940,デリカD5のコトコト音について教えてください。 低速走行時にコトコト音が聞こえます。(30キロ以上だと聞き取れないので分かりません) 速度が一定でもエンジン回転数に応じて音が早くなる。停車時、空ぶかし...,0,0
760,2026/1/28 6:57,子育て、出産,erf********,7時間52分,8,54,6.8,0,1,0.114,14.81,0.01,1.02,あと3日,https://detail.chiebukuro.yahoo.co.jp/qa/question_detail/q14324753939,もうすぐ子供が生まれる女ですが、おそらく男の子の可能性が高いということです。男の子は反抗期になると母親に対しても反抗的になるのでしょうか？,0,0
761,2026/1/28 6:56,鳥類,1252176860,7時間54分,1,19,19.0,0,2,0.04,5.26,0.01,0.27,あと3日,https://detail.chiebukuro.yahoo.co.jp/qa/question_detail/q13324753938,この小鳥の名前を教えてください。オオジュリン？セッカ？ホオジロ？,0,0
762,2026/1/28 6:56,病気、症状,はんちゃ,7時間54分,1,5,5.0,0,0,0.011,20.0,0.0,0.12,あと3日,https://detail.chiebukuro.yahoo.co.jp/qa/question_detail/q11324753936,毎年、必ずしもやけになる人はいるんでしょうか？ 俺くらいですか？,0,0
763,2026/1/28 6:56,特撮,アカレンジャー,7時間54分,5,39,7.8,0,22,0.082,12.82,0.01,2.0,あと3日,https://detail.chiebukuro.yahoo.co.jp/qa/question_detail/q14324753934,「仮面ライダーゼッツ」の後番組は、ズバリこれ？,0,0
764,2026/1/28 6:56,恋愛相談、人間関係の悩み,a6a526888,7時間54分,2,14,7.0,0,3,0.03,14.29,0.0,0.43,あと3日,https://detail.chiebukuro.yahoo.co.jp/qa/question_detail/q13324753933,青森県民と相性良い都道府県民はどこだと思いますか？,0,0
765,2026/1/28 6:56,病気、症状,たかし,7時間54分,1,28,28.0,0,0,0.059,3.57,0.02,0.16,あと3日,https://detail.chiebukuro.yahoo.co.jp/qa/question_detail/q12324753932,一昨日質問したものです。 勤務先上司が日曜日に発熱し、月曜日にインフルおよびコロナの検査では陰性になりました。 しかし、午後になり、ときおり頭がガンガンして思考停止したりするとのことで皆様に相談しまし...,0,0
766,2026/1/28 6:56,恋愛相談、人間関係の悩み,ysg********,7時間54分,4,32,8.0,0,5,0.067,12.5,0.01,0.8,あと3日,https://detail.chiebukuro.yahoo.co.jp/qa/question_detail/q11324753931,単身者男です。月収入19万です。 家賃五万円です。賞与はありません。彼女を作るとお金がかかるのですが、この収入では彼女はしんどいですか？,0,0
767,2026/1/28 6:56,日本語,猫,7時間54分,2,3,1.5,0,0,0.006,66.67,0.0,0.22,あと3日,https://detail.chiebukuro.yahoo.co.jp/qa/question_detail/q10324753930,リステッドって何ですか？,0,0
768,2026/1/28 6:56,福祉、介護,匿名,7時間54分,1,7,7.0,0,0,0.015,14.29,0.0,0.12,あと3日,https://detail.chiebukuro.yahoo.co.jp/qa/question_detail/q14324753929,福祉の仕事をしている女性は、何の理由で、福祉の仕事をしているのですか？,0,0
769,2026/1/28 6:56,ライブ、コンサート,1152414228,7時間54分,0,2,2.0,0,0,0.004,0.0,0.0,0.0,あと3日,https://detail.chiebukuro.yahoo.co.jp/qa/question_detail/q11324753926,ペンライト（ギンブレ）について。 ライトピンクとライトブルーの単色のと、両方の色が入った12色？切り替えのがほしいです。おすすめあれば教えてください。,0,0
770,2026/1/28 6:56,交通事故,ba7861727,7時間54分,7,69,9.9,0,2,0.145,10.14,0.01,1.01,あと3日,https://detail.chiebukuro.yahoo.co.jp/qa/question_detail/q12324753927,昨日、一時停止に気づかず、左折をし後ろからクラクションならされました。 その後、クラクションならした車から人が降りてきて「一時停止見えてんのか！！」と怒られて、窓開けてすみませんと謝ったのですが。 す...,0,0
771,2026/1/28 6:56,病気、症状,bd6c28e81,7時間54分,0,15,15.0,0,0,0.032,0.0,0.0,0.03,あと3日,https://detail.chiebukuro.yahoo.co.jp/qa/question_detail/q10324753925,おはようございます 身内にがんになっている方がいるのですが肝臓のうら？にあるようで最初は手術で開腹してみないとがんと確定できないみたいで去年の12月に肝臓半分切除しました。 調べたところがんとわかった...,0,0
772,2026/1/28 6:56,アニメ、コミック,ygu********,7時間54分,2,16,8.0,0,2,0.034,12.5,0.0,0.37,あと3日,https://detail.chiebukuro.yahoo.co.jp/qa/question_detail/q14324753924,名探偵コナンの動機ってよくくだらないとか馬鹿にされますが、馬鹿にする人って普段ニュース見ないのですか？ 現実の方がくだらない理由で事件起きてますよね？ この間なんて「ボーナス減らされた」という理由で殺...,0,0
773,2026/1/28 6:55,園芸、ガーデニング,mik********,7時間55分,5,44,8.8,0,3,0.092,11.36,0.01,0.81,あと3日,https://detail.chiebukuro.yahoo.co.jp/qa/question_detail/q13324753923,家の西側からの風当たりが強いので、植物を植えようと考えています。防風林とまではいきませんが高さ2〜3メートル程度の木でも数本あれば防風効果は得られますか？,0,0
774,2026/1/28 6:55,ソフトバンク,c4aa95c2f,7時間55分,0,4,4.0,0,0,0.008,0.0,0.0,0.01,あと3日,https://detail.chiebukuro.yahoo.co.jp/qa/question_detail/q12324753922,ソフトバンク光なんですが、 元々はおばあちゃんの銀行から引き落としだったのですが 一度遅れたら支払用紙が届くようになりそれで支払ってるのですが 最近になってから3〜4ヶ月遅れてから支払用紙が届くように...,0,0
775,2026/1/28 6:55,コスプレ,1151284764,7時間56分,0,37,37.0,0,0,0.078,0.0,0.0,0.08,あと3日,https://detail.chiebukuro.yahoo.co.jp/qa/question_detail/q11324753921,来月あたり初めてコスプレイベントに参加します！そこでツイステのラギーくんマジフトの衣装で参加したいのですが、私には、まったくもって裁縫技術がありません。 今まではなんとか既製品を組み合わせて来たのです...,0,0
776,2026/1/28 6:55,自転車、サイクリング,ルメェェル,7時間56分,4,33,8.2,0,0,0.069,12.12,0.01,0.49,あと3日,https://detail.chiebukuro.yahoo.co.jp/qa/question_detail/q10324753920,テムでジャンパーなどを買う場合 普段Ｍサイズを着てる場合 そのままＭで大丈夫ですか？,0,0
777,2026/1/28 6:55,職場の悩み,ひ,7時間56分,5,97,19.4,0,3,0.204,5.15,0.04,0.92,不明,https://detail.chiebukuro.yahoo.co.jp/qa/question_detail/q14324753919,普段は言いたいことを我慢しつつ文句も何も言わずに大人しく働くけど、辞める時に怒りや不満を一気に爆発させる人がいたらどう思いますか？ その人が辞める時 「自分が言いやすい奴だけ注意すんじゃねーよ！！」 ...,0,0
778,2026/1/28 6:55,スマホアプリ,b64f8dbe6,7時間56分,0,3,3.0,0,0,0.006,0.0,0.0,0.01,あと3日,https://detail.chiebukuro.yahoo.co.jp/qa/question_detail/q13324753918,Simejiというアプリで｢あ｣と打つと、ほとんど使ったことがない｢杏｣という字が先頭に来るのですが、｢ありがとう｣や｢明日｣とかの方が使っていると思い、何故｢杏｣が先頭に来るのか分かりません。 これ...,0,0
779,2026/1/28 6:55,病気、症状,1252703720,7時間56分,2,16,8.0,0,7,0.034,12.5,0.0,0.68,あと3日,https://detail.chiebukuro.yahoo.co.jp/qa/question_detail/q12324753917,患者の体に触れもせず、問診だけで薬だけで終わらせる医者と言うのはヤブ医者と思われますか？,0,0
780,2026/1/28 6:55,政治、社会問題,sho********,7時間56分,0,6,6.0,0,0,0.013,0.0,0.0,0.01,あと3日,https://detail.chiebukuro.yahoo.co.jp/qa/question_detail/q11324753916,9.11の陰謀説でペンタゴンは結局、飛行機突っ込んだ？,0,0
781,2026/1/28 6:55,オンラインゲーム,1152334902,7時間56分,3,39,13.0,0,0,0.082,7.69,0.01,0.4,あと3日,https://detail.chiebukuro.yahoo.co.jp/qa/question_detail/q13324753913,スト6を始めようと思い、モダンでキャラや性能を見て悩んだのですが、「ベガ、ブランカ、舞、ラシード、C.ヴァイパー、ジュリ、ケン、ルーク」とここまでしか絞れずずっと迷ってしまっています。 この上のキャラ...,0,0
782,2026/1/28 6:55,X（旧Twitter）,1150164104,7時間56分,3,46,15.3,0,2,0.097,6.52,0.01,0.54,あと3日,https://detail.chiebukuro.yahoo.co.jp/qa/question_detail/q12324753912,XのDMについてです、自分が行けないことしてしまい、、アカウントの父と名乗る方からこのように法的措置を取ると言われました、 最初は詐欺と思って無視していたのですが３コールくらい電話をかけてきたりした為...,0,0
783,2026/1/28 6:55,高校数学,a42c9a9ec,7時間56分,3,30,10.0,0,0,0.063,10.0,0.01,0.38,あと3日,https://detail.chiebukuro.yahoo.co.jp/qa/question_detail/q10324753910,数学についての質問です。 私は中3です。中高一貫なので、高校入試はしません。なのに、授業の進度が中学の間は高校からの新入生と合わせるために中学生の間は中学までの内容と決められています。 ですが、私は塾...,0,0
784,2026/1/28 6:55,病気、症状,5181g,7時間56分,0,3,3.0,0,0,0.006,0.0,0.0,0.01,あと3日,https://detail.chiebukuro.yahoo.co.jp/qa/question_detail/q14324753909,睡眠時間5時間ほどで毎日無理矢理親に叩き起こされていたら規律性調節障害になるって本当ですか？,0,0
785,2026/1/28 6:55,国内,非公開,7時間56分,5,28,5.6,0,6,0.059,17.86,0.0,0.96,あと3日,https://detail.chiebukuro.yahoo.co.jp/qa/question_detail/q13324753908,地方の田舎の市を都会の大都市と同規模の街並みと人口にするには何が必要ですか？,0,0
786,2026/1/28 6:55,学校の悩み,a46967c7e,7時間56分,2,15,7.5,0,0,0.031,13.33,0.0,0.24,あと3日,https://detail.chiebukuro.yahoo.co.jp/qa/question_detail/q12324753907,至急です。良ければ回答お願いいたします。 仲が良いAくんとBちゃんがいたとします。 1日目にAくんが保健室に「お腹が冷えて」という理由で湯たんぽを借りに行きました。 次の日Bちゃんが生理痛で「お腹痛く...,0,0
787,2026/1/28 6:55,ゲーム,すりー,7時間56分,0,3,3.0,0,0,0.006,0.0,0.0,0.01,あと3日,https://detail.chiebukuro.yahoo.co.jp/qa/question_detail/q11324753906,東ロワについてです！ 香木で強化しようとしているのですがなぜか素材が足りないと出てきてしまいます。でも全種持っています。香木を持っている以外に条件があるのでしょうか？教えて下さい！,0,0
788,2026/1/28 6:54,恋愛相談、人間関係の悩み,非公開,7時間57分,4,63,15.8,0,0,0.132,6.35,0.02,0.55,あと3日,https://detail.chiebukuro.yahoo.co.jp/qa/question_detail/q14324753904,至急 回答急募です。 彼氏からの返信が遅すぎて不安になります。 お互い社会人で不規則勤務ではあります。 1度、返信が遅いというのは伝えたことがあり、彼も遅い自覚があったようで「そうだよね、治す」と言っ...,0,0
789,2026/1/28 6:54,ダイエット,1150854732,7時間57分,3,61,20.3,0,0,0.128,4.92,0.03,0.44,あと3日,https://detail.chiebukuro.yahoo.co.jp/qa/question_detail/q13324753903,170cm74kg男です。最近体重的に痩せてるはずなのに体の変化がありません。標準体重まで痩せるつもりなのですがここから変化はあるでしょうか？,0,0
790,2026/1/28 6:54,お笑い芸人,非公開,7時間57分,0,5,5.0,0,0,0.01,0.0,0.0,0.01,あと3日,https://detail.chiebukuro.yahoo.co.jp/qa/question_detail/q12324753902,たくろうの赤木さんが着ていらっしゃるシャツは、同じものを何枚も持っている感じですか？それとも１枚だけをずっと大切に着ていらっしゃるのでしょうか？,0,0
791,2026/1/28 6:54,携帯型ゲーム全般,ぬか漬けれもん,7時間57分,1,33,33.0,0,0,0.069,3.03,0.02,0.17,不明,https://detail.chiebukuro.yahoo.co.jp/qa/question_detail/q11324753901,学マスで、この手持ちサポカのDaViセンス最適編成を教えていただけると助かります,0,0
792,2026/1/28 6:54,メール,ridis_selia,7時間58分,1,9,9.0,0,0,0.019,11.11,0.0,0.12,あと3日,https://detail.chiebukuro.yahoo.co.jp/qa/question_detail/q10324753900,Sheinから急に謎の購入メールが届きました。 私はSheinをアカウント登録どころか使ったことがなく間違ってURLをタップしてしまうくらいでしか開いたことはありません。なのに何故かSheinからメー...,0,0
793,2026/1/28 6:54,大学受験,1052712808,7時間58分,0,14,14.0,0,0,0.029,0.0,0.0,0.03,あと3日,https://detail.chiebukuro.yahoo.co.jp/qa/question_detail/q14324753899,【至急】早稲田大学教育学部英語英文学科について、ホームページの合格最低点は英語を1.5倍した175点満点中ですか？それとも150点満点に換算した上での点数ですか？ https://www.waseda...,0,0
794,2026/1/28 6:54,家具、インテリア,1253164811,7時間58分,3,13,4.3,0,0,0.027,23.08,0.0,0.34,あと3日,https://detail.chiebukuro.yahoo.co.jp/qa/question_detail/q13324753898,ゲーミングチェアを使用されている方に質問です。 ゲーミングチェアを横に倒せるのが楽そうだなって思ったんですけど、オフィスチェアを買った方がいいという意見をよく見かけます。 横に倒す機能を優先すべきなの...,0,0
795,2026/1/28 6:54,大学院,匿名,7時間58分,3,21,7.0,0,0,0.044,14.29,0.0,0.36,あと3日,https://detail.chiebukuro.yahoo.co.jp/qa/question_detail/q12324753897,大学院を卒業した年齢はいくつですか？,0,0
796,2026/1/28 6:54,日本語,ken********,7時間58分,3,25,8.3,0,0,0.052,12.0,0.0,0.37,あと3日,https://detail.chiebukuro.yahoo.co.jp/qa/question_detail/q11324753896,宮城県（みやぎけん）と読むので 茨城県（いばらぎけん）と勘違いしている人が多いのでしょうか？,0,0
797,2026/1/28 6:54,一般教養,ac9bc3fed,7時間58分,2,18,9.0,0,4,0.038,11.11,0.0,0.5,あと3日,https://detail.chiebukuro.yahoo.co.jp/qa/question_detail/q10324753895,支払いの時に手数料引いて支払いしたらダメになるのですか？,0,0
798,2026/1/28 6:53,公務員試験,bf392fa31,7時間59分,2,32,16.0,0,0,0.067,6.25,0.01,0.27,あと3日,https://detail.chiebukuro.yahoo.co.jp/qa/question_detail/q12324753892,現在大学1年生です。 国家公務員一般職を志望しています。大学2年から教養区分は受験できるそうです。 もし大学2年で1次試験と2次試験に両方合格し、大学4年の時に各官庁に面接に行き採用してもらうというこ...,0,0
