2212,2026/1/31 3:08,大学,匿名,13時間46分,2,10,5.0,0,0,0.012,20.0,0.0,0.13,あと3日,https://detail.chiebukuro.yahoo.co.jp/qa/question_detail/q14324849374,大学の先生の男性の月給の相場はいくらですか？,0,0
2213,2026/1/31 3:08,恋愛相談、人間関係の悩み,みみ,13時間46分,1,11,11.0,0,0,0.013,9.09,0.0,0.07,あと3日,https://detail.chiebukuro.yahoo.co.jp/qa/question_detail/q13324849373,俺は寛大な心を持つことにする。 やっぱ全裸流しするやつは違うっすわ。 彼氏がこの言葉をあげていたのですがどういう意味かわかる方いますか？,0,0
2214,2026/1/31 3:08,男性アイドル,1150237138,13時間46分,3,59,19.7,0,0,0.071,5.08,0.01,0.25,あと3日,https://detail.chiebukuro.yahoo.co.jp/qa/question_detail/q12324849372,ジャニーズのライブを2連で申し込みましたが同行者一人だけが入場することは可能ですか？,0,0
2215,2026/1/31 3:08,恋愛相談、人間関係の悩み,honoka,13時間46分,5,48,9.6,0,18,0.058,10.42,0.01,1.01,あと3日,https://detail.chiebukuro.yahoo.co.jp/qa/question_detail/q11324849371,太陽みたいな人に会ったことはありますか？この人太陽みたいだなと思ったこと。,0,0
2216,2026/1/31 3:08,レディース全般,c41861206,13時間46分,1,18,18.0,0,0,0.022,5.56,0.0,0.08,あと3日,https://detail.chiebukuro.yahoo.co.jp/qa/question_detail/q10324849370,LIZLISAについてです ほしい商品の予約受付が2/28 0:00までの場合、店舗販売は何日後の可能性が高いですか？新作ではなく再版物です 過去の傾向からでも構いません。 2/28~3/3まで東京に...,0,0
2217,2026/1/31 3:08,天文、宇宙,｡.:+* Lisa .｡:+*,13時間46分,1,39,39.0,0,0,0.047,2.56,0.02,0.11,あと3日,https://detail.chiebukuro.yahoo.co.jp/qa/question_detail/q13324849368,太陽の質量の10倍以上の恒星がその寿命を終えると重力崩壊が起こりますが、そこで生まれた中性子星が発するビームは光子なんでしょうか？,0,0
2218,2026/1/31 3:08,恋愛相談、人間関係の悩み,1151052782,13時間46分,4,44,11.0,0,6,0.053,9.09,0.01,0.51,あと3日,https://detail.chiebukuro.yahoo.co.jp/qa/question_detail/q12324849367,中卒の21歳風俗嬢です。 最近失恋してなにもできません。この仕事をはじめたきっかけは整形資金を貯めるためです、もうこの仕事を始めて一年半です。本来なら貯まってるつもりでしたが彼氏ができたり仕事に行きた...,0,0
2219,2026/1/31 3:08,子育ての悩み,えだまめﾁｬﾝ,13時間46分,2,26,13.0,0,4,0.031,7.69,0.0,0.3,あと3日,https://detail.chiebukuro.yahoo.co.jp/qa/question_detail/q11324849366,反抗期って子供にとってどんな成長になるんですか？,0,0
2220,2026/1/31 3:08,職場の悩み,非公開,13時間46分,3,15,5.0,0,0,0.018,20.0,0.0,0.2,あと3日,https://detail.chiebukuro.yahoo.co.jp/qa/question_detail/q10324849365,給料が払われない？ 入ったばかりの会社でまだ研修期間の 数日の研修費が振り込まれていません。 最初、私の担当の上司に尋ねると 経理に伝えます。経理からの連絡は 有りませんでした。 給料日に通帳記入する...,0,0
2221,2026/1/31 3:07,ゲーム,haru,13時間47分,1,15,15.0,0,0,0.018,6.67,0.0,0.08,あと3日,https://detail.chiebukuro.yahoo.co.jp/qa/question_detail/q13324849363,escape from tarkovについての質問です 現在 AMD Ryzen7 5700X3D Radeon RX6600XT メモリ32GB でゲームをしているのですがスコープを覗くと画面が固ま...,0,0
2222,2026/1/31 3:07,政治、社会問題,nan********,13時間47分,2,23,11.5,0,0,0.028,8.7,0.0,0.15,あと3日,https://detail.chiebukuro.yahoo.co.jp/qa/question_detail/q12324849362,非正規雇用は自己責任なんでしょうか？企業側も、社会保険料を負担したくないのでょうか？ 求人を見ても短時間のパートの仕事が多く、正社員1人雇うより短時間のパートタイマーを何人か雇うほうが、シフトも回るだ...,0,0
2223,2026/1/31 3:07,家族関係の悩み,nek********,13時間48分,4,35,8.8,0,0,0.042,11.43,0.0,0.28,あと3日,https://detail.chiebukuro.yahoo.co.jp/qa/question_detail/q11324849361,"トラウマと向き合う方法を教えてください。 大学三年生の10,11月頃、母親から「離婚するから役所に離婚届出してきて」と言われました。父親は気まずそうな顔をし、「私が出してくるから」と言うと、 母「○○...",0,0
2224,2026/1/31 3:07,ライブ、コンサート,1252982339,13時間48分,0,4,4.0,0,0,0.005,0.0,0.0,0.0,あと3日,https://detail.chiebukuro.yahoo.co.jp/qa/question_detail/q10324849360,"予算15,000以内で買えるおすすめピアスブランド教えてください！",0,0
2225,2026/1/31 3:06,パソコン,1250302835,13時間49分,1,37,37.0,0,0,0.045,2.7,0.02,0.1,あと3日,https://detail.chiebukuro.yahoo.co.jp/qa/question_detail/q14324849359,ノートパソコンから買い替えでデスクトップを購入したのでセットアップしました。 Microsoftの設定の名前なども今の名前で設定しましたが、起動時は旧姓で出るので嫌なので変更のかけ方教えてください。 ...,0,0
2226,2026/1/31 3:06,病気、症状,b45ee64db,13時間49分,4,70,17.5,0,1,0.084,5.71,0.01,0.36,あと3日,https://detail.chiebukuro.yahoo.co.jp/qa/question_detail/q13324849358,睡眠障害で睡眠薬飲んでも中途覚醒してしまう人いますか？治らない人？,0,0
2227,2026/1/31 3:06,家族関係の悩み,c6ecc141b,13時間49分,5,72,14.4,0,7,0.087,6.94,0.01,0.64,あと3日,https://detail.chiebukuro.yahoo.co.jp/qa/question_detail/q12324849357,先日、出産した一児の母親30代です。 出産したのに、夫側の兄弟や私の兄弟に 妊娠出産の報告していません。 私の方は、兄弟と仲が悪く、 兄と弟は典型的なクズ男でして、 祖母が何かと男尊女卑で、男には甘く...,0,0
2228,2026/1/31 3:06,ストレス,1150134879,13時間49分,3,28,9.3,0,0,0.034,10.71,0.0,0.21,あと3日,https://detail.chiebukuro.yahoo.co.jp/qa/question_detail/q11324849356,運動するのは鬱病やストレスの問題とはよく言いますが、 私は運動嫌いです 嫌いなことして鬱病対策やストレス解消になるのでしょうか？,0,0
2229,2026/1/31 3:05,資格,bf0c1e55,13時間50分,0,11,11.0,0,0,0.013,0.0,0.0,0.01,あと3日,https://detail.chiebukuro.yahoo.co.jp/qa/question_detail/q13324849353,現在アズミエステールにて販売員のお仕事をしています。 お仕事自体は不満はないのですが、トリーバーチの販売員として働く事へのあこがれがあり、ゆくゆくは転職を考えています。 そこで ①サービス接遇検定2級...,0,0
2230,2026/1/31 3:05,バラエティ、お笑い,ＩＤ非公開,13時間50分,4,42,10.5,1,0,0.051,9.52,0.01,0.41,あと3日,https://detail.chiebukuro.yahoo.co.jp/qa/question_detail/q12324849352,何か探偵ナイトスクープのの依頼者がヤングケアラーだとか言ってる問題何とかならないですかね？ 他人の家庭のことに口出しするなって感じなんですよね。大して何も知らないネット民のクズがグダグダ言ってんじゃね...,0,0
2231,2026/1/31 3:05,大学受験,1153286745,13時間50分,4,59,14.8,0,1,0.071,6.78,0.01,0.35,あと3日,https://detail.chiebukuro.yahoo.co.jp/qa/question_detail/q11324849351,若者世代には「学業不振」を理由に自○する人が多いそうですが、そんなの政府や社会に何かできるようなことではなくないですか？ これが健康問題とか虐待とかなら分かるのですが、 学業不振を理由に自○といわれて...,0,0
2232,2026/1/31 3:05,福祉、介護,urf********,13時間50分,5,68,13.6,1,2,0.082,7.35,0.01,0.57,あと3日,https://detail.chiebukuro.yahoo.co.jp/qa/question_detail/q10324849350,生活保護受給中に引っ越ししたのですが、前の家賃滞納があり支払いできません。この場合、どうしたらいいのでしょうか？ 前家賃の保証会社から催促がきてて、生活保護者なんで今は支払えませんと言っても、払って下...,0,0
2233,2026/1/31 3:05,パソコン,あああ,13時間50分,0,10,10.0,0,0,0.012,0.0,0.0,0.01,あと3日,https://detail.chiebukuro.yahoo.co.jp/qa/question_detail/q14324849349,バイパーv3pro を使ってるのですが、 8000hzの項目がないです。 あと、マウス加速の設定もないです なぜでしょう,0,0
2234,2026/1/31 3:05,レディース全般,1151651832,13時間50分,2,10,5.0,0,3,0.012,20.0,0.0,0.24,あと3日,https://detail.chiebukuro.yahoo.co.jp/qa/question_detail/q13324849348,ポンチョコートにリュックって変ですか？,0,0
2235,2026/1/31 3:05,携帯電話キャリア,学生,13時間50分,4,27,6.8,0,0,0.032,14.81,0.0,0.27,あと3日,https://detail.chiebukuro.yahoo.co.jp/qa/question_detail/q12324849347,初めまして、女子学生です。 私は言葉にして伝えることがあまり得意ではないため、下手な文章ですが読んでいただけると嬉しいです。 昨年の11月からほとんど毎月非通知から電話がかかってくるようになりました。...,0,0
2236,2026/1/31 3:04,国際情勢,yuu********,13時間51分,4,89,22.2,0,16,0.107,4.49,0.02,0.92,あと3日,https://detail.chiebukuro.yahoo.co.jp/qa/question_detail/q11324849346,「靖国神社で、ポケカのイベントは、歴史の真実に対する冒涜」というのは本当ですか？ 中国共産党系のメディアが社説で、靖国神社で予定されていた、”子供向けのポケモンカードの体験イベント”に言及、 ． 「こ...,0,0
2237,2026/1/31 3:04,恋愛相談、人間関係の悩み,mom********,13時間51分,2,32,16.0,1,0,0.038,6.25,0.01,0.28,あと3日,https://detail.chiebukuro.yahoo.co.jp/qa/question_detail/q10324849345,長文ですがご意見をいただけたらありがたいです。同じ職場の元彼に酷い事をしました。 2年付き合っていたのですが、彼を信用できなくなるような事があり、私は傷ついてLINEで理由と今までありがとうと送信しま...,0,0
2238,2026/1/31 3:04,生き方、人生相談,1151812422,13時間51分,2,36,18.0,0,0,0.043,5.56,0.01,0.16,あと3日,https://detail.chiebukuro.yahoo.co.jp/qa/question_detail/q14324849344,中高一貫校に通う中３女子です 死ぬのが怖い、歳とりたくない などの悩みが去年の12月からありました 友達と先程まで通話したのですが、意味分からない、不死身にでもなりたいのかなって思う、(私)は将来が不...,0,0
2239,2026/1/31 3:04,恋愛相談、人間関係の悩み,1153006371,13時間52分,4,33,8.2,0,0,0.04,12.12,0.0,0.28,あと3日,https://detail.chiebukuro.yahoo.co.jp/qa/question_detail/q13324849343,至急！相席屋ってどんな感じですか？私は18の女です！普通に無料で飲み食いできるって聞いて行ってみたいんですけど結構男の人と喋らないとダメな感じですか？顔はかわいいです！,0,0
2241,2026/1/31 3:04,うつ病,1052674441,13時間52分,2,45,22.5,1,5,0.054,4.44,0.01,0.47,あと3日,https://detail.chiebukuro.yahoo.co.jp/qa/question_detail/q11324849341,デエビゴ錠って効果が表れるまで、どのくらい日数がかかるものですか？,0,0
2243,2026/1/31 3:04,コンビニ,非公開,13時間52分,2,31,15.5,1,1,0.037,6.45,0.01,0.31,あと3日,https://detail.chiebukuro.yahoo.co.jp/qa/question_detail/q14324849339,昨日オープンしたばかりのセブンイレブンで、お店で揚げたカレーパンを１つ購入したのに、レシートには２個購入となってるんですが、現金払いでしたが食べてしまいましたが返金してくれるんでしょうか？,0,0
2244,2026/1/31 3:03,携帯型ゲーム全般,lD非公開,13時間53分,2,69,34.5,0,0,0.083,2.9,0.03,0.2,あと3日,https://detail.chiebukuro.yahoo.co.jp/qa/question_detail/q13324849338,原神の月反応についてなんですけど、これ思うの自分だけですかね？ キャラが悪いとか嫌いとかそういう話では全くない前提なんですが、月感電と月結晶って、フリンズやシハクが出る前の方が正直盛り上がってた気がし...,0,0
2245,2026/1/31 3:03,メンズシューズ,umi********,13時間53分,0,13,13.0,0,0,0.016,0.0,0.0,0.02,あと3日,https://detail.chiebukuro.yahoo.co.jp/qa/question_detail/q12324849337,ニューバランスの靴に詳しい方 写真の靴の名前、カラーが分かる方いますか？,0,0
2246,2026/1/31 3:03,男性アイドル,非公開ID,13時間53分,0,9,9.0,0,0,0.011,0.0,0.0,0.01,あと3日,https://detail.chiebukuro.yahoo.co.jp/qa/question_detail/q11324849336,ウィバースDM トゥバのDMを購入しようか迷ってるんですけど、今ボムギュだけもってて ほかのメンバーで返信の頻度が高くて優しい、甘い感じのメンバーいますか？,0,0
2247,2026/1/31 3:03,大学受験,c1ce1ac39,13時間53分,0,89,89.0,0,0,0.107,0.0,0.0,0.11,あと3日,https://detail.chiebukuro.yahoo.co.jp/qa/question_detail/q10324849335,今日名古屋学院大学の前期一般を受けました。 自己採点をしたのですが、共通テストプラスで 共通テスト65%前期試験75% 130＋75＝205でした。学部は経済です。 この点数で合格することはありますか...,0,0
2248,2026/1/31 3:03,職業,匿名,13時間53分,1,15,15.0,0,0,0.018,6.67,0.0,0.08,あと3日,https://detail.chiebukuro.yahoo.co.jp/qa/question_detail/q14324849334,①昼職の、顔がかっこいい男性 ②ホストの、顔がかっこいい男性 上記は、どちらのほうが、【沢山の、顔が可愛い女性】からモテている人が多いですか？ ※19歳～25歳の場合 ※絶対数ではなく割合で,0,0
2249,2026/1/31 3:03,アニメ,aa2a9685a,13時間53分,1,26,26.0,0,0,0.031,3.85,0.01,0.09,あと3日,https://detail.chiebukuro.yahoo.co.jp/qa/question_detail/q13324849333,小さい頃に見ていたアニメ？について質問です。 小さい頃すぎて記憶が曖昧なのですが、2006年～2010年の間に見ていたと思います。 リモコンのdボタンから見れたはずで、オープニングかエンディングでビー...,0,0
2250,2026/1/31 3:02,恋愛相談、人間関係の悩み,rn,13時間54分,5,46,9.2,0,0,0.055,10.87,0.01,0.35,あと3日,https://detail.chiebukuro.yahoo.co.jp/qa/question_detail/q12324849332,なぜ女性は高学歴の彼氏が欲しいというのですか？？ 私には高学歴の彼氏がいます。私は別に学歴を気にしていないのですが、彼氏の学校の名を出すと周りの人から「高学歴彼氏羨ましい〜」「付き合うなら絶対高学歴が...,0,0
2251,2026/1/31 3:02,話題の人物,a8e360d0c,13時間54分,1,13,13.0,0,0,0.016,7.69,0.0,0.08,あと3日,https://detail.chiebukuro.yahoo.co.jp/qa/question_detail/q11324849331,瓜田純士さんって何故今横山みどりさんやおにやさんと絡んでいるのですか？元々ブレイキングダウンなど格闘技で活躍されていたと思うのですが、配信者に変わったということですか？ご回答お願いします。,0,0
2252,2026/1/31 3:02,就職、転職,1151221366,13時間54分,1,32,32.0,0,0,0.038,3.12,0.01,0.1,あと3日,https://detail.chiebukuro.yahoo.co.jp/qa/question_detail/q10324849330,コンサル業界の方、または有識者の方に質問です。 友人の幼馴染に現在20歳の男性がいます。彼は高卒でホストと工場勤務からコンサルに転職し、今2年目で年収700万と言われました。転職して2年目というのがま...,0,0
2253,2026/1/31 3:02,小説,nan********,13時間54分,1,98,98.0,0,0,0.117,1.02,0.11,0.18,不明,https://detail.chiebukuro.yahoo.co.jp/qa/question_detail/q14324849329,5年以上前に読んだ本なのですが、タイトルが全く思い出せないので知恵を貸していただけたら嬉しいです。(記憶があやふやなので嘘を言っていたり、他の作品と混ざっているかもしれません、、、) 日本の小説 5年...,0,0
2254,2026/1/31 3:02,政治、社会問題,1150979566,13時間54分,6,108,18.0,1,9,0.129,5.56,0.02,0.93,あと3日,https://detail.chiebukuro.yahoo.co.jp/qa/question_detail/q13324849328,これから高市内閣の政治を続投すると、中国からの農作物、工業品特にレアアース関係がかなり高い関税が取られ日中貿易戦争で、エンタメ系など日本の産業に痛手を被ることは、間違いないです。 物価高は避けられない...,0,0
2255,2026/1/31 3:02,アニメ,1153037457,13時間55分,0,20,20.0,0,0,0.024,0.0,0.0,0.02,あと3日,https://detail.chiebukuro.yahoo.co.jp/qa/question_detail/q14324752349,『ヤマト３１９９』の臨界稼働艦隊に関する質問です。 僅か３０センチほどのイスカンダル純正の波動コア１つの臨界稼働の威力は凄まじかった。 ガルマン星と衛星の全てのイスカンダル遺跡を起動した上、イスカンダ...,0,0
2256,2026/1/31 3:02,CM,b4c135609,13時間55分,0,30,30.0,0,0,0.036,0.0,0.0,0.04,あと3日,https://detail.chiebukuro.yahoo.co.jp/qa/question_detail/q14324752329,10年まえくらいのCMについてなのですが餃子の王将のCMで男の子が大きな声でイーガーコーテル！！というコマーシャルをの動画がどこを探してもありません。わかる方いらっしゃいますか？,0,0
2257,2026/1/31 3:02,ゲーム,非公開,13時間55分,0,25,25.0,0,0,0.03,0.0,0.0,0.03,あと3日,https://detail.chiebukuro.yahoo.co.jp/qa/question_detail/q14324752334,バウンティについて質問です。 メダルを火力全振りにして遊びたいのですが、カイドウメダルと熱息メダル、カイドウ(人獣型)をつけるとき、どんな感じに振るべきでしょうか？,0,0
2258,2026/1/31 3:02,邦楽,非公開,13時間55分,0,18,18.0,1,0,0.022,0.0,0.0,0.14,あと3日,https://detail.chiebukuro.yahoo.co.jp/qa/question_detail/q14324752399,離婚伝説好きですか？,0,0
2259,2026/1/31 3:02,菓子、スイーツ,c42a916d7,13時間55分,2,21,10.5,0,0,0.025,9.52,0.0,0.14,あと3日,https://detail.chiebukuro.yahoo.co.jp/qa/question_detail/q14324752379,1番好きなお菓子カラムーチョって人いますか？,0,0
2260,2026/1/31 3:02,ポケットモンスター,Us,13時間55分,0,14,14.0,0,0,0.017,0.0,0.0,0.02,あと3日,https://detail.chiebukuro.yahoo.co.jp/qa/question_detail/q14324752304,ポケマス パシオタワー攻略 ㅤ パシオタワー16階のvsユウキ(物理攻撃無効)が倒せません。 はがね用のバンダナ、ブローチ、ミサンガも最大まで強化しました。 はがねタイプで特殊攻撃持ちがキバナ(わざレ...,0,0
2261,2026/1/31 3:02,携帯型ゲーム全般,zeu********,13時間55分,0,15,15.0,0,0,0.018,0.0,0.0,0.02,あと3日,https://detail.chiebukuro.yahoo.co.jp/qa/question_detail/q14324752194,ツムツム復活勢です。 Cバズ スキル4 平均3500-4000枚 モアナスキル5 平均5000-6000枚 どちらをあげるべきでしょうか？ cバズはすくなすぎますか？ スキルチケット20枚ほどあります...,0,0
2262,2026/1/31 3:02,YouTube,iny********,13時間55分,0,25,25.0,0,0,0.03,0.0,0.0,0.03,あと3日,https://detail.chiebukuro.yahoo.co.jp/qa/question_detail/q14324752134,この2人の動画、毎回さいしょの10秒程の動画しかないのですがフルバージョンってないんですかね？,0,0
2263,2026/1/31 3:02,Instagram,1149797183,13時間55分,0,12,12.0,0,0,0.014,0.0,0.0,0.01,あと3日,https://detail.chiebukuro.yahoo.co.jp/qa/question_detail/q14324752074,インスタのリールで、本を読んでると急に服装とかが変わって、人が現れてキスされる時のTearsっていう音源の元ネタってなんですか？ 同じ音源で、男の人がベッドとかに寝転がって背中だけ見えるみたいなやつも...,0,0
2264,2026/1/31 3:02,病気、症状,匿名で,13時間55分,0,19,19.0,0,0,0.023,0.0,0.0,0.02,あと3日,https://detail.chiebukuro.yahoo.co.jp/qa/question_detail/q14324752054,足首捻挫が癖になったら辞めれないのですか？ グキッグニャグニャっと足を捻り捻挫が癖になり靭帯がびろんびろんに伸び切った人は靭帯断裂して手術うけて成功しても捻挫癖は無くなる事無く一生永遠に捻挫し続けてし...,0,0
2265,2026/1/31 3:02,レディースバッグ、財布、小物類,1253122133,13時間55分,1,49,49.0,0,1,0.059,2.04,0.03,0.15,あと3日,https://detail.chiebukuro.yahoo.co.jp/qa/question_detail/q14324752114,"至急教えて下さい！ シャネルのバッグ(チェーンウォレット含)で40万円台、もしくはそれ以下で買える物を教えて下さい！ネットだと輸入業者だったり中古だったりで正規のショップでのお値段が分からなくて..,...",0,0
2266,2026/1/31 3:02,アニメ,暁,13時間55分,0,12,12.0,0,0,0.014,0.0,0.0,0.01,あと3日,https://detail.chiebukuro.yahoo.co.jp/qa/question_detail/q14324752144,ファイノンの本名はカスライナですがキュレネの本名は明かされていますか？ エ……リ……… と言ったのはネタバレで知っていますが明確に明かされているのか知りたいです,0,0
2267,2026/1/31 3:02,アニメ,James1950s,13時間55分,0,12,12.0,0,0,0.014,0.0,0.0,0.01,あと3日,https://detail.chiebukuro.yahoo.co.jp/qa/question_detail/q14324751859,『樫の木モック』と『ピコリーノの冒険』ならどちらの方が原作に忠実ですか?,0,0
2268,2026/1/31 3:02,恋愛相談、人間関係の悩み,匿名,13時間55分,1,18,18.0,0,0,0.022,5.56,0.0,0.08,あと3日,https://detail.chiebukuro.yahoo.co.jp/qa/question_detail/q12324849327,気になってる男性にバレンタインを渡そうと思っているのですが、手作りか市販だとどちらが良いのでしょうか。相手は24歳です 2度遊びに行ってどちらもお会計を出してくれたのでその感謝の気持ちと、出張先でお土...,0,0
2269,2026/1/31 3:02,オンラインゲーム,wup********,13時間55分,0,31,31.0,0,0,0.037,0.0,0.0,0.04,あと3日,https://detail.chiebukuro.yahoo.co.jp/qa/question_detail/q14324751924,ハートピアスローライフについてです。 乗り物をインテリアとして飾ろうとしていたのですが、持ち物の中から出して飾ろうとすると、初期の緑のバイクだけ見当たらず飾れません。 バックにも倉庫にも見当たりません...,0,0
2270,2026/1/31 3:02,病気、症状,1252859621,13時間55分,3,30,10.0,0,0,0.036,10.0,0.0,0.22,あと3日,https://detail.chiebukuro.yahoo.co.jp/qa/question_detail/q11324849326,ポルノ依存症ってどうすれば抑えられますか？また、手術などをせずに性欲を完全になくすことは不可能ですか？,0,0
2271,2026/1/31 3:02,カラオケ,山崎,13時間56分,1,21,21.0,0,0,0.025,4.76,0.01,0.08,あと3日,https://detail.chiebukuro.yahoo.co.jp/qa/question_detail/q13324752268,副業でライブ配信をしています。 ワンカラで配信したかったのですが、音が外に流れないって本当ですか？ヘッドホンからしか出ないのでリスナーに聞こえないんですね… スマホに接続すると聞こえるようになったりと...,0,0
2272,2026/1/31 3:02,アニメ,b37c1c340,13時間56分,1,13,13.0,0,0,0.016,7.69,0.0,0.08,あと3日,https://detail.chiebukuro.yahoo.co.jp/qa/question_detail/q13324752233,紫と黒がイメージカラーのキャラクターを沢山教えてください。人間系じゃなくてクロミちゃん系のキャラクターがいいです。 語彙力なくてごめんなさい(>_<),0,0
2273,2026/1/31 3:02,観光地、行楽地,pek********,13時間56分,0,20,20.0,0,0,0.024,0.0,0.0,0.02,あと3日,https://detail.chiebukuro.yahoo.co.jp/qa/question_detail/q13324752068,大阪の安倍晴明神社にお詳しい方、お守りのお取り扱いにお詳しい方にお伺い致します。今月末から仕事で大阪に仕事で1ヶ月くらい滞在する事になりました。 実は昨年夏にも大阪に2週間くらい仕事で滞在し、休みの日...,0,0
2274,2026/1/31 3:02,ネコ,1151484735,13時間56分,1,43,43.0,1,0,0.051,2.33,0.02,0.23,あと3日,https://detail.chiebukuro.yahoo.co.jp/qa/question_detail/q10324849325,猫白血病について質問です。 今回子猫を2匹保護しました そしたら、1匹は、白血病陽性 もう1匹は、陰性でした。 ですが陽性の子は検査の時線が薄かったので ご陽性の可能性がある為、外注に出しました その...,0,0
2275,2026/1/31 3:02,高校,ae308d143,13時間56分,0,21,21.0,1,0,0.025,0.0,0.0,0.14,あと3日,https://detail.chiebukuro.yahoo.co.jp/qa/question_detail/q13324752063,就学のための給付金について質問です。 大阪府在住です。 昨年夏頃に給付対象のため申請しました。 案内を見ると認定不認定の結果送付などが令和7年12月以降とありますが、未だに認定不認定の連絡すらありませ...,0,0
2276,2026/1/31 3:02,数学,1150886670,13時間56分,0,26,26.0,0,0,0.031,0.0,0.0,0.03,あと3日,https://detail.chiebukuro.yahoo.co.jp/qa/question_detail/q13324752193,経済学の問題が分からなくて答案として教えていただくことはできますか？有識者の方お返事待ってます,0,0
