758,2026/1/24 6:28,LINE,mon********,8時間13分,0,5,5.0,0,0,0.01,0.0,0.0,0.01,あと3日,https://detail.chiebukuro.yahoo.co.jp/qa/question_detail/q14324613649,オープンチャットで検索すると色々出てきますが あるお部屋の下に枠が出てきてそこにスライド出来て複数の部屋の紹介？みたいなのがありますがこれは管理人が一緒なのですか？ なんで下枠で宣伝されるのですか？,0,0
759,2026/1/24 6:28,病気、症状,梨白,8時間13分,3,20,6.7,0,6,0.041,15.0,0.0,0.71,あと3日,https://detail.chiebukuro.yahoo.co.jp/qa/question_detail/q13324613648,慢性腎不全とはどのような病気ですか？,0,0
760,2026/1/24 6:27,ゲーム,cab0f243b,8時間14分,0,17,17.0,0,0,0.034,0.0,0.0,0.03,あと3日,https://detail.chiebukuro.yahoo.co.jp/qa/question_detail/q12324613647,原神引くべきキャラについて 星5キャラはコロンビーナのみ所持 強さだけをみる場合引いた方がいいキャラを教えてほしいです。 イネファ、茲白、ヌヴィレット、その他 どれが良いか知りたいです。,0,0
761,2026/1/24 6:27,性の悩み、相談,a3ad63329,8時間14分,5,55,11.0,0,0,0.111,9.09,0.01,0.62,あと3日,https://detail.chiebukuro.yahoo.co.jp/qa/question_detail/q11324613646,脇毛が生えてきません！ 下の毛は中2ぐらいに生えてきたんですけど、脇の毛が中三になっても生えてきません。 自分的には生えてきて欲しくないんですけど（邪魔だから）、遅くても何歳までに生えますか？ あと毛...,0,0
762,2026/1/24 6:27,恋愛相談、人間関係の悩み,m1o********,8時間14分,2,42,21.0,0,0,0.085,4.76,0.02,0.29,あと3日,https://detail.chiebukuro.yahoo.co.jp/qa/question_detail/q10324613645,結婚相談所で 奥さんを見たときに 高市総理に似ていると思って結婚したそうです。 恋は盲目という ことは 世の中でありますか？ この奥様は高市総理に似ていますか？ あなたの おくさまやご主人は 誰に似て...,0,0
763,2026/1/24 6:27,読書,taf********,8時間14分,6,98,16.3,0,4,0.198,6.12,0.03,1.05,あと3日,https://detail.chiebukuro.yahoo.co.jp/qa/question_detail/q14324613644,今年で25歳になる女です。 元々そこまで頭が良くないのと語彙力が乏しいため 恥ずかしながらこの年齢から読書を習慣化しようと思います。(見た目が賢そうじゃないので、意外と思われたいという浅い理由もありま...,0,0
764,2026/1/24 6:26,恋愛相談、人間関係の悩み,a80bc7e48,8時間15分,5,58,11.6,0,0,0.117,8.62,0.01,0.62,あと3日,https://detail.chiebukuro.yahoo.co.jp/qa/question_detail/q12324613642,高2女子です。恋愛相談に乗っていただきたいです。 私は半年ほど前にSNSで出会った1つ年上の方（仮にAくんとします）の事が好きです。 Aくんとは住んでいる場所が近くで、2回ほど遊んだことがあります。よ...,0,0
765,2026/1/24 6:26,職場の悩み,ogtp,8時間15分,4,63,15.8,0,3,0.127,6.35,0.02,0.71,あと3日,https://detail.chiebukuro.yahoo.co.jp/qa/question_detail/q10324613640,男で総務経理をしており今仕事を女性の上司から教わっていますが、女性が教える時の距離が近く、人半分くらいの距離です。 教えているのだからこれくらい近くなるのでしょうか？ それとも教えているとはいえ近過ぎ...,0,0
766,2026/1/24 6:26,就職、転職,my_********,8時間15分,2,12,6.0,0,0,0.024,16.67,0.0,0.23,あと3日,https://detail.chiebukuro.yahoo.co.jp/qa/question_detail/q14324613639,65歳での再就職の質問では、若い同僚との人間関係を懸念されることが多いですが、若い上司ならともかく、高齢者が就けるような職場に若い同僚なんているのでしょうか？,0,0
767,2026/1/24 6:26,家族関係の悩み,1152494262,8時間15分,4,59,14.8,0,1,0.119,6.78,0.02,0.58,あと3日,https://detail.chiebukuro.yahoo.co.jp/qa/question_detail/q12324613637,皆様に質問です！昨日、いとこから食事会に誘われました！とっさに「少し考えさして」と返事をしてしまいました。すぐ断るのも失礼かなと思い言ってしまいました。明日までに返事をしなくといけません 自分としては...,0,0
768,2026/1/24 6:25,政治、社会問題,社会問題の人,8時間16分,3,33,11.0,0,1,0.066,9.09,0.01,0.43,あと3日,https://detail.chiebukuro.yahoo.co.jp/qa/question_detail/q11324613636,格差って何が悪いんでしょうか？ 金持ちを貧乏にしても貧乏人は金持ちにはなれませんよね？ 金持ちの家系が金持ちであり続けることも、何か問題があるんでしょうか？ 金あるんだから、高いレベルの教育を受けられ...,0,0
769,2026/1/24 6:25,スマートフォン,b9e********,8時間16分,1,14,14.0,0,0,0.028,7.14,0.0,0.13,あと3日,https://detail.chiebukuro.yahoo.co.jp/qa/question_detail/q14324613634,スマホの修理急増「突然動かなくなった」 最強最長の寒波が影響 https://news.yahoo.co.jp/articles/b8bf58bd9ab9e65fc9501fc2d1d5ce64653...,0,0
770,2026/1/24 6:25,新築一戸建て,nik********,8時間17分,4,34,8.5,0,6,0.068,11.76,0.01,0.83,あと3日,https://detail.chiebukuro.yahoo.co.jp/qa/question_detail/q12324613632,大阪市内で狭小住宅を建てたいのですが 道路に面してる3.2メートルから 建てる時の幅2.4メートルしか取れない土地が販売されています。 10坪の土地です(建てれるのはもっと少ないかも) まず、頼めるハ...,0,0
771,2026/1/24 6:25,芸能人,ものみんた,8時間17分,0,1,1.0,0,0,0.002,0.0,0.0,0.0,あと3日,https://detail.chiebukuro.yahoo.co.jp/qa/question_detail/q10324613630,クイズノックで、東兄弟(言と問)を見分ける方法はありますか？(テロップは出ますが、途中から再生されたりした場合に見分けられるようにしたいのです),0,0
772,2026/1/24 6:25,コスプレ,1252933151,8時間17分,2,23,11.5,0,1,0.046,8.7,0.01,0.31,不明,https://detail.chiebukuro.yahoo.co.jp/qa/question_detail/q11324613631,少し前にXで見たシスターのコスプレ？をした女性が上半身だけゴミ箱に入っていて脚が出ている画像を探しています、結構バズっていました。ご協力お願いします！,0,0
773,2026/1/24 6:25,法律相談,t_k********,8時間17分,0,9,9.0,0,0,0.018,0.0,0.0,0.02,あと3日,https://detail.chiebukuro.yahoo.co.jp/qa/question_detail/q13324613628,中学生の息子が、いじめでサッカーのクラブチームを辞めました。いじめで辞めたのは息子で3人目です。 いじめが発覚した時に、クラブ側はコンプライアンス規約を作り、しっかりと罰則を設けると約束したのに、その...,0,0
774,2026/1/24 6:25,鉄道、列車、駅,kaw********,8時間17分,7,111,15.9,0,21,0.223,6.31,0.04,2.19,あと3日,https://detail.chiebukuro.yahoo.co.jp/qa/question_detail/q12324613627,何で昔の汽車は1等 2等 3等と客が乗る車両が別れていたんですか？,0,0
775,2026/1/24 6:25,ゲーム,117000円君,8時間17分,1,4,4.0,0,0,0.008,25.0,0.0,0.11,あと3日,https://detail.chiebukuro.yahoo.co.jp/qa/question_detail/q11324613626,フォートナイトについて質問です。 PCパットでやってます。 いいプレーをした時に保存したいのですが可能ですか？Switchみたいに保存したい時にボタン押すだけで30秒前のやつを記録できる機能のことです...,0,0
776,2026/1/24 6:25,大学受験,1252307096,8時間17分,2,237,118.5,2,0,0.476,0.84,0.57,1.08,あと3日,https://detail.chiebukuro.yahoo.co.jp/qa/question_detail/q10324613625,息子が名古屋工業大学の情報工学部を目指していましたが、共通テストが６割しか取れなかったので第一志望を岐阜大学にしようと思っています。 ６割で二次試験で受かる可能性はほぼないですよね？,0,0
777,2026/1/24 6:24,イヌ,小悪魔,8時間18分,1,11,11.0,0,0,0.022,9.09,0.0,0.12,あと3日,https://detail.chiebukuro.yahoo.co.jp/qa/question_detail/q13324613623,犬のワクチンで生ワクチンのデメリットは何ですか？,0,0
778,2026/1/24 6:24,政治、社会問題,kri********,8時間18分,3,21,7.0,0,0,0.042,14.29,0.0,0.34,あと3日,https://detail.chiebukuro.yahoo.co.jp/qa/question_detail/q10324613620,「中道改革連合」、こういうのを野合と言うのですか？,0,0
779,2026/1/24 6:24,プロレス,ysg********,8時間18分,1,11,11.0,0,1,0.022,9.09,0.0,0.18,あと3日,https://detail.chiebukuro.yahoo.co.jp/qa/question_detail/q14324613619,新日本プロレス昭和のMSGシリーズ 何年の大会が面白かったですか？,0,0
780,2026/1/24 6:24,恋愛相談、人間関係の悩み,T,8時間18分,3,32,10.7,0,0,0.064,9.38,0.01,0.36,あと3日,https://detail.chiebukuro.yahoo.co.jp/qa/question_detail/q13324613618,はじめまして、男性の方に質問です。 最近職場の男性が、私によくお菓子をくれるようになったのですが、私が1人で作業してる時にお菓子をくれます。 先日も私が1人で作業してる時にその男性がお菓子をくれて、「...,0,0
782,2026/1/24 6:24,資産運用、投資信託、NISA,rot********,8時間18分,5,70,14.0,0,1,0.14,7.14,0.02,0.7,あと3日,https://detail.chiebukuro.yahoo.co.jp/qa/question_detail/q11324613616,株の売買について。 投資初心者です。 少し個別株にも挑戦し、紆余曲折しながらも順調に上がっています。 そこで疑問におもったのが いずれ売却すると思うのですが 高値で買う人が誰もいなかったら、つまり売れ...,0,0
783,2026/1/24 6:24,ゲーム,1052442196,8時間18分,1,6,6.0,0,0,0.012,16.67,0.0,0.11,あと3日,https://detail.chiebukuro.yahoo.co.jp/qa/question_detail/q14324613614,ナイトレインの致命の強さについての質問です。 本編では致命と言えば慈悲短剣でしたが、こちらでは何が強いのでしょうか？ ちなみに追跡者で致命特化をする予定です,0,0
784,2026/1/24 6:24,商品の発送、受け取り,a2ab575dd,8時間18分,1,10,10.0,0,0,0.02,10.0,0.0,0.12,あと3日,https://detail.chiebukuro.yahoo.co.jp/qa/question_detail/q10324613615,返品ついて質問です。 ershenpin oneseptより義歯を、注文したのですが、違う商品が届いて、返品交換センターに、連絡しても応答が、ありません¥6000はらったのに、詐欺でしょうか？,0,0
785,2026/1/24 6:24,オーディオ,1150359502,8時間19分,0,16,16.0,0,0,0.032,0.0,0.0,0.03,あと3日,https://detail.chiebukuro.yahoo.co.jp/qa/question_detail/q13324613613,テレビのイヤホンMiniジャックからアンプに接続しスピーカーから出力していて問題はないのですが、 テレビの電源を入れずにアンプの電源を入れるとスピーカーから「ブー」と鳴り続けテレビの電源を入れるとその...,0,0
786,2026/1/24 6:23,大学受験,1052044735,8時間20分,1,116,116.0,0,0,0.232,0.86,0.27,0.33,あと3日,https://detail.chiebukuro.yahoo.co.jp/qa/question_detail/q12324613612,共テリサーチについてです。河合塾の方ではb判定マイナス1点だったのですが、駿台の方ではe判定でした。どっちを見た方がいいですか？大阪公立中期です。,0,0
787,2026/1/24 6:23,カスタマイズ,fjg********,8時間20分,1,32,32.0,0,2,0.064,3.12,0.02,0.28,あと3日,https://detail.chiebukuro.yahoo.co.jp/qa/question_detail/q11324613611,FD3Sのホイールマッチングについて。 FD3SのノーマルフェンダーのツライチのJ数が9.5Jらしいのですがそこに25mmのオーバーフェンダーをつけてホイールも10.5Jにしますが5ミリ程度はみ出しま...,0,0
788,2026/1/24 6:23,アニメ、コミック,t,8時間20分,1,7,7.0,0,0,0.014,14.29,0.0,0.11,あと3日,https://detail.chiebukuro.yahoo.co.jp/qa/question_detail/q10324613610,アニメメジャーの本田吾郎は典型的なB型ですか？,0,0
789,2026/1/24 6:23,モータースポーツ,bfl********,8時間20分,0,9,9.0,0,0,0.018,0.0,0.0,0.02,あと3日,https://detail.chiebukuro.yahoo.co.jp/qa/question_detail/q14324613609,F1のマシンの燃料に呉工業のスーパーパワーブースターを添加したら何馬力位出力アップするでしょうか？,0,0
790,2026/1/24 6:23,大学受験,1252515284,8時間20分,1,121,121.0,0,0,0.242,0.83,0.29,0.34,あと3日,https://detail.chiebukuro.yahoo.co.jp/qa/question_detail/q13324613608,国立大学医学部志望です。 2026共通テストで886点でした。 当初、新潟大学医学部を志望していましたが、想定より取れたので、もう少し上を目指ざすか迷っています。 二次力次第なことは十分承知しています...,0,0
791,2026/1/24 6:23,テーマパーク,pen********,8時間20分,1,17,17.0,0,1,0.034,5.88,0.01,0.19,あと3日,https://detail.chiebukuro.yahoo.co.jp/qa/question_detail/q12324613607,絶叫系好き×絶叫系苦手カップルに質問です。 テーマパークではどのように過ごされていますか？ お互いディズニーやユニバが好きで、私は男です。 彼女も私もショーやキャラグリは好きなので、最初の方は楽しんで...,0,0
792,2026/1/24 6:23,外国為替、FX,xtc********,8時間20分,1,98,98.0,0,0,0.196,1.02,0.19,0.3,あと3日,https://detail.chiebukuro.yahoo.co.jp/qa/question_detail/q11324613606,朝起きたら3円近く円高になってました。 原因は何ですか？,0,0
793,2026/1/24 6:23,イヌ,小悪魔,8時間20分,1,8,8.0,0,0,0.016,12.5,0.0,0.12,あと3日,https://detail.chiebukuro.yahoo.co.jp/qa/question_detail/q10324613605,犬のワクチンで生ワクチンは一般に細胞性免疫も強く誘導しますか？,0,0
794,2026/1/24 6:22,Yahoo!知恵袋,。,8時間21分,6,91,15.2,0,0,0.181,6.59,0.03,0.78,あと3日,https://detail.chiebukuro.yahoo.co.jp/qa/question_detail/q13324613603,至急 霊等に詳しい方、また同じような経験をした事がある方教えて欲しいです。 少し前に授かった子供を堕ろしてから酷い耳鳴りがしたり、急に耳元で人の声がしたり後ろから気配がしたり寝ている時にゆっくりドアが...,0,0
795,2026/1/24 6:22,CM,1250401108,8時間21分,1,27,27.0,0,0,0.054,3.7,0.01,0.15,不明,https://detail.chiebukuro.yahoo.co.jp/qa/question_detail/q14324613604,いろんな格闘技や番組やスタジアムのスポンサーって、高いお金を払って名前を目立つところに書いてもらっているんですよね？ その払ったお金に対してあの名前を見てお客さんは実際に来て、売り上げが上がって、費用...,0,0
796,2026/1/24 6:22,英語,lem********,8時間21分,1,17,17.0,0,0,0.034,5.88,0.01,0.13,あと3日,https://detail.chiebukuro.yahoo.co.jp/qa/question_detail/q11324613601,この英語 どんな意味ですか？ 意味というか… リセット 再スタート リフォーカス？ ポップ ステップ ジャンプ？ みたいな感じですか？,0,0
797,2026/1/24 6:22,福祉、介護,1049678965,8時間21分,2,34,17.0,1,2,0.068,5.88,0.01,0.58,あと3日,https://detail.chiebukuro.yahoo.co.jp/qa/question_detail/q12324613602,認知症の父は、食事を取らないのに、便を漏らします。 漏らした後、お尻をよく拭いてないみたいで、1日に何枚もパンツを替えるので 洗濯が間に合いません。 昨晩から、尿漏れパッドをお尻に当ててるのにもかかわ...,0,0
798,2026/1/24 6:22,流行、話題のことば,匿名,8時間21分,1,7,7.0,0,0,0.014,14.29,0.0,0.11,あと3日,https://detail.chiebukuro.yahoo.co.jp/qa/question_detail/q10324613600,ボンボンドロップシールが大流行していますね ボンボンドロップシールの流行が終了する時期を予想してください その時期にした理由も教えてください,0,0
799,2026/1/24 6:22,大学受験,1252910777,8時間21分,2,30,15.0,0,0,0.06,6.67,0.01,0.26,あと3日,https://detail.chiebukuro.yahoo.co.jp/qa/question_detail/q14324613599,西南学院大学の後期試験を受けたいのですが、 国語101／英語152/日本史81でもワンチャンいけますか？？ 上位学部は狙ってなく入れたらどこでもいいかなーって思ってます 一応英検準一もってます 満点扱...,0,0
800,2026/1/24 6:22,鉄道、列車、駅,tab********,8時間21分,4,49,12.2,0,0,0.098,8.16,0.01,0.5,あと3日,https://detail.chiebukuro.yahoo.co.jp/qa/question_detail/q13324613598,小田急の経堂駅始発について質問です 小田急には経堂駅を始発とする列車が朝一番だけあります。 思ったのがあの車両はどこから来ているのでしょうか？ 初めは全営業日の最終列車がそのままホームに留置されてるの...,0,0
801,2026/1/24 6:22,化学,bd8283555,8時間22分,3,30,10.0,0,0,0.06,10.0,0.01,0.36,あと3日,https://detail.chiebukuro.yahoo.co.jp/qa/question_detail/q12324613597,二酸化炭素の電子式の書き方について。 私が使っている参考書に電子式の書き方は以下の通りにやれば良いと書かれていました。 ①2×4個の席がありそこに最外殻電子を入れていく。 ②まずは隣り合わないように入...,0,0
802,2026/1/24 6:22,恋愛相談、人間関係の悩み,非公開,8時間22分,3,66,22.0,0,4,0.131,4.55,0.03,0.67,あと3日,https://detail.chiebukuro.yahoo.co.jp/qa/question_detail/q11324613596,マッチングアプリで知り合って付き合って半年の遠距離の彼氏がいます。バツイチ子持ちで実家で同居してるって聞いてました。家には行ったことありません。この前彼氏に住所聞いたら教えてくれました。 Google...,0,0
803,2026/1/24 6:22,自動車,非公開,8時間22分,9,42,4.7,0,3,0.084,21.43,0.0,1.16,あと3日,https://detail.chiebukuro.yahoo.co.jp/qa/question_detail/q10324613595,見通しの良い1車線しか無い道路で 頑なに制限速度ピッタリ若しくはそれに満たない速度で走る人が居ると、その軽乗用車を先頭にみんな数珠繋ぎになり、その車の先は何キロも道路が空いてしまうので、 そういう時に...,0,0
804,2026/1/24 6:22,就職活動,bxybcn,8時間22分,2,26,13.0,0,0,0.052,7.69,0.01,0.25,あと3日,https://detail.chiebukuro.yahoo.co.jp/qa/question_detail/q14324613594,面接で、仕事をしてない期間何をしていたか聞かれた時なんて答えれば良いでしょうか？ 22歳女です。営業の仕事を辞めてからもう少しで1年が経とうとしています。未だにニートでこの期間バイトも何もしていません...,0,0
805,2026/1/24 6:21,イヌ,小悪魔,8時間23分,1,6,6.0,0,0,0.012,16.67,0.0,0.11,あと3日,https://detail.chiebukuro.yahoo.co.jp/qa/question_detail/q12324613592,犬のワクチンで生ワクチンのメリットは何ですか？,0,0
806,2026/1/24 6:21,パソコン,dgj********,8時間23分,2,30,15.0,0,0,0.06,6.67,0.01,0.26,あと3日,https://detail.chiebukuro.yahoo.co.jp/qa/question_detail/q11324613591,"USBメモリをパソコンに挿したところ、データは全て消えて、"".Spotlight-V100""というファイルのみあります。 なぜ、このようになったのだと思われますか？ 復元方法を教えてください。",0,0
807,2026/1/24 6:21,ゲーム,1150167825,8時間23分,1,34,34.0,0,0,0.068,2.94,0.02,0.17,あと3日,https://detail.chiebukuro.yahoo.co.jp/qa/question_detail/q10324613590,今から始めるなら原神と鳴湖どっちがオススメですか?エンドフィールドにハマってて同じようなゲームがしたいと思ったからです。 あとどっちが配布多いですか?,0,0
808,2026/1/24 6:21,政治、社会問題,m1o********,8時間23分,1,43,43.0,0,2,0.085,2.33,0.04,0.3,あと3日,https://detail.chiebukuro.yahoo.co.jp/qa/question_detail/q14324613589,沖縄では「いきなりエイズ」患者の割合が77.8％だそいうです。 県民の7割近くが７０％です。 近頃 コロナから 国際間の感染症が流行しています。沖縄旅行では どんなことにきおつければいいでしょう？,0,0
809,2026/1/24 6:21,バイク,stf********,8時間23分,1,7,7.0,0,0,0.014,14.29,0.0,0.11,あと3日,https://detail.chiebukuro.yahoo.co.jp/qa/question_detail/q13324613588,TCS125TC.TOPSUN.トップサン.エンジンチェーンソーに合うチェーンを教えていただけると助かります。 よろしくお願いします。,0,0
810,2026/1/24 6:21,Word,nak********,8時間23分,5,32,6.4,1,5,0.064,15.62,0.0,1.05,不明,https://detail.chiebukuro.yahoo.co.jp/qa/question_detail/q12324613587,WordやExcelなどがほとんどできないのですが 普通の人はどこでWordやExcelの勉強をするのでしょうか。 私は高校や大学でも全く使えないのに周りの他の子供たちは普通にできていたので どこで習...,0,0
811,2026/1/24 6:21,気象、天気,c3bdb766e,8時間23分,5,25,5.0,1,0,0.05,20.0,0.0,0.74,あと3日,https://detail.chiebukuro.yahoo.co.jp/qa/question_detail/q11324613586,気温が0℃以上だと雪が降っても積もらないですか?,0,0
812,2026/1/24 6:21,ポケットモンスター,c7960a63c,8時間23分,0,15,15.0,0,0,0.03,0.0,0.0,0.03,あと3日,https://detail.chiebukuro.yahoo.co.jp/qa/question_detail/q10324613585,ポケモンについてです 最近（SVあたりから）ポケモンの種族値配分がインフレ化してきてると聞いたのですが素早さが高すぎるポケモンが増えたからですか？ 配分に無駄がない、だったり嫌がらせかと思うほどこのポ...,0,0
813,2026/1/24 6:21,プロ野球,kaw********,8時間23分,1,16,16.0,0,0,0.032,6.25,0.01,0.13,あと3日,https://detail.chiebukuro.yahoo.co.jp/qa/question_detail/q14324613584,松坂大輔氏（現役時代）の最速ストレートは155㌔ですか？,0,0
814,2026/1/24 6:21,家族関係の悩み,iD非公開,8時間23分,5,99,19.8,0,0,0.196,5.05,0.04,0.69,あと3日,https://detail.chiebukuro.yahoo.co.jp/qa/question_detail/q12324613582,15歳女子です。母に漫画を貸してと言われましたが、内容的に悩んでいます 真面目な相談です。 私はBL漫画が好きでよく読んでいますが、家では基本的にジャンルを明言せず、普通の漫画として扱っています。 今...,0,0
815,2026/1/24 6:21,自動車,非公開,8時間24分,9,39,4.3,0,0,0.077,23.08,0.0,0.97,あと3日,https://detail.chiebukuro.yahoo.co.jp/qa/question_detail/q11324613581,駐車場に軽自動車枠が有って、空いてるのに普通車枠に停める軽自動車を見ると良い気はしませんよね？ 普通車は軽自動車枠に停めると顰蹙買うので、停めたくても停められませんよね？,0,0
817,2026/1/24 6:21,病気、症状,こしょう,8時間24分,0,17,17.0,0,0,0.034,0.0,0.0,0.03,あと3日,https://detail.chiebukuro.yahoo.co.jp/qa/question_detail/q14324613579,37.2の微熱で頭痛が酷いんですが今日英検があってどうしても受けたいです。行ってもいいですかねテスト中に熱が上がって体調崩す可能性ありますか？,0,0
818,2026/1/24 6:20,資産運用、投資信託、NISA,1051991632,8時間25分,1,20,20.0,0,0,0.04,5.0,0.01,0.14,あと3日,https://detail.chiebukuro.yahoo.co.jp/qa/question_detail/q13324613578,複数の金融商品の相関係数についての質問です。投資信託を４種類保有してます。 現在のリスク・リターンを出す方法はありますか？ 投資信託は、個別ごとにリスク・リターンは、わかっています。４本保有している時...,0,0
820,2026/1/24 6:20,生き方、人生相談,1251949592,8時間25分,11,132,12.0,0,0,0.261,8.33,0.03,1.35,あと3日,https://detail.chiebukuro.yahoo.co.jp/qa/question_detail/q11324613576,高級車と高級時計 前にも似た質問しましたが、いまだに納得できずにあらためて質問させて頂きます。 私は高級時計が大好きです。あ、えっとあくまで「私の中では高級」という概念でお話します。 ロレックスのエク...,0,0
821,2026/1/24 6:20,大学受験,c9f013fa4,8時間25分,8,359,44.9,0,6,0.71,2.23,0.32,1.85,あと3日,https://detail.chiebukuro.yahoo.co.jp/qa/question_detail/q14324613574,中央大学って高学歴なの？低学歴なの？友達がめっちゃ中央大学のこと馬鹿にしてるので気になりました,0,0
822,2026/1/24 6:19,アニメ、コミック,hgf********,8時間26分,0,2,2.0,0,0,0.004,0.0,0.0,0.0,あと3日,https://detail.chiebukuro.yahoo.co.jp/qa/question_detail/q13324613573,おはよう御座います！ 人気漫画「ローゼンメ イデン」の初期で言えば どのドールが好きですか？ 私は真紅が一番 好きでした。 アニメやヤングジャンプ での連載も有ったよう ですが、私にとっての 最初の印...,0,0
823,2026/1/24 6:19,ライブ、コンサート,cd4cf412f,8時間26分,1,17,17.0,0,0,0.034,5.88,0.01,0.13,あと3日,https://detail.chiebukuro.yahoo.co.jp/qa/question_detail/q12324613572,ミセスのチケットを申し込みいた後に同行者が行けなくなり、今度違う同行者と同じ会場と同じスタンド席で申し込みしたいのですが申し込みって可能なんでしょうか？,0,0
