2150,2026/1/25 18:49,菓子、スイーツ,tby********,8時間6分,0,11,11.0,0,0,0.023,0.0,0.0,0.02,あと3日,https://detail.chiebukuro.yahoo.co.jp/qa/question_detail/q12324670177,2000年代に販売していた揚げパスタのお菓子知ってる方いますか？ どこのメーカーのお菓子だったか知りたいです。 見た目はこんな感じです。,0,0
2152,2026/1/25 18:49,職場の悩み,1252513346,8時間6分,4,38,9.5,0,0,0.078,10.53,0.01,0.49,あと3日,https://detail.chiebukuro.yahoo.co.jp/qa/question_detail/q10324670175,会社での振る舞いに関する悩み・質問です もし、私の考えがおかしいと感じたり、それは違うと思ったりしたところがあれば遠慮なく指摘してください 私は今社会人１年目で、元々体育会系ノリ、古風なしきたりがとて...,0,0
2153,2026/1/25 18:49,大学受験,cbd612ef,8時間6分,1,62,62.0,0,0,0.127,1.61,0.08,0.23,あと3日,https://detail.chiebukuro.yahoo.co.jp/qa/question_detail/q13324670173,近畿大学経済学部の共通テスト併用A日程についてです。 共通テストで172点あるのですが個別試験で何点取れば安心ですか？ あと最悪落ちた時に共通テスト利用後期を出そうと思うのですが2科目172点で受かる...,0,0
2154,2026/1/25 18:49,MLB,380,8時間6分,2,34,17.0,0,6,0.07,5.88,0.01,0.64,あと3日,https://detail.chiebukuro.yahoo.co.jp/qa/question_detail/q11324670171,ヤンキース、アーロンジャッジさんは守備上手いですか？わかる方いますかm(_ _)m,0,0
2155,2026/1/25 18:49,郵便、宅配,cd6f77058,8時間6分,2,11,5.5,0,0,0.023,18.18,0.0,0.23,あと3日,https://detail.chiebukuro.yahoo.co.jp/qa/question_detail/q10324670170,土曜日の夕方に島根から滋賀宛に普通郵便が発送された場合何曜日に届きますか？,0,0
2156,2026/1/25 18:49,釣り,ルネサンスミッシー0156,8時間6分,1,21,21.0,0,2,0.043,4.76,0.01,0.27,あと3日,https://detail.chiebukuro.yahoo.co.jp/qa/question_detail/q13324670168,アブの丸型ベイトリールのパーミングカップダイヤルは何の調節なんですか？,0,0
2157,2026/1/25 18:49,おもちゃ,a2f11340d,8時間6分,1,15,15.0,0,0,0.031,6.67,0.0,0.13,あと3日,https://detail.chiebukuro.yahoo.co.jp/qa/question_detail/q12324670167,ボンボンドロップシール バンダイの台紙なのですが バンダイのシールが無いのと 少し印刷ズレなのかなって思ってて 正規品なのですかね？ みみっちの正規品が無いので比べるものがなくて 回答待ってます,0,0
2158,2026/1/25 18:49,恋愛相談、人間関係の悩み,cbba1ab90,8時間6分,1,60,60.0,0,0,0.123,1.67,0.07,0.23,不明,https://detail.chiebukuro.yahoo.co.jp/qa/question_detail/q11324670166,自分は、50代の不細工な独身の障害者の男です。大学病院に入院した時、看護師に用事があり、ナースステーションに行きました。そこにいた若い看護師に用件を言おうとしたら、他の患者の処置をしていました。 しか...,0,0
2159,2026/1/25 18:49,コンビニ,cd7e30896,8時間6分,1,20,20.0,0,0,0.041,5.0,0.01,0.14,あと3日,https://detail.chiebukuro.yahoo.co.jp/qa/question_detail/q10324670165,優しい方、早急に返答をお願いします。 本日までの入金締め切りのものの入金をコンビニに支払いにきたのですが、一枚は自分の名前で印刷できたものの、同じところから申し込んだもののはずが、もう一枚は名前が反映...,0,0
2160,2026/1/25 18:49,病気、症状,里う,8時間6分,3,23,7.7,0,1,0.047,13.04,0.0,0.42,あと3日,https://detail.chiebukuro.yahoo.co.jp/qa/question_detail/q14324670164,過敏性腸症候群の方、または詳しく知っている方に質問です。 数日前くらいから突然過敏性腸症候群の症状が出てきました。 まだ確証はないのですが、 ・頻繁にお腹を壊す、水下痢が出る ・おならがお尻のところで...,0,0
2161,2026/1/25 18:49,釣り,man********,8時間6分,3,32,10.7,0,0,0.066,9.38,0.01,0.37,あと3日,https://detail.chiebukuro.yahoo.co.jp/qa/question_detail/q13324670163,ルアーのフックのアイの大きさについて質問です。 一般的に売られているフックのアイの大きさは何か基準があってのサイズなのでしょうか？ 大きすぎるとフックが暴れてしまうとかあるのでしょうか？ その事につい...,0,0
2162,2026/1/25 18:48,恋愛相談、人間関係の悩み,t,8時間8分,1,11,11.0,0,0,0.023,9.09,0.0,0.12,あと3日,https://detail.chiebukuro.yahoo.co.jp/qa/question_detail/q11324670161,最初は良い人に見えて急に迷惑行為をしたら嫌われますか？,0,0
2163,2026/1/25 18:48,日用品、生活雑貨,ohhirahiroshi,8時間8分,3,16,5.3,0,0,0.033,18.75,0.0,0.34,不明,https://detail.chiebukuro.yahoo.co.jp/qa/question_detail/q10324670160,トイレ用ファブリーズを使っています。8週間の防臭効果とありましたが、夏場は暑さで気体の蒸発もあって1ヶ月程で液が無くなりました。反対に今は冬の寒さで２ヶ月使用していますが、液が半分程残っています。 液...,0,0
2164,2026/1/25 18:48,携帯型ゲーム全般,1251939440,8時間8分,2,25,12.5,0,0,0.051,8.0,0.01,0.26,あと3日,https://detail.chiebukuro.yahoo.co.jp/qa/question_detail/q13324670158,ブロスタのガチバトルについて。 2018年ぐらいにしていて、最近またやり始めました。 ガチバトルなのですが、10連敗するとかザラなのですがこんなものですか？ ゴールド2帯です,0,0
2165,2026/1/25 18:48,カスタマイズ,tai********,8時間8分,2,13,6.5,0,0,0.027,15.38,0.0,0.23,あと3日,https://detail.chiebukuro.yahoo.co.jp/qa/question_detail/q14324670159,ZZR1100のバーハンドル化でハイスロに交換に伴い質問です ハイスロにしたかったというよりは、バーハン化＆ラジアルポンプマスター交換のためにハイスロにせざるをえなかったのですが ハイスロ化に伴いスロ...,0,0
2166,2026/1/25 18:48,ゲーム,あ,8時間8分,0,4,4.0,0,0,0.008,0.0,0.0,0.01,あと3日,https://detail.chiebukuro.yahoo.co.jp/qa/question_detail/q11324670156,プレステ5の中古と新品の今後の価額はどの位になりますか？予想で良いのでご回答お願いします,0,0
2167,2026/1/25 18:48,学校の悩み,非公開,8時間8分,1,20,20.0,0,0,0.041,5.0,0.01,0.14,あと3日,https://detail.chiebukuro.yahoo.co.jp/qa/question_detail/q12324670157,昨日、雪が少し積もってたのでこのブーツで学校行ったらクラスの女子に「ダッサ爆笑爆笑」って言われました。そんなにダサいですか？高校が土足なので学校の中でもこれです。,0,0
2168,2026/1/25 18:48,俳優、女優,令和のケンケンPA名人,8時間8分,6,36,6.0,0,0,0.074,16.67,0.0,0.69,あと3日,https://detail.chiebukuro.yahoo.co.jp/qa/question_detail/q10324670155,本日1月25日は、女優・多部未華子さんの誕生日です。 そこで質問。多部さんの好きな出演作品を1つだけ挙げてください。,0,0
2169,2026/1/25 18:48,大学受験,さー,8時間8分,1,50,50.0,0,0,0.102,2.0,0.05,0.2,あと3日,https://detail.chiebukuro.yahoo.co.jp/qa/question_detail/q14324670154,年度によって変わると思いますが関西学院大学 全学部 商学部の過去問解いたんですけど 国語148/200 英語142/200 日本史111/150 総合401/550 だったんですけど受かりますかね,0,0
2170,2026/1/25 18:48,デンタルケア,den********,8時間8分,1,26,26.0,0,0,0.053,3.85,0.01,0.16,あと3日,https://detail.chiebukuro.yahoo.co.jp/qa/question_detail/q13324670153,親知らず抜歯後の骨腫について。 2〜3年前に親知らずを抜いてもらいました。 痛みや腫れが引いてから現在も頬側の歯茎にしこりがあり、他の病院で骨腫と言われました。 押すと若干痛み、口を動かすとつっぱる感...,0,0
2171,2026/1/25 18:48,就職活動,c7033f0ae,8時間8分,1,20,20.0,0,0,0.041,5.0,0.01,0.14,あと3日,https://detail.chiebukuro.yahoo.co.jp/qa/question_detail/q14324670149,現在21歳 聴覚障害者 資格もってるので運がよく中途入社で、そこそこ大きい会社に入れた高卒社会人です。 日本で唯一の障害者のための大学、筑波技術大学に進学したいです。 地方出身のため、高校生の頃は金銭...,0,0
2172,2026/1/25 18:48,スキンケア,owj********,8時間8分,1,8,8.0,0,0,0.016,12.5,0.0,0.12,あと3日,https://detail.chiebukuro.yahoo.co.jp/qa/question_detail/q10324670150,へそカスを取る時にオリーブオイルをへそに塗るとへそカスが取れやすくなるのはどうしてですか？仕組みを教えてください。,0,0
2173,2026/1/25 18:48,麻雀,そうパン,8時間8分,2,44,22.0,0,0,0.09,4.55,0.02,0.29,あと3日,https://detail.chiebukuro.yahoo.co.jp/qa/question_detail/q13324670148,麻雀の清一色の待ちの時のコツがあれば教えてください。,0,0
2174,2026/1/25 18:48,大学受験,あ,8時間8分,0,14,14.0,0,0,0.029,0.0,0.0,0.03,あと3日,https://detail.chiebukuro.yahoo.co.jp/qa/question_detail/q12324670147,3週間で世界史をある程度点数アップすることって出来ますか？ 本日私立大の入試を受けましたが、私は英国数で受験しており、2日間ありどちらも過去問より難しかった印象で、このような問題が続くと数学で点数を取...,0,0
2175,2026/1/25 18:48,大学受験,非公開,8時間8分,0,14,14.0,0,0,0.029,0.0,0.0,0.03,あと3日,https://detail.chiebukuro.yahoo.co.jp/qa/question_detail/q11324670146,中部大学の共テ利用で115/200のC判定なのですが受かると思いますか？今年共テ利用多いので受かるか微妙ですよね^^;,0,0
2176,2026/1/25 18:48,病気、症状,1052407918,8時間8分,0,9,9.0,1,0,0.018,0.0,0.0,0.22,あと3日,https://detail.chiebukuro.yahoo.co.jp/qa/question_detail/q10324670145,elifeでオンライン診療をせずにリベルサス7ミリグラム30錠を購入しました。いつになっても届かなかったので、問い合せたところオンライン診療をしてくださいとのことだったので、 オンライン診療をしたとこ...,0,0
2177,2026/1/25 18:48,観光地、行楽地,1150002750,8時間9分,1,45,45.0,0,0,0.092,2.22,0.04,0.19,あと3日,https://detail.chiebukuro.yahoo.co.jp/qa/question_detail/q14324670144,札幌民です。今日の雪で自分の駐車場含め近辺は車が確定で埋まるほど雪が積もってしまったのですが、近くのスーパーに1泊とめるのはやっぱりだめでしょうか？ スーパーは24時間営業で駐車場はタイムズと契約して...,0,0
2178,2026/1/25 18:48,郵便、宅配,b82a323c0,8時間9分,3,19,6.3,0,0,0.039,15.79,0.0,0.34,あと3日,https://detail.chiebukuro.yahoo.co.jp/qa/question_detail/q13324670143,クリックポストの日数についてです。 神奈川県から1/26午前中に発送手続きした場合、兵庫県に1/28到着は可能でしょうか？ 高速道路の状況等含めご回答いただければ幸いです。,0,0
2179,2026/1/25 18:48,大学受験,1052890948,8時間9分,0,6,6.0,0,0,0.012,0.0,0.0,0.01,あと3日,https://detail.chiebukuro.yahoo.co.jp/qa/question_detail/q12324670142,福井大学の物理って問題の量バグってません？ 導出とかもしないとダメだから毎回時間切れで解けない問題が出てきます。6割くらいからいい時で7割くらいなんですけどこれ結構まずいですか？,0,0
2180,2026/1/25 18:48,恋愛相談、人間関係の悩み,名無し,8時間9分,2,75,37.5,0,5,0.153,2.67,0.06,0.66,不明,https://detail.chiebukuro.yahoo.co.jp/qa/question_detail/q11324670141,ぜひ恋愛相談乗ってください… 先日気になる男性と1時間ほどカフェでお話してきました。 前提で、私と男性は学校内のイベントでたまたま出会って私のタイプすぎたので、私からインスタ交換を申し出て繋がりました...,0,0
2181,2026/1/25 18:48,スキンケア,cb76ee9ae,8時間9分,0,3,3.0,0,0,0.006,0.0,0.0,0.01,あと3日,https://detail.chiebukuro.yahoo.co.jp/qa/question_detail/q10324670140,長時間マスクをつけていると、外した時にほうれい線がくっきりしている気がするのですが、自分だけでしょうか？,0,0
2182,2026/1/25 18:48,賃貸物件,ba3c25b3c,8時間9分,3,76,25.3,0,0,0.155,3.95,0.04,0.46,不明,https://detail.chiebukuro.yahoo.co.jp/qa/question_detail/q14324670139,SUUMOとYahoo不動産の賃貸物件サイトの件で質問です。 ３月いっぱいで引越しを考えています。 横浜駅から電車で20分圏内で駅近の物件を探していて10件以上を同じ不動産会社を通じて問い合わせをしま...,0,0
2183,2026/1/25 18:48,デジタル一眼レフ,byw********,8時間9分,2,31,15.5,0,0,0.063,6.45,0.01,0.27,あと3日,https://detail.chiebukuro.yahoo.co.jp/qa/question_detail/q13324670138,現在EOS R8を使っていて、今回初めて本体の乗り換えを考えており、EOS R6markⅢの購入を検討しているのですが、色味や写り方は変わらないですか？ 宜しくお願いします。,0,0
2184,2026/1/25 18:48,メルカリ,mas********,8時間9分,1,43,43.0,0,4,0.088,2.33,0.04,0.43,あと3日,https://detail.chiebukuro.yahoo.co.jp/qa/question_detail/q11324670136,メルカリで【おまけ付き】の商品があり、なんのオマケか不明なので質問すると「おまけなのでオマケです、届いてからのお楽しみにしてください」とされ、その後質問削除されてました。 同じ人から同じ商品が出てます...,0,0
2185,2026/1/25 18:48,高校,yum********,8時間9分,0,4,4.0,0,0,0.008,0.0,0.0,0.01,あと3日,https://detail.chiebukuro.yahoo.co.jp/qa/question_detail/q10324670135,ぎふ国際高等学校通ってる方に質問です。 学費は、毎月払いですか❓それとも、前期・後期の2回払いですか❓,0,0
2186,2026/1/25 18:48,大学院,ちゃねーふけ,8時間9分,2,12,6.0,0,0,0.025,16.67,0.0,0.23,あと3日,https://detail.chiebukuro.yahoo.co.jp/qa/question_detail/q14324670134,大学の学長って大学院のトップでもありますか？ 大学院のトップは別の学長ですか？,0,0
2187,2026/1/25 18:48,トレーニング,mio*******,8時間9分,0,4,4.0,0,0,0.008,0.0,0.0,0.01,あと3日,https://detail.chiebukuro.yahoo.co.jp/qa/question_detail/q13324670133,ベンチプレス120kg、スクワット210kg、デッドリフト200kgです。これはベンチプレスが弱すぎますか？最近降ろし方見直したら胸に筋肉痛が来るようになりましたが、それまでは肩ばっか痛めてました,0,0
2188,2026/1/25 18:48,家族関係の悩み,1151160836,8時間9分,3,23,7.7,0,1,0.047,13.04,0.0,0.41,あと3日,https://detail.chiebukuro.yahoo.co.jp/qa/question_detail/q11324670131,私は父親と実家で暮らしています。父は70代なのですが家の中が臭いといってかなり気にしています。 一緒に住んでいる私や姉は臭くないと思っているのですが色々調べてみたら鼻の病気や精神的な病気が隠れている可...,0,0
2189,2026/1/25 18:48,ゲーム,1150284333,8時間9分,0,7,7.0,0,0,0.014,0.0,0.0,0.01,あと3日,https://detail.chiebukuro.yahoo.co.jp/qa/question_detail/q14324670129,アークナイツエンドフィールドで探索ツールというものがあると思うんですけど探索ツールの枠で最初使われていない枠があると思うのですが、どのようにして振り分けれるのかやり方が分からなく教えて頂きたいです,0,0
2190,2026/1/25 18:48,生命保険,hod********,8時間9分,1,76,76.0,0,3,0.155,1.32,0.12,0.44,あと3日,https://detail.chiebukuro.yahoo.co.jp/qa/question_detail/q13324670128,プルデンシャル生命とビッグモーターはどちらが悪質ですか？,0,0
2191,2026/1/25 18:48,高校受験,1153334949,8時間9分,2,12,6.0,0,0,0.024,16.67,0.0,0.23,あと3日,https://detail.chiebukuro.yahoo.co.jp/qa/question_detail/q10324670130,兵庫県公立入試の過去問を解いたんですけど 2023〜2025年は点数が高いのに 2021~2022年は点数が低いんですよ 2026年に受験するときどれを参考にすればいいですか？ 語彙力なくてすいません,0,0
2192,2026/1/25 18:48,話題の人物,ohc********,8時間9分,0,3,3.0,0,0,0.006,0.0,0.0,0.01,あと3日,https://detail.chiebukuro.yahoo.co.jp/qa/question_detail/q10324670125,加藤紗里は清純派の代表格ですか？,0,0
2193,2026/1/25 18:48,クレジットカード,1052624836,8時間9分,2,34,17.0,0,0,0.069,5.88,0.01,0.27,あと3日,https://detail.chiebukuro.yahoo.co.jp/qa/question_detail/q14324670124,クレジットカードの引き落とし日が月曜日なのですが、それに充分な金額を振り込んだのが直前の土日だった為、現在口座にあるお金がそれを下回ったままです。 この場合間に合わないですか？ どう言った対応をするべ...,0,0
2194,2026/1/25 18:48,ゲーム,1253207216,8時間9分,2,34,17.0,1,1,0.069,5.88,0.01,0.54,あと3日,https://detail.chiebukuro.yahoo.co.jp/qa/question_detail/q12324670127,どうしてスマブラの一部のプレイヤーは自分の使ってるキャラをポジられるのを嫌がってるんですか？ 自分の使ってるキャラが強いって言われて嬉しくなれないのが自分には分からないので理由が分かる方は教えて欲しい...,0,0
2195,2026/1/25 18:48,バイク,tam********,8時間10分,5,40,8.0,0,0,0.082,12.5,0.01,0.59,あと3日,https://detail.chiebukuro.yahoo.co.jp/qa/question_detail/q13324670123,バイク用ヘルメットについて SHOEIとARAIのヘルメットはそれぞれどういう特徴なのでしょうか サーキットでの使用を想定しています 実際に走行している方に教えていただきたいです,0,0
2196,2026/1/25 18:48,役所、手続き,ash********,8時間10分,3,20,6.7,0,0,0.041,15.0,0.0,0.35,あと3日,https://detail.chiebukuro.yahoo.co.jp/qa/question_detail/q12324670122,生活保護受給者は 社会保険と医療券と併用できるようですが 3割負担でもいいなら、医療券使わなくてもいいですかね？ それはルール違反ですか？ なぜ医療券使わないんだ、と思うかもしれませんが事情があります...,0,0
2197,2026/1/25 18:47,中国語,1151798703,8時間11分,2,13,6.5,0,0,0.026,15.38,0.0,0.23,あと3日,https://detail.chiebukuro.yahoo.co.jp/qa/question_detail/q10324670120,雑誌を買って帰ってきました。 买回杂志来了。 买杂志回来了。 杂志买回了。 どれが正しいですか？,0,0
2198,2026/1/25 18:47,ゲーム,1151039889,8時間11分,2,5,2.5,0,0,0.01,40.0,0.0,0.21,あと3日,https://detail.chiebukuro.yahoo.co.jp/qa/question_detail/q11324670121,荒野行動をやっている時画面の明るさを変えようとしたら「明るさは荒野行動-AIRで制御されているため、調整できません」と出るのですが原因はなんでしょうか。 他のアプリを開いたりすればすぐに戻るのですが荒...,0,0
2199,2026/1/25 18:47,メンズ全般,非公開,8時間11分,1,26,26.0,0,0,0.053,3.85,0.01,0.15,あと3日,https://detail.chiebukuro.yahoo.co.jp/qa/question_detail/q14324670119,この服どうですか？,0,0
2200,2026/1/25 18:47,携帯型ゲーム全般,aho********,8時間11分,0,58,58.0,0,0,0.118,0.0,0.0,0.12,あと3日,https://detail.chiebukuro.yahoo.co.jp/qa/question_detail/q13324670118,先日リリースされたサカつくのモバイル版を始めたのですが、監督レベルが上がり、セーブデータが１つ追加されたので、新しいセーブデータで他のチームで始めようとしたのですが、 シーズン開始決定時に「所属クラブ...,0,0
2201,2026/1/25 18:47,運転免許,非公開,8時間11分,1,22,22.0,0,0,0.045,4.55,0.01,0.15,あと3日,https://detail.chiebukuro.yahoo.co.jp/qa/question_detail/q12324670117,免許証の再発行について。 財布ごと紛失してしまい、身分証となるマイナンバーカードも何もないとき、免許証再発行で必要な身分証は、住民票でも大丈夫ですか？,0,0
2202,2026/1/25 18:47,料理、食材,lD非公開,8時間11分,2,12,6.0,0,1,0.024,16.67,0.0,0.29,あと3日,https://detail.chiebukuro.yahoo.co.jp/qa/question_detail/q11324670116,レトルトのハンバーグで特殊な穴が付いていてレンチンでも湯せんでもOKな場合 どちらで食べたいですか？,0,0
2203,2026/1/25 18:47,恋愛相談、人間関係の悩み,1151032344,8時間11分,3,30,10.0,0,1,0.061,10.0,0.01,0.43,あと3日,https://detail.chiebukuro.yahoo.co.jp/qa/question_detail/q10324670115,画面越しで可愛いとか思わない。 自分は、スマホやテレビで可愛い女優やアイドルグループを見ても、確かにかわいいはかわいいのですが、全くドキッとしません。 友達や周りの人を見てみると、あの女優かわいい！だ...,0,0
2204,2026/1/25 18:47,大学受験,1152016554,8時間11分,2,30,15.0,0,0,0.061,6.67,0.01,0.26,あと3日,https://detail.chiebukuro.yahoo.co.jp/qa/question_detail/q14324670114,日本史で一問一答を先にやるのはよくないと聞きますが教科書だとあまり頭に入った気がしないので一問一答ばかり使って勉強してしまいます。良くないですか？どのように勉強するのが良いですか？ 使っているのは東進...,0,0
2205,2026/1/25 18:47,パソコン,1150461997,8時間11分,2,24,12.0,0,0,0.049,8.33,0.01,0.25,あと3日,https://detail.chiebukuro.yahoo.co.jp/qa/question_detail/q13324670113,VRC目的でゲーミングPCを求めている者です。デスクトップパソコンについては初心者です。悩んだ末、二つほどパソコンを選びました。このどちらを買うのが良いか教えていただきたいです。 一つ目はmouseの...,0,0
2206,2026/1/25 18:47,マッサージ、整体,iit********,8時間11分,6,41,6.8,0,8,0.083,14.63,0.01,1.18,あと3日,https://detail.chiebukuro.yahoo.co.jp/qa/question_detail/q12324670112,腰痛のヘルニアにはコルセットは有効なのでしょうか？,0,0
2207,2026/1/25 18:47,国際情勢,非公開,8時間11分,1,8,8.0,0,0,0.016,12.5,0.0,0.12,あと3日,https://detail.chiebukuro.yahoo.co.jp/qa/question_detail/q11324670111,ベネズエラのオリノコ油田の超重質油ってイランの希釈剤がないと販売できないレベルですか？何にも使えませんか？,0,0
2208,2026/1/25 18:47,政治、社会問題,………,8時間11分,5,38,7.6,0,1,0.077,13.16,0.01,0.65,あと3日,https://detail.chiebukuro.yahoo.co.jp/qa/question_detail/q10324670110,今度の衆院選では、私の小選挙区には自民党と参政党の2人しか候補者がいません。いつもなら国民民主党や日本共産党も立候補していたのに…。正直どちらにも投票したくありません。 もうこれ以上候補者が増えること...,0,0
2209,2026/1/25 18:47,文学、古典,1151370934,8時間11分,0,8,8.0,0,0,0.016,0.0,0.0,0.02,あと3日,https://detail.chiebukuro.yahoo.co.jp/qa/question_detail/q14324670109,４巻を試し読みしたのですが、韓非子がつまらなかったのですが皆さんはどう思いますか,0,0
2210,2026/1/25 18:47,薄毛、抜け毛,a2bf6ab8c,8時間12分,1,34,34.0,0,0,0.069,2.94,0.02,0.17,あと3日,https://detail.chiebukuro.yahoo.co.jp/qa/question_detail/q13324670108,高校生２年生です。このつむじってはげてますか？おでこが広くて髪もぺちゃんこなので不安です。,0,0
2211,2026/1/25 18:47,作詞、作曲,1252140548,8時間12分,5,44,8.8,0,0,0.089,11.36,0.01,0.6,あと3日,https://detail.chiebukuro.yahoo.co.jp/qa/question_detail/q12324670107,曲を作るにはどうしたらいいでしょうか。 メロディーだけあります。 それに当てはめるコードを探すのでしょうか。 それに合うコードの見つけ方？もわかりません。,0,0
2212,2026/1/25 18:47,恋愛相談、人間関係の悩み,1052605699,8時間12分,2,20,10.0,0,0,0.041,10.0,0.0,0.24,あと3日,https://detail.chiebukuro.yahoo.co.jp/qa/question_detail/q11324670106,男性に質問です。 恋愛について聞きたいのですが、管理職だったり、出向などに行ってたらやっぱり恋愛する余裕はなくなりますか？ 好きだけど付き合う余裕がないってことはありますか？,0,0
2213,2026/1/25 18:47,英語,1152819447,8時間12分,2,45,22.5,0,0,0.091,4.44,0.02,0.29,あと3日,https://detail.chiebukuro.yahoo.co.jp/qa/question_detail/q10324670105,準2級英検のライティングのeメールの問題で、ふたつの質問に？をつけ忘れました。それにプラスして小さな文法ミスを数回しています。？つけ忘れは結構まずいですか？,0,0
2214,2026/1/25 18:47,ライブ、コンサート,1052562196,8時間12分,1,45,45.0,0,0,0.091,2.22,0.04,0.19,あと3日,https://detail.chiebukuro.yahoo.co.jp/qa/question_detail/q14324670104,M!LKのファンミについての質問です。 最近ハマった新規のものですが、ファンミーティングに応募しようかとおもっております。FC限定のイベントは全て本人確認はありますでしょうか？また、あった場合どの程度...,0,0
