ID,質問日時,カテゴリ,投稿者名,経過時間,回答数,閲覧数,回答難易度,共感数,回答リアクション総数,注目度,回答競争率,注目/競争比,ランキングポテンシャル,受付終了まで,URL,本文冒頭,マイフラグ,ベストアンサーフラグ
1,2026/1/25 19:45,メンズ全般,1150859853,4時間58分,1,12,12.0,0,0,0.04,8.33,0.0,0.21,あと3日,https://detail.chiebukuro.yahoo.co.jp/qa/question_detail/q10324672235,高校一年野球部男子です。 冬服について相談です。 20000円以内で色々着こなしできる服を教えて欲しいです。 できれば2セットは作りたいです。 体型はがっちりしていて、結構巻き型です。 少しストレート...,0,0
2,2026/1/25 19:45,アニメ,ポメ,4時間58分,0,4,4.0,0,0,0.013,0.0,0.0,0.01,あと3日,https://detail.chiebukuro.yahoo.co.jp/qa/question_detail/q14324672234,もしもヒロアカに、リゼロのエミリアがヒーロー科1年A組の麗日お茶子に次ぐサブヒロインとしていたら、どんな個性を持って、恋愛要素は誰だったと思いますか？,0,0
3,2026/1/25 19:45,占い,b57a5c313,4時間58分,1,4,4.0,0,0,0.013,25.0,0.0,0.18,あと3日,https://detail.chiebukuro.yahoo.co.jp/qa/question_detail/q13324672233,辰巳天中殺1988うまれで来月の4日に明けるとか或いは本厄、後厄は信じるか？,0,0
4,2026/1/25 19:45,資産運用、投資信託、NISA,1251982133,4時間58分,5,95,19.0,0,0,0.318,5.26,0.06,1.15,あと3日,https://detail.chiebukuro.yahoo.co.jp/qa/question_detail/q11324672231,22歳です。手取りは18万円です。 将来のことが不安なので資産を増やすために色々やろうとしています。 ただ自分はマルチタスクが苦手で優先順位をつけずに一気にやるとすぐに辞めてしまうと思うのでアドバイス...,0,0
5,2026/1/25 19:45,大学受験,shuuuu,4時間58分,0,15,15.0,0,0,0.05,0.0,0.0,0.05,あと3日,https://detail.chiebukuro.yahoo.co.jp/qa/question_detail/q10324672230,私大文系の共テ利用についてです。 玉川大学の観光学部に共テ利用で出願したのですが、河合のリサーチ、バンザイシステム、駿台の選太君でA判定でした。 また、去年の合格人数よりもそれらの判定で順位は上回って...,0,0
6,2026/1/25 19:45,高校受験,通信制高校行ってみたい,4時間58分,1,24,24.0,1,0,0.08,4.17,0.02,0.58,あと3日,https://detail.chiebukuro.yahoo.co.jp/qa/question_detail/q14324672229,通信制高校に行きたいのですが 私は中二の女子です。 来年からとくべつしえんきゅうに入ります。 みんなに鹿島にしろといわれます。 正直にいうとN高に行きたいのですが説得ができないのでどうすればいいですか...,0,0
7,2026/1/25 19:45,家族関係の悩み,1252508393,4時間59分,7,82,11.7,0,0,0.274,8.54,0.03,1.44,あと3日,https://detail.chiebukuro.yahoo.co.jp/qa/question_detail/q13324672228,お金がなさすぎて悲しくなります。 19歳社会人女です。働き始めてもうすぐで一年経ちます。 給料は月平均で15〜17万です。そのうち8万は実家に入れ、4万は自動車学校の支払い、1万は定期代、その他支払い...,0,0
8,2026/1/25 19:45,アニメ、コミック,1150706462,4時間59分,1,6,6.0,0,0,0.02,16.67,0.0,0.19,あと3日,https://detail.chiebukuro.yahoo.co.jp/qa/question_detail/q12324672227,今度二次創作の女の子たちのギャグ漫画を描きたいと思ってるのですが、女の子の面白い顔の参考になりそうな漫画やアニメを教えてください。,0,0
10,2026/1/25 19:45,英語,1253277821,4時間59分,4,76,19.0,0,0,0.254,5.26,0.05,0.92,あと3日,https://detail.chiebukuro.yahoo.co.jp/qa/question_detail/q14324672224,中2です。英検2級で、 R48% L63% W78% だったら合格できますか？？ W75%の場合どうなるかも教えて欲しいです！,0,0
12,2026/1/25 19:45,新車,ツクダオリジナル Othello,4時間59分,2,33,16.5,0,0,0.11,6.06,0.02,0.44,あと3日,https://detail.chiebukuro.yahoo.co.jp/qa/question_detail/q11324672221,スズキブロンクスがオーストリア？オーストラリア？の安全評価で最低ランクとなり販売中止リコール案件になった 後部座席のシートベルトも拘束がうまく働かず乗員ダミーが前席後部に衝突した などの記事をネットで...,0,0
14,2026/1/25 19:45,懸賞、くじ,XOXO,4時間59分,3,176,58.7,0,10,0.588,1.7,0.35,2.08,あと3日,https://detail.chiebukuro.yahoo.co.jp/qa/question_detail/q13324672218,宝くじ当たったひといるんですか？当たったとか言う人嘘くさいんだが,0,0
15,2026/1/25 19:45,英語,be15e321,4時間59分,1,79,79.0,0,1,0.264,1.27,0.21,0.53,あと3日,https://detail.chiebukuro.yahoo.co.jp/qa/question_detail/q12324672217,今日英検2級(2025年度第3回)を受けて、自己採点結果 リーディング 20/31 リスニング 20/30でした。 ライティングは2問とも書ききって内容は大丈夫だと思いますが文法が多分ぐちゃぐちゃで不...,0,0
17,2026/1/25 19:45,マッサージ、整体,ttt********,4時間59分,3,38,12.7,0,12,0.127,7.89,0.02,1.82,あと3日,https://detail.chiebukuro.yahoo.co.jp/qa/question_detail/q13324672213,カイロプラクティックで慢性的な首のコリと猫背を矯正してほしくてお願いしたのですか 先生が「よっしゃ！入ったあ！」と言いながらボキボキされました。 首を左右に何度もひねりボキという音がしたのです。 両腕...,0,0
18,2026/1/25 19:45,英語,1151669589,4時間59分,2,87,43.5,0,0,0.29,2.3,0.13,0.62,あと3日,https://detail.chiebukuro.yahoo.co.jp/qa/question_detail/q12324672212,今日英検２級を受けました。 自己採点し、リスニングは友達と同じだったところだけ正解と考えたため正確では無いですが、リーディング51%、リスニング60%〜でした。ライティングは手応えあるのですが少し減点...,0,0
19,2026/1/25 19:45,おみやげ、ご当地名物,dai********,4時間59分,3,24,8.0,0,0,0.08,12.5,0.01,0.58,あと3日,https://detail.chiebukuro.yahoo.co.jp/qa/question_detail/q11324672211,2月の日曜に京都に行く用事があり、ずっと気になっていた出町ふたばさんの豆大福を買いたいと思うのですが並んでいる時間はなく、前日までに予約しておけば並ばずに買えるとのことですが 全く並ばなくても大丈夫な...,0,0
20,2026/1/25 19:45,LINE,やゆ,4時間59分,1,38,38.0,0,0,0.127,2.63,0.05,0.29,あと3日,https://detail.chiebukuro.yahoo.co.jp/qa/question_detail/q10324672210,スマホを新しくしたのですがラインの前のアカウントが引き継ぎできず新しいアカウントを作りました。 その際前のアカウントの削除はした方がいいでしょうか？ あと、画像の退出になってないのを放置したらまずいで...,0,0
21,2026/1/25 19:45,自動車,agmpj,4時間59分,2,9,4.5,0,0,0.03,22.22,0.0,0.36,あと3日,https://detail.chiebukuro.yahoo.co.jp/qa/question_detail/q14324672209,車のナビのBluetoothについて質問です。 接続はされるんですが、急に接続解除になったりで音が出なくなったりするのですが、どうすればいいですか？,0,0
22,2026/1/25 19:45,メルカリ,aim********,4時間59分,2,45,22.5,0,0,0.15,4.44,0.03,0.48,あと3日,https://detail.chiebukuro.yahoo.co.jp/qa/question_detail/q13324672208,メルカリでオリジナルのイラストを販売してますが、A4サイズの作品よりも色紙でちょっとえっちな作品の方が高く売れるのは何故でしょうか？,0,0
23,2026/1/25 19:45,吹奏楽,c397a2b12,4時間59分,1,9,9.0,0,0,0.03,11.11,0.0,0.2,あと3日,https://detail.chiebukuro.yahoo.co.jp/qa/question_detail/q12324672207,トロンボーンケースについての質問です。 セイヤーバルブが収納でき譜面台やスタンドもしくは楽譜ファイルも収納できるケースのおすすめはありますか？学生なのでできるだけ安価なものでお願いします！,0,0
24,2026/1/25 19:45,算数,R0827,5時間0分,4,23,5.8,0,1,0.077,17.39,0.0,0.84,あと3日,https://detail.chiebukuro.yahoo.co.jp/qa/question_detail/q11324672206,√81は奇数ですか？ √81は9で割るから、9も奇数ですか？,0,0
25,2026/1/25 19:44,特撮,けんたろう,5時間1分,1,5,5.0,0,0,0.017,20.0,0.0,0.18,あと3日,https://detail.chiebukuro.yahoo.co.jp/qa/question_detail/q10324672205,ショッカー、黒十字軍、ドツクゾーンが戦ったらどれが勝つと思いますか？,0,0
26,2026/1/25 19:44,家族関係の悩み,szx********,5時間1分,2,27,13.5,0,0,0.09,7.41,0.01,0.42,あと3日,https://detail.chiebukuro.yahoo.co.jp/qa/question_detail/q14324672204,旦那が休みの日に遊びに行って、次の人体調壊し寝てました。その間私が家事仕事やってるのに感謝一つありません。それどころか当たり前の態度です。普段からあまりやりませんが、腹が立って仕方ないです。 子供と仲...,0,0
27,2026/1/25 19:44,英語,えび,5時間1分,1,66,66.0,0,0,0.219,1.52,0.14,0.38,あと3日,https://detail.chiebukuro.yahoo.co.jp/qa/question_detail/q13324672203,英検２級今日受けました。。 自己採点の結果、リーディング16/31 リスニング22/30 でした。ライティングにいちばん費やしたので6、7割はあるはずです。 でもリーディングがさすがに痛いですかね、？...,0,0
28,2026/1/25 19:44,メイク、コスメ,c4d788926,5時間1分,0,1,1.0,0,0,0.003,0.0,0.0,0.0,あと3日,https://detail.chiebukuro.yahoo.co.jp/qa/question_detail/q12324672202,ミゼルエディのシェーディングってもう再販や製造しないのでしょうか？,0,0
29,2026/1/25 19:44,料理、食材,名無し,5時間1分,5,23,4.6,0,0,0.076,21.74,0.0,0.9,あと3日,https://detail.chiebukuro.yahoo.co.jp/qa/question_detail/q11324672201,寒い日に食べる麺類といえばうどんかラーメンならどちらですか？,0,0
30,2026/1/25 19:44,大学受験,匿名,5時間1分,0,14,14.0,0,0,0.046,0.0,0.0,0.05,あと3日,https://detail.chiebukuro.yahoo.co.jp/qa/question_detail/q10324672200,至急です。 神奈川大学の共テ併用で経営学部に出そうと思っているのですが、165/200では厳しいですか？今年から英検が使えるようなので合格最低点が上がりそうで不安です。,0,0
31,2026/1/25 19:44,福祉、介護,xz********,5時間1分,6,55,9.2,0,0,0.182,10.91,0.02,1.17,あと3日,https://detail.chiebukuro.yahoo.co.jp/qa/question_detail/q14324672199,恋愛では男性は若い女性ばかりを狙うものでしょうか？,0,0
32,2026/1/25 19:44,自動車,シグシグ,5時間1分,1,30,30.0,0,1,0.099,3.33,0.03,0.36,あと3日,https://detail.chiebukuro.yahoo.co.jp/qa/question_detail/q13324672198,駐停車車両に異常に腹立つのは私ぐらいなものですか？ 道路は通る場所であって、駐車場でも配送スペースでもありません！！ 私の住んでるアパートには配送車が停められるスペースがあるので、全ての駐停車車両に抗...,0,0
33,2026/1/25 19:44,病院、検査,1253034920,5時間1分,0,1,1.0,0,0,0.003,0.0,0.0,0.0,あと3日,https://detail.chiebukuro.yahoo.co.jp/qa/question_detail/q11324672196,"ROM関節可動域をはかる際、ゴニオメーター(角度計)のどの数字を読めばいいのか分からなくなってしまいます。 効率良くスムーズに測らなくてはならなかったり、焦りからか0～180,0～(90)～0,180...",0,0
34,2026/1/25 19:44,賃貸物件,smi********,5時間1分,2,22,11.0,0,0,0.073,9.09,0.01,0.4,あと3日,https://detail.chiebukuro.yahoo.co.jp/qa/question_detail/q10324672195,今年が契約更新の年になります。 更新を期に5月から家賃が1万円値上げすると、同意書が届きました。回答期限が2週間くらいしかありません。 ↳ これを気に、退去しようかと考えています。 8年近く住んでるの...,0,0
35,2026/1/25 19:44,運転免許,af6a4daa8,5時間1分,3,32,10.7,0,2,0.106,9.38,0.01,0.8,あと3日,https://detail.chiebukuro.yahoo.co.jp/qa/question_detail/q12324672192,原付免許に前回落ちて、もう一度行くのですが、前回の結果通知書に貼り付けてある住民票が手元にあるのですがこれでいいのでしょうか、それとももう一度取る必要がありますか？,0,0
36,2026/1/25 19:44,政治、社会問題,c24dea412,5時間1分,0,8,8.0,0,0,0.027,0.0,0.0,0.03,あと3日,https://detail.chiebukuro.yahoo.co.jp/qa/question_detail/q13324672193,大学受験真っ只中の高校生です。 駐日デンマーク大使館の大学入学システム(日本とデンマークの比較)に関する投稿が物議をかもしてますが、上から目線だ！差別だ！と批判浴びてるのが理解できないです。どこにも差...,0,0
37,2026/1/25 19:44,英語,1052799544,5時間1分,1,8,8.0,0,0,0.026,12.5,0.0,0.19,あと3日,https://detail.chiebukuro.yahoo.co.jp/qa/question_detail/q14324672194,You might as well go on and submit. とある曲の歌詞で、公式だと「これは親切から言ってんだ」という意味なのですが、直訳するとどういった意味になりますか？ また、使われ...,0,0
38,2026/1/25 19:44,爬虫類、両生類,17884365142,5時間1分,1,63,63.0,0,3,0.209,1.59,0.13,0.67,不明,https://detail.chiebukuro.yahoo.co.jp/qa/question_detail/q11324672191,爬虫類のニシアフが太ってきたので、部屋の中を歩かせようか迷っています。（ネットで調べるとその方法が載っていたため） １歳の女の子です。まだ、お迎えして５か月目です。 部屋の中を歩かせるとストレスになら...,0,0
39,2026/1/25 19:44,税金,ぽこ,5時間2分,3,34,11.3,0,0,0.113,8.82,0.01,0.61,あと3日,https://detail.chiebukuro.yahoo.co.jp/qa/question_detail/q14324672189,個人での確定申告について質問です。 2025.11.15に退職し、 2025.11.16に入社して、 年末調整は自分でと言われました。 やり方が分からず困っています。 ・生命保険などのハガキ ・前職の...,0,0
40,2026/1/25 19:44,ゲーム,柴野友紀,5時間2分,0,3,3.0,0,0,0.01,0.0,0.0,0.01,あと3日,https://detail.chiebukuro.yahoo.co.jp/qa/question_detail/q10324672190,蒼炎の軌跡で、カウンターのスキルは、アシュナードには発生しないそうですが、漆黒の騎士には発生するのですか？アイク以外のキャラがつけていた場合です。,0,0
41,2010/2/1 12:29,日本史,凸,140100時間17分,1,17381,17381.0,2,15,0.002,0.01,0.2,0.0,不明,https://detail.chiebukuro.yahoo.co.jp/qa/question_detail/q1236106972,五十貫って今だとどのくらいの価値がありますか？,0,0
42,2026/1/25 16:50,大相撲,shi********,7時間56分,5,8704,1740.8,0,16,18.276,0.06,304.6,19.77,あと3日,https://detail.chiebukuro.yahoo.co.jp/qa/question_detail/q14324665909,2026年春場所の番付予想です。ご意見ください。 【幕内→十両】 ・羽出山(西17、2勝) ・友風(西13、4勝) ・千秋楽の取組結果から竜電(東15、6勝)が陥落 【十両→幕内】 ・藤青雲(西1、1...,0,0
43,2026/1/23 17:02,大学受験,1251976145,55時間44分,25,12190,487.6,2,90,3.645,0.21,17.36,4.88,あと1日,https://detail.chiebukuro.yahoo.co.jp/qa/question_detail/q14324490864,至急おねがいします。 もうしんどいです。第一志望の私立大学の受験1日目までもう2週間を切りました。なのに、昨日やった過去問の英語が全く読めませんでした。 今まで過去問を解いていて、こんなに読めないのは...,0,0
44,2026/1/24 3:46,バラエティ、お笑い,1051917307,45時間0分,17,58285,3428.5,17,181,21.583,0.03,719.43,24.53,あと2日,https://detail.chiebukuro.yahoo.co.jp/qa/question_detail/q12324612562,探偵ナイトスクープのヤングケアラーの回の両親のインスタが知りたいです。わかる方教えてください。,0,0
45,2026/1/25 14:20,X（旧Twitter）,a3c77b384,10時間26分,4,5913,1478.2,0,7,9.436,0.07,134.8,10.07,あと3日,https://detail.chiebukuro.yahoo.co.jp/qa/question_detail/q13324661243,Twitterで伊藤篤志のLINEのスクショが上がってきたのですが具体的に何があったのですか？ LINEを流出させたのは彼女かセフと書いていたのですが男の友達じゃないのですか？,0,0
46,2026/1/25 17:09,資格,waz********,7時間37分,19,8976,472.4,8,105,19.611,0.21,93.39,30.25,あと3日,https://detail.chiebukuro.yahoo.co.jp/qa/question_detail/q14324666599,介護福祉士試験 自己採点をして午前中35点しかなかったです 午後も取れてる気がしません 確実に落ちますか？,0,0
47,2026/1/21 12:21,大学受験,Radiguet（ラディゲ）,108時間25分,52,38379,738.1,9,433,5.899,0.14,42.14,8.43,不明,https://detail.chiebukuro.yahoo.co.jp/qa/question_detail/q11324518811,共通テスト自己採点、E判定。どうしても諦められない大学があるのですが、特攻は無謀ですか？ 【本文】 中学生の頃からずっと憧れていた旧帝大があります。そのために3年間、遊びも部活も制限して勉強してきまし...,0,0
48,2026/1/23 22:17,大学受験,b95ca50b,50時間30分,3,6291,2097.0,1,6,2.076,0.05,41.52,2.22,あと1日,https://detail.chiebukuro.yahoo.co.jp/qa/question_detail/q12324605372,東京科学大学志望の高校三年生です。共通テストが自己採点737点だったのですが、東京科学大学の工学部の足切りは超えられそうですか？,0,0
49,2026/1/20 20:57,大相撲,一富士、二鷹、三茄子,123時間50分,8,5059,632.4,2,50,0.681,0.16,4.26,0.96,不明,https://detail.chiebukuro.yahoo.co.jp/qa/question_detail/q14324500814,安青錦が初場所を優勝しても１回では横綱は無理ですか？,0,0
50,2026/1/21 0:07,大学受験,b2f227caf,120時間40分,6,4115,685.8,1,25,0.568,0.15,3.79,0.73,不明,https://detail.chiebukuro.yahoo.co.jp/qa/question_detail/q13324508053,長文です。助けてください。 私は来年度高3の高2です。今まで建築士になりたかったので理系に進んだのですが、いまさら美大に行きたくなりました。理系だと難しいですか？しかも数学3を取ってしまいました。後悔...,0,0
51,2026/1/25 19:44,賃貸物件,(^^),5時間3分,0,3,3.0,0,0,0.01,0.0,0.0,0.01,あと3日,https://detail.chiebukuro.yahoo.co.jp/qa/question_detail/q12324672187,droomの事前審査通過後は、どのような審査があるのでしょうか？ 事前審査を通過していれば、基本的には次の審査？も通過するものですか？,0,0
52,2026/1/25 19:44,日本語,深紅の漆黒オフホワイト,5時間3分,4,42,10.5,0,0,0.138,9.52,0.01,0.79,あと3日,https://detail.chiebukuro.yahoo.co.jp/qa/question_detail/q11324672186,中道改革連合を「中革連」と 呼ぶ人にとっては、 「中道・改革・連合」ではなく 「中道改・革・連合」なのですか？,0,0
53,2026/1/25 19:44,テーマパーク,cfcf378c9,5時間3分,5,40,8.0,0,0,0.132,12.5,0.01,0.95,あと3日,https://detail.chiebukuro.yahoo.co.jp/qa/question_detail/q10324672185,ディズニーランドにATMはありますか？ ゆうちょです！！！,0,0
54,2026/1/25 19:44,Yahoo!知恵袋,自由研究(・∀・),5時間3分,1,51,51.0,4,0,0.168,1.96,0.09,1.64,あと3日,https://detail.chiebukuro.yahoo.co.jp/qa/question_detail/q14324672184,(・∀・) . 多くのアカウントで多くのキャラを同時運用しているお方は、１つ２つが使えなくなっても簡単に使い捨てて、新しく補充するだけなんですか？,0,0
55,2026/1/25 19:44,政治、社会問題,非公開,5時間3分,3,31,10.3,0,1,0.102,9.68,0.01,0.69,あと3日,https://detail.chiebukuro.yahoo.co.jp/qa/question_detail/q13324672183,今度の政権ではやっと外国人生活保護に見直しが行われるようですが、 どの辺まで見直し行われると思いますか？,0,0
56,2026/1/25 19:44,芸能人,非公開,5時間3分,3,21,7.0,0,2,0.069,14.29,0.0,0.76,あと3日,https://detail.chiebukuro.yahoo.co.jp/qa/question_detail/q12324672182,指原莉乃、超苦手。そういう人は大多数ですか？,0,0
57,2026/1/25 19:44,学校の悩み,ももた,5時間3分,1,47,47.0,0,1,0.155,2.13,0.07,0.42,不明,https://detail.chiebukuro.yahoo.co.jp/qa/question_detail/q10324672180,看護学生の2年生です。 いくつか質問があります。 ①明日から基礎Ⅱの実習が始まるのですが、持病が悪化して休学→出席日数が足りず留年していたこともあり、久々の実習で緊張と焦りが凄いです。ケアを行う際は教...,0,0
58,2026/1/25 19:44,恋愛相談、人間関係の悩み,phe********,5時間3分,5,85,17.0,0,0,0.28,5.88,0.05,1.1,あと3日,https://detail.chiebukuro.yahoo.co.jp/qa/question_detail/q14324672179,気になっていた店員さんに連絡先のメモを渡したところ、連絡をくれました。 ただ、上辺だけの会話のようで、私からもご飯など誘えていません。 共通の趣味があるのでその話ができたら、とメモに書いて渡したのでそ...,0,0
59,2026/1/25 19:44,家族関係の悩み,ちゃみ,5時間3分,2,14,7.0,0,0,0.046,14.29,0.0,0.37,あと3日,https://detail.chiebukuro.yahoo.co.jp/qa/question_detail/q13324672178,子持ち専業主婦でアニオタのお母様いますか？ 今子供が1歳になったので自分も働き始めてお金に少し余裕が出来ました。 月4-6万ぐらいは余るのですが、毎回2万程アニメのグッズに使ってしまい流石にやばいなと...,0,0
60,2026/1/25 19:44,絵画,nei,5時間3分,0,28,28.0,0,0,0.092,0.0,0.0,0.09,あと3日,https://detail.chiebukuro.yahoo.co.jp/qa/question_detail/q12324672177,陸・海 も作った方がいいですか？,0,0
61,2026/1/25 19:44,大学受験,af0aa048c,5時間3分,0,15,15.0,0,0,0.049,0.0,0.0,0.05,あと3日,https://detail.chiebukuro.yahoo.co.jp/qa/question_detail/q11324672176,至急質問です。滋賀県立大学の国際コミュニケーション学科について質問です。 共テが57%しか取れていないのですが、滋賀県立大学の2次試験で7.5割ほどとれば受かるでしょうか。また、7.5割とることは可能...,0,0
62,2026/1/25 19:44,宝塚,tam********,5時間4分,0,124,124.0,0,0,0.408,0.0,0.0,0.41,あと3日,https://detail.chiebukuro.yahoo.co.jp/qa/question_detail/q10324672175,宝塚歌劇団の組の違いについてお伺いしたいです。 今の雪組公演で宝塚にハマり今後は他の組も観劇していきたいと思っています。 そこで今現在の組ごとの特徴を知りたいです。 私は雪組ショーのPrayerが大好...,0,0
63,2026/1/25 19:44,受験、進学,867299,5時間4分,3,28,9.3,0,0,0.092,10.71,0.01,0.58,あと3日,https://detail.chiebukuro.yahoo.co.jp/qa/question_detail/q14324672174,金沢大学の理系一括を二次試験物理で受けようと思っているのですが、最低何割くらい取れれば確実に受かるのでしょうか？,0,0
65,2026/1/25 19:44,大学受験,b386475f5,5時間4分,0,4,4.0,0,0,0.013,0.0,0.0,0.01,あと3日,https://detail.chiebukuro.yahoo.co.jp/qa/question_detail/q12324672172,東京都立大学システムデザイン学部志望です。 二次試験英語の対策は何をすればいいですか？ おすすめの参考書等あれば教えてほしいです,0,0
67,2026/1/25 19:43,英語,1151351271,5時間5分,1,103,103.0,0,0,0.337,0.97,0.35,0.5,不明,https://detail.chiebukuro.yahoo.co.jp/qa/question_detail/q10324672170,英検について 先ほど英検一級を受けました。 自己採点の結果 リーディング20/35、 リスニング16/27 でした ライティングは自信あります、正直この結果可能性ありますか？ チャットgptに聞いたら...,0,0
68,2026/1/25 19:43,病気、症状,hpj********,5時間5分,1,15,15.0,0,0,0.049,6.67,0.01,0.21,あと3日,https://detail.chiebukuro.yahoo.co.jp/qa/question_detail/q14324672169,生理が終わって1週間経つのですが、腹痛が治まりません。 ずっとお腹がゴロゴロしていて、鈍い鈍痛が続いています。 便は出るのですが、コロコロしていて残便感があり、ガスがよく出ます。 仕事中もお腹全体がぼ...,0,0
69,2026/1/25 19:43,病気、症状,1151519358,5時間5分,4,29,7.2,1,5,0.095,13.79,0.01,1.56,あと3日,https://detail.chiebukuro.yahoo.co.jp/qa/question_detail/q13324672168,健康についてです 23の女性です 最高血圧112 最低血圧82 脈拍108 寝てるのにめまいのようにクラクラして 気持ち悪くなりました 数分、動けませんでした これは病院に行くべきでしょうか？,0,0
70,2026/1/25 19:43,恋愛相談,nr_yhgvs,5時間5分,0,12,12.0,0,0,0.039,0.0,0.0,0.04,あと3日,https://detail.chiebukuro.yahoo.co.jp/qa/question_detail/q12324672167,連絡先聞かれる時もっと話したいのでって入れるのと入れないのどっちがいいと思いますか？,0,0
