687,2026/1/25 19:25,大相撲,kaw********,6時間1分,1,31,31.0,1,0,0.086,3.23,0.03,0.5,あと3日,https://detail.chiebukuro.yahoo.co.jp/qa/question_detail/q13324671498,安青錦は将来の横綱候補ですか？,0,0
688,2026/1/25 19:25,iPhone,cha********,6時間1分,0,8,8.0,0,0,0.022,0.0,0.0,0.02,あと3日,https://detail.chiebukuro.yahoo.co.jp/qa/question_detail/q12324671497,スズキの純正7インチディスプレイオーディオの件です。 当方iphoneですので、CarPlayを使いたいのですが 全く反応しません。ケーブルも色々変えたのですが 充電すら出来ません。ナビと連動出来なく...,0,0
689,2026/1/25 19:25,病気、症状,rap********,6時間1分,1,11,11.0,0,0,0.03,9.09,0.0,0.17,あと3日,https://detail.chiebukuro.yahoo.co.jp/qa/question_detail/q14324671494,ストレスを感じにくくすれば大体の精神疾患は治せそうですが、なぜストレスを感じる能力を下げるという根本的な治療が行われないのですか？,0,0
690,2026/1/25 19:25,クレジットカード,hjl********,6時間1分,1,15,15.0,0,0,0.042,6.67,0.01,0.18,あと3日,https://detail.chiebukuro.yahoo.co.jp/qa/question_detail/q10324671495,auPayカードのゴールドカードからシルバーに変更する書類は大体電話してからどのくらいで送られてきますか？,0,0
691,2026/1/25 19:25,バイク,1150163751,6時間1分,7,74,10.6,0,8,0.205,9.46,0.02,1.83,あと3日,https://detail.chiebukuro.yahoo.co.jp/qa/question_detail/q11324671496,400cc〜のバイクには車検がありますが、400ccのバイクを不正改造して事故をした場合、車検時と車体構造が違うので保険は降りないのでしょうか？ 例として ・ネイキッドバイクにフロントカウルをつける ...,0,0
692,2026/1/25 19:25,タブレット端末,a187aac3c,6時間1分,1,16,16.0,0,0,0.044,6.25,0.01,0.18,あと3日,https://detail.chiebukuro.yahoo.co.jp/qa/question_detail/q13324671493,ゲオでiPadを買おうと思っています。契約はせずにiPadを買う際WiFi○、SiM〇と書いていたのですがWiFiとSIMカードってないとアプリ入れたり動画みたりできませんか？ 少し分がおかしくなって...,0,0
693,2026/1/25 19:25,男性アイドル,qcd********,6時間1分,0,12,12.0,0,0,0.033,0.0,0.0,0.03,あと3日,https://detail.chiebukuro.yahoo.co.jp/qa/question_detail/q12324671492,M!LKのkirariについて質問です。 住所登録を行いたいのですが、郵便番号を入れてもエラーが出てしまい、登録できません。何度も確認しましたので間違いはないはずです。,0,0
694,2026/1/25 19:25,動物,bdbe3c1ca,6時間1分,0,4,4.0,0,0,0.011,0.0,0.0,0.01,あと3日,https://detail.chiebukuro.yahoo.co.jp/qa/question_detail/q11324671491,大学卒業後、動物のことについて興味があり専門学校に進学しようと考えています。将来的には動物園で仕事をしたいなと思っているのですが、難しいですか？ また、これを頑張っておいた方がいいみたいなものがあれば...,0,0
695,2026/1/25 19:25,韓国・朝鮮語,あ,6時間1分,1,32,32.0,1,1,0.088,3.12,0.03,0.58,あと3日,https://detail.chiebukuro.yahoo.co.jp/qa/question_detail/q14324671489,韓国人は何であんなに言葉選びが上手いんですか？kpopを見ているとメンバーを褒める時や感謝の言葉をする時も言葉選びが丁寧ですごいなと思います私も言葉選び上手くなりたいです語彙力もないのでお願いします,0,0
696,2026/1/25 19:25,テーマパーク,1250804432,6時間1分,4,25,6.2,0,1,0.069,16.0,0.0,0.7,あと3日,https://detail.chiebukuro.yahoo.co.jp/qa/question_detail/q10324671490,ボンボヤージュに売ってるグッズは、入園なしのディズニーリゾートのオンラインで買えるものと同じでしょうか？,0,0
697,2026/1/25 19:25,タブレット端末,bea********,6時間1分,0,7,7.0,0,0,0.019,0.0,0.0,0.02,あと3日,https://detail.chiebukuro.yahoo.co.jp/qa/question_detail/q13324671488,以下の使用用途でおすすめのタブレット端末探してます。 ・YouTube、Amazonプライムビデオ、ネットフリックスの動画視聴 ・Amazon Kindle ・ゲームアプリ ・Googleスプレッドシ...,0,0
698,2026/1/25 19:25,車検、メンテナンス,tak********,6時間1分,4,14,3.5,0,0,0.039,28.57,0.0,0.59,あと3日,https://detail.chiebukuro.yahoo.co.jp/qa/question_detail/q12324671487,車のラジオcd一体型のヒーズは何処にありますか？,0,0
699,2026/1/25 19:25,大学受験,313系0番台,6時間2分,1,23,23.0,0,0,0.064,4.35,0.01,0.2,あと3日,https://detail.chiebukuro.yahoo.co.jp/qa/question_detail/q11324671486,2025年愛知県一宮興道高校から千葉大学2人合格、名古屋大学5人、大阪大学1人合格しました。 質問 ・愛知県一宮興道高校から千葉大学文学部学校型推薦(共通テストなし)合格する人や名古屋大学文学部学校型...,0,0
700,2026/1/25 19:25,大学受験,a6376672e,6時間2分,1,25,25.0,0,1,0.069,4.0,0.02,0.29,あと3日,https://detail.chiebukuro.yahoo.co.jp/qa/question_detail/q10324671485,助けてください！！！大学受験始まるのに好きな人のこと考えちゃって勉強集中できないです。今日だって十二時間椅子座ってますが、実質3時間くらいしかできてないです。どうすればいいですか？？,0,0
701,2026/1/25 19:25,温泉,1252146605,6時間2分,3,20,6.7,1,2,0.055,15.0,0.0,0.91,あと3日,https://detail.chiebukuro.yahoo.co.jp/qa/question_detail/q13324671483,静岡県の河津、下田付近で美味しいご飯バイキングと温泉がある宿ありますか？70代の母も一緒に行きます。中学生、夫もいます。,0,0
702,2026/1/25 19:25,香水,1150932244,6時間2分,1,16,16.0,1,0,0.044,6.25,0.01,0.46,あと3日,https://detail.chiebukuro.yahoo.co.jp/qa/question_detail/q12324671482,香水に関する質問です。 写真の香水を調べたところ、 ライジングウェーブのクリスチャン リース ラッセン オードトワレ という昔の限定品との情報が出てきました。 匂いが気に入っており同じものが欲しいと思...,0,0
704,2026/1/25 19:25,ライブ、コンサート,srh********,6時間2分,1,46,46.0,0,0,0.127,2.17,0.06,0.26,あと3日,https://detail.chiebukuro.yahoo.co.jp/qa/question_detail/q10324671480,本日Pontaパス会員(初回加入時より30日間無料を使用)先行にてライブチケットのエントリーを行ったんですが、仮に当選→入金したとして、 その後Pontaパス会員費が課金される前に(無料期間中のうちに...,0,0
705,2026/1/25 19:25,健康、病気、病院,非公開,6時間2分,5,20,4.0,0,1,0.055,25.0,0.0,0.83,あと3日,https://detail.chiebukuro.yahoo.co.jp/qa/question_detail/q14324671479,絶対休めない日に体調崩したら行くものですか？,0,0
706,2026/1/25 19:25,恋愛相談、人間関係の悩み,yus********,6時間2分,1,13,13.0,0,0,0.036,7.69,0.0,0.17,あと3日,https://detail.chiebukuro.yahoo.co.jp/qa/question_detail/q12324671477,変な人悪口なりますか？,0,0
707,2026/1/25 19:25,メルカリ,1152820824,6時間2分,2,57,28.5,0,1,0.157,3.51,0.04,0.51,あと3日,https://detail.chiebukuro.yahoo.co.jp/qa/question_detail/q13324671478,メルカリで商品を購入したんですが、発送する前に出品者のアカウントから勝手にキャンセルされていて、お金も帰ってきてました。 そして、違う出品者のほうで新しいものを購入したのですが、キャンセルされた商品が...,0,0
708,2026/1/25 19:25,ヘアケア,なゆ,6時間2分,1,29,29.0,0,0,0.08,3.45,0.02,0.22,不明,https://detail.chiebukuro.yahoo.co.jp/qa/question_detail/q11324671476,触覚が左右非対称になってしまいました…т т 状態は片方が長くて細くなっていて片方が短くて髪の毛の量が多くなっています… 髪の毛がそこそこ長い方なのでしばらないといけません、どうすればいいでしょうか,0,0
709,2026/1/25 19:25,派遣、アルバイト、パート,1051801906,6時間2分,0,11,11.0,0,0,0.03,0.0,0.0,0.03,あと3日,https://detail.chiebukuro.yahoo.co.jp/qa/question_detail/q10324671475,日中は正社員で平日8時間働いているのですがダブルワークでその後に夜働こうと考えてます そこで質問なのですがアルバイトと派遣社員どちらが良いのでしょうか？迷ってます その場合のメリットとデメリットを教え...,0,0
710,2026/1/25 19:25,麻雀,wri********,6時間2分,2,35,17.5,0,0,0.097,5.71,0.02,0.37,不明,https://detail.chiebukuro.yahoo.co.jp/qa/question_detail/q14324671474,三麻って先に北抜きが入ったら、後の人は九種九牌で流せないんですか？,0,0
711,2026/1/25 19:25,恋愛相談,1253112566,6時間2分,1,17,17.0,0,0,0.047,5.88,0.01,0.18,あと3日,https://detail.chiebukuro.yahoo.co.jp/qa/question_detail/q13324671473,167センチで短髪イケメンか180センチセンター分けフツメンどっちがモテる？,0,0
712,2026/1/25 19:25,郵便、宅配,非公開,6時間2分,3,40,13.3,0,0,0.11,7.5,0.01,0.52,あと3日,https://detail.chiebukuro.yahoo.co.jp/qa/question_detail/q12324671472,郵便局でバイトする人が、バイト先で まず言われるのが「書留を着服するな」 というのは本当ですか？,0,0
713,2026/1/25 19:25,福祉、介護,のほほん,6時間2分,2,10,5.0,0,0,0.028,20.0,0.0,0.3,あと3日,https://detail.chiebukuro.yahoo.co.jp/qa/question_detail/q11324671471,今の障害者施設や病院、老人施設の体罰は増えてるのですか？,0,0
714,2026/1/25 19:24,ポケットモンスター,.,6時間3分,1,14,14.0,0,1,0.038,7.14,0.01,0.26,あと3日,https://detail.chiebukuro.yahoo.co.jp/qa/question_detail/q10324671470,ポケカの買い時について ※転売ヤーではありません！！ 趣味で集めているのですが、 ユカリ SR・SAR ピュールSR カナリィSR・SAR タラゴンSR カラスバSR の買い時はそれぞれいつでしょうか...,0,0
715,2026/1/25 19:24,女性アイドル,pfd********,6時間3分,1,19,19.0,1,0,0.052,5.26,0.01,0.46,あと3日,https://detail.chiebukuro.yahoo.co.jp/qa/question_detail/q14324671469,乃木坂の40thアンダードキュメンタリーがテレビで見れなかったので見逃し配信を探しているのですが、見つかりません。どこで見れるか教えてください。,0,0
716,2026/1/25 19:24,男性アイドル,1052498947,6時間4分,1,76,76.0,1,0,0.209,1.32,0.16,0.62,あと3日,https://detail.chiebukuro.yahoo.co.jp/qa/question_detail/q13324671468,ジャニーズのチケット取引に理解ある方のみお願いします。 今回のSixTONESのツアーで真駒内のチケットを積もうと思っているのですが、最近、真駒内の黒服が厳しいとお聞きします。QR毎で買った方が安全だ...,0,0
717,2026/1/25 19:24,iPhone,。,6時間4分,3,12,4.0,0,0,0.033,25.0,0.0,0.44,あと3日,https://detail.chiebukuro.yahoo.co.jp/qa/question_detail/q12324671467,iPhone7を写真用でディズニー等で使ったりしているのですが、70%とか超えて残ってても写真撮ってたら突然真っ暗になってフリーズしたりしてしまいます。 充電器にさしたら割とすぐ元あった充電くらいまで...,0,0
718,2026/1/25 19:24,シニアライフ、シルバーライフ,m1o********,6時間4分,3,20,6.7,0,0,0.055,15.0,0.0,0.47,あと3日,https://detail.chiebukuro.yahoo.co.jp/qa/question_detail/q11324671466,中道改革連合の野田佳彦共同代表は 選挙中は オムライスをたべ チャーハンを食べないと言っていますが あんたは どちらが好きですか？,0,0
719,2026/1/25 19:24,中学受験,rosehiptea,6時間4分,3,44,14.7,0,0,0.121,6.82,0.02,0.53,あと3日,https://detail.chiebukuro.yahoo.co.jp/qa/question_detail/q10324671465,中学受験の算数の答え方です。 入試の解答は、小数点で書くのと、分数で書くのはどちらが正解ですか？,0,0
720,2026/1/25 19:24,妊娠、出産,1151368111,6時間4分,4,52,13.0,0,3,0.143,7.69,0.02,0.94,不明,https://detail.chiebukuro.yahoo.co.jp/qa/question_detail/q14324671464,花音（かのん） 名前、イメージ教えて下さい。,0,0
722,2026/1/25 19:24,建築,kaw********,6時間4分,0,5,5.0,0,0,0.014,0.0,0.0,0.01,あと3日,https://detail.chiebukuro.yahoo.co.jp/qa/question_detail/q12324671462,土木仮設の設計におけるH鋼の重ね梁について質問です。H鋼のフランジ同士を高力ボルトで接合した時に、断面二次モーメントは単純に2倍として計算することが一般的ですか？ 完全に一体化しているなら断面二次モー...,0,0
723,2026/1/25 19:24,大学受験,御茶ノノノノ水,6時間4分,0,13,13.0,0,0,0.036,0.0,0.0,0.04,あと3日,https://detail.chiebukuro.yahoo.co.jp/qa/question_detail/q11324671461,模試についてです。 次の模試を範囲は違うものの難しい順に並べていただけますでしょうか。 ①高1アドバンスト／高1プロシードテスト／高1プライムステージ ②高2アドバンスト／高2プロシードテスト／プライ...,0,0
724,2026/1/25 19:24,文学、古典,tet********,6時間4分,0,10,10.0,0,0,0.027,0.0,0.0,0.03,あと3日,https://detail.chiebukuro.yahoo.co.jp/qa/question_detail/q10324671460,漢文 漢詩 読み下し 中国古典 翻訳 禅語 先日、こちらの知恵袋様で掛軸の草書を読んでいただきましたところ、 「石徑生苔從雨洗」 と教えていただきました。 読み下しとわかりやすい意味を教えていただける...,0,0
725,2026/1/25 19:24,大学受験,ゲスト,6時間4分,4,31,7.8,0,0,0.085,12.9,0.01,0.63,あと3日,https://detail.chiebukuro.yahoo.co.jp/qa/question_detail/q14324671459,高校2年生です。私は情報系の短大、四大に行きたいと考えています。今持ってる資格は、食物、被服検定準1、秘書検定3級、ビジネス文書準2級で、いま情報処理検定準2級簿記3級のために勉強しています。 そして...,0,0
726,2026/1/25 19:24,車検、メンテナンス,plq********,6時間4分,3,35,11.7,0,0,0.096,8.57,0.01,0.51,あと3日,https://detail.chiebukuro.yahoo.co.jp/qa/question_detail/q13324671458,軽のターボ車、基本街乗り休日高速を使っての遠出 あるメーカーのディーラーでは3000キロ毎でオイル交換してくださいとのことで別のメーカーのディーラーでは5000キロ毎くらいで大丈夫ですよーとのこと 皆...,0,0
727,2026/1/25 19:24,海外,kkk.kcon,6時間4分,0,4,4.0,0,0,0.011,0.0,0.0,0.01,あと3日,https://detail.chiebukuro.yahoo.co.jp/qa/question_detail/q12324671457,学生ゲイです。 海外の方(英語圏)と出会いたいのですが、どんなところで出会えばいいでしょうか？,0,0
728,2026/1/25 19:24,大学受験,高校生,6時間4分,0,17,17.0,0,0,0.047,0.0,0.0,0.05,あと3日,https://detail.chiebukuro.yahoo.co.jp/qa/question_detail/q10324671455,東北福祉大学の受験票ってどこから入手できますか？メールも出願はできているんですが来てないしポータルサイトをみてもそれらしきものがないです。,0,0
729,2026/1/25 19:24,高校数学,b6be243e0,6時間4分,1,17,17.0,0,1,0.047,5.88,0.01,0.27,あと3日,https://detail.chiebukuro.yahoo.co.jp/qa/question_detail/q11324671456,ベクトルの問題（3）について 言っていることはわかるのですがいまいち状況がイメージできません 図を教えていただきたいです 高校 数学,0,0
730,2026/1/25 19:24,恋愛相談、人間関係の悩み,b21ef5657,6時間4分,4,25,6.2,0,0,0.069,16.0,0.0,0.62,あと3日,https://detail.chiebukuro.yahoo.co.jp/qa/question_detail/q14324671454,マッチングアプリ、全然興味ない人や外人さんがプロフィール読んで連絡くれたら、返事しますか？,0,0
731,2026/1/25 19:24,水泳,a4f58b119,6時間4分,1,2,2.0,0,0,0.005,50.0,0.0,0.14,あと3日,https://detail.chiebukuro.yahoo.co.jp/qa/question_detail/q13324671453,パジャマの上を着た状態で屋内プールで着衣水泳をやるとしたらどのような流れになりますか,0,0
732,2026/1/25 19:24,ニキビケア,あ,6時間4分,1,40,40.0,0,0,0.11,2.5,0.04,0.25,不明,https://detail.chiebukuro.yahoo.co.jp/qa/question_detail/q12324671452,※画像あります 苦手な方閲覧注意です 両頬にニキビのような白いプツプツした何かが沢山あります。これは一体何なのでしょうか(;_;) また、おすすめのスキンケアの成分や美容医療(レーザーなど)ありました...,0,0
733,2026/1/25 19:24,大相撲,lD非公開,6時間4分,1,22,22.0,0,3,0.06,4.55,0.01,0.44,あと3日,https://detail.chiebukuro.yahoo.co.jp/qa/question_detail/q11324671451,大相撲のインタビュー。 関脇以下が横綱･大関に勝った場合の「殊勲インタビュー」のほかに 「勝ち越しインタビュー」というのがあります。 この勝ち越しインタビューって、どんな場合に行なわれるのですか？,0,0
734,2026/1/25 19:24,K-POP、アジア,1152377487,6時間4分,1,33,33.0,0,0,0.09,3.03,0.03,0.23,不明,https://detail.chiebukuro.yahoo.co.jp/qa/question_detail/q10324671450,トゥメさんに質問兼相談です！ 来月に友達に誘われてTREASUREのライブに行くんですけど、3、4年ずっとSMオタクだったのでYG自体全然無知で分かりません( ; ; )でもMAMAでTREASURE...,0,0
735,2026/1/25 19:24,一人暮らし、シングルライフ,rin********,6時間5分,3,14,4.7,0,0,0.038,21.43,0.0,0.45,あと3日,https://detail.chiebukuro.yahoo.co.jp/qa/question_detail/q14324671449,一人暮らしでの外食は週に何回からだと多く感じますか？,0,0
736,2026/1/25 19:24,耳の病気,chi_,6時間5分,1,10,10.0,0,0,0.027,10.0,0.0,0.16,あと3日,https://detail.chiebukuro.yahoo.co.jp/qa/question_detail/q13324671448,身体障害者手帳で補聴器の助成を受ける場合、両耳の補聴器の申請は難しいですか？,0,0
737,2026/1/25 19:24,絵画,内緒,6時間5分,0,11,11.0,0,0,0.03,0.0,0.0,0.03,あと3日,https://detail.chiebukuro.yahoo.co.jp/qa/question_detail/q12324671447,"アイビスペイントで作った 自作のアニメーション動画を プレゼントしたいです。 デジタルフォトフレームは 10,000円するので もっと手軽なアイテムに入れて プレゼントしたいです。 何かいいアイテムは...",0,0
738,2026/1/25 19:24,高校野球,1053335854,6時間5分,0,9,9.0,0,0,0.025,0.0,0.0,0.02,あと3日,https://detail.chiebukuro.yahoo.co.jp/qa/question_detail/q11324671446,野球の関東の強豪校で1年に実力差で練習をさせてもらえないところってありますか？東海大相模とかはその傾向がありますか？,0,0
740,2026/1/25 19:24,退職,匿名,6時間5分,0,16,16.0,0,0,0.044,0.0,0.0,0.04,あと3日,https://detail.chiebukuro.yahoo.co.jp/qa/question_detail/q14324671444,顔のアトピーが悪化して、現在パートを休んでいます 接客業をしているのですが、今月1日しか出勤できませんでした 治る見込みもなく悪化しています 毎度毎度休む連絡入れるのも限界です 精神的にも外見的にも酷...,0,0
741,2026/1/25 19:24,恋愛相談,1150789525,6時間5分,1,28,28.0,0,3,0.077,3.57,0.02,0.46,あと3日,https://detail.chiebukuro.yahoo.co.jp/qa/question_detail/q13324671443,好きか分からないってなったら二度と好きになることは無いですか？？？,0,0
742,2026/1/25 19:24,マラソン、陸上競技,a357e09d5,6時間5分,1,15,15.0,0,0,0.041,6.67,0.01,0.18,あと3日,https://detail.chiebukuro.yahoo.co.jp/qa/question_detail/q12324671442,1500m４分５秒位で走るのに、最もいいスパイクを教えてください。ちなみに中２です。筋力はそこそこあります。,0,0
743,2026/1/25 19:24,同人誌、コミケ,a32aabec2,6時間5分,1,10,10.0,0,0,0.027,10.0,0.0,0.16,あと3日,https://detail.chiebukuro.yahoo.co.jp/qa/question_detail/q11324671441,香川県で同人誌等を買取できるお店はありますか？？ 引っ越すのですがらしんばん等がなくて、、、 可能であればURL等教えて頂けますと幸いです。,0,0
744,2026/1/25 19:24,ライトノベル,eve,6時間5分,1,18,18.0,0,0,0.049,5.56,0.01,0.19,あと3日,https://detail.chiebukuro.yahoo.co.jp/qa/question_detail/q10324671440,現在応募受付中のラノベ新人賞はありますか？,0,0
745,2026/1/25 19:24,大学受験,b64eb2856,6時間5分,0,18,18.0,0,0,0.049,0.0,0.0,0.05,あと3日,https://detail.chiebukuro.yahoo.co.jp/qa/question_detail/q14324671439,福教大の人文社会教育プログラムを推薦2型で受けて共テの点数が6割3分程でした。 このまま推薦で合格出来ると思いますか。,0,0
746,2026/1/25 19:24,生き方、人生相談,知恵袋の座敷わらし,6時間5分,4,33,8.2,0,12,0.09,12.12,0.01,1.62,あと3日,https://detail.chiebukuro.yahoo.co.jp/qa/question_detail/q13324671438,いつまでも、こだわっていても仕方ない！諦める事も一つの道ですか？,0,0
747,2026/1/25 19:24,スマホアプリ,♪,6時間5分,0,4,4.0,0,0,0.011,0.0,0.0,0.01,あと3日,https://detail.chiebukuro.yahoo.co.jp/qa/question_detail/q12324671437,少し前にインストールしたsora aiというアプリを久しぶりに開いたら、あなたへの特別な動画みたいな感じで動画ができていたんですが、その内容がサンタが入ってきて何かを言うっていう動画だったのですが、 ...,0,0
748,2026/1/25 19:24,ドコモ,cam********,6時間5分,0,8,8.0,0,0,0.022,0.0,0.0,0.02,あと3日,https://detail.chiebukuro.yahoo.co.jp/qa/question_detail/q11324671436,今、ケータイプランがカブアンドのdocomoプランなのですが、ahamoに乗り換えようとしています。 この場合でもiPhone17買うと44000円割引が効くのでしょうか？ docomo系→docom...,0,0
749,2026/1/25 19:24,数学,1253340482,6時間5分,1,22,22.0,0,0,0.06,4.55,0.01,0.2,不明,https://detail.chiebukuro.yahoo.co.jp/qa/question_detail/q10324671435,"この問題の解説と答えをお願いします( . .)""",0,0
750,2026/1/25 19:24,生き方、人生相談,*********,6時間5分,2,7,3.5,0,0,0.019,28.57,0.0,0.29,あと3日,https://detail.chiebukuro.yahoo.co.jp/qa/question_detail/q12324671432,台湾の女性も見た目は可愛いですが、中身は非常に気が強く自立していると聞きます。アメリカなどは言わずもがな「強さ」が魅力です。 しかし、日本だけは外見も内面も「幼さ・控えめさ・可愛さ」がセットで求められ...,0,0
751,2026/1/25 19:24,大学受験,dan********,6時間5分,1,8,8.0,0,0,0.022,12.5,0.0,0.16,あと3日,https://detail.chiebukuro.yahoo.co.jp/qa/question_detail/q13324671433,熊本の壺溪塾の費用について質問です。 国立文系で浪人の場合、一年間どれくらいかかるか知りたいです。 どうぞ宜しくお願いします。,0,0
752,2026/1/25 19:23,大学受験,1252893893,6時間7分,0,22,22.0,0,0,0.06,0.0,0.0,0.06,あと3日,https://detail.chiebukuro.yahoo.co.jp/qa/question_detail/q14324671429,共通テスト利用で私立大学に出願しようと思っているのですが、定員が少なく受かるか不安です。リサーチではA判定でも不合格になることはあるのでしょうか？共通テストのみで2次試験はありません。,0,0
753,2026/1/25 19:23,宗教,両刃の剣,6時間7分,1,33,33.0,0,0,0.09,3.03,0.03,0.23,あと3日,https://detail.chiebukuro.yahoo.co.jp/qa/question_detail/q13324671428,聖書から､キリスト・イエスの再臨についての質問です。 マタイ２４章３７節～３９節に「人の子が来るのは､ちょうど､ノアの日のようだからです。 洪水前の日々は､ノアが箱舟に入るその日まで､人々は､飲んだり...,0,0
754,2026/1/25 19:23,ゲーム,1150520759,6時間7分,1,6,6.0,0,0,0.016,16.67,0.0,0.15,あと3日,https://detail.chiebukuro.yahoo.co.jp/qa/question_detail/q12324671427,イーフトで僕がドリブルする時だけとんでもなくラグくなるのですが、どうやったらそんな技ができるのですか？結構効果的なので僕も習得したいです！,0,0
755,2026/1/25 19:23,家族関係の悩み,cmy********,6時間7分,1,16,16.0,0,0,0.044,6.25,0.01,0.18,あと3日,https://detail.chiebukuro.yahoo.co.jp/qa/question_detail/q11324671426,未だにいる。子供を目の届く範囲で管理してない親。 店の中を自由に走り回せて、買いもしない商品を触り、大声、泣きっぱなし。 これを放置してる親はどうなってるんですか？ 駐車場やガソスタでもわざわざ下ろし...,0,0
756,2026/1/25 19:23,カラオケ,ba4d13e67,6時間7分,3,17,5.7,0,2,0.046,17.65,0.0,0.62,あと3日,https://detail.chiebukuro.yahoo.co.jp/qa/question_detail/q14324671424,カラオケまねきねこを中学生一人で利用する時って2時間までですか？室料無料の学割を利用するときです,0,0
