1423,2026/1/25 19:03,賃貸物件,匿名,7時間8分,0,14,14.0,0,0,0.033,0.0,0.0,0.03,あと3日,https://detail.chiebukuro.yahoo.co.jp/qa/question_detail/q11324670676,退去まであと十日なのですが、入居契約を進めているところが大丈夫か？という不安でいっぱいです。 これから十日で別の入居可能な部屋って探せるものでしょうか？ また入居資金はもう振込みましたが、契約解除って...,0,0
1424,2026/1/25 19:03,ライブ、コンサート,a4db18223,7時間8分,0,15,15.0,1,0,0.035,0.0,0.0,0.27,あと3日,https://detail.chiebukuro.yahoo.co.jp/qa/question_detail/q10324670675,先日CDTVのライブに当選したのですが、昨日iPhoneの機種変更をしてしまい申し込み時に入力した電話番号と現在使用している端末の電話番号が変わってしまいました。 この場合チケットは無効となるのでしょ...,0,0
1425,2026/1/25 19:03,恋愛相談、人間関係の悩み,b484c07a1,7時間8分,2,33,16.5,0,2,0.077,6.06,0.01,0.45,あと3日,https://detail.chiebukuro.yahoo.co.jp/qa/question_detail/q14324670674,いい感じだったのに急に冷たくする男性心理を教えてください。 私の好きな人は、バイトが一緒で4つ上の大学生です。(春から2人とも社会人) アプローチをし始めたのは私からで、既に2回プライベートでご飯に行...,0,0
1426,2026/1/25 19:03,受験、進学,匿名,7時間8分,1,24,24.0,0,0,0.056,4.17,0.01,0.17,あと3日,https://detail.chiebukuro.yahoo.co.jp/qa/question_detail/q12324670672,指定校推薦で大学に合格しました。 入学手続きは期限以内に完了したのですが、共通テストの点数の提出期限を過ぎてしまいました。厳守と書いていました。遅れて提出したのですが、大学に電話などをしておいた方がい...,0,0
1427,2026/1/25 19:03,政治、社会問題,c498fb7f3,7時間8分,0,14,14.0,0,0,0.033,0.0,0.0,0.03,あと3日,https://detail.chiebukuro.yahoo.co.jp/qa/question_detail/q11324670671,台湾有事は起こりますか？,0,0
1428,2026/1/25 19:03,ポケットモンスター,ac1538641,7時間8分,1,10,10.0,0,0,0.023,10.0,0.0,0.14,あと3日,https://detail.chiebukuro.yahoo.co.jp/qa/question_detail/q10324670670,ポケポケのゲットチャレンジで、メガフシギバナの虹枠をゲットした いつの間にか英語から日本語にかわっていた。 何でかわかる？,0,0
1429,2026/1/25 19:03,生理,naaa,7時間8分,1,12,12.0,0,0,0.028,8.33,0.0,0.14,あと3日,https://detail.chiebukuro.yahoo.co.jp/qa/question_detail/q14324670669,20女です。 一般的に見てどうかはわかりませんが、生理が重い方だと思うのでピルを飲むのを考えています。 最近は生理前、生理中だけでなく、排卵日付近も頭痛がしたり眠気がひどかったりです。 生理中に関して...,0,0
1430,2026/1/25 19:03,政治、社会問題,c6ad9d8f,7時間8分,0,3,3.0,0,0,0.007,0.0,0.0,0.01,あと3日,https://detail.chiebukuro.yahoo.co.jp/qa/question_detail/q13324670668,電気工事か空調工事 将来性、収入が悪くないのはどちらですか？,0,0
1431,2026/1/25 19:02,職場の悩み,1053164389,7時間9分,2,26,13.0,0,0,0.061,7.69,0.01,0.29,あと3日,https://detail.chiebukuro.yahoo.co.jp/qa/question_detail/q14324670664,パワハラする人に質問です 自分が鬱にした人間のことをプライベートの時間に考えたりしますか？ 職場に意味不明にキレる人がいます 被害妄想的な感じでキレます キレると止められません 「さっきのどういう意味...,0,0
1432,2026/1/25 19:02,メイク、コスメ,hik********,7時間9分,0,1,1.0,0,0,0.002,0.0,0.0,0.0,あと3日,https://detail.chiebukuro.yahoo.co.jp/qa/question_detail/q11324670666,ブルベの方、化粧品詳しい方 VISSE PK854に似ているティントリップまたはプランパーを教えて下さい。 854好きなのですが、乾燥する…,0,0
1433,2026/1/25 19:02,菓子、スイーツ,カイセンモン,7時間9分,4,13,3.2,0,4,0.03,30.77,0.0,0.77,あと3日,https://detail.chiebukuro.yahoo.co.jp/qa/question_detail/q10324670665,チョコパイとマンハッタンならどちらが好きですか?,0,0
1434,2026/1/25 19:02,K-POP、アジア,c3a0567ba,7時間9分,0,19,19.0,0,0,0.044,0.0,0.0,0.04,あと3日,https://detail.chiebukuro.yahoo.co.jp/qa/question_detail/q14324565109,NCTWISHのグッズ買いたいんですけど、どこで皆さん買ってますか？？,0,0
1435,2026/1/25 19:02,病気、症状,ema********,7時間9分,0,4,4.0,0,0,0.009,0.0,0.0,0.01,あと3日,https://detail.chiebukuro.yahoo.co.jp/qa/question_detail/q14324565174,肩甲骨の痛みって長引きますか？首動かすと痛くて泣,0,0
1436,2026/1/25 19:02,レディース全般,非公開,7時間10分,0,18,18.0,0,0,0.042,0.0,0.0,0.04,あと3日,https://detail.chiebukuro.yahoo.co.jp/qa/question_detail/q14324565134,この服に合う靴はどんな靴だとおもいますか、！ できればSHEINで買える靴がいいです 画像の子はTikTokの橋本ちゃんです！,0,0
1437,2026/1/25 19:02,大学受験,bdb3b6189,7時間10分,1,17,17.0,0,0,0.04,5.88,0.01,0.16,あと3日,https://detail.chiebukuro.yahoo.co.jp/qa/question_detail/q14324565214,高一です。塾に通っていないのですが、河合塾模試やその他の外部模試で高得点を狙うにはどのような勉強や対策をしたらいいか分からないです。毎回、いい結果が望めなくて困っています。教えていただけると幸いです。,0,0
1438,2026/1/25 19:02,ネットバンキング,1049950111,7時間10分,0,23,23.0,0,0,0.053,0.0,0.0,0.05,あと3日,https://detail.chiebukuro.yahoo.co.jp/qa/question_detail/q14324564919,スマホのアプリに入れている銀行のログインについてです。ちなみに私は楽天銀行なんですが、自動でログインパスワードが入るようにしてあって、何時間か前までは自動のログインパスワードでログインができました。 ...,0,0
1439,2026/1/25 19:02,テーマパーク,非公開,7時間10分,0,8,8.0,0,0,0.019,0.0,0.0,0.02,あと3日,https://detail.chiebukuro.yahoo.co.jp/qa/question_detail/q14324564974,ディズニーのヲタバってこう作ったら可愛いよ〜とかおすすめありますか?,0,0
1440,2026/1/25 19:02,英語,ー,7時間10分,0,21,21.0,0,0,0.049,0.0,0.0,0.05,あと3日,https://detail.chiebukuro.yahoo.co.jp/qa/question_detail/q14324564814,英語できる方ー！この文おかしくないですか？ テストで50語以上で書かなくちゃいけないのが出るらしくてめっちゃ簡単で覚えやすい文ちゃっぴーに考えてもらいました！w 英語苦手…,0,0
1441,2026/1/25 19:02,スマホアプリ,Smile!,7時間10分,1,9,9.0,0,0,0.021,11.11,0.0,0.14,あと3日,https://detail.chiebukuro.yahoo.co.jp/qa/question_detail/q14324564984,ロブロックスについてです。 よくTikTokとかのロブロ配信で「フォローしたら参加できるよ」みたいに言ってる人がいて、それってプロフから参加するとき、その参加された人にはフレンドじゃなくても来たときに...,0,0
1442,2026/1/25 19:02,アニメ、コミック,非公開,7時間10分,0,10,10.0,0,0,0.023,0.0,0.0,0.02,あと3日,https://detail.chiebukuro.yahoo.co.jp/qa/question_detail/q14324564769,「聲の形」の小学生編で川井が石田に「植野と川井も俺と同じように」と言われて泣き出した後はどうなったかは描かれていませんが、 校長先生は恐らく「まあまあ」とその場をなだめたと思いますが、 さらにその後は...,0,0
1443,2026/1/25 19:02,恋愛相談、人間関係の悩み,wbp********,7時間10分,0,98,98.0,0,0,0.228,0.0,0.0,0.23,あと3日,https://detail.chiebukuro.yahoo.co.jp/qa/question_detail/q14324564819,最近広告で見かけたメンズリフトに興味あるのですが料金が書いておらず…無料相談があると書いてあったのですが料金分かる方いますか？？？？ メンズリフト使ってる方お願いします,0,0
1444,2026/1/25 19:02,大学受験,非公開,7時間10分,0,58,58.0,0,0,0.135,0.0,0.0,0.13,あと3日,https://detail.chiebukuro.yahoo.co.jp/qa/question_detail/q14324564609,河合塾の「共テリサーチ」と「バンザイシステム」の判定ごとの基準の点数って一緒ですか？ 例えば、ある大学の共テリサーチのA判定が450点以上、B判定が430点以上だとしたら、バンザイシステムでもA判定は...,0,0
1445,2026/1/25 19:02,病気、症状,b41978e62,7時間10分,0,7,7.0,0,0,0.016,0.0,0.0,0.02,あと3日,https://detail.chiebukuro.yahoo.co.jp/qa/question_detail/q14324564764,左肩が痛いです。鏡を見ると腫れてました。 触るとぷにぷにしてます。 これは何ですか？放置してはいけない系でしょうか？,0,0
1446,2026/1/25 19:02,掃除機、洗濯機,smi********,7時間10分,1,17,17.0,0,0,0.039,5.88,0.01,0.16,あと3日,https://detail.chiebukuro.yahoo.co.jp/qa/question_detail/q13324670663,ダイソンのコードレス掃除機を使っています。最近吸込みが悪く先端のブラシも回っていませんでした。先端ブラシを今日分解してみると、糸や毛髪、紐などが絡んでいて全部取り除きました。 先端ブラシを本体にセット...,0,0
1447,2026/1/25 19:02,大学受験,b2729d83f,7時間10分,0,78,78.0,0,0,0.181,0.0,0.0,0.18,あと3日,https://detail.chiebukuro.yahoo.co.jp/qa/question_detail/q14324564604,2次試験が小論文のみの場合、逆転はできないと言われることがありますが、配点が300点ある場合は逆転は可能でしょうか？また、合格最低点などの指標は参考にしてよいのでしょうか？,0,0
1448,2026/1/25 19:02,レディース全般,c3e59af1f,7時間10分,1,18,18.0,0,0,0.042,5.56,0.01,0.16,あと3日,https://detail.chiebukuro.yahoo.co.jp/qa/question_detail/q14324564714,173センチ60キロがヌプシのレディースsサイズきれますか？,0,0
1449,2026/1/25 19:02,飲食店,1053000778,7時間10分,1,5,5.0,0,0,0.012,20.0,0.0,0.13,あと3日,https://detail.chiebukuro.yahoo.co.jp/qa/question_detail/q12324670662,どこかの飲食店街にサンマルコとインディアンカレーが並んで合ったら だいたいの人はサンマルコに入りますよね,0,0
1450,2026/1/25 19:02,ゲーム,abd5dac4d,7時間10分,0,2,2.0,0,0,0.005,0.0,0.0,0.0,あと3日,https://detail.chiebukuro.yahoo.co.jp/qa/question_detail/q14324564559,Switchライトでエペをやりたいんですけど、プロコンの接続が毎回始まったらプロコンが切れて操作ができないです、なぜこうなるのか教えてほしいです,0,0
1451,2026/1/25 19:02,大学受験,ありがとうと伝えたい,7時間10分,0,42,42.0,4,0,0.097,0.0,0.0,1.02,あと3日,https://detail.chiebukuro.yahoo.co.jp/qa/question_detail/q14324564374,東京都立大学の英語の対策を教えてください,0,0
1452,2026/1/25 19:02,デンタルケア,1051588468,7時間10分,1,13,13.0,0,0,0.03,7.69,0.0,0.15,あと3日,https://detail.chiebukuro.yahoo.co.jp/qa/question_detail/q14324564369,歯茎を押すと痛みがあります。なんでしょうか？詳しい方教えて下さい。,0,0
1453,2026/1/25 19:02,大学受験,1010,7時間11分,0,25,25.0,0,0,0.058,0.0,0.0,0.06,あと3日,https://detail.chiebukuro.yahoo.co.jp/qa/question_detail/q14324564474,共テの判定が第一志望、第二志望共にＣでした 11月の実戦模試では第一志望がB、第二志望がAでした 皆さんだったらどちらを受けるのか参考にさせていただきたいです 回答お願いします,0,0
1454,2026/1/25 19:02,アニメ,A.P.R,7時間11分,0,20,20.0,0,0,0.046,0.0,0.0,0.05,あと3日,https://detail.chiebukuro.yahoo.co.jp/qa/question_detail/q14324564379,モコキさんに聞きたいです！もこうさんが2025春アニメと2025夏アニメ、日々は過ぎれど飯うましを査定したアーカイブをそれぞれ教えてください！このチャンネルで教えてくれると嬉しいです！ できればURL...,0,0
1455,2026/1/25 19:02,健康、病気、病院,1152542442,7時間11分,0,3,3.0,0,0,0.007,0.0,0.0,0.01,あと3日,https://detail.chiebukuro.yahoo.co.jp/qa/question_detail/q14324564539,冬の寒いときによく皮膚から生乾きみたいなにおいがするのですが何ですか？,0,0
1456,2026/1/25 19:02,プレイステーション4,kin********,7時間11分,0,4,4.0,0,0,0.009,0.0,0.0,0.01,あと3日,https://detail.chiebukuro.yahoo.co.jp/qa/question_detail/q14324564364,ps5 スパイダーマン2について 写真の場所、マップ上でアベンジャーズビルのちょい左下のテニスコート2つある所の建物の2階から普通に中に入れるようになっています。 これは自分だけでしょうか？ ちなみに...,0,0
1457,2026/1/25 19:02,アニメ,se3********,7時間11分,0,1,1.0,0,0,0.002,0.0,0.0,0.0,あと3日,https://detail.chiebukuro.yahoo.co.jp/qa/question_detail/q14324564544,閃乱カグラについて 好きなキャラは誰ですか？,0,0
1458,2026/1/25 19:02,職場の悩み,非公開,7時間11分,0,21,21.0,0,0,0.049,0.0,0.0,0.05,あと3日,https://detail.chiebukuro.yahoo.co.jp/qa/question_detail/q14324564254,キャバで働いている、もしくは働いてた人に質問です。 ・お客さんを好きになったことはありますか？ ・お父さんと仲は良かったですか？ 好きになったことない人もこの2点を合わせて教えてください。 差し支えな...,0,0
1459,2026/1/25 19:02,芸術、文学、哲学,未設定,7時間11分,0,8,8.0,0,0,0.019,0.0,0.0,0.02,あと3日,https://detail.chiebukuro.yahoo.co.jp/qa/question_detail/q14324563989,本来勉強に向けられているはずの私の知識欲は、情報の塊みたいなスマホに吸収されちゃってるってことですか！？,0,0
1460,2026/1/25 19:02,大学受験,a5a203f70,7時間11分,0,23,23.0,0,0,0.053,0.0,0.0,0.05,あと3日,https://detail.chiebukuro.yahoo.co.jp/qa/question_detail/q14324564084,駿台のデータネットについてです。 同サイトで公開されている前年度の合格者数が実際よりも少ないのは、把握しきれていないからでしょうか。 また、私立の合格・不合格を見ていると受かってる人より高い点数の人が...,0,0
1461,2026/1/25 19:02,この仕事教えて,b47fec431,7時間11分,0,1,1.0,0,0,0.002,0.0,0.0,0.0,あと3日,https://detail.chiebukuro.yahoo.co.jp/qa/question_detail/q14324564184,ビサーチという美容モニターした事ありますか？実際に稼げますか？？立替なしで収入を獲得する場合、いくらの案件がありますか？ アンケートでちまちまちまちま、1円ずつ貯まっていくようなものですか？？ 副業と...,0,0
1462,2026/1/25 19:02,大学受験,1251689453,7時間11分,0,18,18.0,0,0,0.042,0.0,0.0,0.04,あと3日,https://detail.chiebukuro.yahoo.co.jp/qa/question_detail/q14324564139,國學院大学 経済 数学について質問です 2月2日の数学②を解いたのですが３割程度でした。大門2は全く歯が立たなかったです。この年は難しい年なのでしょうか？合格者は何割程度取れているのでしょうか？,0,0
1463,2026/1/25 19:02,病気、症状,fuj********,7時間11分,0,23,23.0,1,0,0.053,0.0,0.0,0.28,あと3日,https://detail.chiebukuro.yahoo.co.jp/qa/question_detail/q14324564154,生まれつきのキアリ奇形で、お子さんを産んだ方へお聞きします。 わたしは20代です。先日キアリ奇形と診断され経過観察と言われました。 脳の疾患ですので、遺伝で、将来産む子供が脳の障害(発達障害等)を持っ...,0,0
1464,2026/1/25 19:02,大学受験,1253350535,7時間11分,1,17,17.0,0,0,0.039,5.88,0.01,0.15,あと3日,https://detail.chiebukuro.yahoo.co.jp/qa/question_detail/q11324670661,大学受験の古典で、覚えた方がいい助動詞の識別って何だと思いますか？ ぬ、ね、る、れ、なむなどは、識別しないと文の意味が変わってきてしまうので必要だと思いますが、他にも識別のがたくさんあって、全部覚える...,0,0
1465,2026/1/25 19:02,周辺機器,aae3659df,7時間11分,0,15,15.0,0,0,0.035,0.0,0.0,0.03,あと3日,https://detail.chiebukuro.yahoo.co.jp/qa/question_detail/q14324563804,logicool g pro x2についてです。 当方windows11で、付属の取り付け型マイクを付けているのですがマイクが入りません。 最初は無線でやっていたのですが2.4ghzが混みあうらしく、...,0,0
1466,2026/1/25 19:02,就職活動,c50bbaa42,7時間11分,0,16,16.0,0,0,0.037,0.0,0.0,0.04,あと3日,https://detail.chiebukuro.yahoo.co.jp/qa/question_detail/q14324563674,日ナレジュニアクラス(ジュニアコース)の入所審査へ送る履歴書？的なものがあるんですけど、志望動機はどのように書くのがベストですか？ シンプル？それとも面白系？何系か教えてください……笑 あと例的なので...,0,0
1467,2026/1/25 19:02,iPhone,名前が思いつかない,7時間11分,0,6,6.0,0,0,0.014,0.0,0.0,0.01,あと3日,https://detail.chiebukuro.yahoo.co.jp/qa/question_detail/q14324563839,iOSのリマインダーアプリには「明日」というリストがありますがそこに追加したタスクは日が変われば別リストに移動するのですか？「今日」リストでも同じですか？,0,0
1468,2026/1/25 19:02,K-POP、アジア,ＩＤ非公開,7時間11分,0,18,18.0,0,0,0.042,0.0,0.0,0.04,あと3日,https://detail.chiebukuro.yahoo.co.jp/qa/question_detail/q14324563814,日本人でSpotify有料登録してる人ってそんないますか？周りの人などどうですか？ 世界のランキングに反映されるっぽいけど日本人はそんなに有料登録してないから日本人ファンが多い韓国アイドルとかあまり上...,0,0
1469,2026/1/25 19:02,大学受験,bffe34444,7時間11分,0,104,104.0,0,0,0.241,0.0,0.0,0.24,あと3日,https://detail.chiebukuro.yahoo.co.jp/qa/question_detail/q14324563829,今年の共通テストを現役で受けました。佐賀大学の経済学部経済法学科を志望してるのですが、結果はとても悪く、河合塾、東進、ベネッセ、バンザイシステムすべての判定はE判定で、2次評価はD判定でした。 絶望で...,0,0
1470,2026/1/25 19:02,日用品、生活雑貨,James1950s,7時間11分,0,2,2.0,0,0,0.005,0.0,0.0,0.0,あと3日,https://detail.chiebukuro.yahoo.co.jp/qa/question_detail/q14324563879,カイ・ボイスン モンキー 北欧 雑貨 木製 についてどう思いますか?,0,0
1471,2026/1/25 19:02,カフェ、喫茶,ID未解決,7時間12分,0,32,32.0,0,0,0.074,0.0,0.0,0.07,あと3日,https://detail.chiebukuro.yahoo.co.jp/qa/question_detail/q14324563969,インスタントココアを飲んだ後のカップを見て思いました。 コーヒーより、後の汚れ落ちが悪いなと。 飲んで直ぐに洗っても、軽い水洗いだけでは済まず、洗剤付きスポンジで擦らないと原則無理でしょうか？ 飲んだ...,0,0
1472,2026/1/25 19:02,大学受験,cbfb4e9d8,7時間12分,0,47,47.0,0,0,0.109,0.0,0.0,0.11,あと3日,https://detail.chiebukuro.yahoo.co.jp/qa/question_detail/q14324563654,神戸市外大英米学科志望です。 単語はEX準一級だけやっているのですが、ターゲット1900や速単上級などにも手を出すべきでしょうか？ 共テ英語は85%でした。,0,0
1473,2026/1/25 19:02,就職活動,abc********,7時間12分,0,6,6.0,0,0,0.014,0.0,0.0,0.01,あと3日,https://detail.chiebukuro.yahoo.co.jp/qa/question_detail/q14324563849,株式会社アップビートに勤めている方に質問です。 •ノルマは厳しいですか？ •中途社員への対応は新卒と比べてやはり雑ですか？ •ロープレはありますか？また、ある場合めんどくさいものですか？,0,0
1474,2026/1/25 19:02,飲食店,se1********,7時間12分,0,8,8.0,0,0,0.019,0.0,0.0,0.02,あと3日,https://detail.chiebukuro.yahoo.co.jp/qa/question_detail/q14324563639,焼き鳥屋さんに質問です 焼台は炭火、ガス、電気ではどれが1番速く美味しく焼けますか？ また、それぞれの販売メーカーやオススメの焼台を教えてください,0,0
1475,2026/1/25 19:02,周辺機器,aa3ce259,7時間12分,0,18,18.0,0,0,0.042,0.0,0.0,0.04,あと3日,https://detail.chiebukuro.yahoo.co.jp/qa/question_detail/q14324563459,今LogicoolのGProのキーボードを使ってゲームをしているんですがXとDのキーだけ爪の先が当たって禿げてきたりしてしまっています。なのでGProで使えるキーキャップはなにかないですか？ 少量だけ...,0,0
1476,2026/1/25 19:02,邦楽,b8e4458a8,7時間12分,3,32,10.7,0,3,0.074,9.38,0.01,0.63,あと3日,https://detail.chiebukuro.yahoo.co.jp/qa/question_detail/q10324670660,B'zとMr.Childrenどちらが人気ありますか？,0,0
1477,2026/1/25 19:02,就職活動,らたとぅいゆ,7時間12分,0,22,22.0,0,0,0.051,0.0,0.0,0.05,あと3日,https://detail.chiebukuro.yahoo.co.jp/qa/question_detail/q14324563499,就活中の27卒です。 某大手銀行でメンター制度というものがあり、私はそのメンター制度に参加させていただくことになりました。 メンターの方からの電話で最初の挨拶ということなんですが、3回ほど自身の都合で...,0,0
1478,2026/1/25 19:02,生物、動物、植物,edgvvn,7時間12分,0,6,6.0,0,0,0.014,0.0,0.0,0.01,あと3日,https://detail.chiebukuro.yahoo.co.jp/qa/question_detail/q14324563489,植物状態で小脳は働いてますか？,0,0
1479,2026/1/25 19:02,ピアノ、キーボード,1053054868,7時間12分,0,12,12.0,1,0,0.028,0.0,0.0,0.26,あと3日,https://detail.chiebukuro.yahoo.co.jp/qa/question_detail/q14324563409,RolandのGO：KEYS3でネクライトーキーの「おしゃれ大作戦」のキーボードソロの音色ってありますか？,0,0
1480,2026/1/25 19:02,女性アイドル,1151586549,7時間12分,0,24,24.0,0,0,0.055,0.0,0.0,0.06,あと3日,https://detail.chiebukuro.yahoo.co.jp/qa/question_detail/q14324563214,イコラブの行こラブ会に初めて当選しました。 ①チケットはいつどこで受け取れますか？ ②カンペは持って行っていいのですか？ 有識者の方教えていただけると嬉しいです！,0,0
1481,2026/1/25 19:02,ドコモ,1151822082,7時間12分,0,24,24.0,0,0,0.055,0.0,0.0,0.06,あと3日,https://detail.chiebukuro.yahoo.co.jp/qa/question_detail/q14324563179,ドコモで分割中のスマホがあります。 今、ネットワーク利用制限のサイトで調べたら分割中なのに〇になってました。朝までは△だったのですがこれはなにか原因があるのでしょうか？,0,0
1482,2026/1/25 19:02,飛行機、空港,chi********,7時間12分,0,71,71.0,0,0,0.164,0.0,0.0,0.16,あと3日,https://detail.chiebukuro.yahoo.co.jp/qa/question_detail/q14324563439,キャセイパシフィック航空をトリップドットコムから予約しました。 その予約をキャセイの公式アプリで表示させました。同行者がいるのですが最初にアプリで予約番号等を入力した際は、 同行者も表示され私のアプリ...,0,0
1483,2026/1/25 19:02,バドミントン,名無し,7時間12分,0,14,14.0,0,0,0.032,0.0,0.0,0.03,あと3日,https://detail.chiebukuro.yahoo.co.jp/qa/question_detail/q14324563229,古賀輝選手の現在使ってるラケットは何ですか？,0,0
1484,2026/1/25 19:02,国内,神奈川より横浜,7時間12分,4,32,8.0,0,0,0.074,12.5,0.01,0.53,あと3日,https://detail.chiebukuro.yahoo.co.jp/qa/question_detail/q13324670658,群馬県高崎市は浜松市よりも都会？,0,0
1485,2026/1/25 19:02,中学校,ryunosuske,7時間12分,2,29,14.5,0,0,0.067,6.9,0.01,0.3,あと3日,https://detail.chiebukuro.yahoo.co.jp/qa/question_detail/q14324670659,来週修学旅行でスマホを持っていきたいと考えています。せっかくの中学生最後の修学旅行で、思い出を残したいと考えています。自分の学校はスマホ禁止で、音楽機器、カメラ類、ゲーム類が禁止です。 スーツケースは...,0,0
1486,2026/1/25 19:02,学校の悩み,bac90a72f,7時間12分,1,44,44.0,0,0,0.102,2.27,0.04,0.22,あと3日,https://detail.chiebukuro.yahoo.co.jp/qa/question_detail/q12324670657,指定校推薦で入学したのに留年しそうです。大学2年生です。親にも学校にも顔向けできません。〇にたくなります。メンタル弱すぎた発言をしてしまいすみません。,0,0
1487,2026/1/25 19:02,学校の悩み,1153212735,7時間13分,0,2,2.0,0,0,0.005,0.0,0.0,0.0,あと3日,https://detail.chiebukuro.yahoo.co.jp/qa/question_detail/q11324670656,質問です 今この時期に通信に転入したら単位は間に合いませんよね？僕は今高校1年生です その場合は転学先で1年からまたやり直すことになるのですか？今の所の高校では単位30個 欠席数9回ですももしあと1ヶ...,0,0
1488,2026/1/25 19:02,ライブ、コンサート,1253210861,7時間13分,0,11,11.0,0,0,0.025,0.0,0.0,0.03,あと3日,https://detail.chiebukuro.yahoo.co.jp/qa/question_detail/q14324563124,これらの黒いワンピースにあう、靴と靴下を教えてください！！ https://www.grail.bz/item/an17052812/ https://www.grail.bz/item/ru1388...,0,0
